id,movie_id,language,related_scenes,question,answer,evidence_or_reason,question_type
1,en8549e3d0b5db47a98dea7624fcdf2a0c,en,26、INT. E BLOCK - DAY,What does Percy's aggressive pursuit of the mouse reveal about his underlying objective?,Assert dominance through cruelty,"A low, static shot shows the green floor stretching out before the camera. Harry and Bill Dodge are at the desk in the background, filling out paperwork and handling files. Percy stands nearby, idling, softly whistling as he combs his hair. A small mouse enters the frame, moving steadily along the Green Mile toward Percy. The inmates watch silently as it passes, including Coffey and Del. When the mouse appears near him, Percy initially freezes, then slowly reaches for his baton. After missing a violent strike, he chases the mouse across the floor, roaring and stomping, ultimately failing to catch it before it escapes under the restraint room door. His reaction escalates into furious threats and physical outbursts, revealing a need to exert control.",Character Understanding
2,en8549e3d0b5db47a98dea7624fcdf2a0c,en,48、INT. BEDROOM - MORNING,"After the intimate moment with Paul, what does Jan immediately press him about?",His failure to attend a scheduled doctor's visit,"Jan notices a pattern of avoidance in Paul's behavior and directly questions him about his health choices after their physical intimacy [scene: After an intimate moment, Jan catches her breath and looks over at Paul].",Character Understanding
3,en8549e3d0b5db47a98dea7624fcdf2a0c,en,44、INT. E BLOCK - DAY,What motivates Paul's movement toward Coffey after the others have left?,To reach Coffey despite his pain,"After the others leave, Paul collapses on the Mile, writhing in pain from a groin injury and fever. Drenched in sweat and gasping, he struggles to move. Hearing Coffey's urgent call from his cell, Paul forces himself to stand, leans against the wall, and takes slow, labored steps down the block toward Coffey.",Character Understanding
4,en8549e3d0b5db47a98dea7624fcdf2a0c,en,22、EXT. FIELD - DAY (FLASHBACK),What is Hal's primary concern in initiating the conversation with Paul?,Addressing backlash over Percy's removal,"Warden Hal Moores approaches Paul on the bleachers to discuss a complaint from the governor’s wife about Paul removing Percy Wetmore from duty. While Hal shares personal worries about his wife’s deteriorating health, he shifts focus to the political pressure he is facing due to Percy’s removal, emphasizing Percy’s connection to the governor’s wife and the need for Paul to maintain order until Percy’s transfer to Briar Ridge.",Character Understanding
5,en8549e3d0b5db47a98dea7624fcdf2a0c,en,16、INT. E BLOCK (THE GREEN MILE) - DAY,What action does Paul take to assess Coffey's demeanor before placing him in the cell?,Paul checks Coffey for potential trouble before cell entry,"As the guards lead John Coffey down the Green Mile, Paul steps forward to evaluate whether Coffey poses any threat. He asks Coffey directly if he will cause trouble, observes his quiet and cooperative response, and proceeds with the intake process. This moment establishes Paul's cautious but humane approach to new inmates, setting the tone for Coffey's integration into E Block.",Scene Grounding
6,en8549e3d0b5db47a98dea7624fcdf2a0c,en,26、INT. E BLOCK - DAY,What action takes place as Paul and the guards move through the corridor after Percy's search?,navigate the cluttered corridor,"After Percy's frantic search through the restraint room fails to find the mouse, Paul and the guards proceed down the corridor, stepping around overturned chairs and scattered papers. Brutal mutters sarcastically, feigning sorrow over Percy's misfortune, while Harry confronts Percy for going too far and unsettling the inmates. Brutal steps forward aggressively but is blocked by the others. Percy remains defiant, insisting the block is soft, until Paul delivers a firm warning that no one is permitted to threaten another officer.",Scene Grounding
7,en8549e3d0b5db47a98dea7624fcdf2a0c,en,26、INT. E BLOCK - DAY,What action initiates the confrontation between Percy and the mouse on the Green Mile?,Mouse walks along the Green Mile toward Percy,"A small mouse enters the block, moving steadily along the Green Mile directly toward Percy, who is idly combing his hair and whistling. The mouse draws the attention of the guards and inmates alike, creating a moment of quiet fascination until Percy reacts violently, marking the start of his aggressive pursuit.",Scene Grounding
8,en8549e3d0b5db47a98dea7624fcdf2a0c,en,44、INT. E BLOCK - DAY; 44、INT. E BLOCK - DAY,What event directly enables Paul to move without pain during his walk on the Mile?,John Coffey heals Paul by removing his illness through touch,"In a pivotal moment on the E Block, Coffey reaches through the cell bars and places his hand on Paul, transferring a surge of energy that eradicates Paul's physical ailment. As the illness leaves Paul's body, Coffey visibly deteriorates, gagging and expelling a dark, insect-like mass that dissolves into light. Paul, stunned and pain-free, realizes he has been healed, while Coffey collapses from the exertion. This act of healing fundamentally alters Paul's physical state, setting the stage for his subsequent ease of movement and renewed vitality observed during his walk on the Mile.",Causal-Motivational Reasoning
9,en8549e3d0b5db47a98dea7624fcdf2a0c,en,44、INT. E BLOCK - DAY; 44、INT. E BLOCK - DAY,"In [44、INT. E BLOCK - DAY], what event immediately before Coffey heals Paul explains why Coffey becomes physically overwhelmed during the healing?",Paul collapses in pain on the Green Mile after others leave,"After the other guards leave, Paul suffers a severe flare-up of his urinary infection, collapsing on the Green Mile in intense pain and fever. He struggles to his feet and limps toward Coffey's cell, where Coffey reaches out, draws the illness from him, and is visibly poisoned by the sickness, gagging and expelling a dark mass before collapsing in exhaustion. The physical toll on Coffey directly follows the transfer of Paul's ailment, which had left Paul incapacitated moments earlier.",Causal-Motivational Reasoning
10,en8549e3d0b5db47a98dea7624fcdf2a0c,en,26、INT. E BLOCK - DAY; 26、INT. E BLOCK - DAY,What action directly prompts Paul to order Percy to clean up the mess on the Green Mile?,Percy searches frantically for the mouse in the restraint room,"After the mouse escapes into the restraint room, Percy forces his way in and violently ransacks the space, overturning furniture, scattering papers, and disrupting the block's order. His uncontrolled outburst culminates in a scene of chaos, with debris strewn across the floor. In the aftermath, Paul asserts authority by instructing Percy to clean up the disorder he caused, restoring discipline without confrontation.",Causal-Motivational Reasoning
11,en8549e3d0b5db47a98dea7624fcdf2a0c,en,44、INT. E BLOCK - DAY; 44、INT. E BLOCK - DAY,"In [44、INT. E BLOCK - DAY], what moment immediately before the confrontation reveals a character's foresight that contextualizes Brutal's use of the hickory stick against Billy?",Coffey shows visible fear as Billy approaches,"As Billy arrives on E Block and is guided toward his cell, Coffey presses against his bars, eyes widening with alarm, and whispers a warning: 'Careful.' This reaction occurs just before Billy erupts into violence, attacking Dean and choking him with his wrist chain. Amid the chaos, Brutal enters and strikes Billy with the hickory stick to stop the assault. Coffey’s preemptive fear signals an intuitive recognition of the threat Billy poses, framing Brutal’s decisive action as a necessary response to the danger that Coffey alone seems to anticipate.",Causal-Motivational Reasoning
12,en8549e3d0b5db47a98dea7624fcdf2a0c,en,16、INT. E BLOCK (THE GREEN MILE) - DAY; 44、INT. E BLOCK - DAY,"By the time Coffey heals Paul and collapses in agony, what has already taken place on E Block?",John Coffey revealed for the first time in full view,"Before Coffey demonstrates his healing power and suffers its consequences, he must first be brought to E Block and fully seen by the guards and inmates, marking his official arrival and the moment they witness his imposing presence firsthand. This moment establishes the foundation for the events that follow, including the healing and its aftermath.",Temporal Reasoning
13,en8549e3d0b5db47a98dea7624fcdf2a0c,en,16、INT. E BLOCK (THE GREEN MILE) - DAY; 44、INT. E BLOCK - DAY,"By the time Coffey collapses after healing Paul, what has already happened to Delacroix?",Delacroix was taken to the infirmary for injury assessment,"Before Coffey demonstrates his healing power and subsequently collapses in agony, Paul instructs Dean to bring Delacroix to the infirmary following his assault by Percy. This assessment is a direct consequence of the attack and precedes the healing event, establishing a chain of care and crisis on the block.",Temporal Reasoning
14,en8549e3d0b5db47a98dea7624fcdf2a0c,en,11、INT. TV ROOM - DAY; 104、INT. FUNERAL HOME - DAY,How does the relationship between Elaine Connelly and Paul evolve from their initial interactions to the final scene at the funeral home?,"They maintain a bond of mutual trust and care throughout, with Paul showing reverence in her absence","From their quiet conversation in the TV room, where Elaine expresses concern for Paul and physically supports him, to Paul affirming their friendship in the sun room, their connection is consistently characterized by trust and care. This bond persists through later interactions, culminating in Paul placing a rose on Elaine’s casket and speaking of her with sorrow, reflecting enduring respect and emotional attachment.",Role-Relation Continuity
15,en8549e3d0b5db47a98dea7624fcdf2a0c,en,7、EXT. NURSING HOME - ESTABLISHING - MORNING; 103、INT. SHACK - DAY,How does Brad Dolan's treatment of Paul evolve from their first encounter to the confrontation in the shack?,Brad Dolan consistently treats Paul as a target of hostility and mockery,"From the nursing home's exterior to the final confrontation in the shack, Brad Dolan maintains a hostile stance toward Paul, beginning with muttered insults and scowling, escalating to physical restraint and mocking patronization in the TV room, and culminating in a forceful shove and wall pinning. Throughout these interactions, Brad's behavior reflects a persistent pattern of dominance and antagonism, using feigned concern and demeaning language to assert control rather than engaging with genuine intent or respect.",Role-Relation Continuity
16,en8549e3d0b5db47a98dea7624fcdf2a0c,en,26、INT. E BLOCK - DAY; 86、INT. E BLOCK - NIGHT,How does Brutus Howell's relationship to Percy evolve from their initial confrontation through later interactions in E Block?,"Brutus Howell consistently treats Percy as a hostile subordinate, maintaining an adversarial and disciplinary stance.","From their first encounter in E Block, Brutus Howell demonstrates antagonism toward Percy through threatening gestures and physical aggression, which escalates into active participation in restraining and mocking him. Throughout subsequent scenes, including confrontations in the access tunnel and later disciplinary actions, Brutus remains aligned against Percy, reinforcing a persistent dynamic in which he asserts dominance and enforces control over a defiant and insubordinate Percy.",Role-Relation Continuity
17,en8549e3d0b5db47a98dea7624fcdf2a0c,en,39、INT. PAUL'S KITCHEN - MORNING; 39、INT. PAUL'S KITCHEN - MORNING; 45、INT. PAUL'S HOUSE - DUSK,"What event sets in motion Paul's avoidance of medical care, leading to his growing emotional distance and eventual confrontation with Jan?",Paul gets ready for work while sick,"In the morning, Paul prepares for work despite feeling unwell, choosing to delay seeing a doctor. This decision initiates a chain of consequences: he later promises to seek care after work, returns home visibly distracted, and ultimately faces Jan's concern and confrontation when he fails to attend his appointment. The scene establishes his pattern of neglect and emotional withdrawal.",Narrative Progression
18,en8549e3d0b5db47a98dea7624fcdf2a0c,en,16、INT. E BLOCK (THE GREEN MILE) - DAY; 44、INT. E BLOCK - DAY; 16、INT. E BLOCK (THE GREEN MILE) - DAY,"What pivotal event initiates the chain of developments leading to Paul's healing, Coffey's emotional confession, and the subsequent debriefing?",John Coffey's Arrival and Intake on the Green Mile,"The arrival of John Coffey at the prison block sets in motion a series of transformative events, including his demonstration of supernatural healing, his psychological vulnerability in response to darkness and isolation, and the staff's reassessment of his nature and fate. This intake marks the structural beginning of Coffey's impact on the block’s routine and the moral trajectory of the narrative. [16、INT. E BLOCK (THE GREEN MILE) - DAY]",Narrative Progression
19,en8549e3d0b5db47a98dea7624fcdf2a0c,en,39、INT. PAUL'S KITCHEN - MORNING; 48、INT. BEDROOM - MORNING; 45、INT. PAUL'S HOUSE - DUSK,What pivotal event sets in motion Paul's growing uncertainty about his health and his subsequent emotional withdrawal?,Paul Promises to See a Doctor After Work,"In the kitchen one morning, Paul agrees to make a doctor's appointment after work, a commitment that initiates a chain of hesitation and self-doubt. This promise marks the first concrete step toward addressing his health, but instead of bringing relief, it amplifies his anxiety, leading him to miss the appointment, withdraw at home, and question his choices after calling in sick. [39、INT. PAUL'S KITCHEN - MORNING]",Narrative Progression
20,en8549e3d0b5db47a98dea7624fcdf2a0c,en,45、INT. PAUL'S HOUSE - DUSK; 45、INT. PAUL'S HOUSE - DUSK; 45、INT. PAUL'S HOUSE - DUSK,What pivotal moment shifts the emotional trajectory toward Paul initiating intimacy and Jan confronting his absence at the doctor's visit?,"Paul comes home distracted, Jan asks how he is","In the scene set at dusk in Paul's house, Paul returns home appearing preoccupied, and Jan's simple inquiry about his well-being marks a subtle but critical shift in their interaction. This moment sets in motion a chain of emotional responses—Paul's vulnerability leads to an intimate advance, intensifies their physical connection, and ultimately triggers Jan's confrontation about his missed medical appointment, anchoring the sequence in a growing undercurrent of tension and care.",Narrative Progression
21,en8549e3d0b5db47a98dea7624fcdf2a0c,en,,Who are the 3 most central characters in this story?,"John Coffey, Paul, Percy",,Character Understanding
