id,related_scenes,question,answer,related_context,question_type,question_source
1,15、EXT. BELLA'S HOUSE/INT. BELLA'S TRUCK (CONTINUOUS) - NIGHT,How does Edward kiss Bella during their final moment?,"He kisses her gently at first, then urgently with a painful edge as if it's a goodbye.","He begins carefully, gently... but it changes, he becomes urgent, with an almost painful edge, as if it were goodbye.",Scene Grounding,broad_coverage_scene
2,27、INT. BELLA'S BEDROOM - ANOTHER DAY,"In [27、INT. BELLA'S BEDROOM - ANOTHER DAY], What is Bella's emotional state in the living room scene?","Bella is emotionally numb and in pain, feeling a void after loss.","Bella sits on the couch, blank, as the rain pounds. Charlie watches her, concerned. Bella (V.O.) mentions a huge hole punched through her chest.",Character Understanding,broad_coverage_scene
3,21、EXT. WOODS - DAY,"In [21、EXT. WOODS - DAY], What is Edward's emotional state during his farewell to Bella?",Agonized and resolute,"Here, for the first time, we SEE how truly agonizing this really is for Edward.",Character Understanding,broad_coverage_scene
4,21、EXT. WOODS - DAY,"In [21、EXT. WOODS - DAY], What is Bella's emotional state when Edward rejects her?",Desperate and heartbroken,"Desperation wells up in her, overwhelming dignity. Tears sting Bella's eyes.",Character Understanding,broad_coverage_scene
5,11、INT. CULLEN HOUSE - CARLISLE'S ROOM - NIGHT,Why is Bella concerned about Edward's safety?,Victoria would come after him for killing her mate.,Bella mentions Victoria's threat based on Edward's past action.,Causal-Motivational Reasoning,broad_coverage_scene
6,23、EXT. BELLA'S HOUSE - NIGHT,"In [23、EXT. BELLA'S HOUSE - NIGHT], What is Charlie's emotional state when he pores over the map?",Beside himself with worry,"Charlie, beside himself with worry, pores over a map with BILLY BLACK",Character Understanding,broad_coverage_scene
7,7、INT. FORKS HIGH SCHOOL - ENGLISH CLASS - DAY,What occurs in the flashback scene involving James and Bella?,James grabs Bella's arm and bites her,"FLASHPOP TO 'Twilight' - In the ballet studio, JAMES grabs Bella's arm and BITES --",Scene Grounding,broad_coverage_scene
8,1、EXT. FOREST - ECU ON THE TULIP - DAY,How is Bella searching the woods?,"Desperately with short, surreal cuts","Bella Swan, desperately searching the woods -- SHORT, SURREAL CUTS of her frenetic quest",Scene Grounding,broad_coverage_scene
9,48、INT. BELLA'S HOUSE - LIVING ROOM - ANOTHER DAY,Why did Bella call Jake?,To check on him and apologize for her feelings.,"Bella (O.S.) Hey Jake. Just checking to see how you're doing. And to say I'm sorry, about, you know... how I feel",Causal-Motivational Reasoning,broad_coverage_scene
10,74、EXT. BELLA'S HOUSE - NIGHT,What does Jacob tell Bella to reassure her?,"Don't worry, we've got this place covered. She won't get near you or Charlie.","JACOB: Don't worry, we've got this place covered. She won't get near you or Charlie.",Character Understanding,broad_coverage_scene
11,60、EXT. JACOB'S HOUSE (CONTINUOUS) - DAY,Why does Jacob blame the Cullens?,They started all this by existing.,They started all this by existing.,Causal-Motivational Reasoning,broad_coverage_scene
12,72、INT. MASERATI - SAME,Why did Victoria steal cars?,To throw James off the scent.,James hated cars... to throw him off the scent,Causal-Motivational Reasoning,broad_coverage_scene
13,29、INT. TANYA'S ALASKAN HOME (CONTINOUS) - DAY,"In [29、INT. TANYA'S ALASKAN HOME (CONTINOUS) - DAY], What is Esme's emotional state?",Desolate,Esme desolate; Emmett blank.,Character Understanding,broad_coverage_scene
14,29、INT. TANYA'S ALASKAN HOME (CONTINOUS) - DAY,"In [29、INT. TANYA'S ALASKAN HOME (CONTINOUS) - DAY], What is Jasper's emotional state?",Self-contempt,JASPER (with self-contempt),Character Understanding,broad_coverage_scene
15,32、EXT. BELLA'S HOUSE - DAY,"In [32、EXT. BELLA'S HOUSE - DAY], What is Bella's behavioral state when Bob greets her?",Distracted and unresponsive,"Bella, in her own world, doesn't respond.",Character Understanding,broad_coverage_scene
16,7、INT. FORKS HIGH SCHOOL - ENGLISH CLASS - DAY,"In [7、INT. FORKS HIGH SCHOOL - ENGLISH CLASS - DAY], What does Edward do to Bella's arm during their conversation?","turns her wrist over, runs his hand over the horseshoe-shaped scar","He turns her wrist over, runs his hand over the horseshoe shaped SCAR on her forearm.",Scene Grounding,broad_coverage_scene
17,6、INT. FORKS HIGH SCHOOL - CORRIDOR - DAY,What action does Alice take before leaving?,Hugs Bella again and races off before she can change her mind,Alice hugs her again and races off before she can change her mind,Scene Grounding,broad_coverage_scene
18,32、EXT. BELLA'S HOUSE - DAY,"In [32、EXT. BELLA'S HOUSE - DAY], What is Bella's emotional state when Charlie suggests she move to Jacksonville?","Detached, as she looks away",She looks away. That's how it feels to her.,Character Understanding,broad_coverage_scene
19,30、EXT. SOUTH AMERICA - ANDES (ALICE'S VISION) - DAY,"In [30、EXT. SOUTH AMERICA - ANDES (ALICE'S VISION) - DAY], What is Edward's behavioral state as he runs toward the cliff?",Trying to outrun his memories,"he starts running, like he's trying to outrun his memories",Character Understanding,broad_coverage_scene
20,30、EXT. SOUTH AMERICA - ANDES (ALICE'S VISION) - DAY,"In [30、EXT. SOUTH AMERICA - ANDES (ALICE'S VISION) - DAY], What is Edward's emotional state when he is standing on the mountaintop?",Agonized,face agonized,Character Understanding,broad_coverage_scene
21,37、EXT. FOREST - DAY,When does the rustling restart?,After Nate disappears.,"No answer. He turns to find that Nate has vanished. TIM: Think it's gone? No answer. He turns to find that Nate has vanished. TIM'S POV - BEHIND HIM - something gives chase, flattening foliage and bending thin trees in its path.",Temporal Reasoning,broad_coverage_scene
22,2、EXT. MEADOW - DAY,"In [2、EXT. MEADOW - DAY], What reflects a surreal dreamlike version of the forest?",The wallpaper behind the mirror,"The MIRROR, mounted on a wall with wallpaper reflecting a surreal dreamlike version of the forest behind Bella.",Scene Grounding,broad_coverage_scene
23,35、EXT. JACOB BLACK'S HOUSE - DAY,"In [35、EXT. JACOB BLACK'S HOUSE - DAY], What is Bella's emotional state when Jacob greets her?",Surprised by his affection but doesn't mind.,"Bella's surprised by his affection, but doesn't mind.",Character Understanding,broad_coverage_scene
24,13、INT. CULLEN HOUSE - KITCHEN - NIGHT,How long has Carlisle been practicing his work?,Centuries.,Centuries of practice.,Temporal Reasoning,broad_coverage_scene
25,6、INT. FORKS HIGH SCHOOL - CORRIDOR - DAY,What does Bella do when she sees Jasper?,"She tries to hide Alice's present, hoping no one noticed","Over Alice's shoulder, Bella sees JASPER, keeping his distance. He offers her a pleasant nod. She tries to hide Alice's present, hoping no one noticed",Scene Grounding,broad_coverage_scene
26,28、EXT. TANYA'S ALASKAN HOME - DAY,"In [28、EXT. TANYA'S ALASKAN HOME - DAY], What is Bella's emotional state according to her voiceover?","Feeling her presence is a burden, implying sadness.",Bella (V.O.)'s line about it being better for them not having her around,Character Understanding,broad_coverage_scene
27,11、INT. CULLEN HOUSE - CARLISLE'S ROOM - NIGHT,What does Edward believe about Alice's role in protecting him?,Alice will see Victoria coming and she won't win.,Edward states Alice's ability to foresee Victoria's attack.,Causal-Motivational Reasoning,broad_coverage_scene
28,43、INT. BELLA'S BEDROOM - NIGHT,What does Bella say about Jacob?,He's been keeping me afloat.,BELLA He's been keeping me afloat.,Character Understanding,broad_coverage_scene
29,19、INT. BELLA'S BEDROOM - DAY,"In [19、INT. BELLA'S BEDROOM - DAY], What action does Edward take with Bella's scrapbook?",Pulls it out and takes a closer look,"He pulls it out, takes a closer look",Character Understanding,broad_coverage_scene
30,27、INT. BELLA'S BEDROOM - ANOTHER DAY,"In [27、INT. BELLA'S BEDROOM - ANOTHER DAY], How is Bella physically positioned in her bedroom scene?",Bella is curled up in a ball on the floor.,"In the darkness, Bella is curled up in a ball on her floor.",Character Understanding,broad_coverage_scene
31,20、EXT. BELLA'S HOUSE - DAY,"In [20、EXT. BELLA'S HOUSE - DAY], How does Edward appear to Bella when she approaches him?",Cold and distant,"cold, distant face; an unreadable mask",Character Understanding,broad_coverage_scene
32,20、EXT. BELLA'S HOUSE - DAY,"In [20、EXT. BELLA'S HOUSE - DAY], What is Bella's emotional state when she sees Edward?",Relieved,relief washing over her,Character Understanding,broad_coverage_scene
33,47、EXT. LA PUSH - CLEARING IN THE FOREST (CONTINUOUS) - DAY,"In [47、EXT. LA PUSH - CLEARING IN THE FOREST (CONTINUOUS) - DAY], Where does Bella crash the bike?",Into a wall of trees,She flies right into a wall of trees.,Scene Grounding,broad_coverage_scene
34,70、EXT. LA PUSH - CLIFFS - DAWN,"In [70、EXT. LA PUSH - CLIFFS - DAWN], What document is referenced in the conversation about werewolves and vampires?",The Treaty prevents werewolves from attacking vampires unless they violate it.,unless they bite someone and violate the Treaty,Scene Grounding,broad_coverage_scene
35,15、EXT. BELLA'S HOUSE/INT. BELLA'S TRUCK (CONTINUOUS) - NIGHT,What action does Edward take immediately after exiting the truck?,He opens the passenger side door for her.,He climbs out - instantly he's opening the passenger side door for her.,Scene Grounding,broad_coverage_scene
36,66、INT. BELLA'S TRUCK - NIGHT,Why did Bella drive into the forest?,To find out why she might lose someone else.,"BELLA (V.O.) If I was going to lose someone else, I needed to know why.",Causal-Motivational Reasoning,broad_coverage_scene
37,62、INT. FOREST - NIGHT,"In [62、INT. FOREST - NIGHT], What loud sound does Bella hear before the blackness encroaches?",A screeching noise,HEAR a loud SCREECHING NOISE,Scene Grounding,broad_coverage_scene
38,68、EXT. LA PUSH - EMILY'S HOUSE - NIGHT,"In [68、EXT. LA PUSH - EMILY'S HOUSE - NIGHT], Why does Embry tell Bella not to stare at Emily?",To avoid annoying Sam,just try not to stare. It bugs Sam.,Causal-Motivational Reasoning,broad_coverage_scene
39,79、EXT. EMILY'S HOUSE - DAY,What does Bella ask Emily upon arriving?,Is Jacob here?,"BELLA: Yeah, I just... is Jacob here? He wasn't at home...",Character Understanding,broad_coverage_scene
40,37、EXT. FOREST - DAY,What happens after the rustling sounds surround Nate and Tim?,"Nate becomes silent as his initial confidence fades, and the rustling continues from multiple directions, causing the two hikers to stand back-to-back while scanning the woods.","Nate falls silent, his bravado fading as the sounds multiply and close in from all sides. Rustling noises erupt from multiple directions around Nate and Tim... The two hikers freeze, then slowly turn to stand back-to-back, scanning the trees in all directions.",Temporal Reasoning,broad_coverage_scene
41,5、EXT. FORKS HIGH SCHOOL - PARKING LOT - DAY | 42、EXT. WOODS - NIGHT (NIGHTMARE),What does Edward state when he first approaches Bella?,Edward states 'Happy birthday' when he first approaches Bella.,"He reaches her and says, 'Happy birthday.'",Character Understanding,broad_coverage_event_chain
42,5、EXT. FORKS HIGH SCHOOL - PARKING LOT - DAY | 44、INT. BELLA'S TRUCK - DAY | 47、EXT. LA PUSH - CLEARING IN THE FOREST (CONTINUOUS) - DAY,What does Jacob say the dreamcatcher is meant to do?,Jacob says the dreamcatcher catches bad dreams.,"He hands it to her and says, 'Happy birthday. It catches bad dreams.'",Character Understanding,broad_coverage_event_chain
43,46、INT. HIGH SCHOOL - CAFETERIA - DAY | 47、EXT. LA PUSH - CLEARING IN THE FOREST (CONTINUOUS) - DAY,What does Bella state when Jacob says she looks scared?,Bella states that she is not scared.,"When Jacob says, 'You look scared,' Bella replies, 'I'm not.'",Character Understanding,broad_coverage_event_chain
44,5、EXT. FORKS HIGH SCHOOL - PARKING LOT - DAY | 7、INT. FORKS HIGH SCHOOL - ENGLISH CLASS - DAY,What does Edward state about the line from the play when questioned by Mr. Berty?,"Edward states that the film should be rewound to act five, scene one, line twenty-eight eighty-nine, and he recites the line to redirect attention.","Edward responds politely, apologizing for the distraction and suggesting the film be rewound to act five, scene one, line twenty-eight eighty-nine. He recites the line: 'If you had the strength of twenty men it would dispatch you straight.'",Character Understanding,broad_coverage_event_chain
45,5、EXT. FORKS HIGH SCHOOL - PARKING LOT - DAY,What does Edward state about Jacob's thoughts?,Edward states that he cannot help reading Jacob's thoughts because they are loud and clear.,"Edward says he can't help it, that Jacob's thoughts are loud and clear.",Character Understanding,broad_coverage_scene
46,11、INT. CULLEN HOUSE - CARLISLE'S ROOM - NIGHT | 21、EXT. WOODS - DAY | 1、EXT. FOREST - ECU ON THE TULIP - DAY | 2、EXT. MEADOW - DAY,What does Edward state that Bella protects him from?,"Edward states that Bella protects him from boredom, loneliness, and by giving him a reason to stay un-dead.","Edward tells Bella she already protects him—from boredom, from loneliness, and by giving him a reason to stay un-dead.",Character Understanding,broad_coverage_event_chain
47,11、INT. CULLEN HOUSE - CARLISLE'S ROOM - NIGHT | 21、EXT. WOODS - DAY | 26、INT. BELLA'S BEDROOM - DAY,What does Edward state that Bella protects him from?,"Edward states that Bella protects him from boredom, loneliness, and gives him a reason to stay un-dead.","Edward tells Bella she already protects him—from boredom, from loneliness, and by giving him a reason to stay un-dead.",Character Understanding,broad_coverage_event_chain
48,21、EXT. WOODS - DAY | 26、INT. BELLA'S BEDROOM - DAY | 31、INT. BELLA'S BEDROOM - NIGHT,What does Edward state about his feelings toward being with Bella?,"Edward states that he is tired of pretending and that Bella is not good for him, indicating he believes their relationship is unsustainable.","He says he's tired of pretending and that Bella is not good for him, and that every moment with her requires unbearable restraint.",Character Understanding,broad_coverage_event_chain
49,37、EXT. FOREST - DAY,What happens after Tim realizes Nate is gone?,"Tim begins to run through the woods while something follows him, crashing through the underbrush and breaking plants and small trees.","After a sudden silence, Tim turns and realizes Nate is gone. The rustling returns, louder and faster, coming from all around. Tim breaks into a run, crashing through the trees, his breath sharp and wild. Behind him, something surges through the underbrush, flattening plants and snapping small trees as it follows.",Temporal Reasoning,broad_coverage_scene
50,11、INT. CULLEN HOUSE - CARLISLE'S ROOM - NIGHT | 12、INT. CULLEN HOUSE - SECOND FLOOR LANDING - NIGHT | 15、EXT. BELLA'S HOUSE/INT. BELLA'S TRUCK (CONTINUOUS) - NIGHT,What does Alice state about the timing of the event she announces upon arriving?,Alice states that it is time for the event to begin.,"'It's time!' she exclaims, her voice ringing with excitement.",Character Understanding,broad_coverage_event_chain
51,10、INT. A CIRCULAR WHITE MARBLE HALL - DAY,What does Aro state about the rogue vampire's fate?,Aro does not state anything about the rogue vampire's fate.,The passage describes Aro's actions during the execution but does not include any spoken words or statements from him regarding the rogue vampire's fate.,Character Understanding,broad_coverage_scene
52,15、EXT. BELLA'S HOUSE/INT. BELLA'S TRUCK (CONTINUOUS) - NIGHT | 26、INT. BELLA'S BEDROOM - DAY | 31、INT. BELLA'S BEDROOM - NIGHT,What does Bella state about her birthday in relation to Edward's actions?,Bella states that it is still her birthday and asks Edward to kiss her.,Bella reminds Edward it is still her birthday and asks him to kiss her.,Character Understanding,broad_coverage_event_chain
53,21、EXT. WOODS - DAY | 23、EXT. BELLA'S HOUSE - NIGHT,What does Sam Uley do when Charlie and the others express gratitude after he brings Bella out of the woods?,Sam steps back and avoids their thanks.,"Billy and Harry exchange a look of relief and nod to Sam in gratitude, but Sam steps back, avoiding their thanks.",Character Understanding,broad_coverage_event_chain
54,39、INT. JACOB'S GARAGE - ANOTHER DAY | 47、EXT. LA PUSH - CLEARING IN THE FOREST (CONTINUOUS) - DAY,What does Jacob say about Bella's influence on him when she suggests including homework to appease their fathers?,Jacob says that Bella doesn’t influence him.,"Jacob scoffs, saying she doesn’t influence him.",Character Understanding,broad_coverage_event_chain
55,110、INT. SEWERS (CONTINUOUS) - DAY|112、INT. CIRCULAR WHITE MARBLE HALL (CONTINUOUS) - DAY,How should we describe the shift in Bella and Edward's relationship by the time they face the Volturi?,from romantic partners to protective bond,"Earlier, the relationship between Bella Swan and Edward is marked by romantic partners; later, it shifts to protective bond.",Role-Relation Continuity,supplementary_cross_scene
56,34、EXT. PORT ANGELES - MOVIE THEATER - NIGHT|47、EXT. LA PUSH - CLEARING IN THE FOREST (CONTINUOUS) - DAY|21、EXT. WOODS - DAY,"What causes Bella to crash her motorcycle after seeing Edward's apparition, leading to her hearing a snuffling animal in the woods?",Bella loses control and crashes into trees,"As Bella rides the motorcycle down a dirt road, she sees Edward's apparition, gets startled, fails to turn at a curve, and crashes into a wall of trees.",Narrative Progression,supplementary_cross_scene
57,34、EXT. PORT ANGELES - MOVIE THEATER - NIGHT|47、EXT. LA PUSH - CLEARING IN THE FOREST (CONTINUOUS) - DAY,"What event during Bella's motorcycle ride interrupts her vision of Edward and results in a crash, leading her to try riding again?",Bella loses control and crashes into trees,"In the film, while riding a motorcycle with Jacob, Bella sees an apparition of Edward, which startles her; She fails to turn in time, loses control, and crashes into a wall of.",Narrative Progression,supplementary_cross_scene
58,2、EXT. MEADOW - DAY|3、INT. BELLA'S BEDROOM - MORNING|5、EXT. FORKS HIGH SCHOOL - PARKING LOT - DAY,"Which character is romantically involved with Edward, is Charlie Swan's daughter, and has a friendly acquaintanceship with Jacob Black?",Bella Swan,"Bella Swan is in a romantic partners relationship with Edward, is in a daughter relationship with Charlie Swan, and is in a friendly acquaintances relationship with Jacob Black.",Role-Relation Continuity,supplementary_cross_scene
59,6、INT. FORKS HIGH SCHOOL - CORRIDOR - DAY,What does Bella realize about Jasper's behavior in the school corridor that prompts Edward to remark on vampire unreliability?,Bella becomes aware of Jasper's emotional influence,Bella suddenly realizes that Jasper has been subtly influencing her emotions to keep her calm.,Narrative Progression,supplementary_cross_scene
60,6、INT. FORKS HIGH SCHOOL - CORRIDOR - DAY|12、INT. CULLEN HOUSE - SECOND FLOOR LANDING - NIGHT,What does Bella realize about Jasper's emotional influence after agreeing to attend the birthday party?,Bella becomes aware of Jasper's emotional influence,"After Alice secures Bella's hesitant agreement to attend the party, Bella suddenly realizes that Jasper has been subtly influencing her emotions to keep her calm.",Narrative Progression,supplementary_cross_scene
61,5、EXT. FORKS HIGH SCHOOL - PARKING LOT - DAY|21、EXT. WOODS - DAY|90、INT. TENEMENT APARTMENT - RIO DE JANEIRO - DAY,"Which character's relationships include a friendly rapport with Jacob Black, estrangement from Bella Swan, and a strained connection with Rosalie?",Edward,"Edward is in a share a friendly rapport relationship with Jacob Black, is in a estranged lovers relationship with Bella Swan, and is in a established connection despite tension relationship with Rosalie.",Role-Relation Continuity,supplementary_cross_scene
