id,movie_id,language,related_scenes,question,answer,related_context,question_type
1,enc6e53029ab49475dbb82bf89a57e1a42,en,19、INT. TOP LEVEL OF GREENHOUSE TOWER,What does Zarkov aim to achieve by placing Dale into the capsule?,Get Dale to safety,"Zarkov reveals a mirror-bright capsule amid exploding surroundings, opens it, and urgently pushes Dale inside. Flash follows, and Zarkov enters after her, sealing them in as energy bolts strike the exterior without effect.",Character Understanding
2,enc6e53029ab49475dbb82bf89a57e1a42,en,33、INT. PALACE OF HALLS - SERIES OF DISSOLVES,What does Flash commit to when the Amazons advance?,Resist capture by fighting,"Ming's personal Amazon guards emerge to the sound of martial music, advancing in perfect unison toward Flash and Dale with silent intensity. Flash hesitates, visibly conflicted at confronting female warriors, but Dale's shout that they are not to be spared as women but fought as deadly enemies breaks his paralysis. He immediately engages them in combat, initiating the struggle to resist capture.",Character Understanding
3,enc6e53029ab49475dbb82bf89a57e1a42,en,42、INT. PLASMA CAVERN - FEATURE ZARKOV,What does Zarkov aim to assert through his defiance when confronted by Ming in the planet's core?,Challenge Ming's control over the core,"Dr. Zarkov, bound in chains, reacts sharply to Ming's voice echoing in the vast chamber. Expressing awe at the sight of the planet's core, Zarkov's exclamation quickly shifts into resistance as he strains against his restraints, looking into the darkness to confront the source of power. His defiance is not merely reactive but signals a determination to oppose Ming's dominion over the planet's heart.",Character Understanding
4,enc6e53029ab49475dbb82bf89a57e1a42,en,18、INT. GREENHOUSE - DAY,What does Zarkov aim to achieve by compelling Flash and Dale to ascend the tower?,Reach the tower's top to save Earth,"Dr. Hans Zarkov coerces Flash Gordon and Dale Arden up a tower at gunpoint, asserting that Earth is under attack and that urgent action is required to prevent disaster. Amidst laser fire and explosions, he prods them forward, emphasizing the slim chance of survival. Dale recognizes him but hesitates to speak as the situation escalates, and Zarkov maintains control through force and urgency.",Character Understanding
5,enc6e53029ab49475dbb82bf89a57e1a42,en,33、INT. PALACE OF HALLS - SERIES OF DISSOLVES,What does Ming do upon confronting Flash and Dale in the Palace of Halls?,Demands homage from Flash and Dale,"Ming confronts Flash, Dale, and Zarkov in the Palace of Halls, asserting his authority as armored guards and unseen voices proclaim his name. He commands Dale to approach, uses a golden light to examine her, and touches her skin, prompting Zarkov's scientific curiosity. When Zarkov steps forward, Ming has him seized. Flash attempts to intervene, leading Ming to order his execution. Dale blocks the command, and after Aura whispers a plea to spare Flash, Ming shifts his focus, demanding homage and ordering Dale taken to his quarters. The moment establishes Ming's dominance and sets off a chain of resistance and defiance.",Scene Grounding
6,enc6e53029ab49475dbb82bf89a57e1a42,en,5、INT. PLANE - CONTINUOUS,What initiates the interaction between Flash and Dale during the flight?,Plane experiences turbulence causing Flash to stumble,"The scene begins with sudden turbulence jolting the plane, prompting Flash to lose his balance and grab the overhead compartment before sitting beside Dale. This physical disruption marks the start of their conversation, leading Flash to offer her a candy bar and setting the tone for their uneasy but curious exchange amid her fear of flying.",Scene Grounding
7,enc6e53029ab49475dbb82bf89a57e1a42,en,35、INT. PALACE - ON THE STAIRCASE,What action marks the turning point in the staircase scene?,Flash falls through the trapdoor,"Dale struggles against the Amazon's grip, reaching desperately toward Flash as their fingertips briefly graze. At that moment, the step beneath Flash gives way, opening into a trapdoor that swallows him as he shouts. Aura immediately leaps after him before the door snaps shut, leaving Dale alone in the Amazon's hold.",Scene Grounding
8,enc6e53029ab49475dbb82bf89a57e1a42,en,18、INT. GREENHOUSE - DAY; 18、INT. GREENHOUSE - DAY,What event enables Dale to recognize Dr. Zarkov and react with suspicion when he directs them toward the tower?,Flash Gordon and Dale Arden are struck down by a storm and approach Dr. Zarkov for help,"After a sudden storm knocks Flash and Dale to the ground, they recover and encounter Dr. Zarkov near a tower. Flash initiates contact, seeking to use a phone, while Dale observes silently. It is during this initial interaction that she recognizes Zarkov as the former NASA scientist, triggering her hesitation and growing unease. His strange demeanor and abrupt shift from silent intensity to armed coercion follow directly from this encounter, which begins with their arrival at his location following the storm.",Causal-Motivational Reasoning
9,enc6e53029ab49475dbb82bf89a57e1a42,en,33、INT. PALACE OF HALLS - SERIES OF DISSOLVES; 39、INT. UNDERGROUND GROTTO,"What action by Princess Aura first establishes her influence over Flash, making her later offer of refuge plausible?","Princess Aura observes Flash while fondling a beast, captivating him with her bold presence","Princess Aura emerges near a column, one hand resting on a crouching beast between her legs, and locks eyes with Flash as she runs her gaze over him. The creature hisses beneath her touch while Flash stares, visibly entranced, until Dale nudges him and reminds him of their alliance. Aura laughs low and turns away, leaving a clear impression of power and allure that precedes her later emergence from the water to offer Flash sanctuary in Arboria.",Causal-Motivational Reasoning
10,enc6e53029ab49475dbb82bf89a57e1a42,en,39、INT. UNDERGROUND GROTTO; 41、INT. GROTTO - HIS POV IN CAVERN - ON A CATWALK,What motivates Flash to flee with Aura while leaving Zarkov behind?,Flash insists on rescuing Dale and Zarkov and saving Earth,"After being rescued by Aura and reaching the shore, Flash acknowledges her help but emphasizes that his priority is to locate and save Dale and Zarkov, and ultimately protect Earth. This sense of mission drives his decision to escape with Aura when soldiers capture Zarkov, as he recognizes that staying would mean death and the end of any chance to mount a rescue or resistance.",Causal-Motivational Reasoning
11,enc6e53029ab49475dbb82bf89a57e1a42,en,19、INT. TOP LEVEL OF GREENHOUSE TOWER; 39、INT. UNDERGROUND GROTTO,What action directly enables Flash and Aura's appearance on the shore?,ZARKOV shoves DALE into the MIRROR BRIGHT capsule,"After Zarkov forces Dale into the mirror-bright capsule and enters it himself, Flash follows her inside. The capsule withstands surrounding explosions before it transports them, resulting in Flash and Aura emerging from water onto a beach, where Flash collapses from exhaustion.",Causal-Motivational Reasoning
12,enc6e53029ab49475dbb82bf89a57e1a42,en,33、INT. PALACE OF HALLS - SERIES OF DISSOLVES; 33、INT. PALACE OF HALLS - SERIES OF DISSOLVES,What prompts Ming's scornful critique of Earth's attempts to explore space?,Ming demands to know Flash's identity and purpose on Mongo,"After capturing Flash, Dale, and Zarkov, Ming questions their origins and intentions, leading Flash to identify himself and explain their accidental arrival on Mongo. When Klytus dismisses Earth as insignificant and doomed, Zarkov reacts with desperate hope that Earth still exists, reinforcing to Ming the naivety and futility he later mocks.",Causal-Motivational Reasoning
13,enc6e53029ab49475dbb82bf89a57e1a42,en,17、INT. COCKPIT - DAY; 39、INT. UNDERGROUND GROTTO,"By the time the survivors emerge and collapse on the shore, what has Flash already done for Dale?",Assisted Dale in exiting the wrecked cockpit,"Flash helps Dale escape through an emergency exit after the crash, enabling Dale's survival and subsequent appearance on the shore in the following sequence. This intervention occurs several scenes prior and is critical to Dale's presence during the emergence.",Temporal Reasoning
14,enc6e53029ab49475dbb82bf89a57e1a42,en,12、INT. COCKPIT - CONTINUOUS; 34、INT. PALACE - FIGHT SEQUENCE,"By the time Flash chases Dale up the mysterious stairs, what event has already taken place aboard the aircraft?",Two pilots disappear from the cockpit without explanation,"Before the confrontation on the staircase unfolds, the aircraft is left unattended when both pilots vanish under unexplained circumstances, prompting Flash and Dale to assume control and setting the stage for the subsequent pursuit.",Temporal Reasoning
15,enc6e53029ab49475dbb82bf89a57e1a42,en,33、INT. PALACE OF HALLS - SERIES OF DISSOLVES; 143、INT. GREAT HALL,How does Ming's relationship to Flash evolve from their initial confrontation through the final duel?,Ming consistently treats Flash as a target for elimination,"From the early scenes where Ming orders Flash's execution to the final confrontation in the Great Hall, Ming maintains a hostile stance, repeatedly acting to capture or kill Flash. This includes Flash being held as a prisoner under Ming's control and culminating in direct combat where Ming attacks Flash with lethal intent. Throughout these sequences, Ming's role remains that of an aggressor seeking to eliminate Flash, with no indication of alliance or truce.",Role-Relation Continuity
16,enc6e53029ab49475dbb82bf89a57e1a42,en,76、INT. LODGE - FEATURE OLD MAN; 122、INT. NARROW VERTICAL SHAFT,How does the working relationship between Flash and Tiger Man evolve from their initial encounter to their ascent through the vertical shaft?,they remain cooperative allies relying on each other in high-risk situations,"From the moment Flash frees Tiger Man from the net in the lodge, their relationship is defined by mutual action under duress: Tiger Man immediately defends Flash from the Tree Men, and they coordinate escapes through the forest and vine elevator. This pattern of reciprocal support continues as they join the climbing team, moving up the narrow vertical shaft in a structured, interdependent formation, maintaining a consistent dynamic of operational cooperation without shifts in trust or alignment.",Role-Relation Continuity
17,enc6e53029ab49475dbb82bf89a57e1a42,en,5、INT. PLANE - CONTINUOUS; 17、INT. COCKPIT - DAY; 17、INT. COCKPIT - DAY,What pivotal event shifts the trajectory of the story toward Dale accepting Flash's assistance during the crisis?,Flash and Dale Share a Plane Ride During Turbulence,"During a turbulent flight, Flash and Dale are forced into close proximity, creating the conditions for a critical shift in their dynamic. This shared experience directly sets in motion a sequence in which Dale begins to rely on Flash, leading to Flash facilitating Dale's escape through an emergency exit and ultimately securing Dale's acceptance of his offer under duress.",Narrative Progression
18,enc6e53029ab49475dbb82bf89a57e1a42,en,33、INT. PALACE OF HALLS - SERIES OF DISSOLVES; 33、INT. PALACE OF HALLS - SERIES OF DISSOLVES; 35、INT. PALACE - ON THE STAIRCASE,"What event initiates the chain of resistance and confrontation involving Flash, Dale, and Zarkov by altering Flash's alignment within Ming's court?",Princess Aura's Arrival and Flash's Captivation,"Princess Aura's arrival introduces a pivotal shift in Flash's position on Mongo, as her presence and influence captivate him, creating internal conflict and setting in motion a series of actions that lead to defiance against Ming, including resistance during capture, a desperate escape attempt with Dale, and a direct confrontation with Ming's Amazon guards.",Narrative Progression
19,enc6e53029ab49475dbb82bf89a57e1a42,en,18、INT. GREENHOUSE - DAY; 18、INT. GREENHOUSE - DAY; 18、INT. GREENHOUSE - DAY,What pivotal event sets in motion the sequence in which Flash and Dale are forced up the tower and Dale begins to question Dr. Zarkov's motives?,Flash and Dale meet Dr. Zarkov after being struck down by a storm,"After surviving a violent storm that leaves them stranded, Flash and Dale encounter Dr. Zarkov, whose urgent demeanor and unorthodox claims immediately unsettle them. This encounter establishes Zarkov's authority over the situation and initiates a chain of escalating tension, leading directly to their coerced ascent of the tower under dangerous conditions and prompting Dale to confront whether Zarkov is a savior or a madman.",Narrative Progression
20,enc6e53029ab49475dbb82bf89a57e1a42,en,35、INT. PALACE - ON THE STAIRCASE; 35、INT. PALACE - ON THE STAIRCASE; 46、INT. MING'S SERAGLIO,"What pivotal event sets in motion the sequence where Aura follows Flash into the trap door, Dale consumes Cythera's potion, and Flash and Aura descend into the underground water?",Flash and Dale's Desperate Reach,"The narrative escalates as a critical moment of physical and emotional urgency unfolds, triggering a chain of irreversible actions. This moment propels the characters into confined, hidden spaces and initiates transformative choices involving trust, sacrifice, and descent into the unknown, directly leading to the convergence of key plot threads below the surface.",Narrative Progression
