id,movie_id,language,related_scenes,question,answer,evidence_or_reason,question_type
1,en049957b3c0b54085baddbec23e00506c,en,29、INT. BEDROOM - NIGHT,What is John's objective when he climbs into the big bed and lies down?,To leave the room,"John climbs into the big bed fully clothed, turns off the light, and lies in the moonlight without moving. After twenty seconds, the bedroom door opens, and he gets up as casually as possible, indicating his intention to exit. He tells Nadia she should go and they’ll talk in the morning, but before he can speak further, she silences him by placing her hand over his mouth [John Tries to Leave but Nadia Silences Him].",Character Understanding
2,en049957b3c0b54085baddbec23e00506c,en,33、INT. LANDING - DAY,What does Nadia decide to do after encountering John in the bathroom?,Lock herself in with him,"Nadia walks into the bathroom and sees John sitting naked on the toilet. He lets out a short shout. She holds his gaze for a few seconds longer than expected, then shuts the door and turns the lock, closing them in together.",Character Understanding
3,en049957b3c0b54085baddbec23e00506c,en,39、INT. NADIA'S BEDROOM - DAY,What does he intend to do upon discovering the wooden chest in her suitcase?,Open the chest to examine its contents,"He notices a small wooden chest inside her open suitcase, removes it, and places it on the bed. After a pause, he opens it and finds a pair of Russian Army field binoculars, which he sets beside him.",Character Understanding
4,en049957b3c0b54085baddbec23e00506c,en,14、EXT. HARD SHOULDER - DAY,What does John aim to accomplish upon noticing the woman kneeling by the roadside?,Assess the woman's condition,"John moves through the rain around the Rover and sees a woman kneeling on the verge, vomiting. He steps toward her and places a hand on her shoulder. She quickly stands, her posture stiff, her expression cold and composed despite what just occurred.",Character Understanding
5,en049957b3c0b54085baddbec23e00506c,en,19、INT. SPARE BEDROOM - DAY,What does Nadia do immediately after first seeing John in the spare bedroom?,Observes John beside the single bed,"Nadia enters the spare bedroom and sees John standing next to a narrow bed. She looks at the bed, then at John, and briefly leaves the room. Moments later, she returns with a hold-all and suitcase, places the suitcase on the bed, and begins unpacking.",Scene Grounding
6,en049957b3c0b54085baddbec23e00506c,en,10、INT. ARRIVALS GATE - DAY,What happens when John first meets Nadia at the arrivals gate?,John greets Nadia and welcomes her after identifying her in the crowd,"John waits at the arrivals gate and approaches Nadia when he recognizes her. He introduces himself, welcomes her, and their conversation is briefly interrupted by a loud announcement. Afterward, he asks about her luggage, confirming it's all she has with her.",Scene Grounding
7,en049957b3c0b54085baddbec23e00506c,en,43、INT. NADIA'S BEDROOM - DAY,What action initiates the confrontation in the bedroom scene?,John announces plans to book departure flight,"John is in Nadia's bedroom, packing a suitcase and hiding a photo as she enters. He declares the relationship over, calls it a mistake, and tells her she must leave. He then removes his engagement ring and places it on the bed, prompting no immediate response from Nadia before the encounter turns physical.",Scene Grounding
8,en049957b3c0b54085baddbec23e00506c,en,29、INT. BEDROOM - NIGHT; 29、INT. BEDROOM - NIGHT,"In [29、INT. BEDROOM - NIGHT], what action by Nadia immediately before John's release creates the physical intimacy that precedes her sudden departure?",Nadia initiates a physical encounter on the bed,"After John removes his ring and announces he is ending their relationship, preparing to leave, Nadia responds non-verbally by pulling off his shirt and mounting him on the bed, taking control of the physical interaction. This intimate moment culminates in John's release, after which Nadia silently disengages, stands, and walks out of the room without speaking, marking her emotional withdrawal following the act.",Causal-Motivational Reasoning
9,en049957b3c0b54085baddbec23e00506c,en,29、INT. BEDROOM - NIGHT; 29、INT. BEDROOM - NIGHT,What action directly triggers Nadia's departure shortly after John's release in the bedroom?,She guides John's hand across her body and stimulates him until he climaxes,"In the bedroom at night, after John hesitates and suggests she leave, Nadia takes control by placing his hand on her body, unbuttons her shirt, and directs his touch. She simultaneously unzips his fly and stimulates him until he ejaculates. Observing this, she immediately withdraws, silently exits the room, and leaves him standing there, composing himself.",Causal-Motivational Reasoning
10,en049957b3c0b54085baddbec23e00506c,en,24、INT. KITCHEN - DAY; 24、INT. KITCHEN - DAY,What moment during the meal creates the emotional tension that leads Nadia to place the ring on John's finger?,John and Nadia exchange prolonged eye contact during a tense meal,"During a quiet but strained meal in the kitchen, John and Nadia sit across from each other, their interactions minimal. As they eat, their eyes repeatedly meet and break away, building unspoken tension. John notices ants moving erratically on the wall behind Nadia and sets his fork down, signaling discomfort. This charged silence and sustained eye contact establish a psychological pivot that culminates in Nadia's decisive gesture with the ring later in the same scene.",Causal-Motivational Reasoning
11,en049957b3c0b54085baddbec23e00506c,en,16、INT. JOHN'S HOUSE - DAY; 43、INT. NADIA'S BEDROOM - DAY,What moment prior to John hiding the photo makes his action significant in light of Nadia's presence?,John and Nadia observe the welcome banner upon arriving at the apartment,"When John and Nadia enter the apartment, they encounter a 'Welcome Nadia' banner that marks the first visible sign of someone acknowledging her arrival. Their shared silence and focus on the banner establish an atmosphere of unspoken tension, subtly signaling that appearances matter and certain things must be acknowledged—or concealed. This moment sets the stage for John’s later decision to hide the photo when Nadia enters her bedroom, reflecting a growing awareness of what should remain hidden in her presence.",Causal-Motivational Reasoning
12,en049957b3c0b54085baddbec23e00506c,en,16、INT. JOHN'S HOUSE - DAY; 16、INT. JOHN'S HOUSE - DAY,"In [16、INT. JOHN'S HOUSE - DAY], what action immediately before the kitchen scene establishes John's strained demeanor during the tour?",John leads Nadia to the lounge,"As John shows Nadia through his house, he opens the door to the lounge and quietly indicates the room before guiding her down the hallway toward the kitchen. His movements are tense and deliberate, and his face appears pale as he nods to himself, signaling discomfort that carries into the next space.",Causal-Motivational Reasoning
13,en049957b3c0b54085baddbec23e00506c,en,84、EXT. LAKE IN FOREST - DAY; 165、INT. ALEXEI'S SUITE - NIGHT,How does John Buckingham's relationship with Alexei evolve from their initial confrontation at the lake to the final encounter in Alexei's suite?,"John Buckingham consistently treats Alexei as an adversary, escalating from intervention to direct confrontation","From the lakeside scene where John swims toward Alexei to stop him from submerging Nadia, their relationship is marked by mutual hostility. Alexei responds with a threatening stare, and in subsequent scenes, the tension solidifies: John confronts Alexei in the kitchen, accusing him of threatening Nadia, while Alexei positions himself aggressively with a knife. This adversarial dynamic culminates in Alexei's suite, where he physically attacks John upon seeing him, confirming an ongoing and intensifying hostile relationship.",Role-Relation Continuity
14,en049957b3c0b54085baddbec23e00506c,en,74、INT. JOHN'S LOUNGE - NIGHT; 146、INT. / EXT. AIRPORT EXIT - NIGHT,How does the working relationship between Nadia and Yuri evolve from their interaction in the lounge to the airport exit?,They remain aligned but shift from active cooperation to non-interventionist observation,"From the lounge scene through the airport exit, Nadia and Yuri maintain a positive alignment rooted in trust and shared purpose. In the lounge, they engage directly, with Nadia relying on Yuri for translation and emotional support, reflecting a cooperative and trusting dynamic. Later, at the motel, Nadia is seen as part of Yuri’s close circle, reinforcing their bond as trusted companions. By the airport exit, direct interaction ceases, but Yuri’s presence and passive observation—standing nearby without intervening—suggest continued favor and situational restraint rather than a break in allegiance.",Role-Relation Continuity
15,en049957b3c0b54085baddbec23e00506c,en,19、INT. SPARE BEDROOM - DAY; 19、INT. SPARE BEDROOM - DAY; 19、INT. SPARE BEDROOM - DAY,"What event initiates the sequence in which Nadia unpacks, John tests the lamp, leaves, and is later found naked?",Nadia Enters the Room and Begins to Unpack,"The scene unfolds in the spare bedroom during the day, where Nadia's arrival and the start of her unpacking set into motion a chain of actions involving John's increasingly erratic behavior. Her entering and beginning to unpack establishes the spatial and emotional context that leads directly to John testing the lamp, his abrupt departure, and the tense moment when Nadia discovers him naked and locks the door. [19、INT. SPARE BEDROOM - DAY]",Narrative Progression
16,en049957b3c0b54085baddbec23e00506c,en,43、INT. NADIA'S BEDROOM - DAY; 45、INT. NADIA'S ROOM - DAY; 29、INT. BEDROOM - NIGHT,"What pivotal event initiates the shift in John and Nadia's relationship, leading directly to their intimate and domestic moments together?",John Meets Nadia at the Airport,"The narrative turns decisively when John greets Nadia at the arrivals gate, marking the beginning of their sustained interaction. This encounter sets in motion a series of closely linked developments, including their arrival at the shared space, exploration of common areas, and eventual physical intimacy, all unified by the growing connection established at the airport. [10、INT. ARRIVALS GATE - DAY]",Narrative Progression
17,en049957b3c0b54085baddbec23e00506c,en,16、INT. JOHN'S HOUSE - DAY; 16、INT. JOHN'S HOUSE - DAY; 19、INT. SPARE BEDROOM - DAY,"What pivotal event sets in motion the sequence in which John shows Nadia the lounge and kitchen, she begins unpacking, and he departs while she pauses to look out the window?",John and Nadia Arrive and See the Banner,"The arrival at the house and the immediate reaction to the banner marks the shift into the core domestic space, initiating a chain of actions centered on settling in and unspoken tension. This moment transitions the narrative from external movement to interior engagement, directly enabling the subsequent scenes of exploration, routine activity, and emotional pause. [16、INT. JOHN'S HOUSE - DAY]",Narrative Progression
18,en049957b3c0b54085baddbec23e00506c,en,43、INT. NADIA'S BEDROOM - DAY; 45、INT. NADIA'S ROOM - DAY; 29、INT. BEDROOM - NIGHT,What pivotal event shifts the narrative trajectory toward the intimate encounter and its immediate aftermath between John and Nadia?,Nadia Initiates Physical Encounter After John's Rejection,"In the scene set in Nadia's bedroom, a charged emotional exchange culminates in Nadia initiating physical intimacy with John shortly after he rejects her in a vulnerable moment. This act redefines their dynamic and directly precipitates the subsequent sequence in which they engage in sex with intense eye contact, Nadia assumes control during the encounter, and ultimately departs after John reaches climax. [43、INT. NADIA'S BEDROOM - DAY]",Narrative Progression
19,en049957b3c0b54085baddbec23e00506c,en,,Who are the 3 most central characters in this story?,"Alexei, John Buckingham, Nadia",,Character Understanding
20,en049957b3c0b54085baddbec23e00506c,en,,Which scenes best match the following description: Nadia walks into the kitchen and takes the spoon from John. She says something to him in Russian and gestures for him to sit down. He watches as she tastes the stew and then begins stirring the pot.,23、INT. KITCHEN - DAY | 24、INT. KITCHEN - DAY,Nadia walks into the kitchen and takes the spoon from John. She says something to him in Russian and gestures for him to sit down. He watches as she tastes the stew and then begins stirring the pot.,Scene Grounding
21,en049957b3c0b54085baddbec23e00506c,en,,Which scenes show Branch Manager and Nadia together?,51、INT. JOHN'S KITCHEN - DAY | 55、INT. JOHN'S BEDROOM - DAY | 56、INT. LOUNGE - DAY | 80、INT. BANK - DAY,These 4 scenes were selected because Branch Manager and Nadia are explicitly present together in the extracted scene graph. They co-occur 6 times across the script. The listed scenes are the clearest grounded matches.,Scene Grounding
22,en049957b3c0b54085baddbec23e00506c,en,,Which scenes clearly show Official?,170、INT. TICKET SALES - NIGHT | 172、INT. TICKET SALES - NIGHT | 174、INT. AIRPORT BOARDING GATE - FLIGHT 1311 TO MOSCOW - DAY,These 3 scenes were selected because Official is explicitly mentioned or visibly present in those scenes in the extracted graph. The character is referenced 13 times overall.,Scene Grounding
23,en049957b3c0b54085baddbec23e00506c,en,,"Which scenes best match the following description: Nadia steps out of the bathroom with her hair wrapped in a towel and walks directly toward the group. John stands in Nadia's bedroom, wearing only a tee shirt and running shorts. He closes the chest and drops it back into the suitcase.",42、INT. LANDING - DAY | 43、INT. NADIA'S BEDROOM - DAY,"Nadia steps out of the bathroom with her hair wrapped in a towel and walks directly toward the group. John stands in Nadia's bedroom, wearing only a tee shirt and running shorts. He closes the chest and drops it back into the suitcase.",Scene Grounding
24,en049957b3c0b54085baddbec23e00506c,en,,Which scenes show Nadia and Policeman together?,129、INT. POLICE CORRIDOR - DAY | 141、EXT. FOREST - NIGHT | 173、INT. AIRPORT CAFE - NIGHT,These 3 scenes were selected because Nadia and Policeman are explicitly present together in the extracted scene graph. They co-occur 18 times across the script. The listed scenes are the clearest grounded matches.,Scene Grounding
26,en049957b3c0b54085baddbec23e00506c,en,29、INT. BEDROOM - NIGHT; 43、INT. NADIA'S BEDROOM - DAY,"By the time John hides the photo before Nadia enters, what has already taken place in the bedroom at night?",John lies in bed in the moonlight after turning off the light,"Earlier in the narrative, John is seen lying in bed in the dim light after switching off the lamp, a quiet moment that precedes the later action where he conceals a photograph just before Nadia arrives. The two events are separated by several scenes, but the initial moment establishes the setting and John's presence in the space well before the tension of hiding the photo unfolds.",Temporal Reasoning
27,en049957b3c0b54085baddbec23e00506c,en,23、INT. KITCHEN - DAY; 24、INT. KITCHEN - DAY,What occurs in the kitchen shortly before John and Nadia sit down for their tense meal?,Nadia enters the kitchen and takes the spoon from John,"In the moments leading up to the shared meal, tension builds as Nadia enters the kitchen and asserts control over the cooking by taking the spoon from John. This small but charged action sets the tone for the interaction that follows, establishing a shift in power dynamics between them just before they sit down together. [23、INT. KITCHEN - DAY]",Temporal Reasoning
28,en049957b3c0b54085baddbec23e00506c,en,10、INT. ARRIVALS GATE - DAY; 13、INT. / EXT. JOHN'S CAR (MOVING) - DAY,What key event establishes the start of John and Nadia's interaction shortly before their drive to the motorway?,John greets arriving passenger Nadia at airport,"Prior to the car journey, John meets Nadia for the first time upon her arrival, greeting her at the airport's arrivals gate. This moment sets the foundation for their subsequent interaction during the drive, establishing the beginning of their shared narrative trajectory.",Temporal Reasoning
31,en049957b3c0b54085baddbec23e00506c,en,13、INT. / EXT. JOHN'S CAR (MOVING) - DAY,What causes Nadia to suddenly vomit out of the moving car in 13、INT. / EXT. JOHN'S CAR (MOVING) - DAY?,winding the window down and vomiting out of the speeding car,Suddenly she winds the window down and vomits out of the speeding car.,Causal-Motivational Reasoning
32,en049957b3c0b54085baddbec23e00506c,en,25、INT. LOUNGE - NIGHT,What prompts John to make a distress call off-screen in 25、INT. LOUNGE - NIGHT?,He felt an urgent need to seek help during a moment of emotional crisis.,"JOHN (O.S.)
If anyone gets this message please
call as soon as possible. It's an
emergency.",Causal-Motivational Reasoning
33,en049957b3c0b54085baddbec23e00506c,en,13、INT. / EXT. JOHN'S CAR (MOVING) - DAY,"In 13、INT. / EXT. JOHN'S CAR (MOVING) - DAY, what underlying fear drives John Buckingham’s hesitant speech, even if it’s never stated directly?",fear of miscommunication and social failure in a high-stakes personal encounter,Do uh... Sorry. Can you follow me?\nDo you understand what I'm saying?\nNADIA\nYes.\nJOHN\nGood. Or should I speak slower?\nNADIA\nYes.\nJOHN\nDo you follow or should I speak slower?\nNADIA\nYes.,Character Understanding
34,en049957b3c0b54085baddbec23e00506c,en,25、INT. LOUNGE - NIGHT,"In 25、INT. LOUNGE - NIGHT, what unspoken concern does John’s furtive attention to Nadia reveal?",fixation on Nadia's presence suggesting unease or suppressed emotion,"He steals side-glances at her. Her mouth.
Her red-painted fingers knitting fast.",Character Understanding
