id,movie_id,language,related_scenes,question,answer,evidence_or_reason,question_type
1,ch0b3b18b813e9ce3dcea7e660ab062e79e2637aab,zh,场30，夜，阿信小贤家,小阿信从凳子上跳下后，最在意妈妈对他比赛成就的什么态度？,是否认可,小阿信主动询问妈妈是否看了比赛，且在妈妈回避回应后笑容消失，显示他在意的是母亲对其成就的认可与否。,Character Understanding
2,ch0b3b18b813e9ce3dcea7e660ab062e79e2637aab,zh,场41，日，水闸门河堤边,在阿信拨通电话后，他根据什么信息调整了行动？,撞球间有埋伏需避开,秘书在确认阿信身份后，转达了紧急留言：四点前去撞球间有埋伏，必须小心。阿信回应‘好’，表明他已接收并理解该警告，据此调整后续行动。,Character Understanding
3,ch0b3b18b813e9ce3dcea7e660ab062e79e2637aab,zh,场47，夜，阿信小贤房,在小贤转达母亲抱怨时，阿信的回应反映了他对家庭责任的何种判断？,责任与报酬不对等,阿信认为自己支付的工资有限，不应承担更多家庭劳动义务，因此对母亲的要求表现出疏离和抗拒，体现出他对责任分担的功利性认知。,Character Understanding
4,ch0b3b18b813e9ce3dcea7e660ab062e79e2637aab,zh,场34，黄昏，水果摊,小贤追问阿信体操比赛安排，反映出他在两人关系中扮演什么角色？,支持者/参赛者,小贤主动关心比赛安排，显示他将自己视为阿信体操事业的辅助者，而阿信是被支持的选手。,Character Understanding
5,ch0b3b18b813e9ce3dcea7e660ab062e79e2637aab,zh,场30，夜，阿信小贤家,在小阿信比赛归来后与家人互动的这场戏中，最能推动情节发展的关键动作是什么？,小阿信从凳子跳下并询问妈妈是否来看他比赛,这一动作触发了后续家庭成员之间的张力释放：母亲的沉默与回避揭示了她对儿子成就的冷淡态度，小阿信的情绪变化由此展开，弟弟的向往与母亲的激烈反对也紧随其后，使这场戏成为家庭内部价值观冲突的集中爆发点。,Scene Grounding
6,ch0b3b18b813e9ce3dcea7e660ab062e79e2637aab,zh,场39，日，阿信家餐桌/电话秘书办公室,在[场39，日，阿信家餐桌/电话秘书办公室]中，哪一动作最直接体现了小贤对哥哥离去的内心反应？,小贤担忧地看着哥哥骑车离去,这场戏通过小贤凝视哥哥离开的背影，表现出他对阿信处境的关切，与母亲的责骂形成情绪对比，凸显兄弟间无声的情感联结。,Scene Grounding
7,ch0b3b18b813e9ce3dcea7e660ab062e79e2637aab,zh,场42，日，撞球间／电话秘书办公室,在撞球间那场戏中，哪个动作直接触发了阿信下达撤离指令的连锁反应？,传呼机响起后寻求零钱未果,传呼机响起是外部指令进入的关键信号，阿信随即尝试打电话却缺乏零钱，这一阻碍凸显处境的紧迫与非常规，成为他与环境互动的转折点，最终导向通话、决策与集体行动的展开。该动作串联起信息接收、资源匮乏、权力展示与命令发布的全过程，是推动情节跃迁的核心触发点。,Scene Grounding
8,ch0b3b18b813e9ce3dcea7e660ab062e79e2637aab,zh,场43，夜，庙口小树家面摊/电话秘书办公室; 场39，日，阿信家餐桌/电话秘书办公室,在小贤望着哥哥离开、母亲责骂中催促他吃饭之前，哪一个更早的举动埋下了情感上的伏笔？,阿信临行前注视小树,阿信在离开前默默注视小树收拾碗筷，这一未言明的关注流露出他对小树的在意，也为后续家庭场景中阿信缺席时的情感张力提供了动因。小贤的沉默凝望与母亲的责骂，折射出阿信这一动作所牵连的家庭情绪链条。,Causal-Motivational Reasoning
9,ch0b3b18b813e9ce3dcea7e660ab062e79e2637aab,zh,场28，日，县立体育舘; 场30，夜，阿信小贤家,在小阿信夺冠后家人反应的场景中，是什么更早的事件影响了母亲让孩子们先拜父亲的举动？,黄教练在小阿信比赛过程中表现紧张,黄教练在比赛现场的紧张反应凸显了夺冠的不易，这一压力氛围间接强化了家庭对父亲精神寄托的依赖，从而推动母亲要求孩子先向父亲遗照报喜。,Causal-Motivational Reasoning
10,ch0b3b18b813e9ce3dcea7e660ab062e79e2637aab,zh,场36，日，教练办公室; 场45，夜，体操舘内,是什么更早发生的情节，推动了阿信在深夜倒立凝视黑暗中的体操馆？,阿信因被移出比赛名单而情绪崩溃，踢倒椅子后含恨离去,阿信在教练办公室得知自己无法参赛，感到被否定，愤怒地踢倒椅子并离开。这一挫败与情感爆发成为他后来独自返回体操馆、以倒立姿态静默告别的内在驱动力，标志着他对体操的情感转折。,Causal-Motivational Reasoning
11,ch0b3b18b813e9ce3dcea7e660ab062e79e2637aab,zh,场33，黄昏，铁道涵洞; 场34，黄昏，水果摊,在小贤发现阿信受伤并追问体操比赛之前，哪一个关键事件直接导致阿信脚踝带伤回家？,阿信在国术馆包扎脚踝后被妈妈用机车载回家,阿信脚踝受伤后前往国术馆处理伤口，随后由母亲接回，这一过程使他带着明显伤势出现在家中，从而引发小贤的注意和追问。事件的发生顺序和伤情的可见性构成了后续互动的直接前提。,Causal-Motivational Reasoning
12,ch0b3b18b813e9ce3dcea7e660ab062e79e2637aab,zh,场2，夜，医院走廊; 场33，黄昏，铁道涵洞,到了妈妈骑机车载受伤的阿信经过铁道涵洞时，此前在医院走廊里已发生的紧急情况是什么？,医护人员紧急推送阿信进入急诊室,在铁道涵洞场景之前，故事已在医院走廊展开，阿信被医护人员迅速推进急诊室，标志着救援阶段的开始，为后续母亲接回儿子的情节提供前提。,Temporal Reasoning
13,ch0b3b18b813e9ce3dcea7e660ab062e79e2637aab,zh,场15，日，体操馆内; 场27，日，体操馆跳马区,在小小树跳马成功并回应教练对小阿信的夸奖之前，他作为队长组织了什么体现其领导角色的关键行动？,带领队员跑步热身，履行队长的组织职责,从热身到跳马成功之间存在12场的时间跨度，表明热身是后续表现的基础准备阶段，且由队长发起。,Temporal Reasoning
14,ch0b3b18b813e9ce3dcea7e660ab062e79e2637aab,zh,场32，日，体操馆内跳马区; 场137，日，国际体操馆内,从[场32，日，体操馆内跳马区]到[场137，日，国际体操馆内]，阿信和黄教练之间的指导关系在经历冲突与修复后，最终稳定为何种形式？,从技术指导的师生关系发展为情感深厚、彼此信赖的师徒关系,两人初期建立在训练基础上的正向师生关系曾因比赛名单事件出现短暂破裂，但后续通过黄教练持续的关心与阿信的回归逐步深化，最终在国际赛场的高光时刻体现出超越普通教学的情感联结，形成以信任和情感投入为核心的师徒关系。,Role-Relation Continuity
15,ch0b3b18b813e9ce3dcea7e660ab062e79e2637aab,zh,场37，日，铁路平交道; 场137，日，国际体操馆内,从铁路平交道到国际体操馆的回忆场景中，菜甫和阿信之间的关系或分工如何延续？,阿信始终保护并配合菜甫行动,两人在多个场景中表现出持续的信任与合作，包括共同应对冲突、通过留言协调行动、默契配合制造假警报等，显示出阿信始终在行动上支持和保护菜甫，关系稳定且分工明确。,Role-Relation Continuity
16,ch0b3b18b813e9ce3dcea7e660ab062e79e2637aab,zh,场25，日，体操馆鞍马区; 场137，日，国际体操馆内,从[场25，日，体操馆鞍马区]到[场137，日，国际体操馆内]，小树对阿信的关系如何演变？,从竞争中的同伴变为因对方成功而产生情感共鸣的认同关系,最初两人在鞍马训练中彼此关注，处于竞争中带有合作意味的同伴状态；随着剧情推进，小树多次表现出对阿信的信任与关心，尽管仍视其为对手，但最终在国际赛场看到阿信成功时露出真诚笑容，标志其情感上已产生深层认同，关系由竞争性同伴升华为情感共鸣。,Role-Relation Continuity
17,ch0b3b18b813e9ce3dcea7e660ab062e79e2637aab,zh,场36，日，教练办公室; 场36，日，教练办公室; 场36，日，教练办公室,在[场36，日，教练办公室]中，哪一事件直接引发了阿信被移出比赛名单及后续家庭冲突的连锁反应？,阿信在教练办公室与母亲对峙,该对峙是阿信与家庭矛盾公开化的关键节点，母亲在此施加压力导致教练做出换人决定，进而触发阿信情绪爆发与离场，构成剧情从竞技场转向家庭张力的枢纽。,Narrative Progression
18,ch0b3b18b813e9ce3dcea7e660ab062e79e2637aab,zh,场30，夜，阿信小贤家; 场30，夜，阿信小贤家; 场30，夜，阿信小贤家,在[场30，夜，阿信小贤家]中，哪一个举动打破了小阿信与母亲之间的情感僵局，并触发了后续家庭庆祝与团队认可的连锁反应？,小阿信追问妈妈是否看了比赛,该提问标志着小阿信首次主动寻求母亲的情感见证，将比赛成就从公共领域引入家庭关系的核心，由此激活了后续的仪式性回报、家庭内部的荣誉展演以及团队对个人胜利的集体追认。,Narrative Progression
19,ch0b3b18b813e9ce3dcea7e660ab062e79e2637aab,zh,场33，黄昏，铁道涵洞; 场34，黄昏，水果摊; 场34，黄昏，水果摊,哪一个事件成为后续母女对峙情绪升级的关键转折？,妈妈骑机车载受伤的阿信经过铁道涵洞,该场景首次将身体创伤与沉默的共处空间并置，通过封闭的涵洞环境和母女间无交流的同行，为后续一系列言语冲突和情感爆发埋下张力伏笔，构成叙事推进的枢纽点。,Narrative Progression
20,ch0b3b18b813e9ce3dcea7e660ab062e79e2637aab,zh,场41，日，水闸门河堤边; 场42，日，撞球间／电话秘书办公室; 场42，日，撞球间／电话秘书办公室,什么事件直接触发了阿信紧急撤离、后续突袭撞球帮以及临行前凝视小树这一系列行动？,阿信接通电话收到埋伏警告,该通电话带来了外部威胁的即时情报，迫使阿信中断原有计划，转为主动撤离与反击，成为后续一系列决断行动的导火索。,Narrative Progression
