id,movie_id,language,related_scenes,question,answer,evidence_or_reason,question_type
1,ch89a645353ab1034f9c3cf6f0e52cb1d825a383d8,zh,8、EXT/INT.日/夜.一组蒙太奇,在驾驶区送花时，刘培强最想隐藏的意图是什么？,避免表白被当场揭穿,刘培强手持玫瑰试探性接近韩朵朵，言语闪烁，试图以模糊说法掩饰真实意图；当察觉乘客围观且场面尴尬时，立即试图离开，显示其行动核心是回避公开表白。,Character Understanding
2,ch89a645353ab1034f9c3cf6f0e52cb1d825a383d8,zh,5、EXT/INT.日.利伯维尔 战区废墟/J20C 驾驶舱,在J20C起飞时，张鹏提醒刘培强慢点操作并询问登月准备，他最想确认什么？,确认登月准备与安全操作,张鹏在刘培强起飞过程中提醒其控制操作，并主动询问登月任务准备情况，体现出他对任务执行安全和长期离地球的心理准备的双重关切。,Character Understanding
3,ch89a645353ab1034f9c3cf6f0e52cb1d825a383d8,zh,4、EXT.日.利伯维尔 战区废墟,刘培强在废墟街道摘下墨镜直视太阳并发问，此时他与张鹏之间的角色关系是什么？,质疑者/回应者,刘培强质疑太阳危机的真实性，张鹏则警告并回应关于太阳终将毁灭地球的真相，体现出一方发问、一方提供答案的角色分工。,Character Understanding
4,ch89a645353ab1034f9c3cf6f0e52cb1d825a383d8,zh,6、EXT/INT.日.利伯维尔 战区废墟 返航途中/J20C 驾驶舱,在J20C接近跨海大桥时，刘培强突然加速飞行的判断依据是什么？,突破封锁时机已到,刘培强在接近UEG基地大桥时突然加速，紧贴海面飞行，表明他判断当前是突破防线的最佳时机，张鹏的警告反映出此举具有高风险但意图明确。,Character Understanding
5,ch89a645353ab1034f9c3cf6f0e52cb1d825a383d8,zh,8、EXT/INT.日/夜.一组蒙太奇,在太空电梯升空前的蒙太奇序列中，触发整个升空进程的关键动作是什么？,太空电梯广播宣布发射倒计时开始,该广播标志着升空程序正式启动，是后续所有物理反应和人物状态变化的起点，包括G力增强、角色生理反应及意识丧失。,Scene Grounding
6,ch89a645353ab1034f9c3cf6f0e52cb1d825a383d8,zh,8、EXT/INT.日/夜.一组蒙太奇,在驾驶舱准备升空的过程中，教官传达的关键警告是什么？,警告学员首次升空的危险和规则,教官在升空前向刘培强、韩朵朵和乔希等学员强调这是他们第一次升空，明确告知途中若呕吐将被淘汰且不会获得人工呼吸救助，同时提醒承受9G重力的危险和抗荷服检查的重要性，这些构成了该场景的核心推进动作。,Scene Grounding
7,ch89a645353ab1034f9c3cf6f0e52cb1d825a383d8,zh,8、EXT/INT.日/夜.一组蒙太奇,在车辆行驶途中，哪一动作最能体现太空电梯周边环境的紧张与日常并存的氛围？,扑灭燃烧瓶引发的火势,车辆行进过程中，窗外既有工作人员处理突发火情的紧张场面，又有太空电梯正常发射升空的日常景象，两者并置凸显了环境的特殊氛围。该动作是当前画面中唯一需要紧急应对的事件，构成了场景的视觉与情绪支点。,Scene Grounding
8,ch89a645353ab1034f9c3cf6f0e52cb1d825a383d8,zh,8、EXT/INT.日/夜.一组蒙太奇; 7、EXT/INT.日.利伯维尔 UEG 基地 行星发动机 附近空域/J20C 驾驶舱,在刘培强抵达UEG基地观察行星发动机之前，哪一个关键互动促使他启程进入基地？,刘培强与张鹏相遇并一同登车,刘培强在基地外与张鹏碰面，张鹏的出现和互动打破了刘培强的沉思状态，随即两人共同登上前往基地内部的小巴，这一行动直接启动了他前往行星发动机的行程。该互动标志着他从外部观察转入正式进入任务区域的转折点。,Causal-Motivational Reasoning
9,ch89a645353ab1034f9c3cf6f0e52cb1d825a383d8,zh,8、EXT/INT.日/夜.一组蒙太奇; 8、EXT/INT.日/夜.一组蒙太奇,在太空电梯驾驶区，是什么促使韩朵朵在刘培强试图离开时喊住他并表达等待的意愿？,刘培强送花时因紧张而欲逃离现场,刘培强在驾驶区向韩朵朵送花，面对她的调侃和乘客的围观感到窘迫，试图离开。这一退缩行为触发了韩朵朵的情感回应，她主动喊住他并承诺等待，以此化解尴尬并传递接纳的信号。,Causal-Motivational Reasoning
10,ch89a645353ab1034f9c3cf6f0e52cb1d825a383d8,zh,8、EXT/INT.日/夜.一组蒙太奇; 8、EXT/INT.日/夜.一组蒙太奇,在刘培强送花表白被乘客围观之前，哪一个关键心理瞬间促使他产生了表白的冲动？,刘培强看到韩朵朵制服抗议者后，默念她的名字并浮现出婚姻与家庭的联想,刘培强在基地外目睹韩朵朵果断制服持燃烧瓶的抗议者，对其产生强烈印象。他在看到她名牌上名字的瞬间，内心出现浪漫化联想，包括婚帖和抱婴画面，这一心理反应成为后续送花行为的情感动因。,Causal-Motivational Reasoning
11,ch89a645353ab1034f9c3cf6f0e52cb1d825a383d8,zh,7、EXT/INT.日.利伯维尔 UEG 基地 行星发动机 附近空域/J20C 驾驶舱; 7、EXT/INT.日.利伯维尔 UEG 基地 行星发动机 附近空域/J20C 驾驶舱,J20C飞向UEG基地的飞行行动，如何促成了建筑人员在行星发动机外壁的施工场景？,J20C飞向夕阳下的UEG基地,J20C接近行星发动机的过程中，展示了该设施已进入建设阶段，飞行路径穿越施工区域，直接呈现了建筑人员在外壁作业的现场。这一飞行行动标志着对工程进展的实地观察，将叙事焦点从外部空间转向发动机本体的建造活动，从而引出并合理化后续的施工画面。,Causal-Motivational Reasoning
12,ch89a645353ab1034f9c3cf6f0e52cb1d825a383d8,zh,4、EXT.日.利伯维尔 战区废墟; 149、INT.无日夜.太空 “领航员”空间站 出发大厅,从最初在战区废墟中的互动到后续任务期间的信息传递，刘培强与张鹏之间的角色关系如何体现一种持续的分工与信任结构？,从带路者/跟进者的行动分工发展为托付者/接收者的信任关系，张鹏始终承担引导与保护角色，刘培强则是被保护与信息承接的一方。,两人关系始于张鹏带领刘培强穿越废墟并承诺照顾，后期通过密闭空间站中以暗号传递信息的方式延续，表明其关系稳定且具有明确的角色分工与互信基础。,Role-Relation Continuity
13,ch89a645353ab1034f9c3cf6f0e52cb1d825a383d8,zh,8、EXT/INT.日/夜.一组蒙太奇; 161、EXT.夜.北京 北京三号行星发动机 坝体/水下,从两人重逢的蒙太奇段落到北京三号发动机的最终行动，加拉克乔诺夫与张鹏的关系如何演进？,从大学好友发展为在危机中相互托付的信任伙伴,二人初登场时以旧日同窗身份重逢，互动熟稔自然；后续在跨国救援与联合行动中频繁协作，张鹏在紧急时刻直接呼叫加拉克乔诺夫请求支援，战场上亦有战术配合；至故事高潮阶段，双方以兄弟相称，在生死关头深情告别，体现出超越普通战友的深厚信任与情感联结。关系主线由旧谊自然延伸为共担使命的坚实伙伴关系。,Role-Relation Continuity
14,ch89a645353ab1034f9c3cf6f0e52cb1d825a383d8,zh,51、 EXT/INT.日.利伯维尔 UEG 基地 太空电梯 08 号轿厢; 139、EXT/INT.日/夜.一组蒙太奇,从太空电梯任务初期到后续行动中，图恒宇和马兆之间的合作关系是如何演进的？,从执行指令的协作转为生死托付的信任关系,两人最初在太空电梯任务中作为工作伙伴协同操作，马兆指导图恒宇完成关键步骤，体现任务层面的配合；随着共同经历危机，马兆将个人数据卡交由图恒宇处置，并在最后时刻托付密码器，图恒宇也试图救援，表明关系已深化为基于生死信任的紧密联结。,Role-Relation Continuity
15,ch89a645353ab1034f9c3cf6f0e52cb1d825a383d8,zh,8、EXT/INT.日/夜.一组蒙太奇; 8、EXT/INT.日/夜.一组蒙太奇,在升空过程的高G力情境下，哪一个事件成为触发后续空间站秩序建立、角色间情感互动展开的关键转折？,乔希、刘培强和韩朵朵因高G力相继昏厥,该事件标志着从地面训练向太空真实环境的过渡，角色集体失能引发空间站人员启动应急响应，为后续失重状态下的情感发展与职责分工创造条件。,Narrative Progression
16,ch89a645353ab1034f9c3cf6f0e52cb1d825a383d8,zh,8、EXT/INT.日/夜.一组蒙太奇; 8、EXT/INT.日/夜.一组蒙太奇,在[8、EXT/INT.日/夜.一组蒙太奇]中，哪个事件为后续离心机高G值训练及升空过程中三人因高G力昏厥、静待推进的紧张序列奠定了行动与关系的基础？,教官警告与三人舱内初遇,该场景首次将三位主角置于同一密闭训练空间，教官的警告既确立了高G环境的危险性，也触发了三人从陌生到协作的初始互动，成为后续身体极限考验的情节起点。,Narrative Progression
17,ch89a645353ab1034f9c3cf6f0e52cb1d825a383d8,zh,8、EXT/INT.日/夜.一组蒙太奇; 6、EXT/INT.日.利伯维尔 战区废墟 返航途中/J20C 驾驶舱; 7、EXT/INT.日.利伯维尔 UEG 基地 行星发动机 附近空域/J20C 驾驶舱,哪个事件为后续角色进入太空、适应高G环境及抵达UEG基地等一系列行动提供了必要前提？,张鹏提醒刘培强乘坐太空电梯的注意事项,该提醒标志着地面训练向实际升空的过渡，使角色正式进入太空任务阶段，直接衔接后续高G昏厥、抵达基地与返航感慨等情节的发展逻辑。,Narrative Progression
18,ch89a645353ab1034f9c3cf6f0e52cb1d825a383d8,zh,8、EXT/INT.日/夜.一组蒙太奇; 8、EXT/INT.日/夜.一组蒙太奇; 8、EXT/INT.日/夜.一组蒙太奇,在[8、EXT/INT.日/夜.一组蒙太奇]中，哪个事件标志着刘培强从外部冲突与人际互动转向正式进入任务核心流程的叙事转折？,刘培强撞见张鹏后登车进入基地,该事件发生在一组蒙太奇场景中，整合了多个关键动作的过渡：刘培强在经历外部事件（目睹韩朵朵行动、与张鹏对话）后，由此正式进入基地，开启后续对行星发动机的观察与太空任务的准备，构成从个人情感与人际提醒向使命执行的结构转折。,Narrative Progression
19,ch89a645353ab1034f9c3cf6f0e52cb1d825a383d8,zh,,这个故事中最主要的3个角色分别是谁？,刘培强、图恒宇、韩朵朵,,Character Understanding
20,ch89a645353ab1034f9c3cf6f0e52cb1d825a383d8,zh,,刘培强驾驶J20C战机突然加速掠过跨海大桥，激起海面浪花，张鹏立即出声警告；随后战机在战区废墟中垂直起飞，张鹏再次提醒操作要稳，并询问登月任务的准备情况。这些情节出现在哪几场戏中？,5、EXT/INT.日.利伯维尔 战区废墟/J20C 驾驶舱 | 6、EXT/INT.日.利伯维尔 战区废墟 返航途中/J20C 驾驶舱,该描述涵盖了刘培强低空高速飞行引发张鹏警告，以及后续在废墟中垂直起飞时关于登月任务的对话，两段动作与对白的连续发展对应到战区废墟中的两个连续驾驶舱场景。,Scene Grounding
21,ch89a645353ab1034f9c3cf6f0e52cb1d825a383d8,zh,,蔡东铭和马兆共同出现的场景对应的是哪几场戏？,98、 EXT/INT.日/夜.一组蒙太奇 | 111、INT.夜.北京 第一人民医院 病房 | 114、INT.夜.北京 航天中心 面试区走廊/镜屋/面试评委室 | 128、INT.日.纽约 UEG 总部大楼 厕所,蔡东铭与马兆在剧本中有19次共现，分布于4个明确标注的场景中，场景标题直接记录了二人的同时出场。,Scene Grounding
22,ch89a645353ab1034f9c3cf6f0e52cb1d825a383d8,zh,,泰国航天员对应的是哪几场戏？,58、 EXT.日.利伯维尔 UEG 基地 太空电梯 附近空域 | 59、 EXT/INT.日.利伯维尔 UEG 基地 太空电梯 附近空域/J20C 驾驶舱/俄式战斗机驾驶舱 | 61、 INT.日.利伯维尔 UEG 基地 无人机控制中心 | 64、 EXT/INT.日.利伯维尔 UEG 基地 太空电梯/01 号轿厢,泰国航天员在剧本中被明确提及并出现在这四个场景中，构成其完整的出场分布。,Scene Grounding
23,ch89a645353ab1034f9c3cf6f0e52cb1d825a383d8,zh,,马兆以‘逐月计划’成员的身份参与了哪几场戏？,51、 EXT/INT.日.利伯维尔 UEG 基地 太空电梯 08 号轿厢 | 61、 INT.日.利伯维尔 UEG 基地 无人机控制中心,马兆在两场戏中均以‘逐月计划’核心成员身份出现：一场是参与计划会议并指导关键设备操作，另一场是进行技术评估与任务协调，体现出其在该计划中的持续角色定位。,Scene Grounding
24,ch89a645353ab1034f9c3cf6f0e52cb1d825a383d8,zh,,指挥中心总指挥与郝晓晞共同出现的场景对应的是哪几场戏？,98、 EXT/INT.日/夜.一组蒙太奇 | 98、 EXT/INT.日/夜.一组蒙太奇 | 137、INT.夜.巴黎 UEG 飞控中心 | 151、EXT.无日夜.太空 “领航员”空间站,两人在多个指挥与调度场景中共同出现，体现其在任务协同中的角色关联。,Scene Grounding
25,ch89a645353ab1034f9c3cf6f0e52cb1d825a383d8,zh,5、EXT/INT.日.利伯维尔 战区废墟/J20C 驾驶舱; 8、EXT/INT.日/夜.一组蒙太奇,在乔希、刘培强和韩朵朵因高G力相继昏厥之前，张鹏在驾驶舱内采取了什么行动，体现出他作为上级对任务进程的掌控和对队员状态的关切？,张鹏作为上级提醒刘培强减速并询问登月准备情况，履行了指挥与监督职责,张鹏在升空前的驾驶舱场景中主动提醒减速并确认任务状态，表明其处于指挥位并关注团队执行进度,Temporal Reasoning
26,ch89a645353ab1034f9c3cf6f0e52cb1d825a383d8,zh,4、EXT.日.利伯维尔 战区废墟; 6、EXT/INT.日.利伯维尔 战区废墟 返航途中/J20C 驾驶舱,到了张鹏在返航途中对刘培强感慨活着不易时，此前在战区废墟中已发生的关键事件是什么？,刘培强摘下墨镜直视太阳并提出疑问,在返航场景之前，刘培强于战区废墟中摘下墨镜直视太阳并质疑太阳危机的真相，这一行为构成后续对话的情感与认知前提，具有明确的叙事因果与时间先后关系。,Temporal Reasoning
27,ch89a645353ab1034f9c3cf6f0e52cb1d825a383d8,zh,4、EXT.日.利伯维尔 战区废墟; 5、EXT/INT.日.利伯维尔 战区废墟/J20C 驾驶舱,在“刘培强驾驶J20C起飞并启动战场感知系统”之前，前面先发生了什么关键情节？,在废墟中四处张望观察战争痕迹,刘培强进入战区废墟后，首先在外部环境中小心巡视，查看周围残骸与战斗遗留痕迹，这一观察行为发生在登机并启动系统之前，为后续进入驾驶舱行动提供了情境铺垫。,Temporal Reasoning
28,ch89a645353ab1034f9c3cf6f0e52cb1d825a383d8,zh,6、EXT/INT.日.利伯维尔 战区废墟 返航途中/J20C 驾驶舱; 7、EXT/INT.日.利伯维尔 UEG 基地 行星发动机 附近空域/J20C 驾驶舱,“刘培强低空加速飞行张鹏紧急警告”之后不久，紧接着发生了什么？,J20C 飞向夕阳下的UEG基地,根据场景顺序，刘培强在低空加速并收到警告后，飞行器很快进入UEG基地附近空域，镜头随之转向行星发动机周围的环境，表明行动目标已转向基地观测。,Temporal Reasoning
29,ch89a645353ab1034f9c3cf6f0e52cb1d825a383d8,zh,8、EXT/INT.日/夜.一组蒙太奇,“张鹏在车上叮嘱刘培强严守纪律”之后不久，紧接着发生了什么？,刘培强撞见露出坏笑的张鹏并登车进入基地,两个事件发生在同一组蒙太奇场景中，时间衔接紧密，前一情节结束不久即呈现张鹏被撞见并进入基地的后续动作，具有明确的顺承关系。,Temporal Reasoning
30,ch89a645353ab1034f9c3cf6f0e52cb1d825a383d8,zh,5、EXT/INT.日.利伯维尔 战区废墟/J20C 驾驶舱; 7、EXT/INT.日.利伯维尔 UEG 基地 行星发动机 附近空域/J20C 驾驶舱,在“刘培强抵达UEG基地观察行星发动机”之前，前面先发生了什么关键情节？,提醒减速并询问登月准备情况,在抵达UEG基地前的飞行过程中，张鹏通过通讯对刘培强进行了操作提醒和任务确认，这一互动发生在战区废墟上空的驾驶舱内，为后续抵达发动机区域提供了行动铺垫。,Temporal Reasoning
31,ch89a645353ab1034f9c3cf6f0e52cb1d825a383d8,zh,第4场,在第4场中，刘培强摘下墨镜直视太阳，并向师父提出质疑，他这一行为背后最直接的动机是什么？,怀疑太阳危机的真实性，想确认人类是否真的面临灭绝威胁,刘培强：师父，真的有太阳危机吗？ 刘培强摘下墨镜，直视太阳的方向。,Character Understanding
32,ch89a645353ab1034f9c3cf6f0e52cb1d825a383d8,zh,第4场,在第4场中，张鹏为何会在直升机残骸前主动向刘培强提及他哥哥和嫂子的死讯？促成这一举动的关键前提是什么？,张鹏已承诺在兄长死后照顾刘培强，形成持续的责任关系,张鹏：哥，嫂子，我带培强来看你们来了。这孩子有出息，通过了国内预备航天员的考核……我一定照顾好他。,Causal-Motivational Reasoning
33,ch89a645353ab1034f9c3cf6f0e52cb1d825a383d8,zh,全片,根据整部电影的主线叙事，这部电影最重要的3个角色是谁？,刘培强、图恒宇、韩朵朵,依据 task_1_character_timelines.json 中保留的 focal_character_timelines，可确定本片当前保留的核心角色为刘培强、图恒宇、韩朵朵。这些角色也是当前 task2/task3 重点覆盖的角色，因此可视为本片最重要的角色。,Character Understanding
