id,movie_id,language,related_scenes,question,answer,evidence_or_reason,question_type
1,end5a824f9c5a34d1b8b0181b434ae6674,en,,What does Christy aim to achieve by hiding the newspaper and winking at Ted?,Signal interest to Ted,"Christy hides the newspaper in her locker and winks at Ted. He watches her, then recalls her earlier attention. The wink lingers in his mind as he decides to ask her to the prom.",Character Understanding
2,end5a824f9c5a34d1b8b0181b434ae6674,en,,What is Christy's emotional intent when she jumps into Ted's arms?,To declare her love and attempt to kiss him,"Christy jumps into Ted's arms, wrapping her legs around him in a tight embrace. The room erupts in applause. She looks at him with bright eyes and says, 'You are the most wonderful guy in the whole wide world, and I love you madly, Teddy Nelson!' As she leans in toward his lips, the scene cuts suddenly to black. [Christy Declares Love and Tries to Kiss Ted]",Character Understanding
3,end5a824f9c5a34d1b8b0181b434ae6674,en,,What is Charlie trying to achieve when Charlie ted and Charlie enter the opulent bedroom of Ted's parents?,Secure a useful lead,"Charlie enters the bedroom with Ted and immediately goes to the dresser, searching through a drawer filled with lingerie until he finds and picks up a pair of red silk panties belonging to Ted's biological mother. His focused action and subsequent behavior—caressing and inhaling the scent—indicate the item was his specific target [scene: Ted's Parents' Bedroom].",Character Understanding
4,end5a824f9c5a34d1b8b0181b434ae6674,en,,What is Ted's objective when he tries on the sunglasses while glancing at Ginger?,Seek Ginger's approval,"Ted picks up a pair of stylish sunglasses and tries them on. Ginger smiles, giving her approval. He glances at the price tag, then looks back at her. She meets his gaze, and he lingers in the moment, the sunglasses still on.",Character Understanding
5,end5a824f9c5a34d1b8b0181b434ae6674,en,,What occurs when Ted arrives at the school in the morning?,Classmates surround Ted to congratulate him,"After stepping out of the helicopter, Ted is immediately surrounded by classmates who congratulate him and crowd around, eager to get close. They laugh, cheer, and hang on his every move as he walks toward the school, their attention fixed on him.",Scene Grounding
6,end5a824f9c5a34d1b8b0181b434ae6674,en,,What action takes place when Uncle Billy brings Ted to the group by the swimming pool?,Uncle Billy introduces Ted to the group,"Uncle Billy greets the boys warmly and ushers them forward, introducing Ted to the group with pride. Women lounging near the pool call out friendly greetings in overlapping voices. Charlie whispers to Ted that the moment feels like a dream come true, and Ted nudges him to stay composed.",Scene Grounding
7,end5a824f9c5a34d1b8b0181b434ae6674,en,,What action initiates Ted's interaction with his schoolmates in the hallway scene?,Ted joins schoolmates lining up in the hallway,"Ted lines up with his schoolmates in the hallway, standing away from the windows as they all do. Christy Malone stands directly across from him, and he watches her without looking away. Charlie Duke, Ted's best friend, walks up with a camera hanging around his neck, smiles confidently, and teases Ted about their romantic prospects, comparing girls like Christy to filet mignon and themselves to ground chuck. Ted remains focused on Christy as Charlie speaks.",Scene Grounding
8,end5a824f9c5a34d1b8b0181b434ae6674,en,,"In [10、INT. TECUMSEH HIGH SCHOOL - MEN'S ROOM - DAY], what event immediately before Charlie says 'meatloaf' explains Ted's distressed reaction to the word?",Ted vomits into the sink,"In the school restroom, Ted becomes physically ill after being dared to approach a woman he finds intimidating, ultimately vomiting into the sink while Julie explains she had warned him. As he looks at himself in the mirror, still shaken, Charlie says the word 'meatloaf,' prompting Ted to express despair about his life. The visceral aftermath of the vomiting episode directly shapes Ted's emotional state when the word is repeated.",Causal-Motivational Reasoning
9,end5a824f9c5a34d1b8b0181b434ae6674,en,,What action by Christy directly prompts Ted to consider asking her to the prom?,Christy Malone winks at Ted,"In the school corridor, Christy hides the newspaper in her locker and winks at Ted. The gesture catches his attention and lingers in his thoughts, influencing his decision to ask her to the prom shortly afterward.",Causal-Motivational Reasoning
10,end5a824f9c5a34d1b8b0181b434ae6674,en,,What moment directly prompts Ted's decision to buy the entire case of sunglasses?,Ted emerges from the dressing room in new attire,"In a clothing store, Ted steps out of the dressing room wearing a new outfit and notices the price tag still attached, briefly registering its cost. Ginger touches his arm and whispers a quote about money not mattering to those who possess it, which he absorbs in silence. This moment of curated self-presentation and whispered ideology sets the stage for his later transformation in an eyewear boutique, where he embraces an imagined identity of immense wealth by purchasing all the sunglasses.",Causal-Motivational Reasoning
11,end5a824f9c5a34d1b8b0181b434ae6674,en,,What event directly enables Ginger to join Ted in the Ferrari the following morning?,Ted introduces himself formally to Ginger,"The day before, in the garage at the ""Heaven"" mansion, Ted awkwardly introduces himself to Ginger after nearly stalling the Ferrari. Though flustered, he makes the effort to formally present himself, and Ginger responds with amusement and warmth, establishing a moment of personal connection. This brief interaction sets the tone for her returning the next morning to approach him again, this time by climbing into the passenger seat of the same car.",Causal-Motivational Reasoning
12,end5a824f9c5a34d1b8b0181b434ae6674,en,,"By the time Helen tours Ted, Charlie, and Uncle Billy through the Heaven Magazine offices, what has already taken place upon their arrival at the mansion?",Beautiful young women guide Ted toward the mansion,"Before the tour of the Heaven Magazine offices begins, Ted and the others arrive at the mansion where they are met by beautiful young women who guide Ted toward the entrance. This moment sets the tone for the surreal and orchestrated environment they are entering, establishing the visual and thematic cues that precede the more structured presentation of the magazine's inner workings.",Temporal Reasoning
13,end5a824f9c5a34d1b8b0181b434ae6674,en,,"By the time Ted makes his entrance with Kiki and Kelly, what key moment involving Uncle Billy has already taken place?",Uncle Billy expresses joy over Ted joining the family,"Before Ted appears with Kiki and Kelly in the master bedroom closet at night, Uncle Billy has already voiced his approval and delight regarding Ted's integration into the family during a daytime meeting in the mansion's conference room, marking a shift in his earlier skepticism and setting the stage for Ted's fuller acceptance into the household dynamic.",Temporal Reasoning
14,end5a824f9c5a34d1b8b0181b434ae6674,en,,"What pivotal interaction sets in motion the sequence where Ted characterizes Charlie's traits, Christy reacts emotionally, and Ted responds to Charlie's provocation?",Ted and Charlie in the Hallway,"In the hallway at Tecumseh High School, an encounter between Ted and Charlie escalates subtle tensions into direct confrontation, initiating a chain of emotional and behavioral revelations that unfold across subsequent moments, including Ted's attempt to define Charlie's nature, Christy's conflicted response, and Charlie's deliberate use of language to unsettle Ted.",Narrative Progression
15,end5a824f9c5a34d1b8b0181b434ae6674,en,,What turning point initiates the sequence leading directly to Christy asking Ted to the prom and their subsequent celebration?,Christy Winks and Ted Decides to Ask Her to the Prom,"In the corridor at Tecumseh High School, a brief but significant moment occurs when Christy winks at Ted, prompting him to reconsider their relationship dynamic. This gesture shifts Ted's intentions, setting in motion a chain of events where he decides to ask Christy to the prom, which in turn leads to her reciprocating the invitation and the two celebrating together. The moment serves as the pivotal catalyst for the romantic development between them in the following scenes.",Narrative Progression
16,end5a824f9c5a34d1b8b0181b434ae6674,en,,"What pivotal event initiates the shift in Ted and Ginger's relationship, leading directly to their shared moments in the Ferrari and the aftermath of their night together?",Ted and Ginger's Awkward Introductions,"The shift toward intimacy between Ted and Ginger begins in the garage at the 'Heaven' mansion, where their initial discomfort and tension lay the foundation for the subsequent unfolding of their impulsive connection. This moment sets in motion the chain of events involving the Ferrari, culminating in Ginger joining Ted, their celebration in the mirror, and her teaching him to drive.",Narrative Progression
17,end5a824f9c5a34d1b8b0181b434ae6674,en,,"What turning point initiates the sequence in which Ginger joins Ted in the Ferrari, teaches him to drive it, and Ted later celebrates waking up next to her?",Ginger Invites Ted for a Ride,"The moment Ginger invites Ted for a ride marks a pivotal shift in their dynamic, setting in motion a series of intimate and transformative events centered around the Ferrari. This invitation directly leads to Ginger joining Ted in the vehicle, guiding him through driving it, and culminating in Ted waking up beside her and celebrating his new reality. [33、INT. ""HEAVEN"" MANSION - GARAGE - THE NEXT MORNING]",Narrative Progression
18,end5a824f9c5a34d1b8b0181b434ae6674,en,,"In [4、INT. TECUMSEH HIGH SCHOOL - NEWSROOM - DAY], what physical gesture in the newsroom reveals Ted's nervousness just before Christy asks him to the prom?",Ted wipes his sweaty palms on his jeans,"In the high school newsroom, Ted approaches Christy visibly anxious, his hands damp from nerves. He wipes his palms on his jeans moments before Christy turns to him, smiles, and impulsively asks him to the prom. His physical reaction underscores the tension and anticipation in the moment, setting the emotional tone for her sudden invitation and their shared celebration.",Causal-Motivational Reasoning
19,end5a824f9c5a34d1b8b0181b434ae6674,en,,What event immediately emboldens Christy to declare her love and attempt to kiss Ted?,Ted enthusiastically agrees to take Christy to the prom,"In the high school newsroom, Christy nervously asks Ted to the prom, and his exuberant acceptance—'SHUT UP! Are you serious? Of course I will'—triggers an impulsive celebration where she leaps into his arms. This physical and emotional escalation sets the stage for her subsequent declaration of love and attempted kiss in the same location, framed as a direct response to his joyful affirmation.",Causal-Motivational Reasoning
20,end5a824f9c5a34d1b8b0181b434ae6674,en,,What event immediately before the bathroom scene explains Ted's emotional collapse and vomiting?,Students react with anticipation as Ted proposes to Christy,"In the school corridor, Ted approaches Christy to ask her to the prom, kneeling before her as the entire student body watches in silence. When she rejects him publicly, laughing and clarifying she’s only attracted to 'big, buff, manly men,' the crowd erupts in laughter. Ted is left humiliated, still on one knee, muttering that it must be a dream. Julie helps him up, insisting it’s not—it’s an actual emergency. This public rejection sets the emotional foundation for his subsequent breakdown in the men’s room, where he vomits while fixating on the emptiness of his life, symbolized by meatloaf.",Causal-Motivational Reasoning
21,end5a824f9c5a34d1b8b0181b434ae6674,en,,"Which scene or scenes best match the following description: Ted looks up through the open sun roof, watching the blue Southern California sky and the palm trees passing by overhead. He rises from his seat in the limo. Ted pokes his head out of the limousine's sunroof as the car moves along Sunset Boulevard.",18、INT. STRETCH LIMO - DAY | 19、EXT. LIMO - DAY - MOVING,"Ted looks up through the open sun roof, watching the blue Southern California sky and the palm trees passing by overhead. He rises from his seat in the limo. Ted pokes his head out of the limousine's sunroof as the car moves along Sunset Boulevard.",Scene Grounding
22,end5a824f9c5a34d1b8b0181b434ae6674,en,,In which scene or scenes are Ted and Ted'S Mother both present?,"29、INT. TED'S BEDROOM - ""HEAVEN"" MANSION - NIGHT | 46、INT. NELSON FAMILY ROOM - SAME | 49、INT. ""HEAVEN"" MANSION - TED'S ROOM - DAY | 91、INT. NELSON LIVING ROOM - DAY","{""pair"": [""Ted"", ""Ted'S Mother""], ""pair_mentions"": 26, ""scene_grounding_subtype"": ""copresence_localization"", ""scene_count"": 4, ""scene_numbers"": [29, 46, 49, 91], ""scene_titles"": [""29、INT. TED'S BEDROOM - \""HEAVEN\"" MANSION - NIGHT"", ""46、INT. NELSON FAMILY ROOM - SAME"", ""49、INT. \""HEAVEN\"" MANSION - TED'S ROOM - DAY"", ""91、INT. NELSON LIVING ROOM - DAY""]}",Scene Grounding
23,end5a824f9c5a34d1b8b0181b434ae6674,en,,In which scene or scenes is Ted acting as a member of Heaven Magazine?,42、INT. HOTEL BALLROOM - DAY | 68、INT. NELSON LIVING ROOM - DAY | 86、INT. GIRLS' RESTROOM - CONTINUOUS | 87、INT. SCHOOL CORRIDOR - DAY,"{""character"": ""Ted"", ""role_label"": ""Heaven Magazine"", ""relation_names"": [""is part of"", ""is owner of"", ""is affiliated with""], ""descriptions"": [""Ted Nelson states he is looking forward to the challenge of bringing 'Heaven' magazine into the 21st century, indicating his role as a member or affiliated contributor to the publication."", ""The text explicitly states that Ted is the owner of the 'pornographic empire' and refers to the magazine and related activities as his, establishing his institutional affiliation and control over the Concept.""], ""scene_grounding_subtype"": ""role_state_localization"", ""scene_count"": 4, ""scene_numbers"": [42, 68, 86, 87], ""scene_titles"": [""42、INT. HOTEL BALLROOM - DAY"", ""68、INT. NELSON LIVING ROOM - DAY"", ""86、INT. GIRLS' RESTROOM - CONTINUOUS"", ""87、INT. SCHOOL CORRIDOR - DAY""]}",Scene Grounding
24,end5a824f9c5a34d1b8b0181b434ae6674,en,,In which scene or scenes is Marty Zukerman clearly present?,"12、EXT. NELSON HOUSE - EVENING | 13、INT. NELSON LIVING ROOM - NIGHT | 23、INT. ""HEAVEN"" MANSION - CONFERENCE ROOM - DAY","{""character"": ""Marty Zukerman"", ""mention_total"": 28, ""scene_span"": 12, ""scene_grounding_subtype"": ""entity_presence_localization"", ""scene_count"": 3, ""scene_numbers"": [12, 13, 23], ""scene_titles"": [""12、EXT. NELSON HOUSE - EVENING"", ""13、INT. NELSON LIVING ROOM - NIGHT"", ""23、INT. \""HEAVEN\"" MANSION - CONFERENCE ROOM - DAY""]}",Scene Grounding
25,end5a824f9c5a34d1b8b0181b434ae6674,en,,"Which scene or scenes best match the following description: Ted lines up with his schoolmates in the hallway, standing away from the windows as they all do. Christy Malone stands directly across from him, and he watches her without looking away. Charlie Duke, Ted's best friend, walks up with a camera hanging around",6、INT. CORRIDOR - TECUMSEH HIGH SCHOOL - DAY | 7、INT. BASKETBALL COURT - TECUMSEH HIGH SCHOOL - DAY,"Ted lines up with his schoolmates in the hallway, standing away from the windows as they all do. Christy Malone stands directly across from him, and he watches her without looking away. Charlie Duke, Ted's best friend, walks up with a camera hanging around",Scene Grounding
26,end5a824f9c5a34d1b8b0181b434ae6674,en,,Who are the 3 most central characters in this story?,"Charlie, Julie, Ted",,Character Understanding
