id,movie_id,language,related_scenes,question,answer,evidence_or_reason,question_type
1,en2fd3fabcf59d456fb8c57465762400bf,en,36、INT. AMY'S HOTEL ROOM - LATER,"In [36、INT. AMY'S HOTEL ROOM - LATER], what objective or realization best explains Amy's move when Amy in the dim darkness of the room?",Realize her body is changing in a disturbing way,"Amy is struck by an unseen force while lying on her bed, initially reacting with grogginess rather than alarm. After black liquid begins seeping from her back and she feels the wetness, she smears it on her fingers, still drowsy and dismissive. The turning point occurs when she sees her hands clearly stained with the fluid and then confirms more is flowing from her back. This visual confirmation shifts her state from confusion to concern, prompting her to get up and walk to the bathroom.",Character Understanding
2,en2fd3fabcf59d456fb8c57465762400bf,en,33、INT. HOTEL BATHROOM - NIGHT,What does Amy's action of turning on the light reveal about her state of mind after escaping the shower?,She regains agency and confronts her physical and emotional trauma.,"Amy crawls across broken glass, pulls herself up by the sink, and deliberately finds and flips the light switch. In the illumination, she sees her injured reflection, removes a shard of glass from her shoulder, and turns off the shower—marking a transition from chaos to control.",Character Understanding
3,en2fd3fabcf59d456fb8c57465762400bf,en,10、INT. MARLA'S ROOM - DAY,What drives Amy's actions as she approaches the bathroom in this scene?,The need to confirm Marla's fate after suspecting something is wrong,"Amy moves down the hallway toward the bathroom. The door is open, and inside, Marla sits on the closed toilet lid, her body leaning forward at an unnatural angle. She is dressed only in her bra and panties, her skin gray and swollen. A boot-lace is tightly tied around her neck and secured to the pipe on the wall, pulling her head back. Her hands hang near the floor, her eyes glazed and open, her mouth slightly agape with a dry foam at the corners and her tongue protruding. Flies crawl across her face and over her lips. As Amy steps closer, the flies suddenly buzz upward in a cloud, then settle again over the body. The stench becomes overwhelming. Amy covers her mouth with her shirt and backs away, turning from the scene.",Character Understanding
4,en2fd3fabcf59d456fb8c57465762400bf,en,38、INT. HOTEL BATHROOM - NIGHT,What does Amy seek to do upon discovering blood beneath her feet?,Call emergency services for help,"Amy looks down and sees she is standing in a pool of blood. She gasps, turns toward the mirror, and sees blood pouring from a wound in her chest. Stumbling into the main room, she picks up the phone with shaky, bloody hands and dials 9-9-9, dropping the stiletto she’s been holding onto the table as the line clicks open with no response.",Character Understanding
5,en2fd3fabcf59d456fb8c57465762400bf,en,49、INT. CORRIDOR - DAY,What action defines the moment in the corridor where Amy struggles to maintain balance?,Amy stumbles down the corridor,"Amy moves through the corridor with unsteady steps, stumbling repeatedly as she attempts to move forward, indicating physical distress or disorientation.",Scene Grounding
6,en2fd3fabcf59d456fb8c57465762400bf,en,36、INT. AMY'S HOTEL ROOM - LATER,What occurs immediately to Amy in the darkened hotel room?,An unseen object strikes her,"In the dimly lit hotel room, Amy lies unconscious on the bed when a sudden wet thud breaks the silence. Her body jerks from an unseen impact, though she initially shows no alarm. She awakens groggily, notices a black liquid seeping from her back, and gradually becomes aware of the substance coating her skin and dripping onto the pillow. As she examines her stained hands and rising consciousness, she begins to realize something is seriously wrong.",Scene Grounding
7,en2fd3fabcf59d456fb8c57465762400bf,en,43、INT. TRAIN - NIGHT,What does Amy do to reveal her injury to Joey on the train?,Tears off gaffer's tape to expose a blood-stained chest,"As the train moves through the night, Amy approaches Joey amid flashing lights and a festive crowd. She opens her shirt to show tape securing a towel against her back, then tears the tape down her chest, revealing bloodied skin. She wipes the blood away with her fingers as Joey leans in to examine the wound. He questions whether the injuries are real and comments on her relentless pursuit of truth, drawing a parallel between them. The moment culminates when the train stops and Amy discovers Joey has died unnoticed, his eyes vacant and skin pale.",Scene Grounding
8,en2fd3fabcf59d456fb8c57465762400bf,en,10、INT. MARLA'S ROOM - DAY; 10、INT. MARLA'S ROOM - DAY,What action immediately provokes Amy's panicked flight from the room?,Amy reaches past Marla's corpse to retrieve the envelope and pries the Puzzle Box from Marla's hand,"In the bathroom, Amy retrieves a manila envelope labeled with her name from behind Marla's corpse. As she kneels to recover it, she notices Marla's hand clutching a small object, pries open the fingers, and takes the Puzzle Box. The moment she stands, Marla's hand suddenly jerks up and grabs her leg, triggering Amy's violent recoil and subsequent terror when Marla emits a ghastly sound moments later [10、INT. MARLA'S ROOM - DAY].",Causal-Motivational Reasoning
9,en2fd3fabcf59d456fb8c57465762400bf,en,38、INT. HOTEL BATHROOM - NIGHT; 43、INT. TRAIN - NIGHT,What moment directly enables Amy to discover her injury before revealing it to Joey?,Amy turns on the bathroom light and sees herself in the mirror,"After crawling across broken glass and pulling herself up at the sink, Amy flips on the bathroom light, which allows her to see her reflection. In the mirror, she notices a shard of glass embedded in her shoulder, which she removes and drops into the sink. This is the first time she visually confirms the extent of her injuries, setting the stage for her later decision to show the wound to Joey aboard the train.",Causal-Motivational Reasoning
10,en2fd3fabcf59d456fb8c57465762400bf,en,10、INT. MARLA'S ROOM - DAY; 10、INT. MARLA'S ROOM - DAY,What discovery directly prompts Amy's confrontation with the apartment manager?,Amy discovers Marla's body in the bathroom,"Amy finds Marla's body in the bathroom, where she is seated on the toilet with a bootlace tied around her neck and secured to a pipe, her skin discolored and swollen, flies covering her face. The scene is gruesome, and the stench overwhelms Amy as she recoils in shock. Immediately afterward, she encounters the apartment manager at the door, informs him of Marla's death, and resists his aggressive attempt to search her satchel, leading to a physical altercation.",Causal-Motivational Reasoning
11,en2fd3fabcf59d456fb8c57465762400bf,en,38、INT. HOTEL BATHROOM - NIGHT; 43、INT. TRAIN - NIGHT,What event directly prompts Amy to reveal her injury to Joey aboard the train?,Amy discovers herself standing in a pool of blood,"In the hotel bathroom, Amy notices she is standing in a pool of her own blood, sees the wound in her chest in the mirror, and attempts to call for help. Later, on the moving train, she confronts Joey and exposes the same wound, demonstrating its severity without explanation. The physical and psychological impact of her initial discovery motivates her decision to show him the injury, establishing a direct causal link between the two moments.",Causal-Motivational Reasoning
12,en2fd3fabcf59d456fb8c57465762400bf,en,38、INT. HOTEL BATHROOM - NIGHT; 49、INT. CORRIDOR - DAY,What action immediately before leaving her room explains Amy's unsteady movement in the corridor?,Amy stands up and pulls her pants on after the phone call,"After ending a tense phone call, Amy remains motionless for a moment, visibly affected, before rising from her seat and dressing hurriedly in her hotel room. Her abrupt physical transition from stillness to motion, marked by pulling on her pants and leaving the room, precedes her unstable gait as she moves through the corridor, where she stumbles repeatedly while trying to walk forward.",Causal-Motivational Reasoning
13,en2fd3fabcf59d456fb8c57465762400bf,en,38、INT. HOTEL BATHROOM - NIGHT; 49、INT. CORRIDOR - DAY,What action directly explains Amy's unsteady movement as she progresses down the corridor?,Amy rolls towel into cylinder for wound compression,"After tending to her injury in the bathroom, Amy secures a tightly rolled towel against the wound in her back using duct tape. She dresses, cleans the blood from her face and hands, retrieves her bag, and exits the room. Shortly afterward, she moves through the corridor with visible instability, stumbling as she walks, likely due to the physical strain or pain from her injury and improvised treatment. [38、INT. HOTEL BATHROOM - NIGHT]",Causal-Motivational Reasoning
14,en2fd3fabcf59d456fb8c57465762400bf,en,5、INT. OFFICES OF THE UNDERGROUND - DAY; 25、INT. THE BATHROOM - DAY,How does the relationship between Katya and Winter evolve from their first interaction to their shared presence in the ritual space?,they maintain a ritualistic bond rooted in mutual revival and emotional dependence,"From the early scene in the underground offices, where Winter performs a tender, life-restoring act on Katya’s motionless body—kissing her, breathing into her, and helping her stand—it is evident that their connection is defined by a deep, ritualistic intimacy. This bond persists into the later bathroom scene, where both are present in a communal ritual space, and it is revealed that Winter had previously revived Katya in the same manner as others in the group, confirming that their relationship remains anchored in reciprocal spiritual and physical restoration.",Role-Relation Continuity
15,en2fd3fabcf59d456fb8c57465762400bf,en,36、INT. AMY'S HOTEL ROOM - LATER; 36、INT. AMY'S HOTEL ROOM - LATER; 36、INT. AMY'S HOTEL ROOM - LATER,What event marks the turning point that initiates Amy's confrontation with the mysterious black liquid?,Amy is struck and discovers black liquid on her back,"In the hotel room, Amy is physically struck, leading to her discovery of the black liquid on her body. This moment sets off a chain of actions in which she becomes aware of the substance's presence on her skin and surroundings, prompting her to move through the space, leave traces behind, and begin investigating its origin, including the subway grate. [36、INT. AMY'S HOTEL ROOM - LATER]",Narrative Progression
16,en2fd3fabcf59d456fb8c57465762400bf,en,9、INT. THE SECOND FLOOR - DAY; 9、INT. THE SECOND FLOOR - DAY; 11、INT. THE HALL AND STAIRWAY - DAY,"What pivotal event sets in motion Amy's entry into Marla's room, her subsequent fall, and the encounter in the hallway bathroom?",Amy Confronts the Manager to Enter Marla's Room,"The confrontation with the manager is the critical action that enables Amy to access Marla's room, directly triggering the chain of events that follow, including her reaction to the stench, her physical collapse, and the later movement to the bathroom at the end of the hallway [9、INT. THE SECOND FLOOR - DAY].",Narrative Progression
17,en2fd3fabcf59d456fb8c57465762400bf,en,10、INT. MARLA'S ROOM - DAY; 15、INT. AMY'S HOTEL ROOM - NIGHT; 46、INT. PSYCH WARD/COMMON AREA - DAY,"What pivotal event sets into motion Amy's confrontation with Marla's cryptic warning, her disappearance, and Amy's subsequent departure?",Amy Retrieves the Envelope and Puzzle Box from Marla's Body,"In the aftermath of Marla's sudden death, Amy discovers a hidden envelope and puzzle box on Marla's body, uncovering clues that directly trigger her engagement with Marla's final message, the supernatural vision of her vanishing, and her decision to leave with the cigarettes. This discovery serves as the critical narrative bridge linking Marla's fate to Amy's active involvement in the unfolding mystery. [10、INT. MARLA'S ROOM - DAY]",Narrative Progression
18,en2fd3fabcf59d456fb8c57465762400bf,en,5、INT. OFFICES OF THE UNDERGROUND - DAY; 14、INT. CHARLES RICKMAN'S OFFICE - NIGHT; 14、INT. CHARLES RICKMAN'S OFFICE - NIGHT,"What pivotal event sets in motion Charles's growing concern for Amy's safety, her discovery of the image in the puzzle box, and their eventual parting in the rain?",Amy and Charles After the Tape Ends,"In the aftermath of the tape's conclusion, a critical shift occurs between Amy and Charles during a scene in the underground offices, where unresolved tensions and emerging revelations begin to alter their trajectory. This moment initiates a chain of developments that leads to Charles's increasing unease about Amy's actions, her defiant reaction to a disturbing image uncovered in the puzzle box, and ultimately their emotional separation at the hotel amid a downpour.",Narrative Progression
19,en2fd3fabcf59d456fb8c57465762400bf,en,whole film,Who are the 3 most central characters in this story?,"Amy Klein, Marla Chen, Winter","According to the retained focal_character_timelines in task_1_character_timelines.json, the current core characters for this film are Amy Klein, Marla Chen, Winter. These are the same retained characters centered by the current task setup, so they are the most central characters in the story.",Character Understanding
20,en2fd3fabcf59d456fb8c57465762400bf,en,,"Which scenes best match the following description: Amy sits up in bed, wincing in pain. She looks at her hands and sees they are stained with a sticky black liquid. She reaches over her shoulder to touch her back and pulls her hand away, now smeared with the same dark substance.",36、INT. AMY'S HOTEL ROOM - LATER | 37、INT. HOTEL BATHROOM - NIGHT,"Amy sits up in bed, wincing in pain. She looks at her hands and sees they are stained with a sticky black liquid. She reaches over her shoulder to touch her back and pulls her hand away, now smeared with the same dark substance.",Scene Grounding
21,en2fd3fabcf59d456fb8c57465762400bf,en,,Which scenes show Joey and Marla Chen together?,13、INT. AMY'S HOTEL ROOM - NIGHT | 17、INT. SUBWAY CAR - NIGHT | 43、INT. TRAIN - NIGHT | 57、INT. WINTER'S ROOM - DAY,These 4 scenes were selected because Joey and Marla Chen are explicitly present together in the extracted scene graph. They co-occur 25 times across the script. The listed scenes are the clearest grounded matches.,Scene Grounding
22,en2fd3fabcf59d456fb8c57465762400bf,en,,Which scenes clearly show cab driver?,7、EXT. APARTMENT BUILDING - DAY | 18、INT. SUBWAY PLATFORM - NIGHT | 19、INT. TRAIN STATION - LATER | 21、EXT. POLICE HEADQUARTERS - DAY,These 4 scenes were selected because cab driver is explicitly mentioned or visibly present in those scenes in the extracted graph. The character is referenced 11 times overall.,Scene Grounding
23,en2fd3fabcf59d456fb8c57465762400bf,en,,"Which scenes best match the following description: Amy approaches a building sealed with cinder-blocks over its doors and windows. Along the side, she finds a narrow stairway pressed against the wall, leading down to a basement entrance. She walks down the steps, which are littered with trash.",22、EXT. POTEILARI AND MINVARA - DAY | 23、EXT. THE BOTTOM OF THE STAIRS - DAY,"Amy approaches a building sealed with cinder-blocks over its doors and windows. Along the side, she finds a narrow stairway pressed against the wall, leading down to a basement entrance. She walks down the steps, which are littered with trash.",Scene Grounding
24,en2fd3fabcf59d456fb8c57465762400bf,en,,Which scenes show Winter as part of the Deaders?,5、INT. OFFICES OF THE UNDERGROUND - DAY | 57、INT. WINTER'S ROOM - DAY,"Winter is identified as the leader of the Deaders and participates in group rituals, speaking as part of the collective, which confirms her active membership in the group across these scenes.",Scene Grounding
26,en2fd3fabcf59d456fb8c57465762400bf,en,16、INT. SUBWAY STATION - NIGHT; 43、INT. TRAIN - NIGHT,"By the time Amy boards the train and confronts Joey, what has already taken place?",Amy enters subway station using access card,"Amy arrives at the subway station at night, swipes in with her access card, and descends to the platform, setting the stage for her eventual confrontation with Joey aboard the train. This sequence establishes her deliberate movement through the transit system before the encounter unfolds in a later scene.",Temporal Reasoning
28,en2fd3fabcf59d456fb8c57465762400bf,en,25、INT. THE BATHROOM - DAY; 26、INT. WINTER'S ROOM - DAY,What occurs immediately before Winter begins tracing Amy's anatomy?,Amy falls backward onto the floor in fear,"Shortly after Amy witnesses a shocking resurrection in the bathroom, she collapses to the floor in terror, setting the stage for Winter's subsequent hypnotic examination of her body in the next scene.",Temporal Reasoning
29,en2fd3fabcf59d456fb8c57465762400bf,en,43、INT. TRAIN - NIGHT; 44、INT. SUBWAY TUNNEL - NIGHT,What occurs just before the train enters the narrowing tunnel?,Amy collides with decaying Marla Chen,"Shortly after Amy encounters Marla Chen in a deteriorated state on the train platform, their collision takes place within the train cabin, setting the immediate precedent for the sequence in which the train moves into the narrowing tunnel.",Temporal Reasoning
31,en2fd3fabcf59d456fb8c57465762400bf,en,5、INT. OFFICES OF THE UNDERGROUND - DAY,"What caused Charles to insist Amy watch the videotape in 5、INT. OFFICES OF THE UNDERGROUND - DAY, despite her confusion?",receiving an anonymous tape with no explanation,"He explains it arrived anonymously, with no return address or note. He insists she watch the tape, gets up, and closes the office door.",Causal-Motivational Reasoning
32,en2fd3fabcf59d456fb8c57465762400bf,en,10、INT. MARLA'S ROOM - DAY,What did Amy see in 10、INT. MARLA'S ROOM - DAY that made her retrieve the manila envelope and the Puzzle Box from Marla's body?,She saw the envelope labeled with her name and noticed Marla's hand clenched around the Puzzle Box,"She grabs a manila envelope labeled with her name, but it slips from her fingers and falls behind the body. As she does, she notices Marla's hand clenched around a small object. Amy pries the fingers open and pulls out a Puzzle Box.",Causal-Motivational Reasoning
33,en2fd3fabcf59d456fb8c57465762400bf,en,5、INT. OFFICES OF THE UNDERGROUND - DAY,"In 5、INT. OFFICES OF THE UNDERGROUND - DAY, what was Amy Klein most afraid of, even if she didn't say it directly?",fear that the footage is real and personally significant,"In Charles’s office, Amy stares at the screen, her cigarette falling from her fingers. She steps back, voice sharp with alarm, demanding to know if the police have been called.",Character Understanding
34,en2fd3fabcf59d456fb8c57465762400bf,en,10、INT. MARLA'S ROOM - DAY,"In 10、INT. MARLA'S ROOM - DAY, why did Amy search Marla's apartment so thoroughly after finding her body?",To find items left for her and uncover what happened to Marla,"She opens the refrigerator. It's empty. Not so much as a ketchup bottle. She continues searching, then moves to the bed. Reaching underneath, she pulls out a dusty skirt and then a desiccated mouse... She pulls it out—a small red paper folder, the kind used for photographs.",Character Understanding
