id,movie_id,language,related_scenes,question,answer,evidence_or_reason,question_type
1,ch2900df1120653869ea00145a6edac6585a0c942f,zh,28、白家上房（夏）日内,白嘉轩甩门而出时，看见鹿子霖在门外，这一瞬间他意识到什么？,鹿子霖已知晓内情,白嘉轩出门瞬间与鹿子霖目光相接，对方神色有异且匆匆离去，暗示其已掌握屋内争执的信息，这一判断促使白嘉轩重新评估事态的外泄程度。,Character Understanding
2,ch2900df1120653869ea00145a6edac6585a0c942f,zh,35、郭家后院（夏）日外,田小娥端着木案走向田头，其行为背后的主要意图是什么？,借送饭与黑娃亲近,田小娥送饭时主动搭话，关心黑娃劳作辛苦，并以玩笑语气拉近距离，动作和言语中透露出对黑娃的情感倾向，送饭是建立亲密互动的契机。,Character Understanding
3,ch2900df1120653869ea00145a6edac6585a0c942f,zh,16、白鹿村（秋） 日外,黑娃追上大车并与鹿兆鹏互动时，两人之间的关系实质是什么？,同伙（童年玩伴，情感对等的伙伴）,黑娃与鹿兆鹏互动自然亲密，有问有答，分享食物，情感流露真挚，体现平等伙伴关系。,Character Understanding
4,ch2900df1120653869ea00145a6edac6585a0c942f,zh,46、土崖	（夏）	日	外,在麦垛上沉睡被发现时，黑娃意识到什么而改变了行动？,私情暴露需逃离,黑娃与田小娥在麦场麦垛上相拥而眠，被路过的农人目睹，引发众人惊愕并持械逼近，情势骤然紧张，迫使黑娃必须应对暴露的危机。,Character Understanding
5,ch2900df1120653869ea00145a6edac6585a0c942f,zh,36、郭家庭院	小娥厢房（夏）日内  / 外,在田小娥与黑娃于郭家庭院互动的这场戏中，哪个动作直接引发了两人关系的急剧升温与后续冲突？,田小娥假装摔倒并责骂黑娃关心铜盆胜过关心她,田小娥通过假装摔倒制造与黑娃的亲密接触机会，当黑娃优先关心铜盆而非她的安危时，她借机责骂以表达不满，这一举动既暴露了她的情感诉求，也点燃了两人之间压抑的情感张力，成为后续亲昵与冲突升级的导火索。,Scene Grounding
6,ch2900df1120653869ea00145a6edac6585a0c942f,zh,14、配种院场附近（秋）日内,在[14、配种院场附近（秋）日内]这场戏中，推动后续惩戒与混乱的关键动作是什么？,白嘉轩逼视儿子并下令取酸枣枝,该动作标志着白嘉轩正式启动惩戒程序，展现出他对族规的强硬执行态度，直接引发后续抽打、众人骚动及孩子逃跑等一系列连锁反应，是整场戏的导火索。,Scene Grounding
7,ch2900df1120653869ea00145a6edac6585a0c942f,zh,44、小娥厢房	（夏）	日	内,在[44、小娥厢房	（夏）	日	内]这一场中，田小娥如何回应黑娃归还信物并请求宽恕的举动？,用团扇阻挡黑娃的手并制止其行为,黑娃带回玉镯与荷包，试图归还并表达愧意，请求田小娥唤他一声姐姐。田小娥未接受，而是以团扇挡住他的手，厉声阻止，随后遮面沉默。这一动作标志着她情感上的拒绝与尊严的坚守，是这场戏的核心转折点。,Scene Grounding
8,ch2900df1120653869ea00145a6edac6585a0c942f,zh,14、配种院场附近（秋）日内; 28、白家上房（夏）日内,在白嘉轩发现鹿子霖立于门外之前，哪一个举动直接反映了他对家族危机的激烈反应，并促成了当时的紧张氛围？,白嘉轩怒斥白孝文并泼茶表示痛心,白嘉轩因白孝文坦白丧失生育能力而情绪崩溃，以泼茶和严厉斥责表达对家族香火断绝的极度悲愤，这一激烈反应发生在密闭的室内场景中，随后他走出房间才与门外的鹿子霖相遇，情绪余波仍弥漫在环境中。,Causal-Motivational Reasoning
9,ch2900df1120653869ea00145a6edac6585a0c942f,zh,35、郭家后院（夏）日外; 36、郭家庭院	小娥厢房（夏）日内  / 外,田小娥为何会在郭家庭院故意假摔，试图引黑娃入房亲近？,她此前曾送饭到田头并关切黑娃的劳作与生活，流露出亲近意图。,田小娥在井边送饭时主动关怀黑娃，劝他注意休息、接受照料，表现出逾越主仆的亲近态度，为后续她设计引诱黑娃的行为埋下动机基础。,Causal-Motivational Reasoning
10,ch2900df1120653869ea00145a6edac6585a0c942f,zh,31、郭家塬（夏）日外; 31、郭家塬（夏）日外,在[31、郭家塬（夏）日外]中，是什么促使黑娃在小娥离开后呆立着吃馍却迟迟不咽？,小娥劝黑娃吃饭并特意说明馍里夹了油辣子,小娥在付工钱时不仅鼓励黑娃吃饭，还特意提醒他馍里有油辣子，这一细节传递了她的关心与亲近，使黑娃在她离去后陷入怔忡，动作停滞，反映出情感上的触动。,Causal-Motivational Reasoning
11,ch2900df1120653869ea00145a6edac6585a0c942f,zh,14、配种院场附近（秋）日内; 28、白家上房（夏）日内,在白嘉轩发现鹿子霖立于门外之前，哪一个关键事件加剧了鹿家与白家之间的紧张关系，从而促使鹿子霖登门？,鹿三踢翻黑娃并怒骂,鹿三在配种院场附近当众踢翻黑娃并怒斥其惹祸，同时鹿子霖也激烈反应，这一冲突激化了家族间的矛盾，成为后续鹿子霖前往白家交涉的直接动因。,Causal-Motivational Reasoning
12,ch2900df1120653869ea00145a6edac6585a0c942f,zh,12、白嘉轩家（秋）日内; 38、田埂	土崖	麦场（夏）日外,到了田小娥挣扎起身独自离去时，此前在白嘉轩家发生的哪个事件直接引发了这一转折？,田福贤用草笼砸黑娃并将其掀倒,田福贤在白嘉轩家对黑娃施暴，导致黑娃被制伏，这一冲突为后续田小娥独自离开的行动提供了直接动因，二者通过人物遭遇与情感断裂形成叙事衔接。,Temporal Reasoning
13,ch2900df1120653869ea00145a6edac6585a0c942f,zh,14、配种院场附近（秋）日内; 28、白家上房（夏）日内,到了白嘉轩发现鹿子霖立于门外时，此前在配种院场附近已发生的关键事件是什么？,黑娃承认用土块驱赶黑驴,在白嘉轩面对鹿子霖之前，故事已通过一场对孩童的审问揭示了黑娃用土块驱赶黑驴的行为，该事件发生在配种院场附近，为后续家庭与邻里关系的紧张埋下伏笔。,Temporal Reasoning
14,ch2900df1120653869ea00145a6edac6585a0c942f,zh,2、祠堂私塾（秋）日外; 134、白鹿村头	（冬）	暮	外,从[2、祠堂私塾（秋）日外]到[134、白鹿村头	（冬）	暮	外]，白嘉轩与鹿子霖在公共事务中的合作基础如何演变为私人层面的交往模式？,从共同主持祠堂事务转向私下邀约看戏,初期两人因祠堂事务通报与协作体现制度性合作，中期经历多次权力争执与立场对立，后期在村头以‘嘉轩兄’相称并邀看戏，显示关系由公务搭档转向私人友好往来。,Role-Relation Continuity
15,ch2900df1120653869ea00145a6edac6585a0c942f,zh,1、白鹿原（秋）日 外; 130、祠堂	（冬）	日	内,从白鹿原私塾初遇的同窗到祠堂送别时的对饮，白孝文与黑娃的关系如何演变？,从同窗伙伴变为背负旧怨但试图和解的复杂关系,两人始于私塾共读的伙伴关系，中间经历黑娃对白孝文伤势的嘲弄与敌意，最终在祠堂场景中通过回忆救命旧事、分享点心、尝试碰杯等行为，展现出一种基于过往纠葛但仍寻求联结的复杂正向关系。,Role-Relation Continuity
16,ch2900df1120653869ea00145a6edac6585a0c942f,zh,24、滋水河畔（秋）夜外; 120、白家牲口圈房	（春）	夜	内,从滋水河畔商议黑娃婚事到白家牲口圈房中面对鹿三之死，白嘉轩与鹿三的关系如何延续？,始终是相互信任的伙伴，白嘉轩倚重鹿三的忠诚，鹿三依赖白嘉轩的决断。,两人在多个关键事件中表现出稳定的情感纽带：早期共同商议婚事体现合作，鹿三归家时白嘉轩主动接应显示关切，鹿三在成家大事上主动请白嘉轩‘拿秤’表明深度信任，最终白嘉轩在鹿三死后悲痛扑抱，印证了长期稳固的伙伴关系。,Role-Relation Continuity
17,ch2900df1120653869ea00145a6edac6585a0c942f,zh,44、小娥厢房	（夏）	日	内; 44、小娥厢房	（夏）	日	内; 48、鹿三家	（夏）	日	内,哪个事件标志着黑娃与田小娥关系开始走向破裂，进而引发后续黑娃以泡枣羞辱、劝食无果及呆立吃馍等一系列行为？,黑娃归还玉镯与荷包，田小娥以扇遮面不语,该场景中，黑娃主动归还定情信物，试图终结情感关系，而田小娥沉默以对，情感联结就此冻结。这一举动打破了两人原有的亲密状态，成为后续对抗性互动的起点，直接导向黑娃由爱生恨的羞辱行为与关系的彻底失衡。,Narrative Progression
18,ch2900df1120653869ea00145a6edac6585a0c942f,zh,31、郭家塬（夏）日外; 31、郭家塬（夏）日外; 45、麦场	（夏）	日	外,哪一个事件成为后续黑娃与田小娥情感互动升温的关键转折？,小娥在麦田边给黑娃付工钱,该事件标志着两人关系从雇佣开始向情感联结转变，为后续私会、送饭等亲密行为提供了动机和情感基础，是推动关系发展的首个实质性互动。,Narrative Progression
19,ch2900df1120653869ea00145a6edac6585a0c942f,zh,36、郭家庭院	小娥厢房（夏）日内  / 外; 45、麦场	（夏）	日	外; 44、小娥厢房	（夏）	日	内,田小娥假摔引黑娃入房却遭拒绝，这一事件如何成为后续麦垛私语、归还玉镯与麦堆搏斗情节的叙事转折点？,田小娥假摔引黑娃入房亲昵被拒,该事件首次暴露两人情感中的权力失衡与欲望错位，使黑娃产生愧疚而田小娥转向主动掌控，由此推动后续一系列亲密与冲突交织的行为升级。,Narrative Progression
20,ch2900df1120653869ea00145a6edac6585a0c942f,zh,35、郭家后院（夏）日外; 35、郭家后院（夏）日外; 45、麦场	（夏）	日	外,哪一个事件成为后续田小娥主动接近黑娃、两人在麦垛私语及她设法引他入房却被拒的情感发展转折点？,田小娥送饭到田头与黑娃说话,该场景标志着田小娥首次主动向黑娃传递情意，打破了两人此前的拘谨距离，为后续一系列亲密尝试建立了情感动因，构成关系升级的起点。,Narrative Progression
21,ch2900df1120653869ea00145a6edac6585a0c942f,zh,,这个故事中最主要的3个角色分别是谁？,白嘉轩、白孝文、黑娃,,Character Understanding
