id,movie_id,language,related_scenes,question,answer,related_context,question_type
1,ch2900df1120653869ea00145a6edac6585a0c942f,zh,28、白家上房（夏）日内,白嘉轩甩门而出时，什么关键认知促使他停下脚步？,察觉鹿子霖已在门外,白嘉轩在情绪激动下甩门而出，原欲离开或继续发难，但瞬间看到鹿子霖静立门外，意识到对方已目睹或介入当前局面，这一察觉使他中止原有行动，转为沉默对视，行为发生转折。,Character Understanding
2,ch2900df1120653869ea00145a6edac6585a0c942f,zh,35、郭家后院（夏）日外,田小娥为何在黑娃劳作时送来饭食？,借送饭亲近黑娃,田小娥主动送饭到田头，言语关切，动作亲昵，如捋发、推菜、欲收汗衫，显露出借照料之名接近黑娃的意图。,Character Understanding
3,ch2900df1120653869ea00145a6edac6585a0c942f,zh,16、白鹿村（秋） 日外,黑娃追上大车时，他与鹿兆鹏之间的关系状态如何体现？,同伙兼送别者与被送别者,黑娃因鹿兆鹏的呼喊而奋力追车，接受其赠送的冰糖并流露情感，显示两人间亲密平等的同伴关系。,Character Understanding
4,ch2900df1120653869ea00145a6edac6585a0c942f,zh,46、土崖	（夏）	日	外,黑娃在麦垛上沉睡时，忽略了什么危险从而导致事态失控？,未察觉旁人将至,黑娃与田小娥在麦场相依入睡时，环境看似静谧，但管家带领农人途经此处，意外发现二人私会。农人反应激烈，随即采取行动，说明黑娃对周围环境的警觉缺失，误判了暴露的风险，这一疏忽直接引发后续冲突。,Character Understanding
5,ch2900df1120653869ea00145a6edac6585a0c942f,zh,36、郭家庭院	小娥厢房（夏）日内  / 外,田小娥如何用身体动作引发黑娃进入厢房并开始亲密接触？,假装摔倒并责骂黑娃关心铜盆胜过关心她,田小娥通过故意摔倒制造需要帮助的假象，当黑娃优先捡起铜盆时，她借机责骂以表达不满，从而引导黑娃扶她回房。这一系列动作是她主动制造亲密接触的开端，推动了后续情感与身体互动的发展。,Scene Grounding
6,ch2900df1120653869ea00145a6edac6585a0c942f,zh,14、配种院场附近（秋）日内,在这场戏中，白嘉轩通过什么动作确立了他对家族惩戒的绝对控制？,下令取酸枣枝并亲自杖责儿子,白嘉轩以命令儿子取来酸枣枝为开端，随后亲自执行体罚，打破场主阻拦，确立其在仪式空间中的权威地位。这一系列动作标志着惩戒的正式开始，也触发了后续众人逃离的连锁反应。,Scene Grounding
7,ch2900df1120653869ea00145a6edac6585a0c942f,zh,44、小娥厢房	（夏）	日	内,在田小娥的厢房中，她如何回应黑娃归还信物并请求宽恕的举动？,用团扇阻挡黑娃的手并制止他,黑娃试图归还田小娥赠予的玉镯和荷包，表达愧疚并请求她叫自己一声姐姐，显示出他内心的挣扎与退缩。田小娥以团扇挡住他的手，既是拒绝接受归还，也是阻止他进一步的情感退却，这一动作标志着她从主动示爱转向压抑与隐忍，成为两人关系转折的关键节点。,Scene Grounding
8,ch2900df1120653869ea00145a6edac6585a0c942f,zh,14、配种院场附近（秋）日内; 28、白家上房（夏）日内,白嘉轩在门外遇见鹿子霖之前，哪一个举动最直接地影响了当时的氛围与后续对峙的张力？,白嘉轩怒斥白孝文并泼茶表示痛心,白嘉轩因白孝文坦白丧失生育能力而情绪崩溃，以泼茶和严厉斥责表达对家族血脉断绝的极度悲愤，这一激烈反应直接导致他冲出房间，继而与门外的鹿子霖猝然相遇，使两人本就复杂的对峙关系瞬间紧绷。,Causal-Motivational Reasoning
9,ch2900df1120653869ea00145a6edac6585a0c942f,zh,35、郭家后院（夏）日外; 36、郭家庭院	小娥厢房（夏）日内  / 外,田小娥为何会刻意制造摔倒的机会来接近黑娃？,她此前已通过送饭和关切言语试探黑娃的态度，试图拉近亲密关系。,田小娥在送饭时表现出超出寻常的关心，主动劝他休息、整理衣物，并以玩笑方式试探婚姻话题，显示出她早有亲近意图。这一系列温和而持续的示好行为，为她后续设计身体接触埋下动机基础。,Causal-Motivational Reasoning
10,ch2900df1120653869ea00145a6edac6585a0c942f,zh,31、郭家塬（夏）日外; 31、郭家塬（夏）日外,黑娃为何在小娥离开后站着吃馍却迟迟不咽？,小娥劝他吃饭并特意说馍里夹了油辣子，还多给一个铜板，让他感到意外和触动,小娥在付工钱时不仅关心黑娃的饮食，还用言语调笑、多给报酬，流露出亲近与体贴，这种超越雇主身份的关切让黑娃心绪波动，导致他接过馍后愣住，动作停滞。,Causal-Motivational Reasoning
11,ch2900df1120653869ea00145a6edac6585a0c942f,zh,14、配种院场附近（秋）日内; 28、白家上房（夏）日内,白嘉轩为何会在屋外撞见鹿子霖徘徊？,鹿三踢翻黑娃并怒骂,祠堂前的冲突中，鹿三因黑娃闯祸而动手，鹿子霖也情绪激动，这一场面引发后续震动。白嘉轩介入处理后出门，恰逢鹿子霖在外等候，其出现与此前家族内部的激烈反应直接相关。,Causal-Motivational Reasoning
12,ch2900df1120653869ea00145a6edac6585a0c942f,zh,12、白嘉轩家（秋）日内; 38、田埂	土崖	麦场（夏）日外,到了田小娥挣扎起身独自离去时，在这之前已经发生了什么关键事件？,田福贤用草笼砸黑娃并将其掀倒,在田小娥离开前的场景中，田福贤对黑娃实施了暴力行为，这一冲突直接构成了后续田小娥反应的叙事前提。,Temporal Reasoning
13,ch2900df1120653869ea00145a6edac6585a0c942f,zh,14、配种院场附近（秋）日内; 28、白家上房（夏）日内,到了白嘉轩发现鹿子霖立于门外时，在这之前已经发生了什么关键事件？,黑娃承认用土块驱赶黑驴,在白嘉轩面对鹿子霖之前，剧情已通过审问场景揭示了黑娃对驱赶黑驴行为的供认，这一举动成为后续矛盾展开的导火索，构成了情节推进的前置关键点。,Temporal Reasoning
14,ch2900df1120653869ea00145a6edac6585a0c942f,zh,2、祠堂私塾（秋）日外; 134、白鹿村头	（冬）	暮	外,从早期共同处理祠堂事务，到后来在村中相遇邀约看戏，白嘉轩与鹿子霖之间的关系如何演变？,从共事合作转为私人交好,起初二人因共同管理祠堂事务而维持着基于职责的信任与协作，鹿子霖主动通报消息并愿代为担责；尽管中间经历多次冲突与权力争斗，关系一度敌对，但最终在村头相遇时，鹿子霖以‘嘉轩兄’相称并邀其看戏，流露出私人情谊，标志关系重新走向亲近。,Role-Relation Continuity
15,ch2900df1120653869ea00145a6edac6585a0c942f,zh,1、白鹿原（秋）日 外; 130、祠堂	（冬）	日	内,白孝文和黑娃从童年到成年，两人之间的关系经历了怎样的演变？,从同窗玩伴变为背负旧怨却仍存旧情的复杂关系,两人最初一同上学、玩耍，关系亲密；中途黑娃曾因白孝文受伤而羞辱他，显现敌意；多年后在祠堂重逢，虽各有立场，但仍提及过往恩情，试图共饮，显示出关系中交织着愧疚、记忆与未尽的情感。,Role-Relation Continuity
16,ch2900df1120653869ea00145a6edac6585a0c942f,zh,24、滋水河畔（秋）夜外; 120、白家牲口圈房	（春）	夜	内,从滋水河畔的秋夜到白家牲口圈房的春夜，白嘉轩与鹿三之间的关系如何延续？,始终互为信任的伙伴，白嘉轩倚重鹿三的忠诚，鹿三依赖白嘉轩的决断。,两人在多个关键事件中表现出稳定的情感纽带与相互依赖：早期共同商议黑娃婚事，体现合作与尊重；鹿三归乡时白嘉轩主动接应，流露关切；鹿三在成家大事上主动请白嘉轩‘拿秤’，显示深度信任；直至鹿三去世，白嘉轩恸哭扑抱，情感反应极为亲密。这些行为共同支撑了他们长期稳固的伙伴关系。,Role-Relation Continuity
17,ch2900df1120653869ea00145a6edac6585a0c942f,zh,44、小娥厢房	（夏）	日	内; 44、小娥厢房	（夏）	日	内; 48、鹿三家	（夏）	日	内,在田小娥与黑娃关系走向破裂的过程中，哪一个事件标志着两人情感联结的实质性断裂，从而引向后续一系列疏离与仪式化行为的展开？,黑娃归还玉镯与荷包，田小娥以扇遮面不语,该场景中，黑娃主动归还定情信物，试图以理性姿态结束关系，而田小娥沉默以对，不再争辩或动情，表明双方已从亲密转向隔绝。这一举动终结了此前的情感张力，为后续黑娃机械履行仪式、田小娥决然离去及两人共处时的无言状态提供了动机基础。,Narrative Progression
18,ch2900df1120653869ea00145a6edac6585a0c942f,zh,31、郭家塬（夏）日外; 31、郭家塬（夏）日外; 45、麦场	（夏）	日	外,哪一事件打破了黑娃与田小娥之间原本的雇佣关系，使两人情感开始向私密联结转变？,小娥在麦田边给黑娃付工钱,这一举动表面是结清工酬，实则成为两人关系从主雇走向情感依恋的分水岭。金钱交接的仪式感突显了身份界限的松动，为后续亲密互动创造了情感前提。,Narrative Progression
19,ch2900df1120653869ea00145a6edac6585a0c942f,zh,36、郭家庭院	小娥厢房（夏）日内  / 外; 45、麦场	（夏）	日	外; 44、小娥厢房	（夏）	日	内,在黑娃与田小娥的关系从压抑走向爆发的过程中，哪一个事件首次打破了两人之间表面的克制，触发了后续一系列情感对峙与身体冲突的连锁反应？,田小娥假摔引黑娃入房亲昵被拒,该事件标志着田小娥主动试探黑娃情感防线的失败，其亲密举动遭拒后，双方关系由隐忍转入紧张对峙，直接激化了后续在麦垛上的言语纠缠、道歉挽回与肢体挣扎，成为情感走向失控的起点。,Narrative Progression
20,ch2900df1120653869ea00145a6edac6585a0c942f,zh,35、郭家后院（夏）日外; 35、郭家后院（夏）日外; 45、麦场	（夏）	日	外,哪一事件打破了田小娥与黑娃之间原本克制的距离，使两人的关系开始向私密互动迅速推进？,田小娥送饭到田头与黑娃说话,此次送饭是田小娥主动接近黑娃的首次实质性举动，打破了此前仅限于目光与沉默的张力，开启了后续一系列亲密尝试的连锁反应。对话的私密性与场合的日常性形成反差，为关系升温提供了合理跳板。,Narrative Progression
