id,movie_id,language,related_scenes,question,answer,evidence_or_reason,question_type
1,ch3e4c8f9bd713a665352a147555ff68bf302935cf,zh,十 故梦,在依云与老张化作烟尘后，何云青递出经书的举动反映了他怎样的判断？,完成送别之责,依云与老张的遗体在仪式中消散，何云青目睹全过程，从悲痛到向喇嘛递出经书，表明他接受并参与了超度仪式，视其为对逝者的最后履行。,Character Understanding
2,ch3e4c8f9bd713a665352a147555ff68bf302935cf,zh,八 恨晚,依云在得知乐娘是厉鬼后，为何立即带何云青赶往飘岩斋？,寻求崔先生庇护,依云识破乐娘真实身份为厉鬼，判断当前处境极度危险，必须尽快带何云青找到能够制衡厉鬼的崔先生，因此果断动身前往飘岩斋求助。,Character Understanding
3,ch3e4c8f9bd713a665352a147555ff68bf302935cf,zh,八 恨晚,依云悄然出现并带何云青腾空飞行时，她最想实现什么？,带他逃离并揭露杀意,依云突然现身，带何云青飞离房间，落地后解开他的穴道并警告乐娘将在抄经后杀他，促使何云青意识到危险。,Character Understanding
4,ch3e4c8f9bd713a665352a147555ff68bf302935cf,zh,五 战鼓,何云青醒来后为何追问乐娘何时来的？,确认乐娘留宿原因,何云青醒来发现衣裳已褪，乐娘在梳妆，神情含羞，他意识到情形有异，遂追问乐娘何时来此，试图弄清昨夜发生之事及其责任，反映出他对关系状态与自身行为后果的关切。,Character Understanding
5,ch3e4c8f9bd713a665352a147555ff68bf302935cf,zh,十 故梦,在[十 故梦]这一场中，依云与乐娘的结局是如何呈现的？,在白烟中化为灰烬,该场景通过白烟升腾的视觉意象，完成对依云与乐娘命运的最终收束。她们的身影在烟雾中逐渐消散，象征执念终结与轮回解脱，成为这场戏最核心的叙事动作，也为后续人物反应和经书交付奠定情感基调。,Scene Grounding
6,ch3e4c8f9bd713a665352a147555ff68bf302935cf,zh,十 故梦,在[十 故梦]这一场中，引发幻象彻底暴露并被破除的关键动作是什么？,何云青掷出念珠击中两个依云,这场戏的转折点始于老张的失控攻击，但真正推动剧情走向高潮的是两个依云的并存与搏斗，造成身份难辨的危机。喇嘛现身点破邪祟本质，促使何云青最终听从师父嘱咐，掷出念珠。念珠击中双依云引发异象，使幻象崩解为白烟，揭示真相并完成破邪仪式，因此该动作是定义整场戏核心推进的关键。,Scene Grounding
7,ch3e4c8f9bd713a665352a147555ff68bf302935cf,zh,十 故梦,在[十 故梦]这一场中，崔鸿至通过讲述什么关键情节揭示乐娘对何云青的威胁？,解释老张被乐娘袭击而神志不清的真相,崔鸿至通过还原老张在经略府被乐娘突袭致残的经过，揭示乐娘惯用相同手段对付他人，从而警示何云青正处于相似危险之中。这一叙述将老张的遭遇与当前情境关联，构成对何云青的直接警告。,Scene Grounding
8,ch3e4c8f9bd713a665352a147555ff68bf302935cf,zh,八 恨晚; 十 故梦,崔鸿至为何催促何云青立即离开？这一行为如何促成了他后续归还经书并返回山中的决定？,崔鸿至唤醒何云青并警告他乐娘将怒，迫使他中断停留匆忙离开，这一干预打断了何云青的迟疑状态，推动其重新踏上归途。,崔鸿至在清晨强行唤醒何云青，以乐娘发怒的后果施加压力，促使其迅速离开居所。这一外部推动打破了何云青在情感牵绊中的停滞，成为他重拾使命、返回山中归还经书的直接触发点。,Causal-Motivational Reasoning
9,ch3e4c8f9bd713a665352a147555ff68bf302935cf,zh,八 恨晚; 十 故梦,依云为何拉着何云青赶往飘岩斋，这一举动如何促成了后来何云青送别依云与老张的情景？,依云拉着何云青赶往飘岩斋求助,依云察觉乐娘为厉鬼后，立即带何云青前往飘岩斋寻崔先生援助，途中被乐娘拦截。这一行动开启了后续救援失败、依云与老张身亡、何云青最终送别的悲剧结局，是推动情节发展的关键起点。,Causal-Motivational Reasoning
10,ch3e4c8f9bd713a665352a147555ff68bf302935cf,zh,六 露緣; 七 赶集,何云青为何会在前往村落途中与依云在黄昏山路上相遇并谈心？,他与崔鸿至沿山间小径前往村落,何云青在王妈妈催促下动身前往村落，与崔鸿至同行于山径之上。这段行程使他途经山路，恰逢依云，进而引发二人在黄昏时分并行谈心的情景。相遇的契机根植于此次出行的路线与时机。,Causal-Motivational Reasoning
11,ch3e4c8f9bd713a665352a147555ff68bf302935cf,zh,八 恨晚; 十 故梦,何云青在山路上沉默前行时的心理状态如何影响了他后来决定归还经书并返回山中？,他对前几日经历的真实性产生怀疑，内心不安,在山路上，何云青回想起之前的遭遇，感到一切如同梦境，真实与虚幻的界限模糊，这种疑虑逐渐累积，成为他重新返回山中的内在动因。,Causal-Motivational Reasoning
12,ch3e4c8f9bd713a665352a147555ff68bf302935cf,zh,一 受命; 十 故梦,到了何云青归还经书后返回山中时，在这之前已经发生了哪一关键发展？,何云青抵达海印寺并进入大殿,该发展位于故事早期，是何云青与寺庙产生直接接触的首个关键动作，为后续归还经书的情节建立了空间与行动上的起点，两个事件之间相隔多个场景，具有明确的先后逻辑。,Temporal Reasoning
13,ch3e4c8f9bd713a665352a147555ff68bf302935cf,zh,一 受命; 十 故梦,到了何云青归还经书后返回山中时，此前在‘一受命’场景中已发生的关键发展是什么？,何云青进入神秘山径,在‘一 受命’场景中，何云青受命启程并踏入神秘山径，这是他整个山中经历的起点，早于归还经书与返回山中的情节，构成了后续事件的时间基础。,Temporal Reasoning
14,ch3e4c8f9bd713a665352a147555ff68bf302935cf,zh,一 受命; 十 故梦,从[一 受命]到[十 故梦]，何云青和崔鸿至之间的关系如何演变？,从建立信任的合作者发展为生死与共的挚友,最初何云青凭信件与崔鸿至建立初步信任，随后崔鸿至安排其起居并叮嘱保密，体现合作关系的深化；后续共同经历生死考验，最终在回忆中被确认为深切追念的同伴，关系升华为生死与共的友谊。,Role-Relation Continuity
15,ch3e4c8f9bd713a665352a147555ff68bf302935cf,zh,七 赶集; 十 故梦,从[七 赶集]到[十 故梦]，何云青和依云之间的互动如何体现出他们关系的演进？,从礼节性问候发展为彼此深爱且愿为对方牺牲,在[七 赶集]中，依云向何云青行礼问候，随后通过引路、安慰、陪伴等行为建立初步信任与好感，关系尚偏于礼节与友善；至[十 故梦]，何云青对依云的情感已深化为至情至爱，文本明确表达其愿以身相殉，标志关系升华为深刻的情感羁绊。,Role-Relation Continuity
16,ch3e4c8f9bd713a665352a147555ff68bf302935cf,zh,三 止泊; 四 惊艳,从[三 止泊]到[四 惊艳]，乐娘和王妈之间的互动模式发生了怎样的转变？,从责备对立转为在家庭事务中主仆协作,在[三 止泊]中，王妈因乐娘洒酒而严厉责备她，显示两人关系紧张；到了[四 惊艳]，王妈开始指挥乐娘关门并配合其表演，表明她们已在家庭事务中建立协作关系。这一转变体现了从冲突到功能性合作的演进。,Role-Relation Continuity
17,ch3e4c8f9bd713a665352a147555ff68bf302935cf,zh,十 故梦; 十 故梦; 十 故梦,在[十 故梦]中，哪个事件直接促成了飘岩斋对峙、送别与抄经现场突变等一系列后续发展？,崔鸿至讲述老张被害经过,该事件揭示了老张的真实遭遇，打破了原有叙事平衡，触发多方行动与情感冲突的集中爆发，成为连接过去与后续连锁反应的关键枢纽。,Narrative Progression
18,ch3e4c8f9bd713a665352a147555ff68bf302935cf,zh,十 故梦; 十 故梦; 十 故梦,在[十 故梦]中，哪一个动作打破了虚实交织的幻境，从而触发崔鸿至揭露老张被害真相、何云青与依云告别老张、以及喇嘛以红雾示警的一系列后续发展？,何云青掷念珠破幻影,该事件标志着主角主动识破并干预幻象，成为从被动回忆转向现实抉择的枢纽，由此释放被压抑的记忆与警示，推动多个关键情节同步展开。,Narrative Progression
19,ch3e4c8f9bd713a665352a147555ff68bf302935cf,zh,五 战鼓; 五 战鼓; 六 露緣,哪一个事件成为后续婚期议定、何云青初见乐娘及山径同行等情节发展的关键转折？,何云青随王妈妈走向荷花池,该场景标志着何云青被正式引入乐娘的生活空间，打破了此前的隔阂状态，触发了一系列人际互动与情感铺垫，直接推动了后续婚约安排与人物关系的展开。,Narrative Progression
20,ch3e4c8f9bd713a665352a147555ff68bf302935cf,zh,六 露緣; 十 故梦; 序,何云青与崔鸿至同行前往村落这一行动，如何成为触发后续归还经书、接受抄经任务及夜遇黄影等一系列事件的关键转折？,何云青与崔鸿至踏山径赴村落,该场景标志着何云青从被动避世转向介入世俗事务的起点，通过与崔鸿至的结伴行动，引出村落因经书引发的纷争，进而推动其承担抄经责任并进入新的命运轨迹。,Narrative Progression
21,ch3e4c8f9bd713a665352a147555ff68bf302935cf,zh,,这个故事中最主要的3个角色分别是谁？,乐娘、何云青、依云,,Character Understanding
22,ch3e4c8f9bd713a665352a147555ff68bf302935cf,zh,,一束阳光从窗格间斜照进来，崔鸿至站在何云青的榻旁将他摇醒，何云青见天已大亮，连忙起身相迎。此时依云从内室走出，神情清雅，轻声向崔鸿至问好。这一系列情景出现在哪几场戏中？,八 恨晚 | 九 封印,该描述始于崔鸿至清晨唤醒何云青，依云在旁安静问好，场景充满静谧光影，对应‘八 恨晚’中的离别前刻；随后情节转向依云被揭穿为鬼魂、被迫离去，进入‘九 封印’的核心冲突，两场戏在情绪与真相揭示上紧密衔接，构成连续的情感与叙事转折。,Scene Grounding
23,ch3e4c8f9bd713a665352a147555ff68bf302935cf,zh,,崔鸿至与老张共同出现的场景对应的是哪几场戏？,一 受命 | 二 远涉 | 五 战鼓 | 十 故梦,两人在四场戏中共同出现，分别为受命、远涉、战鼓、故梦，体现其行动轨迹的交集。,Scene Grounding
24,ch3e4c8f9bd713a665352a147555ff68bf302935cf,zh,,依云出现的戏份对应的是哪几场戏？,七 赶集 | 八 恨晚 | 九 封印 | 十 故梦,依云在四场戏中出现，场景跨度从第七场至第十场，覆盖赶集、恨晚、封印、故梦。,Scene Grounding
25,ch3e4c8f9bd713a665352a147555ff68bf302935cf,zh,,鼓声停歇后，崔鸿至劝酒令何云青醉倒，乐娘扶住他并与崔鸿至对视，眼中闪过异样神色。这一系列互动发生在哪几场戏中？,四 惊艳 | 五 战鼓,该情节始于鼓声结束后的劝酒场景，何云青在崔鸿至持续劝饮和乐娘不断斟酒下醉倒，乐娘扶人时与崔鸿至目光交汇，流露微妙情绪。这些动作与神情变化集中体现于‘四 惊艳’与‘五 战鼓’两场戏的衔接段落，构成连续的行为与情感推进。,Scene Grounding
26,ch3e4c8f9bd713a665352a147555ff68bf302935cf,zh,,依云受母亲之托前往后山采药，临行时被暗示可顺道陪伴在附近的何云青，随后她提篮出发并在山路上与他相遇。这些情节发生在哪几场戏中？,七 赶集 | 八 恨晚,依云母亲借采药之机安排她与何云青相见，依云出门后在前往后山途中与其会合，这一互动始于‘七 赶集’并延续至‘八 恨晚’，两场戏共同构成该情节的完整发展。,Scene Grounding
