id,movie_id,language,related_scenes,question,answer,evidence_or_reason,question_type
1,enec3061f1b9d346fa84285a8f3eb111ba,en,25、INT. KURTZMAN'S OFFICE DAY,What does Sam recognize about the cheque when he enters Kurtzman's office and sees Kurtzman's panic?,It is an official Ministry document linked to a billing error for Electromemorytherapy.,"Sam enters Kurtzman's office to find him distressed, waving a cheque for Buttle (mistakenly referred to as Tuttle) due to a billing error in the Electromemorytherapy system. Kurtzman fears bureaucratic consequences, but Sam remains composed, identifying the document as official Ministry paperwork and assessing its implications.",Character Understanding
2,enec3061f1b9d346fa84285a8f3eb111ba,en,37、EXT. BLOCK OF FLATS DAY,What is Sam's objective upon seeing the burning Messerchmidt?,smother the fire on the car,"Sam charges out into the open air and sees the Messerchmidt engulfed in flames. Nearby, a group of children stand in silence, watching. Sam spots an old mattress lying by the building, grabs it, and throws it over the burning car in an attempt to smother the fire.",Character Understanding
3,enec3061f1b9d346fa84285a8f3eb111ba,en,41、INT. SAM'S FLAT EVENING,What does Sam intend when he enters his apartment and finds the walls torn open by workmen?,Comply with the repair authorization,"Sam enters his apartment to find panels ripped from the walls, wires exposed, and two workers studying wiring diagrams under Spoor's supervision. A voice from inside the wall echoes Sam’s own words, revealing a recording of his earlier emergency call to Central Services. Spoor produces a multi-page form and directs Sam to sign it. Sam uses a fountain pen, but the carbon copy fails, prompting Spoor to request a ballpoint. Sam resigns himself to the process and signs each page. When Dowser suddenly bursts from the wall with unrelated cables and a foreign component, the operation’s disorganization becomes evident.",Character Understanding
4,enec3061f1b9d346fa84285a8f3eb111ba,en,37、EXT. BLOCK OF FLATS DAY,What does Sam realize when he finds his vehicle disabled after the lorry departs?,he is stranded and confronted by silent children,"After the lorry roars away, Sam runs back to his smoldering three-wheeler and attempts to start it, only to find all three wheels have been removed. Defeated, he slumps against the charred frame and notices a group of children, including Girl Buttle, standing nearby and watching him in silence. He looks at them without speaking, met with their expressionless stares, marking a moment of isolation and confrontation.",Character Understanding
5,enec3061f1b9d346fa84285a8f3eb111ba,en,23、INT. SAM'S FLAT NIGHT,What initiates the confrontation in the scene where Tuttle is concealed behind the wall panel?,Doorbell rings unexpectedly during repair attempt,"The doorbell rings while Tuttle is working behind the wall panel, prompting Sam to answer the door. Spoor and Dowser from Central Services demand entry to inspect the apartment, but Sam resists, insisting on proper documentation. As tensions rise, Spoor moves toward the inner door leading to Tuttle’s hiding place, causing Tuttle to draw his pistol. Sam interrupts by questioning the absence of a 27B/6 form, triggering a physical episode in Dowser that Spoor suppresses by force. After calming him, Spoor agrees to return with the form, and they retreat, allowing Sam to close the door and end the encounter.",Scene Grounding
6,enec3061f1b9d346fa84285a8f3eb111ba,en,28、EXT. BUTTLE FLATS DAY,What action marks SAM's arrival at the housing tower?,SAM arrives at the base of the decrepit housing tower,"SAM pulls up beside the massive, grey housing tower in his Messerschmidt. The building looms above him, its surface marked by decay and vandalism, framed by large conduits and pipes. He steps out of the car and stands beneath the cool, unfriendly stares of a few locals. Holding a piece of paper in his hand, he looks around, then down at the paper, checking its contents as he takes in his surroundings.",Scene Grounding
7,enec3061f1b9d346fa84285a8f3eb111ba,en,50、INT. 30TH FLOOR CORRIDOR DAY,What action initiates the sequence in the 30th-floor corridor?,Sam exits the elevator and observes the silent corridor,"Sam steps out of the elevator as the doors close behind him. He scans the empty corridor, which is initially silent. A faint, growing sound—whirring, murmuring, and tumbling—begins to emanate from somewhere down the hallway, marking the start of an unsettling encounter.",Scene Grounding
8,enec3061f1b9d346fa84285a8f3eb111ba,en,25、INT. KURTZMAN'S OFFICE DAY; 25、INT. KURTZMAN'S OFFICE DAY,What event immediately motivates Sam's decision to deliver the refund in person?,Sam enters Kurtzman's office during a tense moment,"In Kurtzman's office, Sam finds him agitated and pacing, holding a refund cheque meant for Mrs. Buttle that resulted from a bureaucratic error confusing her with another patient. Kurtzman fears repercussions once the mistake is discovered, emphasizing the administrative risks of retaining the cheque. Observing his distress and assessing the document, Sam remains composed, then begins to hum and eventually proposes resolving the situation directly by delivering the cheque to Mrs. Buttle himself, offering a practical solution to defuse the tension.",Causal-Motivational Reasoning
9,enec3061f1b9d346fa84285a8f3eb111ba,en,49、INT. INFORMATION RETRIEVAL LOBBY DAY; 50、INT. 30TH FLOOR CORRIDOR DAY,What action in the lobby immediately precedes and motivates Sam's decision to follow the group down the corridor?,Video camera follows Sam across the lobby,"Sam enters the vast, austere lobby and walks across it, his movement tracked by a video camera. He stops at the reception desk, standing in tight profile as the camera tilts up to reveal him facing a monitor. This monitored traversal establishes his presence and orientation within the facility, directly preceding his silent departure down the corridor after the departing group.",Causal-Motivational Reasoning
10,enec3061f1b9d346fa84285a8f3eb111ba,en,23、INT. SAM'S FLAT NIGHT; 23、INT. SAM'S FLAT NIGHT,What event immediately enables Tuttle to begin repairing the heater and ultimately escape across the void?,Mysterious voice instructs Sam to drop the phone and raise his hands,"Sam answers a ringing phone, responding groggily, when a sharp voice commands him to put the phone down and raise his hands. As he hesitates, he hears a noise at the kitchen door and turns to see a blurred movement. The voice speaks again—now clearly from behind him—and Sam whirls around to find Tuttle standing in the room, holding a telephone receiver and aiming a gun at him. After Sam complies, Tuttle places the receiver in a bag, pockets his weapon, and inspects the apartment. Only after securing the space does he introduce himself as a heating engineer and begin working on the system, setting in motion his eventual repair of the heater and escape across the void on a rope to a neighboring building.",Causal-Motivational Reasoning
11,enec3061f1b9d346fa84285a8f3eb111ba,en,23、INT. SAM'S FLAT NIGHT; 23、INT. SAM'S FLAT NIGHT,What event immediately precedes and triggers Sam's confrontation with Tuttle during the phone call?,Sam wakes up inside the refrigerator compartment,"Sam awakens disoriented and soaked inside the refrigerator compartment of his flat, water dripping from the defrosted freezer above. As he stumbles toward a ringing phone, he answers it groggily, only to be ordered to put the phone down and raise his hands. When he turns toward a noise at the kitchen door, he sees a blur of movement, and the voice from the phone suddenly seems to come from behind him—revealing Tuttle, who has been listening on a second line and now confronts Sam at gunpoint. [scene: INT. SAM'S FLAT NIGHT]",Causal-Motivational Reasoning
12,enec3061f1b9d346fa84285a8f3eb111ba,en,25、INT. KURTZMAN'S OFFICE DAY; 38、INT. RECORD CLERKS POOL DAY,"By the time Kurtzman and Sam confront the missing transporter and Buttle's cheque, what has Sam already done to initiate the chain of events?",SAM operates the vacuum tube system to retrieve documents,"Before the issue of the missing transporter and Buttle's cheque comes to light, Sam takes initiative by using the vacuum tube system to retrieve key documents, setting in motion the sequence that leads to the later confrontation in the record clerks' pool. This action occurs in Kurtzman's office and establishes Sam's active role in uncovering the administrative discrepancies.",Temporal Reasoning
13,enec3061f1b9d346fa84285a8f3eb111ba,en,10、INT. BUTTLE SITTING-ROOM NIGHT; 31、INT. BUTTLE SITTING ROOM DAY,"By the time Mrs Buttle inquires about her husband's body, what administrative act has already taken place in her home?",Official collects signatures from Mrs Buttle for receipt books,"Prior to Mrs Buttle seeking information about her husband's remains, a bureaucratic official visited her residence to process paperwork, requiring her signature on receipt books as part of a procedural formality, establishing the impersonal machinery of the system that governs her loss [scene: 10, INT. BUTTLE SITTING-ROOM NIGHT].",Temporal Reasoning
14,enec3061f1b9d346fa84285a8f3eb111ba,en,14、EXT. SKY DAY; 133、EXT. MAZE-LIKE DARK PASSAGES NIGHT,How does Sam Lowry's relationship with the Forces of Darkness evolve from their initial confrontation to the final pursuit through the maze-like passages?,Sam Lowry consistently treats the Forces of Darkness as active adversaries,"From the early aerial confrontation where Sam bars their path and they draw swords, through multiple encounters in the stone ship where he physically struggles against them and is overwhelmed, to the final sequence in the maze-like dark passages where they close in on him without possibility of escape, Sam Lowry maintains an adversarial stance toward the Forces of Darkness, meeting each encounter with direct resistance and combat readiness.",Role-Relation Continuity
15,enec3061f1b9d346fa84285a8f3eb111ba,en,22、EXT. DARKNESS NIGHT; 105、EXT. MINISTRY OF INFORMATION RETRIEVAL NIGHT,How does Sam Lowry's relationship with the Giant Samurai Warrior remain consistent from their first encounter through the confrontation at the Ministry of Information Retrieval?,Sam Lowry treats the Giant Samurai Warrior as an adversarial force throughout,"From the initial appearance of the Giant Samurai Warrior in the darkness, Sam reacts with fear and physical resistance, establishing a hostile dynamic. This adversarial pattern continues at the Ministry of Information Retrieval, where the Giant blocks Sam's path and the two engage in direct physical conflict. Sam's actions—confronting, attacking, and ultimately removing the Giant's mask—are framed within a context of opposition and struggle, maintaining a consistent negative and combative relationship without indication of alliance, neutrality, or shift in stance.",Role-Relation Continuity
16,enec3061f1b9d346fa84285a8f3eb111ba,en,19、INT. POSH RESTAURANT (ENTRANCE) DAY; 98、INT. LINGERIE DEPARTMENT/SHOPPING CENTRE,How does the working relationship between Mrs. Terrain and Shirley evolve from their initial interaction to their later collaboration?,Shirley transitions from a shy subordinate to an attentive attendant and companion,"In their first encounter, Shirley speaks timidly and defers to Mrs. Terrain, who responds with protective guidance, suggesting a momentary dynamic of care and hesitation. By the later scene, Shirley is actively pushing Mrs. Terrain's wheelchair and engaging in familiar conversation, reflecting an established, cooperative bond where she serves as both attendant and companion. The shift indicates a deepening of roles from tentative interaction to consistent, supportive partnership.",Role-Relation Continuity
17,enec3061f1b9d346fa84285a8f3eb111ba,en,25、INT. KURTZMAN'S OFFICE DAY; 25、INT. KURTZMAN'S OFFICE DAY; 25、INT. KURTZMAN'S OFFICE DAY,"What pivotal event sets in motion the chain of actions leading to Sam's attempts to resolve the billing error, deliver the refund personally, and confront the administrative chaos surrounding Buttle and Tuttle?",Sam Confronts the Refund Crisis,"In the aftermath of a systemic error that results in a wrongful charge and refund loop, Sam becomes directly involved when he discovers the financial and bureaucratic entanglement affecting Buttle and Tuttle. His decision to intervene marks a shift from passive observer to active participant in navigating the opaque administrative machinery. This moment initiates a series of efforts to correct the record, including personal delivery of the refund and repeated attempts to reconcile the accounts, exposing deeper institutional dysfunction. [25、INT. KURTZMAN'S OFFICE DAY]",Narrative Progression
18,enec3061f1b9d346fa84285a8f3eb111ba,en,28、EXT. BUTTLE FLATS DAY; 35、INT. JILL'S FLAT DAY; 30、INT. CORRIDOR DAY,What event marks the turning point that sets into motion Sam's confrontation with the collapsing reality of the housing tower and Jill's escape?,SAM Arrives at the Housing Tower,"Sam's arrival at the housing tower initiates a chain of escalating disturbances, including the explosion of a car, Jill's flight with a suitcase, the darkened hallway, and the final closing door, all of which follow directly from his presence and investigation at the site [28、EXT. BUTTLE FLATS DAY].",Narrative Progression
19,enec3061f1b9d346fa84285a8f3eb111ba,en,50、INT. 30TH FLOOR CORRIDOR DAY; 50、INT. 30TH FLOOR CORRIDOR DAY; 50、INT. 30TH FLOOR CORRIDOR DAY,What pivotal event initiates Sam's shift from passive observation to active pursuit in the corridor sequence?,Sam Exits Elevator as a Strange Sound Approaches,"As Sam leaves the elevator onto the 30th floor, an uncanny sound builds in the hallway, altering the atmosphere and prompting a series of actions where Sam refrains from joining the passing crowd, then begins to follow their movement toward the stairs. This moment marks the first deviation from routine and sets in motion Sam's physical and narrative trajectory through the unfolding event. [50、INT. 30TH FLOOR CORRIDOR DAY]",Narrative Progression
20,enec3061f1b9d346fa84285a8f3eb111ba,en,23、INT. SAM'S FLAT NIGHT; 23、INT. SAM'S FLAT NIGHT; 30、INT. CORRIDOR DAY,"What event initiates the sequence in which Sam confronts Tuttle during a mysterious phone call, observes the darkened hallway, and deals with a malfunctioning alarm?",Sam Wakes to Dripping Water and a Ringing Phone,"The narrative shifts into motion when Sam awakens in his flat at night to the sound of dripping water and a ringing phone, setting off a chain of urgent actions and encounters. This moment disrupts the stillness and propels Sam into a series of tense, interconnected events involving surveillance, confusion, and escalating system failures. [23、INT. SAM'S FLAT NIGHT]",Narrative Progression
21,enec3061f1b9d346fa84285a8f3eb111ba,en,,Who are the 3 most central characters in this story?,"Jack, Jill Layton, Sam Lowry",,Character Understanding
