id,movie_id,language,related_scenes,question,answer,evidence_or_reason,question_type
1,cha9b2e0b377b122037bc5bcbe4ed13155ee1ea4dd,zh,13 牌馆 内 夜,在唐仁坐在牌桌前时，他接完秦风电话后的行动意图是什么？,准备离开去见秦风,唐仁牌局失利，手机响起，秦风来电询问动向。他应答后挂断，起身离开牌馆，表明其注意力已从赌局转向与秦风会合。,Character Understanding
2,cha9b2e0b377b122037bc5bcbe4ed13155ee1ea4dd,zh,32 街头 外 日,在警察追捕中，唐仁看到秦风出手相助后决定做什么？,联手秦风逃脱,唐仁被警察追赶时，秦风突然出手干扰了追捕的警察黄兰登，使其摔倒。唐仁意识到秦风在帮助自己，立即响应并与其一同逃跑，表明他在此刻选择与秦风合作以摆脱险境。,Character Understanding
3,cha9b2e0b377b122037bc5bcbe4ed13155ee1ea4dd,zh,49 颂帕工厂 外 夜,在颂帕工厂外，唐仁注意到什么促使他催促秦风加快行动？,尽快进入现场,唐仁和秦风到达案发现场时，唐仁未关注摄像头等细节，反而催促秦风快速进入，显示他更在意抢先勘查或控制现场节奏，这一判断推动他立即采取行动。,Character Understanding
4,cha9b2e0b377b122037bc5bcbe4ed13155ee1ea4dd,zh,43 船厂码头 外 夜,在唐仁和秦风走向停靠的船只时，唐仁最终决定做什么？,放弃逃亡，合作查案,唐仁本欲登船逃离，但得知目的地为非洲后心生恐惧，犹豫中拉住秦风选择下船。面对秦风关于查案的提议，经历争执后两人达成共识，决定共同查明真相，标志着从逃避到主动介入的转变。,Character Understanding
5,cha9b2e0b377b122037bc5bcbe4ed13155ee1ea4dd,zh,43 船厂码头 外 夜,在[43 船厂码头 外 夜]中，唐仁和秦风最终决定不下船的关键转折动作是什么？,放弃登船并转身离开,两人原计划逃亡，走向船只准备离开泰国，但在得知目的地是非洲的赤道几内亚后，唐仁因恐惧而犹豫，最终拉住秦风选择不下船。这一动作标志着他们从逃避转向面对，为后续合作查案奠定基础。,Scene Grounding
6,cha9b2e0b377b122037bc5bcbe4ed13155ee1ea4dd,zh,40 阿香家 内 夜,在[40 阿香家 内 夜]这场戏中，引发后续多重藏匿与错位对峙的初始动作是什么？,唐仁和秦风跑上楼梯并躲进房间,这场戏的核心张力始于唐仁和秦风为躲避追查而仓促上楼藏身，直接触发北哥等人随后的搜查，以及接连到来的坤泰和黄兰登引发的层层叠加的躲藏连锁反应。整个场景的混乱节奏和人物错位都由此动作开启。,Scene Grounding
7,cha9b2e0b377b122037bc5bcbe4ed13155ee1ea4dd,zh,36 警局会议室 内 日,在[36 警局会议室 内 日]这场戏中，推动局势逆转的关键动作是什么？,黄兰登指控坤泰是侦探社幕后老板,黄兰登当众揭露坤泰为侦探社幕后主使，引发坤泰激烈否认，而紧随其来的唐仁来电与坤泰的反应形成强烈反差，使指控瞬间获得戏剧性佐证，彻底扭转在场众人对坤泰立场的判断。,Scene Grounding
8,cha9b2e0b377b122037bc5bcbe4ed13155ee1ea4dd,zh,14 泰国机场 内 夜; 44 服装店 内 夜,唐仁和秦风换上新衣在泰国街头穿行之前，是什么关键互动促成了两人会合并开始共同行动？,唐仁在机场通过手机照片确认秦风身份并热情迎接,唐仁在机场凭借手机中的照片识别出秦风，主动上前拥抱并开启对话，这一接待行为标志着两人正式会合，为后续共同购置衣物并一同出行建立了直接前提。,Causal-Motivational Reasoning
9,cha9b2e0b377b122037bc5bcbe4ed13155ee1ea4dd,zh,43 船厂码头 外 夜; 50 颂帕工厂 内 夜,秦风为何会在颂帕工厂内主动检查角落的运行机器？,秦风推断唐仁为案件嫌疑人,在码头对峙时，秦风基于唐仁的行为和供述产生怀疑，进而认定他是案件关键人物。这一判断促使他在进入颂帕工厂后保持高度警觉，主动搜寻可能的证据，最终注意到并检查了角落正在运行的机器，以验证自己的推理。,Causal-Motivational Reasoning
10,cha9b2e0b377b122037bc5bcbe4ed13155ee1ea4dd,zh,43 船厂码头 外 夜; 50 颂帕工厂 内 夜,唐仁和秦风在卧室查找电子线索未果，这一行动是由哪个更早的关键事件直接推动的？,他们抵达案发现场并开始调查,在进入卧室搜索之前，唐仁和秦风刚刚到达颂帕工厂，观察周围环境并决定展开现场勘查。这一进入和初步探查的决定，直接引发了后续在室内寻找电子设备的行为，尽管最终未能获取有效数据。,Causal-Motivational Reasoning
11,cha9b2e0b377b122037bc5bcbe4ed13155ee1ea4dd,zh,43 船厂码头 外 夜; 50 颂帕工厂 内 夜,是什么更早的决定导致唐仁和秦风进入颂帕工厂卧室搜寻电子线索却一无所获？,秦风决定留下破案,在码头躲藏时，秦风怀疑唐仁涉案，但并未选择逃离，而是坚持要查明真相。这一决定使他与唐仁继续深入调查，最终进入颂帕工厂的卧室进行搜查，尽管未能找到有效电子证据，但行动的起点源于秦风当时拒绝逃跑、执意破案的选择。,Causal-Motivational Reasoning
12,cha9b2e0b377b122037bc5bcbe4ed13155ee1ea4dd,zh,13 牌馆 内 夜; 140 科技公司 内 日,从[13 牌馆 内 夜]到[140 科技公司 内 日]，唐仁与秦风在持续合作中分别承担什么角色分工？,唐仁为行动引导者，秦风为逻辑主导者，构成互补型破案搭档,两人在多个场景中持续互动，始终维持正向合作关系，且职责呈现分工特征：唐仁负责推进行动与外部交涉，秦风专注推理与案件分析。,Role-Relation Continuity
13,cha9b2e0b377b122037bc5bcbe4ed13155ee1ea4dd,zh,8 雕像店 内 夜; 135 唐仁家 外 日,从[8 雕像店 内 夜]到[135 唐仁家 外 日]，坤泰和黄兰登之间的敌对关系在表现方式上有何延续与变化？,从公开争执与肢体冲突转为沉默敌视，但仍保持强烈对立,两人最初因案件管辖权在雕像店爆发激烈言语和肢体冲突，后续在警局多次对抗，关系始终处于敌对状态；至故事后期，黄兰登以‘杀死的眼神’注视坤泰，虽不再动手，但敌意明确延续，表现为压抑而持续的对抗姿态。,Role-Relation Continuity
14,cha9b2e0b377b122037bc5bcbe4ed13155ee1ea4dd,zh,19 厕所 外 日; 136 泰国街头 外 日,从[19 厕所 外 日]到[136 泰国街头 外 日]，唐仁对阿香的态度和互动方式发生了怎样的具体变化？,从单方面讨好转向主动追求并试图确立亲密关系,唐仁最初通过称呼‘我的女房东’和赞美阿香为‘唐人街第一大美女’表达好感，属于情境性讨好；随着剧情发展，他在被通缉时仍向阿香送礼并获其收留，两人形成信任与合作；尽管阿香一度协助追捕他，但后期在KTV中主动作证支援，关系回暖；最终唐仁在泰国街头挽住阿香肩膀并邀请她参加婚礼，显示出从讨好到建立实质亲密关系的推进。,Role-Relation Continuity
15,cha9b2e0b377b122037bc5bcbe4ed13155ee1ea4dd,zh,26 金铺 内 夜; 26 金铺 内 夜; 26 金铺 内 夜,在[26 金铺 内 夜]场景中，哪个事件直接促成了唐仁后续向强叔争取更低价格、向秦风展示项链并征求其看法，以及以破案需要为由说服秦风出资的关键行动？,唐仁挑选项链并从强叔手中取得,该事件标志着唐仁已实际获得项链，使其后续议价、展示和劝说行为具备行动基础，是连接采购意图与向秦风转嫁费用的核心节点。,Narrative Progression
16,cha9b2e0b377b122037bc5bcbe4ed13155ee1ea4dd,zh,16 酒吧 内 夜; 16 酒吧 内 夜; 16 酒吧 内 夜,在[16 酒吧 内 夜]，什么事件标志着唐仁与坤泰关系迅速拉近，并为后续共同对秦风设局创造了条件？,唐仁迎接迟到的坤泰并玩笑罚酒,该场景中，唐仁以轻松戏谑的方式接待迟到的坤泰，通过罚酒建立亲密氛围，迅速消除双方隔阂，为接下来联手接近秦风、实施灌酒与下药等行动铺平了人际基础。,Narrative Progression
17,cha9b2e0b377b122037bc5bcbe4ed13155ee1ea4dd,zh,43 船厂码头 外 夜; 46 停车场 内 日; 32 街头 外 日,哪一个事件直接促使唐仁与秦风开始共同行动，继而引发追查海鲜车、摆脱警方追捕以及秦风后续独自离开的一系列发展？,秦风指认唐仁为凶手,该事件发生在船厂码头，秦风在警方面前指认唐仁为凶手，迫使两人从对立转为被迫合作，成为后续逃亡与调查行动的起点。这一公开指控改变了双方关系的性质，触发了联合行动与策略调整的连锁反应。,Narrative Progression
18,cha9b2e0b377b122037bc5bcbe4ed13155ee1ea4dd,zh,9 牌馆 外 日; 9 牌馆 外 日; 28 麻将馆 内 夜,什么事件直接引发了唐仁后续在牌局中的情绪爆发、短暂胜利与最终崩盘？,唐仁接电话后豪言继续赢牌,该事件标志着唐仁心态从被动应对转向盲目自信，推动其在牌局中激进行事，进而引发后续情绪冲突、短暂胡牌成功与最终输光钱财的连锁反应。,Narrative Progression
19,cha9b2e0b377b122037bc5bcbe4ed13155ee1ea4dd,zh,,这个故事中最主要的3个角色分别是谁？,唐仁、秦风、黄兰登,,Character Understanding
20,cha9b2e0b377b122037bc5bcbe4ed13155ee1ea4dd,zh,,唐仁和秦风抵达颂帕工厂调查案发现场，秦风注意到工厂外街口装有多个摄像头，随后两人进入工厂内部继续勘查。这段情节对应的是哪几场戏？,49 颂帕工厂 外 夜 | 50 颂帕工厂 内 夜,情节始于两人抵达案发现场外部，秦风观察到街口摄像头，随后进入工厂内部展开调查。外部场景呈现初步勘查与环境观察，内部场景延续为对现场的深入探查及关键对峙的展开，两场戏共同构成完整的案发现场调查过程。,Scene Grounding
21,cha9b2e0b377b122037bc5bcbe4ed13155ee1ea4dd,zh,,颂帕和黄兰登共同出现的场景对应的是哪几场戏？,12 警局会议室 内 日 | 36 警局会议室 内 日 | 133 医院病房 内 日 | 134 警局 外 日,两人在多个场景中有共现，涉及警局会议、医院探视及警局外会面，体现其工作协作与后续跟进关系。,Scene Grounding
22,cha9b2e0b377b122037bc5bcbe4ed13155ee1ea4dd,zh,,泰哥对应的是哪几场戏？,39 泰国街头 外 夜 | 40 阿香家 内 夜 | 51 颂帕工厂 外 夜,泰哥在剧本中明确出现于这三个场景，且每个场景均有其动作或对白记录，构成实体在场的直接证据。,Scene Grounding
23,cha9b2e0b377b122037bc5bcbe4ed13155ee1ea4dd,zh,,唐仁以‘唐人街第一神探’成员的身份出现在哪几场戏中？,2 秦风卧室 内 日 | 134 警局 外 日,唐仁在对话中被明确称为‘大名鼎鼎的唐人街第一神探’，并自称‘替死鬼找到了唐人街第一神探’，表明其在此身份下行动。这两处表述分别出现在秦风卧室和警局外的场景中，对应其作为该称号持有者的公开自我定位。,Scene Grounding
24,cha9b2e0b377b122037bc5bcbe4ed13155ee1ea4dd,zh,,唐仁在河边告知秦风已安排好行程，随后在面店内一边展示地图介绍景点，一边提议改去调查失踪案，这一系列互动发生在哪几场戏？,20 泰国街头 外 日 | 21 面店 内 日,唐仁先在河边告诉秦风行程已定，随后在面店内通过地图介绍湄南河、大市场等景点，并提出第二天去大皇宫。秦风吃面时提到想看暹罗连体人，唐仁不理解并贬低小说电影，转而提议接手失踪案，同时将观光图扔进垃圾桶。两个场景连续呈现行程安排到案件转向的关键过渡。,Scene Grounding
25,cha9b2e0b377b122037bc5bcbe4ed13155ee1ea4dd,zh,16 酒吧 内 夜; 40 阿香家 内 夜,在‘众人对峙揭露金店案真相’发生前，唐仁与坤泰之间已有怎样的关键互动？,唐仁在酒吧搭肩迎接四处张望的坤泰,在真相揭露场景之前，唐仁于酒吧中主动迎接迟到的坤泰，通过肢体动作和玩笑缓和气氛，建立起两人共同行动的起点，为后续合作推进案件埋下伏笔。,Temporal Reasoning
26,cha9b2e0b377b122037bc5bcbe4ed13155ee1ea4dd,zh,39 泰国街头 外 夜; 40 阿香家 内 夜,在“众人对峙揭露金店案真相”之前，唐仁先意识到了什么关键一点？,唐仁和秦风发现电视播放通缉令,在对峙揭露真相的情节发生前，唐仁与秦风在泰国街头目睹电视播出通缉令，这一信息促使他们开始商议应对策略，为后续冲突埋下伏笔。该事件发生在前一场戏，时间衔接紧密，构成情节发展的直接铺垫。,Temporal Reasoning
27,cha9b2e0b377b122037bc5bcbe4ed13155ee1ea4dd,zh,49 颂帕工厂 外 夜; 50 颂帕工厂 内 夜,“唐仁和秦风抵达颂帕工厂调查案发现场”之后不久，随后出现了什么关键变化？,发现角落运行的机器并触碰检查,秦风进入工厂内部后，迅速注意到一处异常运转的机器，随即上前触摸检查，这一动作发生在调查初期且紧随两人抵达之后，体现了他对现场细节的敏锐察觉。,Temporal Reasoning
28,cha9b2e0b377b122037bc5bcbe4ed13155ee1ea4dd,zh,31 路边拉毛街 外 日; 32 街头 外 日,“唐仁让秦风买可乐并预言桃花运，秦风反唇相讥”之后不久，唐仁接下来做了什么？,唐仁提醒秦风黄兰登是警察并继续逃跑,该情节紧接在可乐对话场景之后，发生在相邻的街头外景中，唐仁识破黄兰登身份并推动两人立即行动，构成连续逃亡的自然推进。,Temporal Reasoning
29,cha9b2e0b377b122037bc5bcbe4ed13155ee1ea4dd,zh,20 泰国街头 外 日; 21 面店 内 日,在“唐仁带秦风转向失踪案调查”之前，唐仁先采取了什么关键行动？,为秦风安排好一周行程,在转向调查失踪案之前，唐仁曾在街头向秦风介绍并规划了接下来的行程，这一安排发生在面店对话之前的场景，构成了后续行动转变的时间铺垫。,Temporal Reasoning
30,cha9b2e0b377b122037bc5bcbe4ed13155ee1ea4dd,zh,第38场,在第38场中，唐仁在枪口下向北哥求情并透露金箱交接地点，他这么做最直接的动机是什么？,为了保护秦风不被枪杀而选择透露信息,越南仔拿着枪指着秦风，对着唐仁喊道：不说！我就打死他 唐仁对着北哥：给点提示呗,Character Understanding
31,cha9b2e0b377b122037bc5bcbe4ed13155ee1ea4dd,zh,第36场,第36场中，坤泰为何突然在众人面前严厉呵斥唐仁？这一态度转变的直接导火索是什么？,手机来电显示唐仁来电且被黄兰登当众抢夺,此时此刻，坤泰桌面的手机显示唐仁的来电显示，坤泰心虚的跟黄兰登看了下，黄兰登一把抢过手机 坤泰一把夺回手机，当着所有人的面接通电话，对着唐仁厉声呵斥,Causal-Motivational Reasoning
32,cha9b2e0b377b122037bc5bcbe4ed13155ee1ea4dd,zh,第43场,在第43场中，唐仁原本打算逃亡，是什么关键信息让他当场决定放弃登船？,发现偷渡船的目的地是赤道几内亚,船员：赤道几内亚 唐仁：什么！ 秦风：非洲吧 唐仁：我们会死在那里吗？ 唐仁：我宁可坐牢也不上这船啦,Causal-Motivational Reasoning
33,cha9b2e0b377b122037bc5bcbe4ed13155ee1ea4dd,zh,第40场,第40场中，阿香一见到北哥三人就迅速把他们拉进屋，她这个举动最直接的动机是什么？,她察觉对方身份可疑且可能威胁到自己安全,阿香往周围勘察了一下，赶紧把他们三人拉进屋说：‘快进来，快点’ 北哥：我们是唐仁的同伙 阿香：你们到底谁啊,Character Understanding
34,cha9b2e0b377b122037bc5bcbe4ed13155ee1ea4dd,zh,第38场,在第38场中，唐仁和秦风被铐在一起，是什么直接促成了他用脚去解开手铐并帮秦风脱困？,发现地上铁丝后立即尝试用脚勾取开锁,唐仁看到地上有一根铁丝，两人拿脚去捡，唐仁用脚转动铁丝给自己开锁 唐仁用脚去解秦风的手铐，秦风嫌弃唐仁一双黑漆漆的脚丫,Causal-Motivational Reasoning
