id,related_scenes,question,answer,related_context,question_type,question_source
1,20、EXT. ROOF OF JAMIE'S HOUSE - CONTINUOUS,"In [20、EXT. ROOF OF JAMIE'S HOUSE - CONTINUOUS], What is Jack's emotional state when he sees the Dreamsand?",Smiling with relief,"Jack turns and looks up, a smile now on his lips.",Character Understanding,broad_coverage_scene
2,31、EXT. SKY - NEAR TOOTH'S PALACE,What action does Jack take to rescue Baby Tooth?,Leaps into the air and rescues it before the Nightmare can snatch it away,Jack leaps into the air and rescues it before the Nightmare can snatch it away,Scene Grounding,broad_coverage_scene
3,65、INT. NORTH POLE - GLOBE ROOM - DAY - MOMENTS LATER,What caused North to declare Jack a Guardian?,Jack stood up to Pitch and saved them.,North: 'You stood up to Pitch. You saved us.',Causal-Motivational Reasoning,broad_coverage_scene
4,20、EXT. ROOF OF JAMIE'S HOUSE - CONTINUOUS,"In [20、EXT. ROOF OF JAMIE'S HOUSE - CONTINUOUS], What is Jack's emotional state when he looks at the moon?",Pensive and frustrated,"Jack flips onto the roof, a little pensive. ... turns away in frustration.",Character Understanding,broad_coverage_scene
5,36、EXT. SHANGHAI ROOFTOPS - NIGHT,What happens to Tooth after she becomes overwhelmed?,Tooth smacks into a toothpaste billboard and then zooms in on a little girl's bedroom window.,"Tooth, overwhelmed, jets off without paying attention and SUDDENLY -- THOOMP -- she smacks into a TOOTHPASTE BILLBOARD. Tooth gasps and her eyes go wide -- she FLIES to the window, excited.",Scene Grounding,broad_coverage_scene
6,18、EXT. SNOWY HILL,"In [18、EXT. SNOWY HILL], How does Pippa's facial expression change after she is hit by a snowball?",a mischievous sparkle,Pippa's face changes - a mischievous sparkle.,Character Understanding,broad_coverage_scene
7,56、INT. PITCH'S LAIR - NIGHT,"In [56、INT. PITCH'S LAIR - NIGHT], What does Pitch create from the nightmare sand?",A crude image of the SANDMAN,A strand of NIGHTMARE SAND...turning it into a crude image of the SANDMAN.,Scene Grounding,broad_coverage_scene
8,19、INT. JAMIE'S BEDROOM - NIGHT,"In [19、INT. JAMIE'S BEDROOM - NIGHT], What is Sophie's emotional state when she urges Jamie to hide?",She is crazed.,"SOPHIE (CRAZED) and her repeated 'Hide, hide, hide, hide!'",Character Understanding,broad_coverage_scene
9,13、INT. GLOBE ROOM - NIGHT,What does North believe about the urgency of the situation?,He believes it was serious enough to call everyone.,"I know, I know, but I obviously wouldn't have called you all here unless it was serious.",Character Understanding,broad_coverage_scene
10,29、EXT. SLEIGH - FLYING THROUGH THE SKY - CONTINUOUS,Why does Bunnymund express regret about the route?,Because North chose a shortcut instead of the tunnels.,Bunny says 'I knew we should have taken the tunnels' after North says he knows a shortcut.,Causal-Motivational Reasoning,broad_coverage_scene
11,36、EXT. SHANGHAI ROOFTOPS - NIGHT,How does North move between chimneys?,"North jumps into one chimney, shoots out of another, and emerges with a bang from a third.","North jumps into one chimney, then shoots out of another across the way. North disappears down yet another chimney only to emerge with a bang out the top of another.",Scene Grounding,broad_coverage_scene
12,26、INT. TOY FACTORY - NORTH POLE - DAY,"In [26、INT. TOY FACTORY - NORTH POLE - DAY], What is North's emotional state when he enters the factory?",Angry and peeved,"North storms through factory floor, Jack trying to keep up. (peeved - still rushing)",Character Understanding,broad_coverage_scene
13,26、INT. TOY FACTORY - NORTH POLE - DAY,"In [26、INT. TOY FACTORY - NORTH POLE - DAY], What is North's role in the factory?",Overseer of factory operations,"North gives orders to yeti, directs elves, and supervises activities",Character Understanding,broad_coverage_scene
14,28、INT. LAUNCHING SHED - A MOMENT LATER,"In [28、INT. LAUNCHING SHED - A MOMENT LATER], What is Bunny's emotional state when boarding the sleigh?",Frozen and terrified,"Bunny is frozen and unnerved... Bunny clutches the edge of his, terrified.",Character Understanding,broad_coverage_scene
15,37、INT. BOY'S BEDROOM - NIGHT,"In [37、INT. BOY'S BEDROOM - NIGHT], What is Jack's personality trait as described in the passage?",Cocksure,"Jack, cocksure, arrives outside an open window",Character Understanding,broad_coverage_scene
16,2、EXT. BURGESS SETTLEMENT - TOWN CENTER - CONTINUOUS,What does Jack say about his name?,My name is Jack Frost. The moon told me so.,JACK (V.O.) My name is Jack Frost -- how do I know that? The moon told me so.,Character Understanding,broad_coverage_scene
17,28、INT. LAUNCHING SHED - A MOMENT LATER,"In [28、INT. LAUNCHING SHED - A MOMENT LATER], What is Jack's emotional state when he sees the sleigh?",Gob-smacked and surprised,"Jack is understandably gob-smacked, so much so that he almost gets knocked over by one of the reindeer.",Character Understanding,broad_coverage_scene
18,65、INT. NORTH POLE - GLOBE ROOM - DAY - MOMENTS LATER,Why are the lights on the globe going out?,Fear has tipped the balance.,Jack: 'It's fear. He's tipped the balance.',Causal-Motivational Reasoning,broad_coverage_scene
19,59、EXT. DOWNTOWN BURGESS - CONTINUOUS,"In [59、EXT. DOWNTOWN BURGESS - CONTINUOUS], What object does Jack use to hit the Nightmare?",His staff,Jack whips a blast from his staff and HITS the Nightmare,Scene Grounding,broad_coverage_scene
20,21、INT. CUPCAKE'S BEDROOM - BURGESS - CONTINUOUS,"In [21、INT. CUPCAKE'S BEDROOM - BURGESS - CONTINUOUS], What is Pitch's emotional state after creating the nightmare?",Delighted.,"Pitch snickers, delighted.",Character Understanding,broad_coverage_scene
21,11、INT. EGG TUNNEL,How does the dimly-lit figure navigate the tunnels?,Races at blinding speed while leaping and zigzagging,"Speeding along through a subterranean tunnel, we can barely keep up with a DIMLY-LIT FIGURE as it races at blinding speed, leaping and zigzagging through a series of TUNNELS --",Scene Grounding,broad_coverage_scene
22,25、INT. NORTH'S LIBRARY - DAY,"In [25、INT. NORTH'S LIBRARY - DAY], What is Bunny's behavioral state?",Grumbling with arms crossed.,"Bunny stands off to the side, grumbling with his arms crossed.",Character Understanding,broad_coverage_scene
23,17、EXT. JAMIE'S BACKYARD - DAY,What does Jack say about the Easter Bunny?,"He's real, annoying, grumpy, and full of himself.","Oh he's real alright. Real annoying, real grumpy, and really full of himself.",Character Understanding,broad_coverage_scene
24,35、INT. TOOTH PALACE - LAGOON - MOMENTS LATER,How does the water react when Jack walks across it?,The water freezes under his feet,"Tooth leads Jack across the pond, the water freezing under his feet as he walks",Scene Grounding,broad_coverage_scene
25,34、EXT. VILLAGE - NIGHT - FLASHBACK - CONTINUOUS,"In [34、EXT. VILLAGE - NIGHT - FLASHBACK - CONTINUOUS], What happens to Pitch after children run through him?",Pitch slips back into the shadows.,"Pitch, thinner and weaker... slips back into the shadows after children run through him.",Scene Grounding,broad_coverage_scene
26,55、EXT. SKYLINE - NIGHT,"In [55、EXT. SKYLINE - NIGHT], What object do the Guardians use to disappear?",Snowglobe portal,The Guardians... disappear through a snowglobe portal,Scene Grounding,broad_coverage_scene
27,33、EXT. VILLAGE - NIGHT - FLASHBACK,How does Pitch appear when revealed on the mountain?,Smiling as he stares up at the moon.,"Pitch, smiling as he stares up at the moon.",Scene Grounding,broad_coverage_scene
28,17、EXT. JAMIE'S BACKYARD - DAY,What does Jamie claim about Big Foot?,He says hair samples and DNA were found in Michigan.,"It says here that they found Big Foot hair samples and DNA, in Michigan. That's like, super close!",Character Understanding,broad_coverage_scene
29,6、EXT. NORTH POLE - CONTINUOUS,When does the Guardians' Call go out?,For the first time in decades,"for the first time in decades, the GUARDIANS' CALL GOES OUT!",Temporal Reasoning,broad_coverage_scene
30,5、INT. NORTH'S GLOBE ROOM - CONTINUOUS,"In [5、INT. NORTH'S GLOBE ROOM - CONTINUOUS], What is the GLOBE OF BELIEF?",A structure covered with lights blanketing the continents.,THE GLOBE OF BELIEF Covered with LIGHTS blanketing the continents.,Scene Grounding,broad_coverage_scene
31,30、EXT. SKY - SLEIGH JETTING THROUGH THE SKY,What visual details describe the sleigh's movement through the portal?,A surreal light surrounds the sleigh as it hits HYPERDRIVE and gets sucked through the snow-globe portal with a WHOOSH.,A surreal light surrounds the sleigh as it hits HYPERDRIVE and gets sucked through the snow-globe portal with a WHOOSH.,Scene Grounding,broad_coverage_scene
32,13、INT. GLOBE ROOM - NIGHT,What does Bunny question about North's reason for summoning him?,He questions if it's because of North's belly.,"Hang on, hang on, you mean to say, you summoned me here THREE DAYS BEFORE EASTER because of your belly?",Character Understanding,broad_coverage_scene
33,42、INT. BOY'S BEDROOM - NIGHT,"In [42、INT. BOY'S BEDROOM - NIGHT], Where does North fall into after leaving the bed?",A rabbit hole,He falls into a rabbit hole.,Scene Grounding,broad_coverage_scene
34,11、INT. EGG TUNNEL,What action do the Easter eggs perform when they emerge from the ground?,Pop up and use their legs to move out of the way,A few EASTER EGGS pop up out of the ground; their little legs carry them out of the way of a fast approaching object.,Scene Grounding,broad_coverage_scene
35,28、INT. LAUNCHING SHED - A MOMENT LATER | 46、EXT. SKYLINE - NIGHT | 32、INT. TOOTH PALACE - A MOMENT LATER,When does Jack take control of the sleigh?,Jack takes control of the sleigh when North spots a Nightmare ahead and hands him the reins.,"As the sleigh speeds through the vast chamber, North spots a Nightmare ahead and hands the reins to Jack.",Temporal Reasoning,broad_coverage_event_chain
36,25、INT. NORTH'S LIBRARY - DAY | 35、INT. TOOTH PALACE - LAGOON - MOMENTS LATER | 36、EXT. SHANGHAI ROOFTOPS - NIGHT,Why does Jack agree to join the Guardians' mission to collect children's teeth?,Jack agrees to join the mission because North assures him that it will lead to finding his stolen memories.,"Jack stands quietly, then looks to North and asks if this will lead to finding his stolen memories. North assures him it will. Jack nods, agreeing to help.",Causal-Motivational Reasoning,broad_coverage_event_chain
37,29、EXT. SLEIGH - FLYING THROUGH THE SKY - CONTINUOUS | 28、INT. LAUNCHING SHED - A MOMENT LATER | 46、EXT. SKYLINE - NIGHT | 25、INT. NORTH'S LIBRARY - DAY,What does Jack say when the yetis lift him to his feet?,Jack protests and tells them to put him down.,"Two yetis step forward, grabbing Jack by the shoulders and lifting him to his feet. Jack protests, 'Hey, hey. Whoa, put me down.'",Character Understanding,broad_coverage_event_chain
38,23、EXT. BURGESS - NIGHT | 24、EXT. STREETS OF BURGESS - NIGHT - CONTINUOUS | 12、EXT. A SNOWY EXPANSE IN THE NORTH POLE,What happens after the yetis throw the sack containing Jack through the portal?,"The yetis charge into the portal after Jack, and the portal closes behind them.","They charge in after him, disappearing as the portal closes behind them.",Temporal Reasoning,broad_coverage_event_chain
39,4、INT. NORTH'S WORKSHOP - DUSK,What happens after the ice locomotive soars into the air?,"Wings unfold from the locomotive and jet engines ignite, propelling it forward.","Midflight, wings unfold from the locomotive and jet engines ignite, propelling it forward.",Temporal Reasoning,broad_coverage_scene
40,18、EXT. SNOWY HILL,What happens after Jack redirects the ice path as the snowplow approaches?,"The ice trail rises into a ramp, launching Jamie into the air, and he lands in a large snow mound.","As a snowplow approaches, Jack redirects the ice path, veering Jamie away just in time. The trail rises into a ramp, launching Jamie into the air. He soars over the street and lands with a soft thud in a large snow mound.",Temporal Reasoning,broad_coverage_scene
41,25、INT. NORTH'S LIBRARY - DAY | 27、INT. NORTH'S OFFICE - A MOMENT LATER | 34、EXT. VILLAGE - NIGHT - FLASHBACK - CONTINUOUS,What happens immediately after Bunny announces that something is wrong at the Tooth Palace?,The Guardians and Jack rush after Pitch as he flees on Onyx into the dark depths below the Tooth Palace.,"After speaking his final words, Pitch turns as Bunny hurls boomerangs toward him. They slice through the air, missing their target as Pitch ducks and leaps onto the back of Onyx, his shadowy steed. The creature surges forward, plunging into the dark depths below the Tooth Palace. The Guardians and Jack rush after him without hesitation, diving into the chasm.",Temporal Reasoning,broad_coverage_event_chain
42,21、INT. CUPCAKE'S BEDROOM - BURGESS - CONTINUOUS | 33、EXT. VILLAGE - NIGHT - FLASHBACK | 22、EXT. BURGESS - NIGHT,What does Pitch state about the Guardians when he speaks to the Moon?,Pitch states that his Nightmares are ready and questions whether the Guardians are ready.,"He looks up at the Moon and speaks to it, his voice filled with defiance. 'Don't look at me like that, old friend. You must have known this day would come. My Nightmares are finally ready. Are your Guardians?'",Character Understanding,broad_coverage_event_chain
43,25、INT. NORTH'S LIBRARY - DAY | 20、EXT. ROOF OF JAMIE'S HOUSE - CONTINUOUS,What does Jack state about his suitability for the Guardian role?,Jack states that he is not suited for the disciplined life of a Guardian and does not fit with their purpose.,"He declares he is not suited for the disciplined life of a Guardian, explaining that he doesn’t fit with their purpose.",Character Understanding,broad_coverage_event_chain
44,27、INT. NORTH'S OFFICE - A MOMENT LATER | 31、EXT. SKY - NEAR TOOTH'S PALACE | 32、INT. TOOTH PALACE - A MOMENT LATER | 35、INT. TOOTH PALACE - LAGOON - MOMENTS LATER,Why do the Guardians decide to collect children's teeth from around the world?,"The Guardians decide to collect children's teeth to restore belief in Tooth, which is fading as her feathers fall and the mural in her palace crumbles.","Tooth's feathers begin to fall and disappear into nothingness as cracks spread across the ancient mural in her palace, pieces of it crumbling away. North declares that they must act immediately—children around the world must be visited to collect their lost teeth, in the hope that belief in Tooth will be restored.",Causal-Motivational Reasoning,broad_coverage_event_chain
45,5、INT. NORTH'S GLOBE ROOM - CONTINUOUS | 28、INT. LAUNCHING SHED - A MOMENT LATER,What happens immediately after the sleigh launches into the sky?,Jack throws his arms up and shouts in exhilaration as the ground falls away beneath them.,The sleigh rockets to the end of the ramp and launches into the bright blue sky. Jack throws his arms up and shouts in exhilaration as the ground falls away beneath them.,Temporal Reasoning,broad_coverage_event_chain
46,18、EXT. SNOWY HILL | 17、EXT. JAMIE'S BACKYARD - DAY | 18、EXT. SNOWY HILL,What does Jack claim about the sledding adventure and the missing tooth?,"Jack claims that the wild ride and all the fun were his doing, not the Tooth Fairy’s.","Jack watches, then calls out, insisting the wild ride and all the fun were his doing, not the Tooth Fairy’s.",Character Understanding,broad_coverage_event_chain
47,35、INT. TOOTH PALACE - LAGOON - MOMENTS LATER | 36、EXT. SHANGHAI ROOFTOPS - NIGHT,What does Tooth state about the contents of the children's teeth?,"Tooth states that the children's teeth hold their most important childhood memories, which are guarded by her fairies and can be returned when people need to remember what matters.","Tooth leads Jack across the pond and stops before a large mural that shows how children’s teeth hold their most important childhood memories, and how her fairies guard them. When people need to remember what matters, the memories are returned.",Character Understanding,broad_coverage_event_chain
48,13、INT. GLOBE ROOM - NIGHT | 32、INT. TOOTH PALACE - A MOMENT LATER | 35、INT. TOOTH PALACE - LAGOON - MOMENTS LATER | 36、EXT. SHANGHAI ROOFTOPS - NIGHT,Why do the Guardians decide to collect children's lost teeth?,"The Guardians decide to collect children's lost teeth to restore belief in Tooth, which is fading as her feathers fall and the mural in her palace crumbles.","Tooth's feathers begin to fall and disappear into nothingness as cracks spread across the ancient mural in her palace, pieces of it crumbling away... North steps forward and declares that they must act immediately—children around the world must be visited to collect their lost teeth, in the hope that belief in Tooth will be restored.",Causal-Motivational Reasoning,broad_coverage_event_chain
49,4、INT. NORTH'S WORKSHOP - DUSK | 28、INT. LAUNCHING SHED - A MOMENT LATER | 31、EXT. SKY - NEAR TOOTH'S PALACE | 32、INT. TOOTH PALACE - A MOMENT LATER,Why does North hand the reins to Jack during the sleigh ride?,North hands the reins to Jack so he can draw his sword and destroy a Nightmare ahead.,North spots a Nightmare ahead and hands Jack the reins of the sleigh. He draws his sword and slices the creature in half.,Causal-Motivational Reasoning,broad_coverage_event_chain
50,101、EXT. STREETS OF BURGESS - MOMENTS LATER|119、EXT. POND - THE MOON,How should the relationship between Jack and Jamie be characterized?,from protects and stands with to trusted mentor and protégé,"Earlier, the relationship between Jack and Jamie is marked by protects and stands with; later, it shifts to trusted mentor and protégé.",Role-Relation Continuity,supplementary_cross_scene
51,4、INT. NORTH'S WORKSHOP - DUSK|13、INT. GLOBE ROOM - NIGHT,"Who is the character that often clashes with the Yetis, collaborates closely with Tooth, and immediately accepts Jack Frost as a Guardian?",North,"North is in a ongoing adversaries relationship with Yetis, is in a trusted colleagues relationship with Tooth, and is in a trusted ally relationship with Jack Frost.",Role-Relation Continuity,supplementary_cross_scene
52,25、INT. NORTH'S LIBRARY - DAY|27、INT. NORTH'S OFFICE - A MOMENT LATER,What does Bunny say to Jack that stops him from leaving and forces the story to pivot toward the Tooth Palace crisis?,Bunny challenges Jack's significance by pointing out children don't believe in him,"Bunny interrupts Jack's attempt to leave by stating that no children believe in him, which confronts Jack and redirects the narrative, leading to Bunny and Sandman rushing to.",Narrative Progression,supplementary_cross_scene
53,25、INT. NORTH'S LIBRARY - DAY,What does Bunny say to Jack that stops him from leaving and forces him to confront the Guardians?,Bunny challenges Jack's significance by pointing out children don't believe in him,"In the scene, Bunny tells Jack that no children believe in him, which causes Jack to pause and turn back, leading to increased tension and North's intervention.",Narrative Progression,supplementary_cross_scene
54,20、EXT. ROOF OF JAMIE'S HOUSE - CONTINUOUS|24、EXT. STREETS OF BURGESS - NIGHT - CONTINUOUS|25、INT. NORTH'S LIBRARY - DAY,"Which character is a trusted ally of Sandy, has a longstanding feud with Bunnymund, and resists North's authority?",Jack,"Jack is in a trusted allies relationship with Sandy, is in a ongoing adversarial history relationship with Bunnymund, and is in a current tension and resistance relationship with North.",Role-Relation Continuity,supplementary_cross_scene
55,27、INT. NORTH'S OFFICE - A MOMENT LATER|31、EXT. SKY - NEAR TOOTH'S PALACE,What event immediately follows Bunny and Sandman's warning and propels the sleigh into the nightmare-infested skies near the Tooth Palace?,Sleigh exits hyperdrive near Tooth Palace,"The sleigh bursts out of hyperdrive at the edge of the Tooth Palace, plunging into chaos.",Narrative Progression,supplementary_cross_scene
56,27、INT. NORTH'S OFFICE - A MOMENT LATER|31、EXT. SKY - NEAR TOOTH'S PALACE|32、INT. TOOTH PALACE - A MOMENT LATER,What pivotal moment brings the Guardians directly into the nightmare assault at the Tooth Palace?,Sleigh exits hyperdrive near Tooth Palace,"The sleigh bursts out of hyperdrive at the edge of the Tooth Palace, plunging into chaos.",Narrative Progression,supplementary_cross_scene
