id,related_scenes,question,answer,related_context,question_type,question_source
1,64、EXT. DEPOT - NIGHT,Describe the appearance of the female walker in the smoke.,"Wearing a soiled, tattered bridal gown that glows in the smoke","A FEMALE WALKER, wearing the soiled and tattered remnants of a bridal gown. The fabric seems to glow in the smoke.",Scene Grounding,broad_coverage_scene
2,65、INT. FIDDLER'S GREEN BOARDROOM - NIGHT,What specific physical behavior does Kaufman exhibit when speaking to Cliff in the alcove?,"Kaufman leans close to Cliff, smiling with eyes blinking too rapidly.","ON THE OTHER SIDE OF THE DOORS: Kaufman leans close to Cliff, smiling, his eyes blinking a bit too rapidly.",Scene Grounding,broad_coverage_scene
3,13、INT. DEAD RECKONING - NIGHT,What additional emotional state does Riley recognize?,the Thing's anguish,He also recognizes the Thing's anguish as...,Scene Grounding,broad_coverage_scene
4,25、EXT. MAIN STREET - UNIONTOWN - NIGHT,"In [25、EXT. MAIN STREET - UNIONTOWN - NIGHT], What emotional states does Big Daddy experience after killing the father?",Sympathy followed by rage.,"The sympathy is joined by rage. Big Daddy lifts his right foot and brings it STOMPING DOWN on the disembodied head, CRUSHING ITS SKULL.",Character Understanding,broad_coverage_scene
5,27、INT. SUBWAY TUNNEL - DAWN,"In [27、INT. SUBWAY TUNNEL - DAWN], What is Riley's emotional state according to the dialogue?",Riley is blaming himself.,RILEY (Blaming himself) Only if you let it.,Character Understanding,broad_coverage_scene
6,11、EXT. DEAD RECKONING - NIGHT,Why does Riley love Charlie?,Because Charlie still believes in heaven.,"RILEY: I love ya, Charlie. Know why? Cuzz you still believe in heaven.",Causal-Motivational Reasoning,broad_coverage_scene
7,25、EXT. MAIN STREET - UNIONTOWN - NIGHT,"In [25、EXT. MAIN STREET - UNIONTOWN - NIGHT], What is Big Daddy's physical condition after the confrontation?",Unhurt but spattered with greenish-black blood.,"Big Daddy is unhurt, but spattered with BLOOD. Not red, greenish-black. The blood of the dead.",Character Understanding,broad_coverage_scene
8,68、EXT. ALLEY - NIGHT,What is visible through the splintered wall?,Big Daddy's eyes staring through,Big Daddy's Eyes staring through at...,Scene Grounding,broad_coverage_scene
9,67、INT. DEAD RECKONING - NIGHT,What action does Cholo perform after sliding open the small window?,Grabs his crossbow and shoots the Gardener in the head.,"Cholo slides open a small window, grabs his crossbow, and SHOOTS the Gardener in the head.",Scene Grounding,broad_coverage_scene
10,"30、EXT. THE CITY - ""THE THROAT"" - DAWN","In [30、EXT. THE CITY - ""THE THROAT"" - DAWN], What is suspended on the barbs of the electrified fencing?",Corpses,"CORPSES hang all along the stretch, suspended on the barbs.",Scene Grounding,broad_coverage_scene
11,54、INT. KAUFMAN PENTHOUSE - FIDDLER'S GREEN - NIGHT,What does Cholo instruct Kaufman to do regarding the money?,"Put the money on a boat and send it across the river to the South Side. Tenth Street Pier. One man to drive the boat, no more. You've got till midnight.","CHOLO (O.S.) Put the money on a boat and send it across the river to the South Side. Tenth Street Pier. One man to drive the boat, no more. You've got till midnight.",Character Understanding,broad_coverage_scene
12,60、INT. FIDDLER'S GREEN WEAPONS STORAGE - NIGHT,What does Slack believe about joining the mission?,I'd feel like a dick if I didn't.,SLACK I'd feel like a dick if I didn't.,Character Understanding,broad_coverage_scene
13,36、INT. PENTHOUSE NUMBER-TWO - FIDDLER'S GREEN - DAY,"In [36、INT. PENTHOUSE NUMBER-TWO - FIDDLER'S GREEN - DAY], What object is suspended from the light fixture in the kitchen?",A homemade noose,a homemade noose suspended from a light fixture in the kitchen,Scene Grounding,broad_coverage_scene
14,45、EXT. DEPOT - NIGHT,"In [45、EXT. DEPOT - NIGHT], Where are Gus and Barrett located when they shoot Tony Baloney?",Outside the Sales Office of the car-lot-turned-depot,"GUS, a young soldier, and his partner BARRETT, are shooting outside the SALES OFFICE of the car-lot-turned-depot.",Scene Grounding,broad_coverage_scene
15,"30、EXT. THE CITY - ""THE THROAT"" - DAWN","In [30、EXT. THE CITY - ""THE THROAT"" - DAWN], What object is welded to the sparking barbs after being decimated?",The Thing's body,"Its body hangs, welded to the SPARKING barbs.",Scene Grounding,broad_coverage_scene
16,9、EXT. HILLTOP ABOVE UNIONTOWN - NIGHT,What happens when Riley fires his .45 at the clown zombie?,"Three bullets hit the chest, neck, cheek; the fourth punches a hole above the left eyebrow, causing the clown to drop.","THREE BULLETS RIP into the Clown's CHEST, NECK, CHEEK. Finally, the FOURTH PUNCHES A HOLE above the thing's left eyebrow. The Clown DROPS.",Scene Grounding,broad_coverage_scene
17,68、EXT. ALLEY - NIGHT,What action does the Butcher perform on the wall?,"Chops into wood with a meat cleaver, causing splinters","HACK! The meat cleaver chops into wood, splintering it.",Scene Grounding,broad_coverage_scene
18,5、EXT. DUMP - NIGHT,When does the skeleton start moving?,After the crates are pushed into the pit,"Three heavily-armed guerrillas push a large crate over a precipice into a garbage pit. Five similar crates lie amid the rubble. ... Except for one, which... suddenly, startlingly MOVES!",Temporal Reasoning,broad_coverage_scene
19,24、INT. UNIONTOWN STATE STORE - NIGHT,"In [24、INT. UNIONTOWN STATE STORE - NIGHT], What is Mike's emotional state when he hears sounds in the silence?",On edge,Every subtle SOUND in the SILENCE puts MIKE more on edge.,Character Understanding,broad_coverage_scene
20,28、EXT. THE CITY - DAY,"In [28、EXT. THE CITY - DAY], What spans the rivers in the passage?",Seven barricaded bridges,SEVEN BARRICADED BRIDGES span the rivers.,Scene Grounding,broad_coverage_scene
21,15、INT. DEAD RECKONING - NIGHT,"In [15、INT. DEAD RECKONING - NIGHT], What is Mike's emotional state during the encounter with the zombies?",Disgusted,"Mike says, 'This is a fucking massacre.'",Character Understanding,broad_coverage_scene
22,63、INT. FIDDLER'S GREEN BOARDROOM - NIGHT,What visual detail is shown in the close-up shot?,Sutherland's alarmed face is shown in a close-up shot.,CLOSE ON: SUTHERLAND'S alarmed face.,Scene Grounding,broad_coverage_scene
23,9、EXT. HILLTOP ABOVE UNIONTOWN - NIGHT,What does the zombie wearing a clown suit look like?,"Wears a clown suit with a partially eaten red nose, painted eyelashes, orange hair crawling with spiders.",This one wears the remains of a CLOWN SUIT. Half its bulbous red nose has been eaten away. Painted eyelashes make its stare alarming. Its ORANGE HAIR is crawling with SPIDERS.,Scene Grounding,broad_coverage_scene
24,4、EXT. HILLTOP ABOVE UNIONTOWN - NIGHT,What does Riley question in his dialogue?,Pretending to be alive,Pretending to be alive?,Character Understanding,broad_coverage_scene
25,"3、EXT. ""UNIONTOWN TEXACO"" - NIGHT","In [3、EXT. ""UNIONTOWN TEXACO"" - NIGHT], What is the physical condition of the ATTENDANT?",He has lost his left arm and has dried blood on his jump-suit.,"He has lost its left arm. Dried blood darkens the shoulder of its jump-suit, where the arm was torn away.",Character Understanding,broad_coverage_scene
26,64、EXT. DEPOT - NIGHT,What action is Manolete performing under the T-Bird's dash?,Fumbling with colored wires,Manolete fumbles with colored wires under the dash.,Scene Grounding,broad_coverage_scene
27,"40、INT. CENTER RING - ""THE ARENA"" - DAY","In [40、INT. CENTER RING - ""THE ARENA"" - DAY], Where are the Painted Walkers thrust after the gates open?",The iron-mesh structure resembling a lion-tamer's cage,Gates open. THE PAINTED WALKERS are thrust inside the cage. Their nooses are released. The gates are locked behind them.,Scene Grounding,broad_coverage_scene
28,60、INT. FIDDLER'S GREEN WEAPONS STORAGE - NIGHT,What does Charlie say about the K-90's firing rate?,I don't norm'ly need fourteen rounds.,C HARLIE I don't norm'ly need fourteen rounds.,Character Understanding,broad_coverage_scene
29,36、INT. PENTHOUSE NUMBER-TWO - FIDDLER'S GREEN - DAY,"In [36、INT. PENTHOUSE NUMBER-TWO - FIDDLER'S GREEN - DAY], What weapon does the young man use to cut the noose?",A paring knife,lifts a paring to knife cut through the noose,Scene Grounding,broad_coverage_scene
30,48、EXT. DEPOT - TONY'S AUTOMANIA SALES OFFICE - NIGHT,"In [48、EXT. DEPOT - TONY'S AUTOMANIA SALES OFFICE - NIGHT], Where does the sound originate?",the woods adjoining the lot,The SOUND comes again. From the woods that adjoin the lot.,Scene Grounding,broad_coverage_scene
31,65、INT. FIDDLER'S GREEN BOARDROOM - NIGHT,"What action does Kaufman take with Cliff, and what is the description of the doors they enter?","Kaufman leads Cliff into an alcove with sandblasted glass doors, where they are visible in silhouette.","Kaufman leads Cliff into... an alcove... shutting two pocket doors made of sandblasted glass. Sutherland and the others... can see, Kaufman and Cliff in SILHOUETTE.",Scene Grounding,broad_coverage_scene
32,23、EXT. UNIONTOWN STATE STORE - NIGHT,When do Cholo and Foxy start into the liquor store?,After Dead Reckoning arrives and Riley and Charlie climb out,They stop as DEAD RECKONING pulls up and RILEY and CHARLIE climb out. Cholo and Foxy start into the liquor store.,Temporal Reasoning,broad_coverage_scene
33,20、EXT. MAIN STREET - UNIONTOWN - NIGHT,What does Anchor state to Harry during the rescue?,Anchor calls out for Harry to jump on the motorcycle.,"Anchor shouts, 'Harry, jump on!'",Character Understanding,broad_coverage_scene
34,47、EXT. DEPOT - NIGHT,When does the guard explain the gunshots to Cholo?,"The guard explains the gunshots after they ring out and Cholo pauses, startled by the sound.","Suddenly, gunshots ring out. Cholo pauses, startled. The guard doesn't react strongly, saying it's just target practice.",Temporal Reasoning,broad_coverage_scene
35,12、EXT. MAIN STREET - UNIONTOWN - NIGHT | 20、EXT. MAIN STREET - UNIONTOWN - NIGHT,What happens to Harry immediately after he impales the cheerleader with a spear?,Harry's motorcycle fishtails out of control and crashes into the side of a building.,Harry's motorcycle fishtails out of control and slams into the side of a building.,Temporal Reasoning,broad_coverage_event_chain
36,"24、INT. UNIONTOWN STATE STORE - NIGHT | 40、INT. CENTER RING - ""THE ARENA"" - DAY",What does Cholo state after being helped to his feet by Riley?,Cholo does not make any statement after being helped to his feet by Riley.,"After being helped up by Riley, the passage mentions Cholo looking around and retrieving the case of Dom Perignon, but it does not record him saying anything.",Character Understanding,broad_coverage_event_chain
37,"40、INT. CENTER RING - ""THE ARENA"" - DAY",What does Slack state about her condition when Riley finds her in the cage?,Slack reassures Riley that she is alive after being shot.,"He kneels beside her, thinking she's dead, but she stirs, reassuring him she's alive.",Character Understanding,broad_coverage_scene
38,2、EXT. HILLTOP ABOVE UNIONTOWN - NIGHT | 7、EXT. HILLTOP ABOVE UNIONTOWN - NIGHT | 9、EXT. HILLTOP ABOVE UNIONTOWN - NIGHT,What does Mike state about Riley's shooting ability after being attacked by the clown zombie?,Mike states that Riley cannot shoot well.,"After the attack, Mike lets out a shaky breath and says, 'Jesus. You can't shoot, neither!'",Character Understanding,broad_coverage_event_chain
39,42、INT. STAIRWELL - FIDDLER'S GREEN - DAY | 50、INT. DEAD RECKONING NIGHT,What does Cholo state about the approaching threat?,"Cholo states that whatever is coming wants to get in, so they should let it in.","Cholo says no, adding that whatever is coming wants to get in—so they should let it in.",Character Understanding,broad_coverage_event_chain
40,14、EXT. TOP OF MAIN STREET - UNIONTOWN - NIGHT | 11、EXT. DEAD RECKONING - NIGHT | 2、EXT. HILLTOP ABOVE UNIONTOWN - NIGHT | 7、EXT. HILLTOP ABOVE UNIONTOWN - NIGHT,Why do Riley and Mike realize the undead figures are advancing toward them?,"Riley and Mike realize the undead figures are advancing toward them because the dead have sensed their presence, likely due to the scent of blood or living flesh.","They do not speak, but both know the dead have sensed them—something in the air, the scent of blood, the presence of living flesh. The gap between them narrows.",Causal-Motivational Reasoning,broad_coverage_event_chain
41,25、EXT. MAIN STREET - UNIONTOWN - NIGHT | 48、EXT. DEPOT - TONY'S AUTOMANIA SALES OFFICE - NIGHT,What does Big Daddy do immediately after firing the shot that kills Barrett?,"Big Daddy stands with the smoking rifle barrel, with Number Nine behind him and more figures emerging from the darkness.","The barrel of Big Daddy's rifle still smokes. In the darkness behind him, Number Nine stands motionless. Behind Number Nine, shadows shuffle in the dark, figures emerging slowly from the tree-line.",Character Understanding,broad_coverage_event_chain
42,11、EXT. DEAD RECKONING - NIGHT | 22、EXT. MAIN STREET - UNIONTOWN - NIGHT | 24、INT. UNIONTOWN STATE STORE - NIGHT,What does Cholo do immediately after Mike shoots himself?,Cholo takes a box of cigars from a counter and flees with Foxy.,"After Mike shoots himself, Cholo moves to a counter, grabs a box of Cohibas, and runs outside with Foxy.",Character Understanding,broad_coverage_event_chain
43,41、INT. BOARD ROOM - FIDDLER'S GREEN - DAY | 42、INT. STAIRWELL - FIDDLER'S GREEN - DAY,What happened immediately after Cholo was seized by the security guards?,Cholo was dragged from the room by the security guards.,Three security guards seized Cholo and dragged him from the room.,Temporal Reasoning,broad_coverage_event_chain
44,"40、INT. CENTER RING - ""THE ARENA"" - DAY",Why did the police arrest Riley despite him stopping the violence?,"The police arrested Riley because he was the only one seen wielding a weapon at the scene after the chaos, and he admitted that someone shot 'the little fat man,' which implicated him in the shooting.","Riley points toward the crowd and says someone shot 'the little fat man.' Without hesitation, the officer places Riley under arrest.",Causal-Motivational Reasoning,broad_coverage_scene
45,"37、INT. ""THE ARENA"" - DAY | 40、INT. CENTER RING - ""THE ARENA"" - DAY",Why was Riley arrested after rescuing Slack?,"Riley was arrested because he was present at the scene of Chihuahua's shooting and identified as someone involved, despite pointing to someone else as the shooter.","A policeman approaches and demands to know what happened. Riley points toward the crowd and says someone shot 'the little fat man.' Without hesitation, the officer places Riley under arrest.",Causal-Motivational Reasoning,broad_coverage_event_chain
46,"40、INT. CENTER RING - ""THE ARENA"" - DAY",Why was Riley arrested after rescuing Slack?,"Riley was arrested because he was suspected of being responsible for the gunfire, even though he claimed someone else shot 'the little fat man'.","A policeman approaches and demands to know what happened. Riley points toward the crowd and says someone shot 'the little fat man.' Without hesitation, the officer places Riley under arrest.",Causal-Motivational Reasoning,broad_coverage_scene
47,14、EXT. TOP OF MAIN STREET - UNIONTOWN - NIGHT | 47、EXT. DEPOT - NIGHT,What does the depot guard state about the gunshots that occur when Cholo reaches for his waistband?,The depot guard states that the gunshots are just target practice.,"The guard doesn't react strongly, saying it's just target practice.",Character Understanding,broad_coverage_event_chain
48,102、INT. DEAD RECKONING - NIGHT|116、EXT. DEAD RECKONING - HILLSIDE - NIGHT,"How would you describe the relationship between Riley Denbo and Cholo Denbo by the end of their arc in Land of the Dead, compared to how it began?",from co-conspirators to mutual hatred,"Earlier, the relationship between Riley Denbo and Cholo Denbo is marked by co-conspirators; later, it shifts to mutual hatred.",Role-Relation Continuity,supplementary_cross_scene
49,20、EXT. MAIN STREET - UNIONTOWN - NIGHT,"What event causes Harry to crash his motorcycle, leaving him vulnerable before Anchor arrives?",Harry's motorcycle loses control and crashes into a building,Harry's motorcycle fishtails out of control and slams into the side of a building.,Narrative Progression,supplementary_cross_scene
50,11、EXT. DEAD RECKONING - NIGHT|15、INT. DEAD RECKONING - NIGHT|23、EXT. UNIONTOWN STATE STORE - NIGHT,"Which character in Land of the Dead is an antagonist to Charlie Houk, cooperates with Mike, and is a trusted ally to Foxy?",Cholo Denbo,"Cholo Denbo is in a mutual antagonists relationship with Charlie Houk, is in a cooperates with relationship with Mike, and is in a trusted companions relationship with Foxy.",Role-Relation Continuity,supplementary_cross_scene
51,24、INT. UNIONTOWN STATE STORE - NIGHT,What does Riley do that becomes a key turning point before Mike's suicide?,Riley comforts Mike after attack,"Episode unit 2 describes Riley kneeling beside Mike, gripping his shoulder, and telling him it will be alright after Mike is bitten, which is listed as 'Riley comforts Mike after.",Narrative Progression,supplementary_cross_scene
52,10、INT. DEAD RECKONING - NIGHT|23、EXT. UNIONTOWN STATE STORE - NIGHT|34、EXT. GARAGE - MORNING,"Which character has a friendly rapport with Pretty Boy, a tense rivalry with Cholo Denbo, and a trusted partnership with Charlie Houk?",Riley Denbo,"Riley Denbo is in a established rapport relationship with Pretty Boy, is in a ongoing adversarial tension relationship with Cholo Denbo, and is in a trusted companions relationship with Charlie Houk.",Role-Relation Continuity,supplementary_cross_scene
53,"40、INT. CENTER RING - ""THE ARENA"" - DAY",What action does Riley take to save Slack during the cage arena fight?,Riley shoots Dead Black to save Slack,"As Dead Black crouched over Slack, drooling and about to bite, Riley fired his M-16.",Narrative Progression,supplementary_cross_scene
54,48、EXT. DEPOT - TONY'S AUTOMANIA SALES OFFICE - NIGHT,What does Barrett do to the dead thing that provokes Big Daddy's fatal shot and leads to Gus screaming?,Barrett fires at dead thing and kills it,"Barrett fires his rifle at a dead thing standing within arm's length, and it drops out of frame.",Narrative Progression,supplementary_cross_scene
