id,movie_id,language,related_scenes,question,answer,evidence_or_reason,question_type
1,en5e7d0ab69a264987ad93be4a13bf5670,en,,What is Israel trying to achieve when Israel israel erupts in anger?,Force a confrontation,"Israel confronts Sir Ivy in the aftermath of a chaotic party in the suite, expressing anger over the poor conditions and loss of control. He emphasizes the financial stakes, citing a fifty-grand bribe, and takes charge by ordering Hugo to call Mecklen and bring up the Russian. Ivy remains calm, justifies the situation, and begins clearing the suite with Beanie, maintaining operational control at the exit with cash in hand—indicating a power tension between the two. [scene: Israel Confronts Sir Ivy Amid Suite Chaos]",Character Understanding
2,en5e7d0ab69a264987ad93be4a13bf5670,en,,What does Messner learn about Heller upon examining the file?,That Heller was already dead and known to the Bureau,"Messner flips through the file and comes across a paper-clipped photograph of Federal Agent Freeman Heller, dead. He stops, looks at Carruthers, and asks why the Bureau never went after Sparazza if they already knew he killed Heller. Carruthers replies that Heller was buried in agency lore, and that Hoover blackballed the memories of operatives who failed or were seen as failures, mentioning Ness as an example. [Messner Finds Heller's Photo]",Character Understanding
3,en5e7d0ab69a264987ad93be4a13bf5670,en,,What is Lazlo trying to achieve by analyzing and imitating the dead man's voice on the micro-cassette?,To perfectly replicate the butler's voice for an impersonation,"Lazlo Soot listens to the dead man's voice on a micro-cassette, studying his Baltic accent, throaty warble, and vocal damage from smoking and drinking. He smokes three cigarettes at once, sprays his throat, and drinks two bottles of Jack Daniel’s to damage his own voice, attempting to match the butler’s vocal qualities. He practices the phrase 'My name is Vitoli. How can I be of assistance,' adjusting his voice until it closely matches. When the phone rings, he answers in character as Vitoli, indicating the goal is full vocal impersonation.",Character Understanding
4,en5e7d0ab69a264987ad93be4a13bf5670,en,,What does Locke conclude from the wiretap data that drives his immediate next step?,Sparazza is behind the contract,"Locke reviews wiretap data revealing a recently opened, cash-rich escrow account linked to Sparazza and references to a mysterious Swede, leading him to confirm that Sparazza is responsible for a high-value contract targeting Israel. After Locke presents these findings, Sykes expresses skepticism about the credibility of the threat, demanding stronger proof before taking action.",Character Understanding
5,en5e7d0ab69a264987ad93be4a13bf5670,en,,What action does Sykes take to ready herself for infiltration in the Horizon Hotel and Casino scene?,prepares her appearance to conceal weapons,"In the Horizon Hotel and Casino, Sykes adjusts her outfit to hide her holsters and secure her weapons against her body. She checks her reflection and finalizes her plan to blend in with the arriving call girls, intending to infiltrate The Nomad's penthouse undetected. Watters monitors the area from the window, armed with a .50 caliber sniper rifle aimed across the street, ready to provide overwatch and eliminate any threat to Sykes.",Scene Grounding
6,en5e7d0ab69a264987ad93be4a13bf5670,en,,What action takes place in the Horizon Hotel and Casino as Sykes prepares for confrontation?,draws revolver from garter-holster and waits at elevator,"In the Horizon Hotel and Casino, Georgia Sykes retrieves a revolver from her garter holster and takes position by the elevator, anticipating an encounter. Concurrently, across the street, Sharice Watters lines up a shot through the scope of a .50 caliber sniper rifle aimed at the penthouse of The Nomad, tracking movement and preparing to fire as a figure comes into view.",Scene Grounding
7,en5e7d0ab69a264987ad93be4a13bf5670,en,,What action defines the scene in the Nomad Hotel suite during the day?,Sykes prepares for mission in tactical hooker disguise,"In the Nomad Hotel suite, Sykes arms herself with a Glock 9mm, adjusts her leather mini-skirt, lace garters, and thigh-high boots as part of her disguise, and fine-tunes her communication gear. After Watters reports feedback through the earpiece, she removes it, makes an adjustment, and reinserts it, confirming the fix.",Scene Grounding
8,en5e7d0ab69a264987ad93be4a13bf5670,en,,What event immediately prompts Padiche to ask for the general outline of the operation plan?,Sykes and Watters enter the restaurant frame and are greeted by Victor Padiche,"In the morning at the Chow Shack Buffet, Victor Padiche greets Sykes and Watters upon their arrival, inviting them to sit and engaging in brief pleasantries about the weather and a mutual contact, Lorenzo. After an awkward exchange in which Watters repeatedly says 'pussy,' leading to confusion before clarifying it as a coded reference, Padiche regains composure and extends his hand. This interaction establishes a tentative rapport, after which he transitions into business, indicating that he and his associate Mr. Serna would like to hear the general outline of their plan—marking the shift from greeting to operational discussion.",Causal-Motivational Reasoning
9,en5e7d0ab69a264987ad93be4a13bf5670,en,,What event directly triggers the police investigation that culminates in their closing in on Primo Sparraza?,Israel confronts Sir Ivy during escalating tension,"In the penthouse suite, Israel erupts in anger toward Sir Ivy, his second-in-command, amid the aftermath of a chaotic party. As women stir among the wreckage and Hugo answers a call from Gill, Ivy questions Israel’s expectations given their reckless behavior. Israel demands updates on a fifty-grand bribe and orders the Russian brought up to clean and pack. As Beanie begins ushering the women out, Ivy stands by the exit counting cash. This instability and visible criminal activity set off a chain of exposure that leads to Dupree’s botched pool game, which draws police attention and initiates the investigation that reaches Primo Sparraza.",Causal-Motivational Reasoning
10,en5e7d0ab69a264987ad93be4a13bf5670,en,,What action by Israel creates the pressure that leads to Mecklen delivering an ultimatum and Israel ultimately accepting the deal?,Israel threatens to cancel the deal over jail time,"In a tense scene at the Nomad Hotel & Casino, Israel lies on a modified baby-grand piano, surrounded by cocaine and shuffling a deck of cards. He declares the deal off unless his associates receive immunity from jail time, issuing a ten-second countdown for compliance. Mecklen, responding from off-screen, insists the terms are non-negotiable. This moment of defiance sets the stage for the subsequent confrontation at the Four Seasons Hotel in Washington D.C., where Mecklen, under pressure from federal agents and lawyers, warns Israel that the deal’s collapse would void all protections and financial agreements. The government’s final offer includes after-tax profits from media rights, and Israel, after considering alternatives like surrendering Hugo, ultimately accepts when faced with total exposure.",Causal-Motivational Reasoning
11,en5e7d0ab69a264987ad93be4a13bf5670,en,,What event immediately prior to Rip Reed's briefing explains his shift from anxiety to focused determination?,Dupree reassures Rip Reed with a confident promise to recover Buddy Israel,"In the hotel room at the Blackjack Inn, Rip Reed displays visible anxiety as he prepares to brief the team on the dangers posed by fugitive Buddy Israel. Before he begins, Dupree places a hand on Reed's shoulder and assures him with quiet certainty that they will find and apprehend Israel without issue. This reassurance visibly calms Reed, allowing him to transition into his briefing with renewed focus, outlining Israel’s armed associates, drug use, and the potential presence of prostitutes at his location.",Causal-Motivational Reasoning
12,en5e7d0ab69a264987ad93be4a13bf5670,en,,"By the time Dr. Gill arrives and waits for Hugo, what has already happened to Israel?",Israel experiences chest pain and physical distress,"In the penthouse bedroom, Israel suffers sudden chest pain and physical distress, prompting medical concern. This incident precedes Dr. Gill's arrival at the Tahoe International Airport, where he waits for Hugo, establishing a clear sequence between Israel's health crisis and the doctor's subsequent appearance.",Temporal Reasoning
13,en5e7d0ab69a264987ad93be4a13bf5670,en,,"By the time Sykes draws her gun and Watters takes aim, what action has Sykes already completed during the diner meeting?",Sets fork down and wipes hands on napkin,"Before the confrontation at the Horizon Hotel and Casino, Sykes and Watters share a strategic conversation over dinner at a diner, where Sykes deliberately places her fork down and wipes her hands, signaling a shift from deliberation to action. This subtle physical cue precedes the later escalation in which she draws her weapon.",Temporal Reasoning
14,en5e7d0ab69a264987ad93be4a13bf5670,en,,How does Primo Sparazza's treatment of Israel evolve or persist across the sequence from the van at night to the ICU recovery room?,Primo Sparazza continues to regard Israel as a sworn enemy,"From the initial confrontation in the van, where Primo expresses violent intent toward Israel, through the briefing room scenes that establish their factions as opposing sides in a civil war within the Carlotta organization, the adversarial relationship persists with explicit references to Israel as Sparazza's 'sworn enemy.' This hostility remains evident in the final ICU scene, where the two exchange glares of 'pure, unadulterated hatred,' confirming an enduring and mutual enmity rooted in betrayal and organizational fracture.",Role-Relation Continuity
15,en5e7d0ab69a264987ad93be4a13bf5670,en,,How does Primo Sparazza's relationship to Freeman Heller remain consistent from the New Jersey Turnpike scene through the Cedars Sinai recovery room scene?,Primo Sparazza keeps treating Freeman Heller as a threat,"From the initial confrontation on the New Jersey Turnpike, where Primo Sparazza stalks and kills Freeman Heller, through later confirmation in the Cedars Sinai recovery room, Sparazza's role remains defined by lethal hostility toward Heller. The narrative consistently frames Sparazza as the perpetrator of Heller's death, maintaining an adversarial dynamic in which Sparazza acts against Heller as a target, with no indication of reconciliation or shift in intent.",Role-Relation Continuity
16,en5e7d0ab69a264987ad93be4a13bf5670,en,,How does Israel's treatment of Ivy evolve from the hotel meeting to the penthouse confrontation?,Israel keeps treating Ivy as a threat,"From the moment Israel betrays Ivy and others at the Four Seasons Hotel, their relationship is defined by hostility. In subsequent scenes, including the master bedroom and penthouse hallway, Israel consistently responds to Ivy with suspicion and defensiveness, perceiving him as a dangerous adversary. This pattern persists through direct confrontations where Ivy accuses Israel of betrayal and threatens him with violence, reinforcing Israel's stance of viewing Ivy as an active threat.",Role-Relation Continuity
17,en5e7d0ab69a264987ad93be4a13bf5670,en,,"What pivotal development sets in motion the sequence leading to Watters watching Sykes through the scope, Sykes drawing her gun, and Carruthers racing to the Nomad?",Sykes and Watters Prepare for Infiltration,"In the moments before the critical confrontation, Sykes and Watters coordinate their tactical approach from concealed positions within the Horizon Hotel and Casino. This preparation establishes the operational framework that directly enables the subsequent chain of events: Watters acquiring visual contact, the escalation as Sykes draws her weapon, and the urgent response triggered by Carruthers' movement toward the Nomad. [scene: 49、INT. HORIZON HOTEL AND CASINO -- SAME]",Narrative Progression
18,en5e7d0ab69a264987ad93be4a13bf5670,en,,What pivotal action sets the story on a direct path toward the confrontation with Keith's past and the final infiltration sequence?,Sykes readies weapon and adjusts comms in disguise,"In the suite at the Nomad Hotel, Sykes prepares for the operation by arming herself and calibrating her comms while in disguise, marking the decisive shift from planning to active engagement. This moment initiates the chain of events leading to the standoff, the infiltration, and the uncovering of Keith's hidden history. [48、INT. NOMAD HOTEL SUITE -- DAY]",Narrative Progression
19,en5e7d0ab69a264987ad93be4a13bf5670,en,,"What pivotal event initiates the confrontation between Watters, Sykes, and Padiche that escalates tensions and prompts Padiche to seek operational details?",Sykes and Watters Meet Padiche at the Tahoe Buffet,"The meeting between Sykes and Watters with Padiche at the Tahoe Buffet marks the critical shift in the narrative, setting in motion a series of confrontations where provocations and strategic disclosures begin to unfold. This encounter directly precedes and triggers the use of inflammatory language, psychological pressure, and the subsequent inquiry into the operation plan, establishing it as the narrative hinge [28、INT. CHOW SHACK BUFFET -- MORNING].",Narrative Progression
20,en5e7d0ab69a264987ad93be4a13bf5670,en,,"What turning point escalates the central conflict and sets the narrative on a direct path toward the convergence of police action, political ultimatums, and covert coordination?",Israel Confronts Sir Ivy Amid Suite Chaos,"In the penthouse suite, escalating tensions culminate as Israel confronts Sir Ivy during a moment of disarray, disrupting the existing power balance and triggering a chain of urgent responses that propel the plot into its final phase, including lockdown procedures, law enforcement mobilization, and high-stakes diplomatic and underground communications. [30、INT. PENTHOUSE SUITE -- DAY]",Narrative Progression
21,en5e7d0ab69a264987ad93be4a13bf5670,en,,"Which scene or scenes best match the following description: Sykes tucks a Glock 9mm into place and adjusts the earpiece and microphone she's wearing. She's dressed in a leather mini-skirt, lace garters, and thigh-high platform boots—outfitted in sharp, provocative gear. She says they shouldn't draw more trouble than",48、INT. NOMAD HOTEL SUITE -- DAY | 49、INT. HORIZON HOTEL AND CASINO -- SAME,"Sykes tucks a Glock 9mm into place and adjusts the earpiece and microphone she's wearing. She's dressed in a leather mini-skirt, lace garters, and thigh-high platform boots—outfitted in sharp, provocative gear. She says they shouldn't draw more trouble than",Scene Grounding
22,en5e7d0ab69a264987ad93be4a13bf5670,en,,In which scene or scenes are Padiche and Sidney K. Serna both present?,1、INT. VAN -- NIGHT | 12、INT. BRIEFING ROOM -- CONTINUOUS | 27、INT. CAR -- DAY | 49、INT. HORIZON HOTEL AND CASINO -- SAME,"{""pair"": [""Padiche"", ""Sidney K. Serna""], ""pair_mentions"": 25, ""scene_grounding_subtype"": ""copresence_localization"", ""scene_count"": 4, ""scene_numbers"": [1, 12, 27, 49], ""scene_titles"": [""1、INT. VAN -- NIGHT"", ""12、INT. BRIEFING ROOM -- CONTINUOUS"", ""27、INT. CAR -- DAY"", ""49、INT. HORIZON HOTEL AND CASINO -- SAME""]}",Scene Grounding
23,en5e7d0ab69a264987ad93be4a13bf5670,en,,In which scene or scenes is Freeman Heller acting as a member of Federal Bureau Of Investigation?,"9、INT. BRIEFING ROOM -- DAY | 36、INT. ""TAHOE SKILLET"" RESTAURANT -- MORNING | 122、INT. CEDARS SINAI -- I.C.U. -- RECOVERY ROOM -- DAY","{""character"": ""Freeman Heller"", ""role_label"": ""Federal Bureau Of Investigation"", ""relation_names"": [""joined"", ""was member of"", ""belongs to""], ""descriptions"": [""The text explicitly states that Heller joined the Bureau, indicating institutional affiliation."", ""Freeman Heller is referred to as a 'Federal Agent' whose death is tied to Bureau history, and whose memory was suppressed by agency leadership, confirming his status as a former FBI member.""], ""scene_grounding_subtype"": ""role_state_localization"", ""scene_count"": 3, ""scene_numbers"": [9, 36, 122], ""scene_titles"": [""9、INT. BRIEFING ROOM -- DAY"", ""36、INT. \""TAHOE SKILLET\"" RESTAURANT -- MORNING"", ""122、INT. CEDARS SINAI -- I.C.U. -- RECOVERY ROOM -- DAY""]}",Scene Grounding
24,en5e7d0ab69a264987ad93be4a13bf5670,en,,In which scene or scenes does Reporter appear?,65、INT. BATHROOM -- DAY | 66、INT. HOTEL ROOM -- BLACKJACK INN -- SAME,"Reporter is present in two consecutive scenes set in the Blackjack Inn hotel, beginning in the bathroom and continuing into the hotel room, where their dialogue and actions directly contribute to the unfolding confrontation.",Scene Grounding
25,en5e7d0ab69a264987ad93be4a13bf5670,en,,In which scene or scenes are Padiche and Richard Messner both present?,1、INT. VAN -- NIGHT | 12、INT. BRIEFING ROOM -- CONTINUOUS | 13、INT. DINER -- NIGHT | 96、INT. PENTHOUSE HALLWAY -- SAME,"{""pair"": [""Padiche"", ""Richard Messner""], ""pair_mentions"": 17, ""scene_grounding_subtype"": ""copresence_localization"", ""scene_count"": 4, ""scene_numbers"": [1, 12, 13, 96], ""scene_titles"": [""1、INT. VAN -- NIGHT"", ""12、INT. BRIEFING ROOM -- CONTINUOUS"", ""13、INT. DINER -- NIGHT"", ""96、INT. PENTHOUSE HALLWAY -- SAME""]}",Scene Grounding
26,en5e7d0ab69a264987ad93be4a13bf5670,en,,Who are the 3 most central characters in this story?,"Georgia_Sykes, Israel, Richard_Messner",,Character Understanding
