id,related_scenes,question,answer,related_context,question_type,question_source
1,44、INT. E BLOCK - DAY,Why does Paul rush to join the fray?,Coffey's warning and the door unlocking prompt him to act.,"Paul hears him, glances back...door, which is being unlocked...",Causal-Motivational Reasoning,broad_coverage_scene
2,6、INT. HALLWAY PAST KITCHEN - MORNING,"In [6、INT. HALLWAY PAST KITCHEN - MORNING], What is Paul's behavioral state as he leaves?",Paul is trying to avoid being seen,Paul slips to the back door unnoticed,Character Understanding,broad_coverage_scene
3,37、INT. PAUL'S BEDROOM - NIGHT,When does Paul come down the stairs?,After he sits up and feels pain in his groin,"He sits up, clutching at a queasy stab of pain in his groin... LIVING ROOM STAIRS ... and comes hurrying down the steps",Temporal Reasoning,broad_coverage_scene
4,32、INT. EXECUTION CHAMBER - NIGHT,When does Bitterbuck surge forward again?,After the switch is thrown a second time,The switch is thrown a second time. Bitterbuck surges forward again...,Temporal Reasoning,broad_coverage_scene
5,32、INT. EXECUTION CHAMBER - NIGHT,When does the switch get thrown a second time?,After the doctor checks for a heartbeat and shakes his head,"Van Hay kills the current. Bitterbuck goes limp. A DOCTOR steps forward, checks for a heartbeat, shakes his head. BRUTAL Again. The switch is thrown a second time.",Temporal Reasoning,broad_coverage_scene
6,25、INT. E BLOCK - NIGHT,What does the mouse do after trotting a short distance?,"It peers right and left as if checking the snoring inmates, then makes another forward spurt.","A tiny brown mouse is coming up the Mile. It trots a short distance, peers right and left as if checking the snoring inmates in their cells, then makes another forward spurt.",Scene Grounding,broad_coverage_scene
7,34、INT. COFFEY'S CELL - DAY,When are the guards' jaws hanging open?,After Delacroix demonstrates the mouse's fetch trick,"By now, the guard's jaws are hanging open.",Temporal Reasoning,broad_coverage_scene
8,26、INT. E BLOCK - DAY,What does Percy do when the mouse approaches him?,"Keeps combing his hair until he hears a squeak, then freezes and turns to see the mouse",Percy keeps working that comb--and freezes at the sound of a TINY SQUEAK. His head swivels slowly... and there's the mouse. Staring at him.,Scene Grounding,broad_coverage_scene
9,1、EXT. FIELD - DAY(SLOW MOTION),What does the whispering voice say to the characters?,"You love your sister? You make any noise, know what happens?","WHISPERING VOICE (V.O.) You love your sister? You make any noise, know what happens?",Character Understanding,broad_coverage_scene
10,18、EXT. DETTERICK FARM - DAWN (FLASHBACK),"In [18、EXT. DETTERICK FARM - DAWN (FLASHBACK)], What is Klaus Detterick's behavioral state when the scream occurs?",Urgently running toward the house after dropping the pail,"Klaus reappears, dropping the pail, running toward the house",Character Understanding,broad_coverage_scene
11,21、EXT. COUNTRY ROAD/FIELD - DAY (FLASHBACK),"In [21、EXT. COUNTRY ROAD/FIELD - DAY (FLASHBACK)], What is Klaus's emotional state when he finds the fabric?",Klaus is in emotional distress.,Klaus... screams... this belongs to my Katie...,Character Understanding,broad_coverage_scene
12,20、INT. DETTERICK HOUSE - DAWN (FLASHBACK),"In [20、INT. DETTERICK HOUSE - DAWN (FLASHBACK)], What is Klaus's behavioral state when instructing Marjorie?",Shouting orders frantically,"KLAUS: GODDAMN IT, WOMAN, GET ON THE PHONE NOW!",Character Understanding,broad_coverage_scene
13,20、INT. DETTERICK HOUSE - DAWN (FLASHBACK),"In [20、INT. DETTERICK HOUSE - DAWN (FLASHBACK)], What is Marjorie's emotional state during the crisis?",Sobbing incoherently,Marjorie sobbing incoherently,Character Understanding,broad_coverage_scene
14,11、INT. TV ROOM - DAY,What does Elaine believe about Paul's conflict?,"It's not everybody he has it in for, Paul. It's you.","ELAINE: It's not everybody he has it in for, Paul. It's you.",Character Understanding,broad_coverage_scene
15,9、INT. SHACK - MORNING,"In [9、INT. SHACK - MORNING], What does 'DISSOLVE TO' indicate in film terminology?",A film editing transition where one scene fades out while another fades in.,DISSOLVE TO:,Scene Grounding,broad_coverage_scene
16,17、EXT. E BLOCK PRISON YARD - DAY,What is Paul doing with Coffey's file and his sandwich?,"Sitting by himself on the bleachers with Coffey's file on his knees, thoughtfully unwrapping his brown-bagged sandwich.","Paul sitting by himself on the bleachers with Coffey's file on his knees, thoughtfully unwrapping his brown-bagged sandwich.",Scene Grounding,broad_coverage_scene
17,22、EXT. FIELD - DAY (FLASHBACK),"In [22、EXT. FIELD - DAY (FLASHBACK)], What is John Coffey's emotional state during the scene?","In monstrous grief, howling, and crying",John Coffey sits on the riverbank... face twisted in monstrous grief... howling... eyes still streaming tears,Character Understanding,broad_coverage_scene
18,36、INT. WARDEN MOORES' OFFICE - DAY,When will Hal's wife die according to the doctors?,By Christmas,They say she'll be dead by Christmas,Temporal Reasoning,broad_coverage_scene
19,22、EXT. FIELD - DAY (FLASHBACK),"In [22、EXT. FIELD - DAY (FLASHBACK)], What is Klaus Detterick's condition after his sons' deaths?",Sobbing into his hands and overwhelmed with grief,"He falls to his knees on the riverbank, sobbing into his hands... overwhelmed with grief",Character Understanding,broad_coverage_scene
20,33、INT. E BLOCK ACCESS TUNNEL - NIGHT,What is the consequence of Paul refusing Percy's request to take Brutal's spot?,Percy threatens to stay and make a career of this.,"PERCY: 'I might just stick around for good, make me a career of this.'",Causal-Motivational Reasoning,broad_coverage_scene
21,8、EXT. WOODS - MORNING,"In [8、EXT. WOODS - MORNING], What object is Paul wearing that resembles Red Riding Hood?",A plastic poncho,Paul... in his plastic poncho,Scene Grounding,broad_coverage_scene
22,54、INT. E BLOCK - DAY,"In [54、INT. E BLOCK - DAY], What item does Paul have when approaching Billy's cell?",A canvas straitjacket,Paul has a canvas straitjacket,Scene Grounding,broad_coverage_scene
23,12、INT. SUN ROOM - DAY,"In [12、INT. SUN ROOM - DAY], Why was death row referred to as the Green Mile?",Because the floor was the color of faded limes.,"We called ours the Green Mile, because the floor was the color of faded limes.",Causal-Motivational Reasoning,broad_coverage_scene
24,52、INT. PAUL'S MODEL T - DAY,"In [52、INT. PAUL'S MODEL T - DAY], Where does Paul drive back to?",Cold Mountain,"Paul drives back to Cold Mountain, his heart conflicted...",Scene Grounding,broad_coverage_scene
25,18、EXT. DETTERICK FARM - DAWN (FLASHBACK),"In [18、EXT. DETTERICK FARM - DAWN (FLASHBACK)], What does Klaus Detterick do after hearing the woman's scream?",Dropping the pail and running toward the house,"Klaus reappears, dropping the pail, running toward the house",Character Understanding,broad_coverage_scene
26,26、INT. E BLOCK - DAY,What does the mouse do as it approaches Percy?,"Cruises up the Mile, keeps coming closer, and stares at Percy",cruising inexorably up the Mile... THE MOUSE keeps coming closer... staring at him.,Scene Grounding,broad_coverage_scene
27,39、INT. PAUL'S KITCHEN - MORNING,When does Paul plan to go to the doctor?,"Today, as soon as the new inmate is squared away.",PAUL: 'Today. Just as soon as we get the new inmate squares away.',Temporal Reasoning,broad_coverage_scene
28,48、INT. BEDROOM - MORNING,"In [48、INT. BEDROOM - MORNING], What does 'CUT TO:' indicate in the passage?",A scene transition,CUT TO:,Scene Grounding,broad_coverage_scene
29,16、INT. E BLOCK (THE GREEN MILE) - DAY,"In [16、INT. E BLOCK (THE GREEN MILE) - DAY], What is Paul's physical condition?","Pale, sweaty, and in pain","The door opens, revealing Paul's pale and sweaty face. ... a THIN TRICKLE, accompanied by a stifled groan of pain",Character Understanding,broad_coverage_scene
30,37、INT. PAUL'S BEDROOM - NIGHT | 41、INT. E BLOCK TOILET - DAY | 44、INT. E BLOCK - DAY,What does Paul state about his condition when responding to Coffey after Billy's outburst?,"Paul does not verbally state anything about his condition, but his actions indicate he is in severe pain and struggling due to the groin injury and fever.","Paul collapses on the Mile, writhing in pain from the injury to his groin and overwhelmed by fever. He lies on the floor, gasping and drenched in sweat. He grimaces, struggling to move, but slowly forces himself to his feet and takes unsteady steps down the block, each one labored, making his way toward Coffey's cell.",Character Understanding,broad_coverage_event_chain
31,33、INT. E BLOCK ACCESS TUNNEL - NIGHT | 26、INT. E BLOCK - DAY,What does Percy state he wants in order to consider leaving his position?,"Percy states he wants Brutal's spot at the next execution, and if he gets it, he will leave afterward.","Percy insists he just wants to be out front, just once, and then he’ll be gone.",Character Understanding,broad_coverage_event_chain
32,49、INT. LIVING ROOM - MORNING | 48、INT. BEDROOM - MORNING,What does Paul state about his certainty regarding taking the morning off?,Paul states that he is not sure what he is sure of.,He replies that he’s not sure what he’s sure of.,Character Understanding,broad_coverage_event_chain
33,27、INT. E BLOCK - NIGHT | 26、INT. E BLOCK - DAY | 27、INT. E BLOCK - NIGHT,What does Percy state about what he will do to the mouse?,Percy states that he is going to rip the mouse's diseased head off.,"As he works the key into the lock, he screams, 'I'M GONNA RIP YOUR DISEASED HEAD OFF, YOU LITTLE PIECE OF SHIT!'",Character Understanding,broad_coverage_event_chain
34,10、EXT. NURSING HOME - DAY | 11、INT. TV ROOM - DAY,Why does Elaine react defensively when Brad Dolan approaches Paul during the movie?,Elaine reacts defensively because Brad Dolan is mocking Paul while pretending to offer help as Paul is emotionally distressed.,"Brad Dolan steps in, placing a hand on Paul’s shoulder and leaning in with a mocking tone, asking why he’s crying. Elaine immediately shoves Brad’s hand away, her voice sharp as she tells him Paul doesn’t need his help.",Causal-Motivational Reasoning,broad_coverage_event_chain
35,34、INT. COFFEY'S CELL - DAY,Why does Delacroix become nervous when Percy enters the cell?,"Delacroix becomes nervous because Percy mocks him and shows indifference toward the mouse, which makes Delacroix fear for the mouse's safety.","Del grows nervous, trying to shield the mouse, but it scurries to the top of his head and stares at Percy. Del pleads, 'Don' hurt him, 'kay? 'kay?' Percy looks on with a smirk, calling Delacroix 'Eddie' and mocking him for having a new friend.",Causal-Motivational Reasoning,broad_coverage_scene
36,26、INT. E BLOCK - DAY | 27、INT. E BLOCK - NIGHT | 26、INT. E BLOCK - DAY | 34、INT. COFFEY'S CELL - DAY,Why does Percy become enraged after the mouse darts under the restraint room door?,"Percy becomes enraged because the mouse escapes from his reach and he is unable to catch it, which triggers his violent outburst.","After the mouse darts under the restraint room door, Percy lunges toward it, slamming his fist against the door in fury... he screams, 'I'M GONNA RIP YOUR DISEASED HEAD OFF, YOU LITTLE PIECE OF SHIT!' His face is red, his voice raw with rage, and he keeps pounding the door between curses, refusing to let the mouse escape his reach.",Causal-Motivational Reasoning,broad_coverage_event_chain
37,10、EXT. NURSING HOME - DAY | 11、INT. TV ROOM - DAY,What does Elaine say when Brad Dolan tries to intervene during Paul's breakdown?,Elaine tells Brad Dolan that Paul doesn’t need his help.,"Elaine immediately shoves Brad’s hand away, her voice sharp as she tells him Paul doesn’t need his help.",Character Understanding,broad_coverage_event_chain
38,10、EXT. NURSING HOME - DAY | 11、INT. TV ROOM - DAY | 10、EXT. NURSING HOME - DAY,What does Paul state about his interaction with Mr. Dolan when Elaine asks if he is coming in?,Paul states that he was just chatting with Mr. Dolan about the weather and that they are finished now.,"After a pause, she asks if he is coming in. Paul replies that he was just chatting with Mr. Dolan about the weather and that they are finished now.",Character Understanding,broad_coverage_event_chain
39,16、INT. E BLOCK (THE GREEN MILE) - DAY | 44、INT. E BLOCK - DAY,What does John Coffey state about his ability to help during the incident he refers to?,John Coffey states that he could not stop what happened and was not able to help.,"After a long pause, Coffey speaks softly, saying he couldn’t stop what happened and that he wasn’t able to help.",Character Understanding,broad_coverage_event_chain
40,11、INT. TV ROOM - DAY | 10、EXT. NURSING HOME - DAY,What does Elaine state about Paul's need for help from Brad Dolan?,Elaine states that Paul does not need Brad Dolan's help.,"Elaine shoves Brad’s hand away and snaps at him to leave Paul alone, indicating that Paul doesn’t need his help.",Character Understanding,broad_coverage_event_chain
41,44、INT. E BLOCK - DAY,What does Paul state about how Percy should deliver the message to the warden?,"Paul states that Percy should deliver only the facts, with no excuses or stories.","Paul orders Percy to go straight to the warden and deliver a clear message: the situation is under control, with no excuses, no stories, just the facts.",Character Understanding,broad_coverage_scene
42,11、INT. TV ROOM - DAY | 10、EXT. NURSING HOME - DAY,What does Elaine state about Paul's need for help from Brad Dolan?,Elaine states that Paul does not need Brad Dolan's help.,"Elaine shoves Brad’s hand away and snaps at him to leave Paul alone, saying Paul doesn’t need his help.",Character Understanding,broad_coverage_event_chain
43,7、EXT. NURSING HOME - ESTABLISHING - MORNING | 10、EXT. NURSING HOME - DAY | 11、INT. TV ROOM - DAY | 10、EXT. NURSING HOME - DAY,What does Paul claim about his interaction with Brad Dolan?,Paul claims that he was just talking with Brad Dolan about the weather.,"Paul says they were just talking about the weather, and later repeats that he was just chatting with Mr. Dolan about the weather.",Character Understanding,broad_coverage_event_chain
44,1、EXT. FIELD - DAY(SLOW MOTION) | 21、EXT. COUNTRY ROAD/FIELD - DAY (FLASHBACK),What does Deputy Rob McGee state about the weapons during the operation?,Deputy Rob McGee states that all weapons must be unloaded to prevent anyone from being accidentally shot.,"Deputy McGee bellowing orders—'I want all the weapons unloaded, y'hear? Take out your shells, I won't have a man shot by accident today!'",Character Understanding,broad_coverage_event_chain
45,16、INT. E BLOCK (THE GREEN MILE) - DAY|25、INT. E BLOCK - NIGHT,' how would you describe the evolution of Paul and Dean's professional relationship from the time of Coffey's arrival to the mouse incident?,from trusted team members to cooperative colleagues,"Earlier, the relationship between Paul and Dean is marked by trusted team members; later, it shifts to cooperative colleagues.",Role-Relation Continuity,supplementary_cross_scene
46,33、INT. E BLOCK ACCESS TUNNEL - NIGHT,What does Percy ask Paul that changes the course of their conversation?,Percy questions Paul about Brutal's hostility,Percy questions Paul about Brutal's hostility.,Narrative Progression,supplementary_cross_scene
47,16、INT. E BLOCK (THE GREEN MILE) - DAY|44、INT. E BLOCK - DAY,How should we characterize their relationship compared to when Coffey first arrived on the mile?,from emerging authority-inmate dynamic to emerging trust,"Earlier, the relationship between Paul and John Coffey is marked by emerging authority-inmate dynamic; later, it shifts to emerging trust.",Role-Relation Continuity,supplementary_cross_scene
48,44、INT. E BLOCK - DAY,How does Harry try to subdue Billy during the attack on Dean?,Harry attempts to subdue Billy from behind,"In the scene, Harry lunges at Billy from behind, attempting to pull him off Dean as Billy strangles him with a wrist-chain.",Narrative Progression,supplementary_cross_scene
49,44、INT. E BLOCK - DAY,What does Coffey do to Paul that interrupts the tension after Billy's arrival and leads to Paul testing his healing?,John Coffey grabs Paul and removes his illness through touch,"Coffey reaches through the cell bars, grabs Paul, and heals his illness by touch, which causes Paul to later walk without pain and urinate comfortably, as described in the scene.",Narrative Progression,supplementary_cross_scene
50,44、INT. E BLOCK - DAY,What does Harry do to try and stop Billy when he's attacking Dean?,Harry attempts to subdue Billy from behind,"Harry lunged at Billy from behind, trying to pull him off Dean.",Narrative Progression,supplementary_cross_scene
51,12、INT. SUN ROOM - DAY|44、INT. E BLOCK - DAY|45、INT. PAUL'S HOUSE - DUSK,"Which character in The Green Mile is friends with Elaine Connelly, has a tense exchange with Delacroix, and is married to Jan?",Paul,"Paul is in a are friends relationship with Elaine Connelly, is in a tense exchange relationship with Delacroix, and is in a married couple relationship with Jan.",Role-Relation Continuity,supplementary_cross_scene
52,16、INT. E BLOCK (THE GREEN MILE) - DAY|63、INT. ACCESS TUNNEL - NIGHT|71、INT. DINING ROOM- DAY,"Who among the E Block guards works as Dean's trusted partner, stands as Percy's adversary, and shares a close working relationship with Paul?",Brutus Howell,"Brutus Howell is in a trusted partners relationship with Dean, is in a ongoing adversaries relationship with Percy, and is in a trusted coworkers relationship with Paul.",Role-Relation Continuity,supplementary_cross_scene
