id,movie_id,language,related_scenes,question,answer,evidence_or_reason,question_type
1,ch65a92838a9e782e6aae93c01ec0de618faca113f,zh,38、超市门口，日，外,徐太浪冲进徐正太家时，最想做什么？,找到徐正太,徐太浪进入屋内未发现人影，立即外出继续搜寻，行动表明其核心意图是 locate 徐正太。,Character Understanding
2,ch65a92838a9e782e6aae93c01ec0de618faca113f,zh,40、岸边，日，外,在徐太浪喝了一口酒后，他因观察到什么情况而决定采取行动？,发现家中冒烟,徐太浪在饮酒后注意到徐正太家方向有烟，虽遭否认仍坚持判断并决定前往查看，表明其行动由这一观察触发。,Character Understanding
3,ch65a92838a9e782e6aae93c01ec0de618faca113f,zh,14、阳台上，日，外,在确认周围安全后，徐正太弯腰捡起BB机并招呼徐太浪，他此时最想做什么？,拿回BB机并带人离开,徐正太在确认安全后立即拾起BB机并示意徐太浪跟上，表明他意图取回物品并继续行动。,Character Understanding
4,ch65a92838a9e782e6aae93c01ec0de618faca113f,zh,15、小镇，日，外,在阳台对质时，徐正太为何邀请徐太浪加入正太帮？,借入会引导他向善,徐正太察觉徐太浪对自己家异常熟悉，怀疑其偷窃行为，但未直接驱赶，而是通过建立帮会关系接纳他，意图引导其改变生活方式。邀请入会既是试探，也是给予归属感的方式，核心动机是劝其改过。,Character Understanding
5,ch65a92838a9e782e6aae93c01ec0de618faca113f,zh,36、楼顶，日，外,在楼顶，日，外这场戏中，徐太浪做出的最具定义性的动作是什么？,情绪激动地质问如何对得起正太,这场戏的核心冲突由徐太浪在得知真相后的情绪爆发所驱动。他质问小花和徐正太的行为是否对得起正太，直接触发了后续的考验揭晓、徐正太现身、六一暗中出现并崩溃离场等一系列关键情节，是推动真相揭露和人物关系转折的中心动作。,Scene Grounding
6,ch65a92838a9e782e6aae93c01ec0de618faca113f,zh,38、超市门口，日，外,在[超市门口，日，外]这一场中，徐太浪进入徐正太家后最关键的行动是什么？,发现屋内无人后立即离开,这场戏的核心是徐太浪寻找徐正太的紧急行动。他冲进屋内确认无人后立刻转身外出，开启了后续在街巷中持续搜寻的情节，推动了整个寻找链条的展开。,Scene Grounding
7,ch65a92838a9e782e6aae93c01ec0de618faca113f,zh,25、汽车修理厂仓库，日，内,在罗力闯入包厢的这场戏中，最能定义冲突升级的关键动作是什么？,罗力带两名手下进入房间,这场戏的核心张力始于罗力带人强行闯入，打破原有空间的安全感，通过武力威慑和言语压迫主导局势，后续所有反应——阻拦、反抗、压制、沉默——皆由此动作引发。该动作确立了权力对比，推动情节走向对峙与象征性反抗。,Scene Grounding
8,ch65a92838a9e782e6aae93c01ec0de618faca113f,zh,40、岸边，日，外; 44、小巷，日，外,在徐太浪拍肩称赞徐正太救出遗像之前，哪一个关键事件促使他改变了对徐正太的看法？,徐太浪发现徐正太家方向冒烟,徐太浪注意到徐正太家冒烟并提醒他，这一观察引发了后续对徐正太行为的重新评估。当徐正太冒险冲入火场抢救父亲遗像而非财物时，徐太浪由此意识到他重情重义的一面，从而改变了原有印象并给予称赞。,Causal-Motivational Reasoning
9,ch65a92838a9e782e6aae93c01ec0de618faca113f,zh,51、黄志强办公室，日，内; 51、黄志强办公室，日，内,在婚礼致辞中徐太浪的言行如何引发了小花的不满以及徐正太的回应？,徐太浪在婚礼上致辞,徐太浪在婚礼致辞时将自己置于情感中心，回顾与新郎的兄弟情并深情赞美新娘，言辞超出常规祝福范围，使小花感到仪式焦点被转移，因而产生抱怨；徐正太基于对徐太浪一贯行为方式的了解，作出平静安抚的回应。,Causal-Motivational Reasoning
10,ch65a92838a9e782e6aae93c01ec0de618faca113f,zh,14、阳台上，日，外; 49、六一家，日,在小花、徐正太和徐太浪于走廊商议活动进展并决定临时上场之前，哪一个具体行动促成了徐太浪的参与？,徐正太捡起BB机并招呼徐太浪跟上,徐正太在确认安全后拾起BB机并主动示意徐太浪跟随，这一举动标志着他开始信任并拉拢徐太浪，为后续三人共同策划活动、徐太浪临时决定上场埋下关键伏笔。该互动发生在阳台场景，早于走廊商议，是推动徐太浪进入核心行动圈的起点。,Causal-Motivational Reasoning
11,ch65a92838a9e782e6aae93c01ec0de618faca113f,zh,14、阳台上，日，外; 15、小镇，日，外,在警察追问徐太浪与徐正太关系的场景中，是什么关键互动促使徐太浪随后询问对方全名并接受入会邀请？,警察当面质问两人关系，迫使徐正太临时认亲并编造祭日谎言以脱身,面对警察盘问，徐正太为摆脱嫌疑临时认徐太浪为弟，并谎称当日是父亲祭日。这一紧急共谋制造了虚假兄弟关系的起点，使后续询问姓名与邀请入会显得合理，推动了两人关系的戏剧性展开。,Causal-Motivational Reasoning
12,ch65a92838a9e782e6aae93c01ec0de618faca113f,zh,14、阳台上，日，外; 58、小河，日，外,从[14、阳台上，日，外]到[58、小河，日，外]，徐太浪和徐正太之间的互动如何体现出他们关系的演进？,从单向指令发展为相互信任的兄弟关系,初期徐正太通过BB机对徐太浪下达‘过来’的指令，体现单向沟通；随后在修理厂共同策划行动、同步踩碎眼镜，展现合作默契；后期徐正太主动邀请徐太浪合伙经营，并在离别时托付家人，称其为‘阿浪’，表明深厚信任与情感联结。关系逐步深化为平等、互信的兄弟纽带。,Role-Relation Continuity
13,ch65a92838a9e782e6aae93c01ec0de618faca113f,zh,16、汽车修理厂屋顶，日，外; 50、饭店大厅，日，内,从汽车修理厂屋顶的冲突到饭店大厅的共处，六一和徐正太之间的关系如何演变？,从责备对立转为相互信任的同伴关系,最初徐正太因六一走丢而公开责备他，表现出明显的对立情绪；随后在仓库中两人共同商议对策、配合行动，显示出合作与信任；最终六一主动背负徐正太的武器，标志着关系已稳定为彼此托付的同伴状态。,Role-Relation Continuity
14,ch65a92838a9e782e6aae93c01ec0de618faca113f,zh,25、汽车修理厂仓库，日，内; 45、仓库，日，内,从[25、汽车修理厂仓库，日，内]到[45、仓库，日，内]，六一和徐太浪之间的合作关系是如何延续的？,持续作为行动伙伴共同制定策略并保持默契配合,从汽车修理厂仓库开始，两人在制定帮派策略时展现合作，过程中通过一致动作和肢体互动强化团结；后续场景中面对威胁时仍主张集体行动，信任关系稳定，表明其伙伴关系贯穿多个关键决策时刻。,Role-Relation Continuity
15,ch65a92838a9e782e6aae93c01ec0de618faca113f,zh,36、楼顶，日，外; 18、小巷，夜，外,哪一个事件标志着徐太浪从被动服从转向主动质疑，并引发后续对父子关系与江湖规则的冲突？,徐太浪通过考验，徐正太现身揭晓真相,该事件发生在楼顶场景，徐正太在徐太浪完成考验后现身并揭示身份真相，打破了此前父子间伪装与试探的平衡，直接触发徐太浪对既有秩序的质疑以及对亲情与规则的重新审视，成为后续一系列对抗与揭露的起点。,Narrative Progression
16,ch65a92838a9e782e6aae93c01ec0de618faca113f,zh,38、超市门口，日，外; 42、岸边，日，外; 41、徐正太家，日，外,哪一个事件成为徐正太与徐太浪共同冲入火场、徐太浪紧随父亲奔赴险境，以及他在重逢时情绪失控咬弯玫瑰的叙事转折点？,徐太浪寻找徐正太,该事件标志着父子关系从分离走向直面冲突的临界点，徐太浪主动寻找父亲的行为打破了此前的情感僵局，直接触发后续共同行动与情绪爆发，构成情节推进的核心动因。,Narrative Progression
17,ch65a92838a9e782e6aae93c01ec0de618faca113f,zh,32、汽车修理厂值班室，日，内; 46、徐正太家，夜，内; 46、徐正太家，夜，内,在汽车修理厂值班室的对峙中，哪一个事件打破了僵局，直接引发了黄志强下令施暴、徐太浪挑衅与徐正太激化冲突，以及罗力持枪现身派出所门口被制止的后续发展？,徐正太驾车闯入，徐太浪联手制服对手,该事件标志着被动防御转向主动反击，打破了原有对峙平衡，迫使黄志强采取镇压行动，同时激化双方矛盾，为后续冲突升级和外部武力介入提供了直接导火索。,Narrative Progression
18,ch65a92838a9e782e6aae93c01ec0de618faca113f,zh,36、楼顶，日，外; 36、楼顶，日，外; 36、楼顶，日，外,在[楼顶，日，外]场景中，哪一个事件成为徐太浪与小花关系推进与心理变化的关键转折，直接引发了后续亲近倾诉、心生疑虑与情感退缩的发展？,小花开窗后与徐太浪近距离互动并选定《白蛇传》,该场景中，小花主动开窗与徐太浪建立近距离接触，并共同选择观看《白蛇传》，这一行为打破了此前的隔阂，既推动了两人情感升温，也为徐太浪后续对关系的犹豫与怀疑埋下伏笔，构成情节走向的枢纽。,Narrative Progression
19,ch65a92838a9e782e6aae93c01ec0de618faca113f,zh,,这个故事中最主要的3个角色分别是谁？,六一、徐太浪、徐正太,,Character Understanding
20,ch65a92838a9e782e6aae93c01ec0de618faca113f,zh,,徐太浪和罗力共同出现的场景对应的是哪几场戏？,17、小花家，夜，内 | 23、挚爱 KTV 门口，夜，外 | 25、汽车修理厂仓库，日，内 | 56、镜头组合,徐太浪与罗力在四场戏中共同出现，关系为同伙，基于多次共现及互动行为可定位具体场景。,Scene Grounding
21,ch65a92838a9e782e6aae93c01ec0de618faca113f,zh,,佳依明确出现在了哪几场戏中？,20、街道上，夜，外 | 21、电影院，夜，内 | 22、拉面馆，日，内 | 25、汽车修理厂仓库，日，内,佳依在剧本中有多个明确出场场景，依据其在场的对话与行动可定位到四个连续性场景，涵盖街道、电影院、拉面馆与汽车修理厂仓库，这些场景中她均作为可见角色参与情节。,Scene Grounding
22,ch65a92838a9e782e6aae93c01ec0de618faca113f,zh,,徐太浪以正太帮成员的身份参与了哪几场戏？,15、小镇，日，外 | 23、挚爱 KTV 门口，夜，外 | 25、汽车修理厂仓库，日，内 | 36、楼顶，日，外,徐太浪在被徐正太邀请后明确表示‘我入会’，并被接纳进入正太帮的管理层，标志着其正式成为组织成员。此后在多个场景中以该身份参与行动，身份状态持续至楼顶对峙场次。,Scene Grounding
23,ch65a92838a9e782e6aae93c01ec0de618faca113f,zh,,徐太浪与他的父亲共同出现在哪几场戏中？,4、赛道终点，日，外 | 5、阳台上，日，外 | 6、赛道终点，日，外 | 39、小河，日，外,两人在多个场景中有共现，涉及父子互动的关键情节，包括比赛结束后的重逢、阳台对话及河边回忆场景。,Scene Grounding
24,ch65a92838a9e782e6aae93c01ec0de618faca113f,zh,,六一作为正太帮成员参与行动的场景对应的是哪几场戏？,22、拉面馆，日，内 | 23、挚爱 KTV 门口，夜，外 | 25、汽车修理厂仓库，日，内 | 36、楼顶，日，外,六一被徐正太确认为通过终极考验的成员，且在多个场景中与徐正太、徐太浪共同出现于团伙据点并参与行动，表明其以正太帮成员身份参与这些场景。,Scene Grounding
25,ch65a92838a9e782e6aae93c01ec0de618faca113f,zh,27、街道上，日，外; 45、仓库，日，内,到了三人被麻袋套头遭突袭时，此前在街道上已发生了什么关键发展？,徐太浪被麻袋套头并遭人拖走,在仓库突袭事件之前，街道场景中徐太浪已被不明人员用麻袋套头并强行带离，构成后续三人遭袭的前置关键情节。,Temporal Reasoning
26,ch65a92838a9e782e6aae93c01ec0de618faca113f,zh,35、徐正太家，日，内; 47、镜头组合,到了六一朗读被雨水浸湿的信时，此前他在徐正太家楼边已有何种关键举动？,六一在楼边情不自禁哭泣,在朗读信件之前，六一已在徐正太家楼边流露强烈情绪，这一行为构成后续传达离别消息的情感铺垫，两场景相隔十二场，叙事上呈现从私人哀伤到公开告知的递进。,Temporal Reasoning
27,ch65a92838a9e782e6aae93c01ec0de618faca113f,zh,41、徐正太家，日，外; 42、岸边，日，外,在“徐正太与徐太浪冲入火场救人”之前，哪一关键情节已经为这一幕埋下了伏笔？,发现家中着火并冲向火场,在救人行动之前，徐正太目睹自家起火并率先奔向现场，这一反应直接触发了后续两人共同救人的场景，构成事件发展的前置动因。,Temporal Reasoning
28,ch65a92838a9e782e6aae93c01ec0de618faca113f,zh,37、镜头组合; 38、超市门口，日，外,“徐太浪让徐正太原地等待后离开”之后不久，紧接着发生了什么？,37、镜头组合; 38、超市门口，日，外,徐正太在徐太浪离开后不再等待，行动上由原地转为返回家中，体现两人从共处到分离的空间位移连续性。,Temporal Reasoning
29,ch65a92838a9e782e6aae93c01ec0de618faca113f,zh,14、阳台上，日，外; 15、小镇，日，外,“徐正太拿回BB机并招呼徐太浪”之后不久，紧接着发生了什么？,徐太浪说出自己名字并接受绰号阿浪,徐正太在阳台拿回BB机并呼唤徐太浪后，两人进入小镇场景，随即开始互报姓名，徐太浪在此过程中透露本名并接受对方给的绰号‘阿浪’，情节自然推进至人物身份确认与互动调侃阶段。,Temporal Reasoning
30,ch65a92838a9e782e6aae93c01ec0de618faca113f,zh,35、徐正太家，日，内; 36、楼顶，日，外,在“徐太浪通过考验，徐正太现身揭晓真相”之前，前面先发生了什么关键情节？,三人共同干杯庆祝,在真相揭晓前的上一场戏中，三人通过共饮庆功酒达成情感高点，这一举动标志着阶段性目标的完成，为后续徐正太现身并推进剧情转折提供了时间与情绪上的衔接。,Temporal Reasoning
31,ch65a92838a9e782e6aae93c01ec0de618faca113f,zh,第34场,在第34场中，徐太浪为什么突然中断与小花的亲近，退到窗边？,听到小花说想改名为张素贞,小花：结婚前我要去一趟派出所，把名字改了，我还是想用我妈妈的姓，你觉得这个名字怎么样？张素贞。 徐太浪的嘴和小花的嘴巴近在咫尺，听到“张素贞”三个字，徐太浪睁开眼睛退到了窗户旁。,Causal-Motivational Reasoning
32,ch65a92838a9e782e6aae93c01ec0de618faca113f,zh,第16场,在第16场中，徐太浪内心最深处的担忧是什么，即使他没有亲口说出来？,担心自己会因父母未相遇而无法出生,△插入徐太浪内心独白：不行，我不能让他们两个再继续这样下去，我得找到张素贞，把她介绍给我爸，如果不是这样的话，就没有我了啊！,Character Understanding
33,ch65a92838a9e782e6aae93c01ec0de618faca113f,zh,第12场,在第12场中，徐太浪在说出父亲遗物细节之前，是什么让他突然意识到自己对过去的了解超出了正常范围？,他事先知道父亲遗像和骨灰盒的摆放位置以及电视机品牌,阿sir，我哥阿正……我爸从小特别宠他，一点都不宠我，所以我很小的时候就出去打工了，其实我一辈子都没有得到过父爱，所以他死了，我一点都不难过。 遗像里他穿得是格子衬衫，骨灰盒是暗红色的，放在电视机的旁边，电视机上盖着一块白布，你可以亲自去看一下。 电视机的牌子叫什么？日立。,Character Understanding
34,ch65a92838a9e782e6aae93c01ec0de618faca113f,zh,第33场,在第33场中，小马为什么最终选择离开录像厅，不再做放片员？,徐正太轻视他的互联网构想，否定他的专业价值,徐正太根本没兴趣听：拜托，你那拨号上网天天掉，一个电话过来就断网，我们现在都用什么？（掏出一个BB 机放在桌子上）BB 机。 你打打杀杀又不行，专业技能又没有，你出去怎么混？现在社会是很险恶的。,Causal-Motivational Reasoning
35,ch65a92838a9e782e6aae93c01ec0de618faca113f,zh,第16场,在第16场中，是什么让徐太浪下定决心亲自插手徐正太和小花的关系？,意识到徐正太与小花感情稳固且即将结婚，可能影响自己出生的因果链,△徐太浪内心独白：他们俩的感情很好，看来我只能亲自动手了，爸，对不起啊！ 徐正太：下个月结婚了。\n徐太浪听到后呛了一口，小花递给了他一杯水。,Causal-Motivational Reasoning
