id,related_scenes,question,answer,related_context,question_type,question_source
1,14、小曼家，日，外,"在[14、小曼家，日，外]中, 卢小鱼在表白时的情绪如何？",紧张且急切,卢小鱼对小曼：从第一次见到你，我就愿意为你赴汤蹈火。,Character Understanding,broad_coverage_scene
2,23、树林里，日，外,"在[23、树林里，日，外]中, 卢小鱼的身份是什么？",假扮小曼母亲的女生,那个女人慢慢转过身，原来是卢小鱼假扮的。,Character Understanding,broad_coverage_scene
3,29、卢小鱼住处，夜，外,卢小鱼小弟为什么按掉卢小鱼的电话？,因卢小鱼打算打电话提亲，而小弟认为应打给爷爷,按了一下手机给他挂掉）被胜利的喜悦冲昏头脑了啊，提亲应该打电话给爷爷啊,Causal-Motivational Reasoning,broad_coverage_scene
4,29、卢小鱼住处，夜，外,卢小鱼为什么收敛脸上的笑容？,因卢小鱼小弟质疑他的开心源于追到小曼,对哦！可是我怎么感觉你的开心是来源于追到了小曼呢？卢小鱼收敛住了脸上的笑容,Causal-Motivational Reasoning,broad_coverage_scene
5,15、堕落街，日，外,"在[15、堕落街，日，外]中, 卢小鱼的情绪状态如何？",急切且寻求帮助,卢小鱼起身离开：我再问问别人。,Character Understanding,broad_coverage_scene
6,20、蔡老板家，夜，内,"在[20、蔡老板家，夜，内]中, 蔡老板的威胁是什么？",把卢小鱼扔进田里当肥料,我就把你装进麻袋扔进田里当肥料,Character Understanding,broad_coverage_scene
7,43、酒吧，日，内,卢小鱼对小曼表达了什么意愿？,愿意为她赴汤蹈火。,△卢小鱼：从第一次见到你，我就愿意为你赴汤蹈火。,Character Understanding,broad_coverage_scene
8,46、卢小鱼住处，夜，外,黄杰瑞认为什么样的人能发挥最本真之味？,用情至深的人,仅此类人方可作出世间最本真之味，但也因用情至深,Character Understanding,broad_coverage_scene
9,46、卢小鱼住处，夜，外,在[46、卢小鱼住处，夜，外]中，黄杰瑞的画外音中提到什么条件会导致天赋之力冲破束缚？,情感受创后再次创伤,如若情感受创，感知会自行封闭，直觉不仅及常人，直至再受创伤，其天赋之力，又将会冲破束缚，水到渠成，王者归来。,Character Understanding,broad_coverage_scene
10,45、病房，夜，内,梅姐提出什么建议？,联手去挑战，把堕落街赢回来吧！,梅姐：要不我们联手去挑战，把堕落街赢回来吧！,Character Understanding,broad_coverage_scene
11,52、医院，日，内,黄杰瑞认为厨圣的真正原因是什么？,超强的感知力接收到更多信息并指导烹饪方式,黄杰瑞：原来厨圣并不是厨艺高强而是靠超强的感知力让自己在触摸食材时接收到比常人多百倍的信息，并立刻想到最适合的烹饪方式来指导搭配，这远远超越了技法本身。,Character Understanding,broad_coverage_scene
12,32、堕落街，夜，外,建国对‘男朋友’称谓有何反应？,质问为什么用‘男朋友’称谓,建国举着哑铃似乎很愤怒：为什么是男朋友这种称谓？,Character Understanding,broad_coverage_scene
13,40、堕落街，夜，外,小曼为什么在喝汤后突然唱歌？,因为黄杰瑞的汤让她感到温暖充满爱,好温暖啊，整个世界都充满了爱，愿世界和平。,Causal-Motivational Reasoning,broad_coverage_scene
14,35、卢小鱼住处，夜，外,卢小鱼小弟离开后为什么把钱扔在卢小鱼脚下？,表达对卢小鱼的不满,卢小鱼小弟离开了，把钱扔在了卢小鱼脚下。,Causal-Motivational Reasoning,broad_coverage_scene
15,37、殡仪馆，夜，内,卢小鱼为什么栽倒下去？,四大金刚朝他扑过来,四大金刚朝他扑了过来,Causal-Motivational Reasoning,broad_coverage_scene
16,31、卢小鱼住处，夜，外,卢小鱼如何评价自己的行为？,质疑自己放弃前程是否合理,我身为一个麻木无情的枭雄，放弃大好的前程不要去喜欢一个女张翼德，这样合理吗？,Character Understanding,broad_coverage_scene
17,53、发布会会场，日，内,提鲜粉的作用是什么？,让人的味觉产生间歇性麻痹，再吃其他菜没味儿。,我在汤母的锅里放了咱们公司的提鲜粉，吃了会上瘾的，一定要替我保密啊，这种鲜味儿，会让人的味觉产生间歇性的麻痹，再吃你们的菜，当然就没味儿了。,Scene Grounding,broad_coverage_scene
18,8、招牌小吃，夜，内,"在[8、招牌小吃，夜，内]中, 黄杰瑞拿出的黄色碟片包含哪些内容？",《夫妻恩爱秘籍》、《我与神笔马良的一段情》,黄杰瑞将衣服扯开，露出了挂在衣服内侧的黄色碟片。黄杰瑞：《夫妻恩爱秘籍》、《我与神笔马良的一段情》，店长推荐。,Scene Grounding,broad_coverage_scene
19,44、街道，夜，外,为什么卢小鱼小弟要回来？,因为卢小鱼得心脏病了，要继承他的金银珠宝。,你都得心脏病了，我得回来继承你这身金银珠宝啊！,Causal-Motivational Reasoning,broad_coverage_scene
20,26、堕落街，日，外,"在[26、堕落街，日，外]中, 新佑卫门的自我评价如何？",认为自己无敌,看来新佑卫门无敌记录，在中国也能保持下去了。,Character Understanding,broad_coverage_scene
21,27、招牌小店，夜，内,在黄杰瑞用毛衣针将蔡老板的衣服变成毛衣后，蔡老板表现出怎样的心理状态？,蔡老板感到羞怒和狼狈，急于摆脱窘境。,蔡老板低头发现衣服变成缠满线团的毛衣后急忙挣扎扯下，满脸羞怒，顾不上多言就拉起随从离开。,Character Understanding,broad_coverage_scene
22,47、卢小鱼住处，日，外 | 49、发布会现场，日，内,卢小鱼为什么选择用厨艺对决的方式来阻止蔡老板获得堕落街的控制权？,因为卢小鱼希望通过一场有明确胜负规则的公开挑战，以自己的超能力厨艺赢回堕落街的归属权，同时避免秘籍落入蔡老板之手。,卢小鱼提出以厨艺对决决定堕落街归属，若赢则收回堕落街，若输则交出秘籍电子版，且该挑战得到蔡老板和汤母的同意。,Causal-Motivational Reasoning,broad_coverage_event_chain
23,2、龙凤酒楼，日，内 | 27、招牌小店，夜，内,为什么蔡老板在龙大师演唱《水手》时能够迅速压制其气势并赢得现场支持？,因为蔡老板紧接着带领黑衣人整齐鞠躬并合唱《三百六十五个祝福》，以更有组织和感染力的集体仪式扭转了现场氛围。,蔡老板带领黑衣人鞠躬后高唱《三百六十五个祝福》，黑衣人列队拍手助阵并高喊‘厨圣’，现场气氛完全转向支持蔡老板。,Causal-Motivational Reasoning,broad_coverage_event_chain
24,43、酒吧，日，内 | 40、堕落街，夜，外 | 49、发布会现场，日，内,小曼在当众殴打蔡老板后，对卢小鱼表达了怎样的情感态度？,小曼转身走向卢小鱼，直视着他，公开称赞他有情、有义、有胆、有品，并表示支持他。,小曼打完蔡老板后走向卢小鱼，当众称他为‘四有新人’并表明支持。,Character Understanding,broad_coverage_event_chain
25,2、龙凤酒楼，日，内 | 8、招牌小吃，夜，内,为什么蔡老板在看到建国烤羊腿时会觉得场面太残忍？,因为建国在空中旋转烤羊腿的动作让蔡老板联想到自己童年为保卫祖国拼命锻炼的痛苦回忆，产生了情感上的共鸣与不适。,蔡老板曾回忆小时候为保卫祖国拼命锻炼，而建国在空中旋转烤羊腿的行为唤起了类似的画面和感受。,Causal-Motivational Reasoning,broad_coverage_event_chain
26,48、街道，日，外 | 49、发布会现场，日，内,为什么卢小鱼在提出厨艺对决后还要求几分钟时间？,因为卢小鱼想利用这几分钟时间与堕落街的伙伴们沟通，组织人手为即将到来的对决做准备。,卢小鱼提出对决后请求几分钟时间，要和堕落街的伙伴们说几句话，组织人手准备应战。,Causal-Motivational Reasoning,broad_coverage_event_chain
27,43、酒吧，日，内 | 40、堕落街，夜，外 | 49、发布会现场，日，内,小曼在什么情况下表现出对卢小鱼的情感支持，这种支持反映了她怎样的内心状态？,小曼在当众殴打蔡老板后，转身向卢小鱼表达支持，称他是有情有义有胆有品的四有新人，这反映了她对真诚情感的珍视和对虚伪势力的愤怒。,小曼因蔡老板讥讽卢小鱼而动手打人，随后当众肯定卢小鱼的品格并表示支持。,Character Understanding,broad_coverage_event_chain
28,10、堕落街，日，外 | 49、发布会现场，日，内,卢小鱼为什么选择用厨艺对决的方式来争夺堕落街的归属？,因为卢小鱼希望通过一场有明确胜负规则的公平较量来决定堕落街的归属，同时以秘籍电子版作为失败的代价来增加挑战的可信度和约束力。,卢小鱼提出以厨艺对决决定堕落街的归属，并约定自己赢则收回堕落街，输则将秘籍电子版交给蔡老板，以此建立双方认可的博弈机制。,Causal-Motivational Reasoning,broad_coverage_event_chain
29,8、招牌小吃，夜，内,蔡老板在吃烤羊腿时流露出怎样的情感状态，这种状态如何影响女助理的态度？,蔡老板在吃烤羊腿时流露出对童年保卫祖国经历的深情回忆，表现出深沉而感伤的情感状态，这使原本对料理不以为然的女助理转为积极态度，开始称赞菜肴并鼓掌。,蔡老板吃烤羊腿时回忆起小时候为保卫祖国拼命锻炼，神情深远；女助理听到后立刻改口称赞并拍手，态度明显转变。,Character Understanding,broad_coverage_scene
30,38、殡仪馆食堂，夜，内,为什么中年女人在听到卢小鱼提到杰瑞后突然攻击他？,因为中年女人听到杰瑞这个名字后情绪失控，似乎对这个名字有强烈的情感反应，导致她立即逼问卢小鱼并攻击他。,卢小鱼提到杰瑞后，中年女人停下勺子，冲向他并掐住他的脖子逼问杰瑞的下落。,Causal-Motivational Reasoning,broad_coverage_scene
31,26、堕落街，日，外 | 27、招牌小店，夜，内,在新佑卫门与黄杰瑞的厨艺对决前，新佑卫门因回忆起什么经历而表现出沉静的神情？,新佑卫门因回忆起自己在好再来海鲜市场挑选海鲜并用‘千刃一刀流’迅速处理大虾的经历而表现出沉静的神情。,新佑卫门站在餐桌前回忆起为准备食材前往好再来海鲜市场，用刀快速将跃起夹住他手的大虾切成均匀片状。,Character Understanding,broad_coverage_event_chain
32,39、堕落街，夜，外 | 27、招牌小店，夜，内,在蔡老板带人指认黄杰瑞后，汤母表现出怎样的心理状态？,汤母内心产生动摇，怀疑自己可能认错了人，认为那个风流但不至于做那种事的人不像是黄杰瑞。,汤母站在门口神情波动，低声嘀咕会不会是自己搞错了，那个人虽然风流但不像是会做出那种事的人。,Character Understanding,broad_coverage_event_chain
33,48、街道，日，外 | 49、发布会现场，日，内,卢小鱼提出与蔡老板进行厨艺对决的条件是什么，这些条件对双方各自意味着什么？,卢小鱼提出，如果他赢了厨艺对决，堕落街的归属权将归还给他；如果他输了，他将把秘籍的电子版交给蔡老板。,卢小鱼提出以厨艺对决决定堕落街的归属，并说明胜负对应的条件：胜则收回堕落街，败则交出秘籍电子版。,Causal-Motivational Reasoning,broad_coverage_event_chain
34,2、龙凤酒楼，日，内 | 27、招牌小店，夜，内,蔡老板在洗澡时对龙大师的菜表现出怎样的情绪状态，原因是什么？,蔡老板在洗澡时表现出强烈的不满和愤怒，因为他觉得龙大师的菜难吃且让他身上沾上了怪味，不得不立即洗澡清除。,蔡老板一边洗澡一边怒斥龙大师的菜难吃如猪食，并称其导致自己一身怪味，必须洗澡去除。,Character Understanding,broad_coverage_event_chain
35,2、龙凤酒楼，日，内 | 27、招牌小店，夜，内,蔡老板在被黄杰瑞用毛衣针攻击后表现出怎样的情绪和反应？,蔡老板感到羞怒，急忙挣扎着扯下变成毛衣的衣服，动作狼狈，随后不发一言地拉着随从离开。,蔡老板低头发现衣服异样后急忙挣扎扯下毛衣，满脸羞怒，随即拉起随从转身离开。,Character Understanding,broad_coverage_event_chain
36,12、小曼家，日，内|14、小曼家，日，外,故事发展中，卢小鱼和小曼的关系最终应如何概括？,从爱慕转为单方面情感倾向,早期卢小鱼与小曼的关系是爱慕；后期变为单方面情感倾向。,Role-Relation Continuity,supplementary_cross_scene
37,14、小曼家，日，外|24、田间街道，夜，外,卢小鱼与小曼的关系应如何概括其从早期到后期的发展？,从单方面情感倾向转为共同处境中的同伴,早期卢小鱼与小曼的关系是单方面情感倾向；后期变为共同处境中的同伴。,Role-Relation Continuity,supplementary_cross_scene
38,26、堕落街，日，外|27、招牌小店，夜，内,哪个事件的发生最直接地打断了原有情节，并将故事引向黄杰瑞用毛衣针让蔡老板出丑的转折？发生在在新佑卫门与小曼、卢小鱼的对峙中,新佑卫门纠正他人对名字的错误称呼,在情节单元2中，新佑卫门在索要秘籍时纠正了他人对名字的错误称呼，这一事件导致对峙转折，随后新佑卫门离开，黄杰瑞介入并戏弄蔡老板。,Narrative Progression,supplementary_cross_scene
39,2、龙凤酒楼，日，内|33、卢小鱼住处，夜，外|37、殡仪馆，夜，内,哪个角色在故事中与蔡老板有合作关系，同时与卢小鱼小弟和四大金刚都处于敌对状态？,卢小鱼,卢小鱼与蔡老板是合作，与卢小鱼小弟是持续敌对，与四大金刚是持续敌对。,Role-Relation Continuity,supplementary_cross_scene
40,9、小曼家，日，内|27、招牌小店，夜，内|40、堕落街，夜，外,哪个角色在剧本中与卢小鱼处于敌对关系，同时又是爷爷的孙女，并且与黄杰瑞有祖孙关系？,小曼,小曼与卢小鱼是敌对，与爷爷是孙女，与黄杰瑞是祖孙。,Role-Relation Continuity,supplementary_cross_scene
41,48、街道，日，外|49、发布会现场，日，内,卢小鱼从厨艺展示失败的沮丧到公开呼吁公众关注真相，这一转变的关键推动事件是什么？,卢小鱼提出厨艺挑战,情节单元2：卢小鱼从威亚上摔下后站起身，面对蔡老板掏出一个U盘，提出以厨艺对决决定堕落街的归属。,Narrative Progression,supplementary_cross_scene
42,25、蔡老板家，夜，内|49、发布会现场，日，内,哪个事件起到了关键的推动作用？,卢小鱼提出厨艺挑战,情节单元2描述：卢小鱼从威亚上摔下后站起身，面对蔡老板掏出一个U盘，提出以厨艺对决决定堕落街的归属；如果他赢了，堕落街归还给他。,Narrative Progression,supplementary_cross_scene
