id,movie_id,language,related_scenes,question,answer,evidence_or_reason,question_type
1,enae65d9ec6fc04e98899464a06a5ccf62,en,34、INT. NORLAND PARK - BREAKFAST ROOM - DAY,What does Fanny aim to achieve by discussing Edward's future while observing him with Elinor?,Prevent Edward from marrying a penniless woman,"Fanny stands by the window watching Elinor and Edward in the garden. When Mrs Dashwood joins her and expresses warmth toward Edward, Fanny cautions that while Edward is kind, he may be inclined to make an imprudent match with a woman of no fortune, which would jeopardize his future. She emphasizes their mother’s firm stance that he must marry advantageously and will be disinherited otherwise, ultimately seeking to dissuade any attachment between Edward and Elinor.",Character Understanding
2,enae65d9ec6fc04e98899464a06a5ccf62,en,25、INT. NORLAND PARK - ENTRANCE HALL OUTSIDE LIBRARY - DAY,What does Edward resolve to do after overhearing Elinor at the door?,Intervene in the situation,"Edward stands outside, listening as Elinor speaks through the half-open door, urging Margaret to come out. Her voice is gentle but met with silence. Fanny passes by with a butler, giving instructions, unaware of Edward’s presence. He pretends to examine the mouldings until they move on. After a moment of stillness, Edward straightens, his expression resolving, and takes a step toward the door.",Character Understanding
3,enae65d9ec6fc04e98899464a06a5ccf62,en,28、INT. NORLAND PARK - VELVET ROOM - ANOTHER DAY,What does Edward recognize upon seeing Elinor in the doorway?,Elinor is grieving silently,"Edward enters the room and observes Elinor standing motionless, her posture conveying sorrow as she listens to Marianne play. He notices her tear-streaked face when she turns, and though she attempts to compose herself, he silently offers his handkerchief—a gesture she accepts with quiet gratitude. Their brief exchange about Margaret and a walk to the tree-house follows, but the moment is charged with unspoken understanding. Above, Mrs Dashwood smiles approvingly while Fanny watches with clear disapproval, underscoring the emotional weight of the encounter.",Character Understanding
4,enae65d9ec6fc04e98899464a06a5ccf62,en,7、INT. NORLAND PARK - MRS DASHWOOD'S BEDROOM - DAY,How does Elinor respond to her mother's emotional breakdown over losing their home?,She resolves to begin making inquiries for a new house immediately.,"Mrs. Dashwood becomes overwhelmed while packing, laments being forced to leave her home, and collapses in tears. Elinor observes quietly, acknowledges they have nowhere to go, then announces she will start looking for a new house right away.",Character Understanding
5,enae65d9ec6fc04e98899464a06a5ccf62,en,37、INT/EXT. NORLAND PARK - STABLES - DAY,What happens when Fanny arrives at the stables during Edward and Elinor's conversation?,Fanny interrupts with urgent news and takes Edward away,"Fanny approaches Edward and Elinor at the stables, waving a letter and insisting Edward come to London immediately due to family emergencies. Edward resists, noting he was already planning to leave that afternoon, but Fanny dismisses his objection and insists it is urgent. She physically pulls him away while maintaining control, and Edward shares a tense final glance with Elinor before departing.",Scene Grounding
6,enae65d9ec6fc04e98899464a06a5ccf62,en,32、INT. NORLAND PARK - MORNING ROOM - DAY,What does Mrs. Dashwood conclude about Edward and Elinor during their conversation in the morning room?,She suspects their mutual attachment,"In the morning room at Norland Park, Mrs. Dashwood tells Marianne that she believes Edward and Elinor have formed an attachment. Marianne hesitates, finding Edward too sedate, especially in his reserved manner of reading aloud the previous evening. Mrs. Dashwood counters that his calm nature complements Elinor’s temperament. As Marianne questions whether such subdued affection can sustain true love—invoking passionate ideals embodied by Juliet, Guinevere, and Heloise—Mrs. Dashwood points out the tragic ends of those women. Marianne insists such deaths were glorious, not pitiable, and declares she may never find a man who meets her exacting standards for love and expression.",Scene Grounding
7,enae65d9ec6fc04e98899464a06a5ccf62,en,36、INT. NORLAND PARK - DINING ROOM - EVE,What action takes place in the dining room at Norland Park that sets the family's immediate future in motion?,Mrs Dashwood announces relocation to Barton Cottage,"In the dining room at Norland Park, Mrs Dashwood informs her family that they will be moving to Barton Cottage, a modest house offered by her cousin Sir John Middleton. The announcement visibly affects Edward, who appears distressed, while Fanny smirks and comments on the snugness of cottages. Mrs Dashwood notes the reactions of Edward and Elinor, who remains composed, and affirms their departure timeline when questioned. Margaret extends an invitation for Edward to visit, which he accepts warmly, though Fanny interjects with reminders of his obligations to his mother.",Scene Grounding
8,enae65d9ec6fc04e98899464a06a5ccf62,en,29、EXT. NORLAND PARK - GARDENS - DAY; 37、INT/EXT. NORLAND PARK - STABLES - DAY,What action immediately before Fanny's interruption creates the moment she disrupts?,Edward approaches Elinor near the horse,"Edward approaches Elinor as she stands near her horse, stroking its face. He calls her by her Christian name in a soft and tender tone, causing her to pause, then moves closer to speak with her about something of great importance, his manner earnest and hesitant. As he begins to address her, the horse breathes between them, marking the intimacy and tension of the moment—just before Fanny arrives with a letter and pulls Edward away.",Causal-Motivational Reasoning
9,enae65d9ec6fc04e98899464a06a5ccf62,en,28、INT. NORLAND PARK - VELVET ROOM - ANOTHER DAY; 28、INT. NORLAND PARK - VELVET ROOM - ANOTHER DAY,What interaction directly prompts Edward and Elinor's walk to the tree-house?,Elinor thanks Edward for helping Margaret improve,"In the velvet room at Norland Park, Elinor expresses gratitude to Edward for his positive influence on Margaret, noting how much the girl has changed since his arrival. Edward responds warmly, asking if she would do him the honour of showing him Margaret's tree-house, citing the fine weather. Elinor agrees with pleasure, and they begin walking together, their conversation continuing as they exit the room.",Causal-Motivational Reasoning
10,enae65d9ec6fc04e98899464a06a5ccf62,en,21、INT. NORLAND PARK - DRAWING ROOM - DAY; 37、INT/EXT. NORLAND PARK - STABLES - DAY,What moment of shared realization between the sisters foreshadows Elinor's later emotional response as she watches Edward leave?,Marianne and Elinor exchange surprised glances,"In the drawing room at Norland Park, after Edward stammers through an explanation about a mix-up with the guest rooms, Marianne and Elinor briefly lock eyes in mutual surprise, registering something unspoken beneath his awkwardness. Their silent exchange captures a moment of joint awareness, one that underscores Elinor’s restrained reaction later when Edward departs abruptly with Fanny, leaving her to watch him go in quiet sorrow.",Causal-Motivational Reasoning
11,enae65d9ec6fc04e98899464a06a5ccf62,en,29、EXT. NORLAND PARK - GARDENS - DAY; 37、INT/EXT. NORLAND PARK - STABLES - DAY,What earlier revelation explains why Fanny abruptly removes Edward from Norland Park?,Edward reveals his mother's ambitions for his public distinction,"During a walk in the gardens, Edward confides in Elinor about his desire for a quiet life in the countryside, possibly as a clergyman, but contrasts this with his mother's insistence on securing distinction for him—any role that brings status and visibility will suffice, from politics to the military. He resents the pressure, especially her disdain for modest ambitions and his own dislike of London’s social demands. This tension clarifies Fanny’s later intervention, when she arrives with urgent news from Edward’s mother, insisting he return to London immediately to attend to family affairs, overriding his plans and pulling him away from Elinor.",Causal-Motivational Reasoning
12,enae65d9ec6fc04e98899464a06a5ccf62,en,25、INT. NORLAND PARK - ENTRANCE HALL OUTSIDE LIBRARY - DAY; 37、INT/EXT. NORLAND PARK - STABLES - DAY,"By the time Elinor watches Edward leave, what has already taken place just before his departure?",Edward keeps a discreet lookout outside the door,"In the entrance hall outside the library, Edward pauses by the door, listening and scanning the surroundings before stepping away. This moment of hesitation and vigilance precedes his departure from Norland Park, which Elinor later observes from a distance near the stables.",Temporal Reasoning
13,enae65d9ec6fc04e98899464a06a5ccf62,en,7、INT. NORLAND PARK - MRS DASHWOOD'S BEDROOM - DAY; 24、INT. NORLAND PARK - VELVET ROOM - DAY,"By the time Elinor and Marianne begin reviewing housing letters, what key concern has Elinor already expressed?",Elinor Dashwood voices concern about having no alternative residence,"In an earlier scene at Norland Park, Elinor expresses anxiety over the family’s lack of a future home, setting in motion the practical efforts that later culminate in her and Marianne sorting through housing correspondence.",Temporal Reasoning
14,enae65d9ec6fc04e98899464a06a5ccf62,en,51、INT. BARTON PARK - MUSIC ROOM - EVE; 154、INT. CLEVELAND - UPSTAIRS CORRIDOR - DAY,How does the relationship between Colonel Brandon and Elinor Dashwood evolve from a moment of cautious regard into a functional dynamic by the later stages of their interaction?,they become trusted confidants who exchange sensitive information and provide mutual support,"From their initial encounter where Elinor observes Colonel Brandon with puzzled concern, their relationship develops through shared responsibilities and emotional disclosures. He invites her and her sister on a picnic, signaling social inclusion, and later confides in her about Beth's situation, revealing personal vulnerabilities. By the upstairs corridor scene at Cleveland, he offers urgent assistance, reflecting an established bond of trust and reciprocal care, marked by discretion and emotional restraint.",Role-Relation Continuity
15,enae65d9ec6fc04e98899464a06a5ccf62,en,56、EXT. BARTON PARK - GARDENS - DAY; 150、INT. CLEVELAND - BREAKFAST ROOM - DAY,How does the relationship between Charlotte and Colonel Brandon evolve from their initial social connection to their interaction during the child's illness?,They maintain a supportive and caring alliance throughout.,"From the gardens at Barton Park, where Mrs. Jennings reflects on Charlotte possibly cheering up Colonel Brandon, to their shared journey in the Palmers' carriage, and finally in the breakfast room at Cleveland where Charlotte urges Brandon not to worry about his recovering child, their relationship consistently reflects mutual care and companionship. The bond begins as a socially acknowledged affinity and endures through moments of personal crisis, demonstrating continuity in their supportive dynamic.",Role-Relation Continuity
16,enae65d9ec6fc04e98899464a06a5ccf62,en,114、INT. MRS JENNINGS'S HOUSE - STUDY - DAY; 182、INT. BARTON COTTAGE - PARLOUR - DAY,What specific role does Marianne continue to hold in relation to Edward from their reunion to the visit at Barton Cottage?,trusted acquaintance,"Marianne initially greets Edward with warm affection and expresses deep trust in his character [scene 114], and later interacts with him in a polite, supportive manner that reflects an established but less intimate connection [scene 182].",Role-Relation Continuity
17,enae65d9ec6fc04e98899464a06a5ccf62,en,36、INT. NORLAND PARK - DINING ROOM - EVE; 36、INT. NORLAND PARK - DINING ROOM - EVE; 36、INT. NORLAND PARK - DINING ROOM - EVE,What turning point initiates the shift in focus toward the arrangements and tensions surrounding the move to Barton Cottage and Edward's uncertain future?,Marianne and Mrs. Dashwood Discuss Edward and Elinor,"In the morning room at Norland Park, Marianne and Mrs. Dashwood have a candid conversation about Edward's prospects and Elinor's apparent detachment, which crystallizes the growing uncertainty around the family's future and sets in motion the decisions that lead to the invitation to Barton Cottage, Fanny's warnings, and the changing dynamics between the characters.",Narrative Progression
18,enae65d9ec6fc04e98899464a06a5ccf62,en,36、INT. NORLAND PARK - DINING ROOM - EVE; 36、INT. NORLAND PARK - DINING ROOM - EVE; 36、INT. NORLAND PARK - DINING ROOM - EVE,"What event sets in motion the sequence leading to the invitations to Barton Cottage, the discussions about the move, and Edward's abrupt departure?",Mrs Dashwood Announces the Move to Barton Cottage,"In the dining room at Norland Park, Mrs Dashwood informs her daughters of their impending relocation to Barton Cottage, a decision that reshapes the family's social and emotional trajectory. This announcement directly initiates the planning and reactions that follow, including the outreach to new acquaintances, internal family deliberations, and the disruption of Edward's visit when Fanny intervenes. [36、INT. NORLAND PARK - DINING ROOM - EVE]",Narrative Progression
19,enae65d9ec6fc04e98899464a06a5ccf62,en,29、EXT. NORLAND PARK - GARDENS - DAY; 29、EXT. NORLAND PARK - GARDENS - DAY; 29、EXT. NORLAND PARK - GARDENS - DAY,What pivotal moment shifts the narrative toward Edward's reflections on his future and subsequent interruption by Fanny?,Edward Shares His Hopes and Family Pressures with Elinor,"In a garden at Norland Park, Edward confides in Elinor about his aspirations and the weight of familial expectations, revealing tensions that set the stage for his later expressions of longing for a quiet life and his vocational uncertainties. This private exchange marks a shift in the story’s direction, preceding Fanny’s abrupt intervention that pulls Edward away and disrupts the growing intimacy between him and Elinor. [29、EXT. NORLAND PARK - GARDENS - DAY]",Narrative Progression
20,enae65d9ec6fc04e98899464a06a5ccf62,en,28、INT. NORLAND PARK - VELVET ROOM - ANOTHER DAY; 28、INT. NORLAND PARK - VELVET ROOM - ANOTHER DAY; 28、INT. NORLAND PARK - VELVET ROOM - ANOTHER DAY,"What pivotal event sets in motion Edward and Elinor's walk to the tree-house, followed by Mrs. Dashwood and Fanny observing from the staircase and Fanny's interruption?",Elinor Thanks Edward for Helping Margaret,"In the velvet room at Norland Park, Elinor expresses her gratitude to Edward for assisting Margaret, marking a shift in their interactions and prompting a series of consequential moments between the characters. This exchange subtly alters the emotional dynamics, leading directly to the walk to the tree-house and the tense observation from the staircase. [28、INT. NORLAND PARK - VELVET ROOM - ANOTHER DAY]",Narrative Progression
21,enae65d9ec6fc04e98899464a06a5ccf62,en,,Who are the 3 most central characters in this story?,"Elinor Dashwood, Marianne, Mrs Dashwood",,Character Understanding
22,enae65d9ec6fc04e98899464a06a5ccf62,en,,"Which scene or scenes best match the following description: Mrs Dashwood told the family that they would be moving to Barton Cottage, a small house offered by her cousin Sir John Middleton on his estate. Edward appeared deeply affected by the news, his face falling at the announcement. Fanny, in contrast, smiled and",36、INT. NORLAND PARK - DINING ROOM - EVE | 37、INT/EXT. NORLAND PARK - STABLES - DAY,"Mrs Dashwood told the family that they would be moving to Barton Cottage, a small house offered by her cousin Sir John Middleton on his estate. Edward appeared deeply affected by the news, his face falling at the announcement. Fanny, in contrast, smiled and",Scene Grounding
23,enae65d9ec6fc04e98899464a06a5ccf62,en,,In which scene or scenes are Mrs. Jennings and Robert Ferrars both present?,91、INT. BARTON PARK - DRAWING ROOM - EVE | 105、INT. GRAND BALLROOM - EVE | 109、INT. COFFEE-HOUSE - COVENT GARDEN - DAY | 121、INT. MRS JENNINGS'S HOUSE - BEDROOM - DAY,"{""pair"": [""Mrs. Jennings"", ""Robert Ferrars""], ""pair_mentions"": 25, ""scene_grounding_subtype"": ""copresence_localization"", ""scene_count"": 4, ""scene_numbers"": [91, 105, 109, 121], ""scene_titles"": [""91、INT. BARTON PARK - DRAWING ROOM - EVE"", ""105、INT. GRAND BALLROOM - EVE"", ""109、INT. COFFEE-HOUSE - COVENT GARDEN - DAY"", ""121、INT. MRS JENNINGS'S HOUSE - BEDROOM - DAY""]}",Scene Grounding
24,enae65d9ec6fc04e98899464a06a5ccf62,en,,In which scene or scenes is Lucy Steele acting as a member of Secret Engagement?,91、INT. BARTON PARK - DRAWING ROOM - EVE | 94、INT. MRS JENNINGS'S CARRIAGE - ROAD TO LONDON - DAY | 121、INT. MRS JENNINGS'S HOUSE - BEDROOM - DAY,"{""character"": ""Lucy Steele"", ""role_label"": ""Secret Engagement"", ""relation_names"": [""is part of"", ""is part of the secret engagement""], ""descriptions"": [""Lucy is directly involved in the Secret Engagement, which is a formal arrangement between her and Edward Ferrars, indicating her institutional or relational affiliation with the concept."", ""Lucy is directly involved in the secret engagement, which is a defined Concept representing a binding relational status between her and Edward, indicating institutional or social affiliation with that arrangement.""], ""scene_grounding_subtype"": ""role_state_localization"", ""scene_count"": 3, ""scene_numbers"": [91, 94, 121], ""scene_titles"": [""91、INT. BARTON PARK - DRAWING ROOM - EVE"", ""94、INT. MRS JENNINGS'S CARRIAGE - ROAD TO LONDON - DAY"", ""121、INT. MRS JENNINGS'S HOUSE - BEDROOM - DAY""]}",Scene Grounding
25,enae65d9ec6fc04e98899464a06a5ccf62,en,,In which scene or scenes is Miss Grey clearly present?,108、INT. MRS JENNINGS'S HOUSE - BEDROOM - DAY | 109、INT. COFFEE-HOUSE - COVENT GARDEN - DAY | 127、EXT. THE PALMERS' CARRIAGE - OPEN ROAD - DAY,"{""character"": ""Miss Grey"", ""mention_total"": 9, ""scene_span"": 20, ""scene_grounding_subtype"": ""entity_presence_localization"", ""scene_count"": 3, ""scene_numbers"": [108, 109, 127], ""scene_titles"": [""108、INT. MRS JENNINGS'S HOUSE - BEDROOM - DAY"", ""109、INT. COFFEE-HOUSE - COVENT GARDEN - DAY"", ""127、EXT. THE PALMERS' CARRIAGE - OPEN ROAD - DAY""]}",Scene Grounding
26,enae65d9ec6fc04e98899464a06a5ccf62,en,,"In which scene or scenes does Edward observe Elinor standing silently as she listens to Marianne playing a concerto, before she turns upon sensing his presence?",28、INT. NORLAND PARK - VELVET ROOM - ANOTHER DAY | 29、EXT. NORLAND PARK - GARDENS - DAY,"Edward enters the doorway and sees Elinor with her back to him, still and sorrowful as she listens to Marianne's concerto. She turns, sensing his presence, and their eyes meet. The moment unfolds across two connected settings—the interior Velvet Room and the exterior Gardens—capturing the transition from private observation to quiet interaction.",Scene Grounding
