id,movie_id,language,related_scenes,question,answer,related_context,question_type
1,ene827f5ab63c84c2eb5d32f6d149e9b5d,en,41、INT. CHUCK'S HOUSE - LATER,What action does Chuck take after realizing watching TV won't distract him from his thoughts about Kelly?,He leaves his apartment to find her.,"Chuck lies in bed late at night and turns on the TV, but it fails to take his mind off Kelly. He gets up and decides to act, departing his apartment with the clear intent to locate her.",Character Understanding
2,ene827f5ab63c84c2eb5d32f6d149e9b5d,en,39、INT. CHUCK'S HOUSE - MOMENTS LATER,What is Chuck trying to achieve when Chuck notices two fish floating motionless on the surface of the tank?,Secure a useful lead,"After the filter sputters back to life, Chuck notices two fish floating motionless on the surface of the tank. He picks up a scoop and carefully skims them out of the water, moving slowly as he lifts each one from the tank.",Character Understanding
3,ene827f5ab63c84c2eb5d32f6d149e9b5d,en,20、INT. FEDEX OFFICES - DAY,What does Chuck aim to address upon discovering the package behind the sorting table?,Prevent oversight in package handling,"During the inspection, Chuck notices a package stuck behind a sorting table, pulls it out, and reflects on its possible contents, emphasizing the importance of timely delivery. A sorter adjusts the table against the wall to prevent recurrence, and Chuck observes the interaction between Yuri and the translator, who cites staffing challenges, prompting Chuck’s sharp look before he continues.",Character Understanding
4,ene827f5ab63c84c2eb5d32f6d149e9b5d,en,34、INT. MD-11 - NIGHT,What realization motivates Stan to approach Chuck while he is looking at the sailboat image?,Chuck has unused vacation tied to Kelly,"Stan notices Chuck viewing a sailboat image on his PowerBook, which Chuck explains was from a charter he and Kelly once took. When Stan observes that Chuck has accumulated vacation days, Chuck dismisses their use, revealing an emotional detachment from past experiences linked to Kelly.",Character Understanding
5,ene827f5ab63c84c2eb5d32f6d149e9b5d,en,46、INT. XEROX ROOM,What happens when Kelly intervenes in the Xerox room?,Kelly pulls Chuck away from the Xerox machine,"Chuck is attempting to fix a jammed Xerox machine, his hands stained with toner, when Kelly enters and pulls him away. She questions him about his recent trip to Russia, pressing him to open up. Chuck expresses defeat, admitting he couldn’t fix the machine or make sense of his experience. Kelly observes his disoriented state and, after a moment, tells him to come with her.",Scene Grounding
6,ene827f5ab63c84c2eb5d32f6d149e9b5d,en,20、INT. FEDEX OFFICES - DAY,What action initiates the team inspection in the FedEx offices?,Chuck presents delivery time discrepancy to staff,"Chuck opens the performance review by highlighting systemic inefficiencies and emphasizing team interdependence, then leads a walkthrough of the sorting area to identify operational flaws, beginning with his presentation of a delivery time discrepancy to the staff.",Scene Grounding
7,ene827f5ab63c84c2eb5d32f6d149e9b5d,en,32、INT. MD-11 - MOMENTS LATER,What action initiates the interaction between Stan and Chuck in the MD-11 cockpit?,Stan boards the aircraft and joins Chuck,"Stan enters the MD-11 cockpit and takes a seat beside Chuck, marking the start of their conversation. They exchange greetings that reflect their established rapport, and Stan inquires about the outcome of Chuck's recent delivery. Chuck reports success, noting that the good guys won this time. As the plane taxis, Chuck expresses pride in their teamwork, but Stan deflects, revealing he rerouted Chuck's flight the previous night to maintain a critical connection. This sparks a disagreement about priorities—Chuck emphasizes individual deliveries and people, while Stan insists on the larger operational picture.",Scene Grounding
8,ene827f5ab63c84c2eb5d32f6d149e9b5d,en,44、INT. LAB - NIGHT; 46、INT. XEROX ROOM,What prompts Chuck to help Kelly with the Xerox machine when he returns?,Chuck enters the room and asks about Kelly Frears,"Chuck arrives in a shared academic space and inquires about Kelly Frears, with one of the doctoral candidates silently directing him toward the Xerox room. This moment directly precedes his appearance at the machine, where Kelly is struggling with a jam. His immediate engagement with the broken device—opening the cover, checking the paper path, and attempting repairs—suggests a prior connection or responsibility, rooted in his deliberate search for her upon return.",Causal-Motivational Reasoning
9,ene827f5ab63c84c2eb5d32f6d149e9b5d,en,46、INT. XEROX ROOM; 46、INT. XEROX ROOM,What event immediately before Chuck's breakdown explains why Kelly pulls him away from the Xerox machine?,Kelly reveals her manuscript is stuck in the Xerox machine,"Kelly discovers her manuscript is jammed in the Xerox machine and calls Chuck for help. He begins repairing it, focused and methodical, despite her attempts to divert his attention. As he struggles with the machine, his exhaustion becomes apparent, and Kelly intervenes, pulling him away before he fully breaks down.",Causal-Motivational Reasoning
10,ene827f5ab63c84c2eb5d32f6d149e9b5d,en,41、INT. CHUCK'S HOUSE - LATER; 44、INT. LAB - NIGHT,What action directly prompts Chuck to seek out Kelly Frears in the academic workspace?,Chuck switches on the TV while lying in bed,"After lying in bed and turning on the TV without success, Chuck gets up late at night and leaves his apartment, setting in motion his search for Kelly Frears that leads him to the academic workspace where he asks about her whereabouts.",Causal-Motivational Reasoning
11,ene827f5ab63c84c2eb5d32f6d149e9b5d,en,21、EXT. ST. PETERSBURG - DAY - MOMENTS LATER; 25、INT. FEDEX OFFICES - ST. PETERSBURG - SERIES OF SHOTS,What event immediately prior to Chuck cleaning the site and organizing the workflow motivates his involvement in the cleanup and reorganization?,FedEx truck departs from FedEx office,"As the FedEx truck leaves the office with Chuck aboard, he observes graffiti on the surrounding walls, which prompts him to take initiative in cleaning the site and improving workflow processes upon arrival.",Causal-Motivational Reasoning
12,ene827f5ab63c84c2eb5d32f6d149e9b5d,en,39、INT. CHUCK'S HOUSE - MOMENTS LATER; 39、INT. CHUCK'S HOUSE - MOMENTS LATER,What prompts Chuck to apologize to the fish he removes from the tank?,Discovering two dead fish in the tank,"After the filter restarts, Chuck notices two motionless fish floating on the surface. He uses a scoop to carefully remove them from the water. As he does, he speaks quietly, expressing repeated apologies in a low voice, indicating a response to finding them dead.",Causal-Motivational Reasoning
13,ene827f5ab63c84c2eb5d32f6d149e9b5d,en,29、INT. FEDEX OFFICES - ST. PETERSBURG - MINUTES LATER; 26、INT. FEDEX WAREHOUSE - ST. PETERSBURG - WEEK LATER,What earlier event explains Chuck's ability to delay the semi departure while maintaining team coordination?,Office staff collaborates on package sorting under Chuck's leadership,"Chuck directs the office staff with urgency and precision as they sort packages into containers, correcting routes and adjusting placements in real time. His active oversight establishes a rhythm and structure that the team follows, demonstrating his capacity to organize and lead under pressure. This coordinated effort sets a precedent for the team's responsiveness, which becomes critical when, during the final truck loading, Chuck decides to hold the semi for five minutes to ensure completeness, trusting the team will align with his decision.",Causal-Motivational Reasoning
14,ene827f5ab63c84c2eb5d32f6d149e9b5d,en,24、INT. HOTEL ROOM - NIGHT - LATER; 46、INT. XEROX ROOM,"By the time Kelly greets Chuck upon his return, what must have already taken place for the moment to make narrative sense?",Chuck listens to Kelly's voicemail message,"For Kelly's greeting to resonate as a meaningful response to Chuck's return, the story relies on Chuck having already heard her voicemail, which conveys her emotional state and intentions during his absence. This prior moment informs his understanding of her perspective and shapes the subtext of their reunion.",Temporal Reasoning
15,ene827f5ab63c84c2eb5d32f6d149e9b5d,en,22、INT. TRUCK - MOMENTS LATER; 30、INT. FEDEX OFFICES - ST. PETERSBURG - MINUTES LATER,"By the time the team celebrates the last container being loaded, what key observation has Chuck already made?",Chuck observes Lev's organized approach to package handling,"Chuck notices Lev's systematic method of sorting and stacking packages, recognizing his efficiency and attention to detail during the warehouse operation, which sets the stage for later developments in the team's workflow.",Temporal Reasoning
16,ene827f5ab63c84c2eb5d32f6d149e9b5d,en,245、EXT. RAFT - DAY - LATER; 545、EXT. RAFT - DAY - LATER,How does the Great Frigate Bird's treatment of the booby remain consistent from the earlier to the later scene on the raft?,The Great Frigate Bird continues to act as a predatory adversary by harassing the booby to steal its fish.,"Across both scenes, the Great Frigate Bird engages in aggressive, predatory behavior toward the booby, swooping and harassing it until it drops its catch. This pattern reflects a sustained ecological dynamic in which the frigate bird exploits the booby’s foraging efforts through intimidation and aerial attacks, with no shift in role or outcome observed between the interactions.",Role-Relation Continuity
17,ene827f5ab63c84c2eb5d32f6d149e9b5d,en,20、INT. FEDEX OFFICES - DAY; 20、INT. FEDEX OFFICES - DAY; 20、INT. FEDEX OFFICES - DAY,"What pivotal action sets in motion the sequence where Chuck corrects logistical oversights, challenges inadequate justifications, and resolves operational deficiencies in the warehouse review?",Initiate team accountability and inspection,"The narrative shifts when Chuck establishes a formal inspection process and holds the team accountable for operational accuracy, triggering a series of corrective actions that address previously overlooked issues in logistics, personnel responsibility, and facility management.",Narrative Progression
18,ene827f5ab63c84c2eb5d32f6d149e9b5d,en,46、INT. XEROX ROOM; 46、INT. XEROX ROOM; 24、INT. HOTEL ROOM - NIGHT - LATER,"What event marks the turning point that sets into motion the sequence where Kelly confronts Chuck about his past, attempts to reach him indirectly, and physically intervenes during a critical moment?",Kelly Pulls Chuck Away From the Machine,"The narrative builds toward a cluster of interconnected developments involving Kelly and Chuck, centered on revelations about Chuck's history and Kelly's increasingly direct efforts to break through his emotional or situational detachment. The moment Kelly physically pulls Chuck away from the Xerox machine disrupts his routine behavior and initiates a shift in their dynamic, triggering subsequent actions that explore buried tensions and unspoken truths.",Narrative Progression
19,ene827f5ab63c84c2eb5d32f6d149e9b5d,en,44、INT. LAB - NIGHT; 45、INT. HALLWAY - NIGHT; 47、INT. KELLY'S OFFICE - MOMENTS LATER,"What pivotal moment initiates the sequence in which Chuck approaches the Xerox machine, Kelly licks toner from his fingers, and they repair the device together?",Chuck Asks About Kelly Frears,"The narrative shifts when Chuck inquires about Kelly Frears, prompting a chain of physical and collaborative interactions centered on the malfunctioning Xerox machine. This inquiry marks the first intentional connection between Chuck and Kelly, transforming passive awareness into direct engagement, and setting in motion a series of intimate, task-oriented actions that culminate in the machine's repair.",Narrative Progression
20,ene827f5ab63c84c2eb5d32f6d149e9b5d,en,41、INT. CHUCK'S HOUSE - LATER; 46、INT. XEROX ROOM; 49、EXT. FEDEX OFFICES - NEXT MORNING,What pivotal decision sets in motion Chuck's pursuit that leads to his arrival at the office park and his inquiries about Kelly Frears?,Chuck Decides to Find Kelly,"After becoming aware of Kelly's involvement with the machine and sensing a critical shift in their shared situation, Chuck makes a decisive move to locate her. This choice directly initiates a sequence in which he travels to the office park, begins asking about Kelly Frears, and ultimately encounters her intervention at the machine, marking a key shift in the narrative trajectory.",Narrative Progression
