id,related_scenes,question,answer,related_context,question_type,question_source
1,54、INT. PLANE - IN FLIGHT - LATER,What does Barry do when he sees the baby?,"Barry wells with tears, cringes, his veins pop, and smiles crazily.","HE WELLS WITH TEARS AND A SMILE, CRINGES IN HIS FACE AND WE SEE THE BUILD UP OF EMOTION, HIS VEINS POP FROM HIS FACE AND THEN HE SMILES LIKE CRAZY, SMILING AND SMILING AND SMILING, BRIGHT RED AND PAINFUL.",Scene Grounding,broad_coverage_scene
2,1、INT. WAREHOUSE - EARLY MORNING,What caused Barry to get distracted during his phone call?,The distant sound of a car skidding and screaming.,"OC DISTANT SOUND OF A CAR SKIDDING TO A STOP, SOME VAGUE, DISTANT SCREAMING IS HEARD...THEN SILENCE. Barry hears this, gets distracted",Causal-Motivational Reasoning,broad_coverage_scene
3,12、INT. BARRY'S APARTMENT - LATER,"In [12、INT. BARRY'S APARTMENT - LATER], Why does Barry request to be called Jack?",To keep his identity confidential,I don't want anyone to know it's me.,Character Understanding,broad_coverage_scene
4,18、INT. BARRY'S WORK/WAREHOUSE - MORNING/LATER,"In [18、INT. BARRY'S WORK/WAREHOUSE - MORNING/LATER], What action does Barry take that indicates a significant change in his behavior?",He cuts up his credit card with scissors and throws it away.,Barry paces around... cuts up his CREDIT CARD with some scissors. He throws it away.,Character Understanding,broad_coverage_scene
5,63、INT. ROYAL HAWAIIAN HOTEL ROOM - MOMENTS LATER,What analogy does Barry use to describe his feelings about cuteness?,Squeeze a puppy and smash its skull.,BARRY: 'Have you ever held a little puppy...you get this feeling...squeeze it...smash its skull...',Character Understanding,broad_coverage_scene
6,23、INT. DEAN'S OFFICE/UPSTAIRS/BACKROOM - MOMENTS LATER,"In [23、INT. DEAN'S OFFICE/UPSTAIRS/BACKROOM - MOMENTS LATER], What is David's emotional state when Dean refuses to cover his expenses?",He is frustrated.,It's....whatever....that's not cool.,Character Understanding,broad_coverage_scene
7,28、INT. BATHROOM - MOMENTS LATER,"In [28、INT. BATHROOM - MOMENTS LATER], What is Barry's emotional state when he hits the stall?",Mad at himself and crazier after damaging the stall.,He's mad at himself and he HITS a stall....it seems loose already and falls straight to the floor. This makes him go crazier,Character Understanding,broad_coverage_scene
8,21、INT. LOCAL BAR/PROVO - LATER,"In [21、INT. LOCAL BAR/PROVO - LATER], What behavioral action does Dean take after being bumped?",Smashes a beer bottle and threatens Regular Joe,"Dean takes a BEER BOTTLE, SMASHES it, and holds it up while yelling",Character Understanding,broad_coverage_scene
9,21、INT. LOCAL BAR/PROVO - LATER,"In [21、INT. LOCAL BAR/PROVO - LATER], What is Dean's emotional state when he confronts Regular Joe?",Angry and aggressive,"Dean explodes, uses threatening language, and smashes a beer bottle",Character Understanding,broad_coverage_scene
10,34、INT. HALLWAY - THAT MOMENT,What does 'HOLD' indicate in the scene description?,A directive to maintain the current camera shot,HOLD.,Scene Grounding,broad_coverage_scene
11,14、INT. BARRY'S APARTMENT - MOMENTS LATER,Why does Barry mention wanting to diversify his business?,Because he wishes he was making more money and wants to improve.,I wish I was making more... I'd like to diversify...,Causal-Motivational Reasoning,broad_coverage_scene
12,29、INT. RESTARAUNT - MOMENTS LATER,"In [29、INT. RESTARAUNT - MOMENTS LATER], What is Barry's emotional state when the Manager confronts him?",He appears distressed and defensive.,BARRY: 'Please don't do this to me.' and 'I didn't do it.',Character Understanding,broad_coverage_scene
13,28、INT. BATHROOM - MOMENTS LATER,"In [28、INT. BATHROOM - MOMENTS LATER], What does Barry do after collecting himself?","He hesitates, looks around, and tries to collect the bathroom.","HOLD. He collects himself and then he hesitates, looks around, tries to collect the bathroom but it's in ruins",Character Understanding,broad_coverage_scene
14,63、INT. ROYAL HAWAIIAN HOTEL ROOM - MOMENTS LATER,What does Lena say she wants to do to Barry's face?,Bite his cheek and chew it.,LENA: 'I just...your face is so adorable...I wanna bite your cheek and chew on it....',Character Understanding,broad_coverage_scene
15,18、INT. BARRY'S WORK/WAREHOUSE - MORNING/LATER,"In [18、INT. BARRY'S WORK/WAREHOUSE - MORNING/LATER], What is Barry's emotional state after discovering something unexpected in the warehouse?",Upset and frustrated about something being in the warehouse.,BARRY: 'This is not supposed to be here. Seriously... It already did hurt someone: It hurt me...',Character Understanding,broad_coverage_scene
16,27、INT. RESTAURANT - NIGHT,"In [27、INT. RESTAURANT - NIGHT], Why did Lena come to meet Barry?",She wanted to meet him and didn't want to hide her intention.,"I came to drop my car off there on purpose, to try and meet you.",Character Understanding,broad_coverage_scene
17,23、INT. DEAN'S OFFICE/UPSTAIRS/BACKROOM - MOMENTS LATER,"In [23、INT. DEAN'S OFFICE/UPSTAIRS/BACKROOM - MOMENTS LATER], What is Latisha's emotional state when Dean makes a sudden move?",She is frightened.,She FLINCHES.,Character Understanding,broad_coverage_scene
18,17、INT. KITCHEN - MOMENTS LATER,Why does Georgia call Barry?,To ask for financial help.,I just wanted to call and talk to you... I was wondering if you could help me out with a little bit of money.,Causal-Motivational Reasoning,broad_coverage_scene
19,20、INT. STEVENS BROTHERS HOUSE - DAY,"In [20、INT. STEVENS BROTHERS HOUSE - DAY], What is David's physical condition?",He has a knee injury.,But it's gotta wait until my knee is better. I can't risk it.,Character Understanding,broad_coverage_scene
20,7、INT. WAREHOUSE/NEAR LANCE'S DESK - LATE AFTERNOON,What does Elizabeth say about bringing a friend to the party?,"She says it's a free country, we can look at you if we want to.","ELIZABETH It's a free country, we can look at you if we want to.",Character Understanding,broad_coverage_scene
21,59、INT. WAKIKI STREET/PHONE BOOTH - MOMENTS LATER,What does Barry ask Lena about her relationship status?,You don't have a boyfriend or anything do you?,You don't have a boyfriend or anything do you?,Character Understanding,broad_coverage_scene
22,27、INT. RESTAURANT - NIGHT,"In [27、INT. RESTAURANT - NIGHT], What physical action does Barry perform during the conversation?",He leans a little bit out of FRAME.,Barry leans a little bit out of FRAME.,Character Understanding,broad_coverage_scene
23,7、INT. WAREHOUSE/NEAR LANCE'S DESK - LATE AFTERNOON,What does Elizabeth claim is her intention toward Barry?,She says she's trying to be your friend.,ELIZABETH All I'm trying to do is be your friend.,Character Understanding,broad_coverage_scene
24,53、INT. PLANE - DAY,What camera action is described before the dialogue?,Holds a 2-shot on Barry and a Business Guy,"CAMERA holds 2-shot on Barry and a BUSINESS GUY sitting together, just before take off.....HOLD, THEN:",Scene Grounding,broad_coverage_scene
25,14、INT. BARRY'S APARTMENT - MOMENTS LATER | 17、INT. KITCHEN - MOMENTS LATER | 37、EXT. BARRY'S APARTMENT - LATER,What does Barry state when he is confronted by David and Mike D and asked about additional money?,Barry states that he has nothing else.,"Barry insists he has nothing else when questioned about more money, an ATM, and whether he has another house.",Character Understanding,broad_coverage_event_chain
26,26、EXT/INT. LENA'S APARTMENT COMPLEX - EVENING | 27、INT. RESTAURANT - NIGHT | 31、INT. LENA'S APARTMENT - LATER,What does Lena state about her reason for coming to Barry's workplace?,Lena states that she saw a picture of Barry and his sisters and intentionally dropped off her car at his workplace to meet him.,Lena tells Barry she saw a picture of him and his sisters and decided to drop off her car at his workplace on purpose to meet him.,Character Understanding,broad_coverage_event_chain
27,17、INT. KITCHEN - MOMENTS LATER | 37、EXT. BARRY'S APARTMENT - LATER | 38、EXT. GROCERY STORE/BANK PARKING LOT - NIGHT,What does Georgia state about her ability to access Barry's financial information?,"Georgia states that she can call Barry's girlfriend to ask for money because she has access to his personal information, including credit card and billing details.","Georgia suggests calling his girlfriend instead, saying she has access to his personal information, including credit card and billing details.",Character Understanding,broad_coverage_event_chain
28,49、EXT. PARKING LOT/ANOTHER SMART AND FINAL. | 47、EXT. SMART AND FINAL - DAY | 48、INT. SUPERMARKET - DAY,What does Barry say about himself while sitting in the car after failing to enter the store?,Barry says he gets really sick of himself sometimes.,"He sits quietly for a moment, then says to Lance, 'I get really sick of myself sometimes.'",Character Understanding,broad_coverage_event_chain
29,30、INT. BARRY'S CAR - DRIVING - NIGHT | 31、INT. LENA'S APARTMENT - LATER,What does Barry state about his plans to visit Hawaii?,Barry states that he does not know if he will visit Hawaii.,"When Lena suggests he might visit Hawaii, Barry responds vaguely, saying he doesn’t know.",Character Understanding,broad_coverage_event_chain
30,17、INT. KITCHEN - MOMENTS LATER | 37、EXT. BARRY'S APARTMENT - LATER | 38、EXT. GROCERY STORE/BANK PARKING LOT - NIGHT,What does Georgia state about her access to Barry's personal information during the call?,Georgia states that she has access to Barry's credit card information and billing details.,"Georgia then suggests calling his girlfriend instead, implying she has access to his personal information. Georgia asks Barry if she should call his girlfriend to ask for the money, mentioning that she has access to his credit card information and billing details.",Character Understanding,broad_coverage_event_chain
31,37、EXT. BARRY'S APARTMENT - LATER | 38、EXT. GROCERY STORE/BANK PARKING LOT - NIGHT,What does Barry state about the phone call when confronted by David and Mike D?,Barry states that the call was supposed to be confidential and that he never promised money.,"Barry objects, saying he never promised money and that the call was supposed to be confidential.",Character Understanding,broad_coverage_event_chain
32,33、INT. MAZE OF CORRIDORS - MOMENTS LATER | 40、EXT. STREET NEAR ATM - NIGHT | 37、EXT. BARRY'S APARTMENT - LATER | 38、EXT. GROCERY STORE/BANK PARKING LOT - NIGHT,What happens after Barry is shoved to the ground by Mike D?,"Barry pleads with David and Mike D to take the money in his pockets, which they do while holding him down, and then Mike D pushes his face into the ground while David questions him about more money and an ATM.","Mike D suddenly shoves Barry hard, sending him to the ground. Barry pleads with them, telling them to take the money in his pockets. David and Mike D grab the cash while holding him down. Mike D pushes Barry’s face into the ground, silencing him. David continues questioning, asking about more money, an ATM, whether Barry has another house.",Temporal Reasoning,broad_coverage_event_chain
33,38、EXT. GROCERY STORE/BANK PARKING LOT - NIGHT | 40、EXT. STREET NEAR ATM - NIGHT | 37、EXT. BARRY'S APARTMENT - LATER,Why did Mike D and David confront Barry after the initial robbery at the ATM?,Mike D and David confronted Barry because they believed he had more money and wanted to force him to withdraw additional cash from an ATM.,"After Barry was robbed and fell to the ground, Mike D suggested going to the ATM to withdraw more money, and Barry agreed to do it, indicating they believed he could access more funds.",Causal-Motivational Reasoning,broad_coverage_event_chain
34,33、INT. MAZE OF CORRIDORS - MOMENTS LATER | 40、EXT. STREET NEAR ATM - NIGHT | 37、EXT. BARRY'S APARTMENT - LATER,What does Barry state about his possessions during the confrontation?,Barry states that he has nothing else besides the money in his pockets.,Barry insists he has nothing else.,Character Understanding,broad_coverage_event_chain
35,13、INT. BARRY'S APARTMENT - MOMENTS LATER | 17、INT. KITCHEN - MOMENTS LATER | 37、EXT. BARRY'S APARTMENT - LATER,What does Barry state about his ability to help Georgia financially?,Barry states that he cannot afford to help Georgia with the money she requests.,"Barry says he can’t afford it when Georgia asks for seven hundred fifty dollars, and he repeats that he can’t help when she presses him.",Character Understanding,broad_coverage_event_chain
36,12、INT. BARRY'S APARTMENT - LATER,What does Barry state about his name when providing information to the operator?,Barry states that he does not want anyone to know it is him and asks to be called Jack instead.,"Barry asks that his name not be used and asks to be called Jack instead, expressing concern that no one should know it is him.",Character Understanding,broad_coverage_scene
37,40、EXT. STREET NEAR ATM - NIGHT | 37、EXT. BARRY'S APARTMENT - LATER | 38、EXT. GROCERY STORE/BANK PARKING LOT - NIGHT,What does Barry state when he is confronted and shoved to the ground by Mike D and David?,Barry states that they can take the money in his pockets and insists he has nothing else.,"Barry pleads with them, telling them to take the money in his pockets. Barry insists he has nothing else.",Character Understanding,broad_coverage_event_chain
38,17、INT. KITCHEN - MOMENTS LATER | 37、EXT. BARRY'S APARTMENT - LATER | 38、EXT. GROCERY STORE/BANK PARKING LOT - NIGHT,What does Barry state when David and Mike D demand more money after robbing him?,Barry insists he has nothing else.,Barry insists he has nothing else.,Character Understanding,broad_coverage_event_chain
39,47、EXT. SMART AND FINAL - DAY | 48、INT. SUPERMARKET - DAY,What does Barry state about pudding?,Barry states that you can get places in the world with pudding.,"Barry says, 'You know you can get places in the world with pudding.'",Character Understanding,broad_coverage_event_chain
40,10、INT. SUSAN'S HOUSE - NIGHT,How should Barry and Elizabeth's relationship be characterized?,from sibling to familiar and comfortable rapport,"Earlier, the relationship between Barry and Elizabeth is marked by sibling; later, it shifts to familiar and comfortable rapport.",Role-Relation Continuity,supplementary_cross_scene
41,13、INT. BARRY'S APARTMENT - MOMENTS LATER|17、INT. KITCHEN - MOMENTS LATER,What accusation does Georgia make about Barry's relationship status that prompts him to hang up?,Georgia accuses Barry of being in a relationship,"Georgia questions Barry about having a girlfriend, which he confirms, escalating the tension in the call.",Narrative Progression,supplementary_cross_scene
42,17、INT. KITCHEN - MOMENTS LATER|18、INT. BARRY'S WORK/WAREHOUSE - MORNING/LATER|27、INT. RESTAURANT - NIGHT,What event cuts short Barry's phone call with Georgia and sets the stage for his later emotional reaction to Lena's story?,Elizabeth and Lena enter the warehouse,"Elizabeth and Lena enter the warehouse and approach Barry, interrupting his routine and leading to interactions that eventually trigger his recall of a childhood incident.",Narrative Progression,supplementary_cross_scene
43,17、INT. KITCHEN - MOMENTS LATER|18、INT. BARRY'S WORK/WAREHOUSE - MORNING/LATER|32、INT. RECEPTION AREA/LENA'S BUILDING,What event interrupts Barry's phone call with Georgia and sets the stage for his later call with Lena?,Elizabeth and Lena enter the warehouse,"Elizabeth and Lena enter the warehouse and walk toward Barry, as described in the episode where Barry greets his sister and Lena at the warehouse.",Narrative Progression,supplementary_cross_scene
44,2、INT. BARRY'S WAREHOUSE - THAT MOMENT|19、INT. WAREHOUSE - THAT MOMENT,What final interaction between Lena and Barry occurs right before Barry's emotional breakdown in the warehouse?,Lena and Barry exchange final greetings and part ways,Lena and Barry exchange quiet hellos one final time before she walks away.,Narrative Progression,supplementary_cross_scene
45,37、EXT. BARRY'S APARTMENT - LATER|38、EXT. GROCERY STORE/BANK PARKING LOT - NIGHT|72、INT. BARRY'S GARAGE - NIGHT,"Which character partners with David to confront Barry, attacks Barry, and is Nate's brother?",Mike D,"Mike D is in a cooperating partners relationship with David, is in a confronting and attacking relationship with Barry, and is in a brother relationship with Nate.",Role-Relation Continuity,supplementary_cross_scene
46,3、INT. WAREHOUSE - OFFICE - EARLY MORNING|4、INT. WAREHOUSE/MAIN AREA - DAY|7、INT. WAREHOUSE/NEAR LANCE'S DESK - LATE AFTERNOON,"Who is the character that shares a trusting rapport with Lance, is siblings with Rhonda, and is the target of Elizabeth's attempts at friendship?",Barry,"Barry is in a trusted acquaintances relationship with Lance, is in a sibling relationship with Rhonda, and is in a attempted friendship relationship with Elizabeth.",Role-Relation Continuity,supplementary_cross_scene
