id,movie_id,language,related_scenes,question,answer,evidence_or_reason,question_type
1,enc05e4f27bd8448ebaf9883c64aa4d599,en,,What is Debi trying to achieve when Debi debi stands in the broadcast booth?,Force a confrontation,"Debi stands in the broadcast booth, her breath catching as Martin walks into the police station. He moves toward her, crossing the threshold of the booth without a word. The air shifts. They face each other, silent, the space between them charged. No one speaks, but the tension rises, thick and palpable, as the past settles into the room. [scene: Debi Confronts Martin's Return]",Character Understanding
2,enc05e4f27bd8448ebaf9883c64aa4d599,en,,What does Martin's return to the radio station reveal about his objective in reconnecting with Debi?,Seeks closure or reconnection after absence,"Martin walks into the radio station while Debi is on air. After an awkward pause and a sarcastic exchange about the changes in their lives, Martin reveals he’s been living in California and working as a professional killer—a claim that may be metaphorical or facetious. His brief, halting dialogue and final statement that he’ll come back suggest an unresolved history. The moment they lock eyes, underscored by the unanswered request line and Debi’s solitude after he leaves, implies Martin’s visit is driven by a need to address the past, particularly his sudden disappearance after standing her up on prom night.",Character Understanding
3,enc05e4f27bd8448ebaf9883c64aa4d599,en,,What is Debi's underlying motivation for broadcasting her confrontation with Martin live?,"To publicly hold Martin accountable for abandoning her without explanation, particularly on the night of their prom, and to expose his emotional evasiveness by turning their private conversation into a public reckoning.","Debi initiates a seemingly intimate moment with Martin, then reveals the conversation is being broadcast by flipping the ON-AIR switch unnoticed by him. She immediately confronts him about his unexplained absence on prom night, emphasizing her emotional betrayal—waiting in a seven-hundred-dollar dress. As the broadcast continues, callers further humiliate Martin, amplifying the public nature of his accountability. Her actions shift from personal confrontation to orchestrated exposure, using the radio platform to force Martin to face consequences in front of an audience rather than in private.",Character Understanding
4,enc05e4f27bd8448ebaf9883c64aa4d599,en,,What does Martin intend when he enters the 7-11 and surveys the store?,Confront the clerk,"Martin walks into the 7-11 and looks around the store. He faces the clerk, Carl, and asks, 'What are you doing here?' Carl hesitates, then replies, 'A double shift. What's it look like?' After a pause, he adds, 'Can I help you with something?' Martin scans the room, then says, 'I don't think so.' His demeanor and direct address suggest a purposeful encounter rather than a routine visit.",Character Understanding
5,enc05e4f27bd8448ebaf9883c64aa4d599,en,,What action initiates the pivotal moment in the scene where Martin observes the Doorman's attack from his window?,Martin finishes packing,"Martin finishes packing his bag while on a phone call about securing courtside tickets for the Knicks. He abruptly stops upon hearing gunfire, drops the phone, grabs a scope, and moves to the window. Through the scope, he witnesses the Doorman assaulting several men and shooting their boss with two revolvers. Startled by the sight of a second shooter, Martin withdraws from the window, stows the scope, and quickly departs the room with two parcels. He exits the hotel through a side door as the Doorman disposes of his uniform, changes clothes, and drives away in a Lincoln Town Car.",Scene Grounding
6,enc05e4f27bd8448ebaf9883c64aa4d599,en,,What action defines the scene in the deejay booth?,Martin explains his return as part of therapy,"In the deejay booth, Martin tells Debi that reconnecting with her was suggested by his therapist as part of his emotional recovery. He describes returning home and revisiting past relationships as therapeutic steps. When Debi questions whether she should let him back into her life, she shifts the conversation to the radio audience, opening his personal struggle to public response.",Scene Grounding
7,enc05e4f27bd8448ebaf9883c64aa4d599,en,,What occurs when Martin receives his car at the country club?,Valet delivers Martin's rented Town Car,"The valet pulls up Martin's rented Town Car and stops near the curb. Martin meets him at the trunk, hands over a tip, and takes the keys. He walks around and gets into the driver's seat. As he does, he pulls a laminated 'Personal Pan Power' card from his pocket, looks at it briefly, and drops it onto the asphalt. The card lies on the ground as a police car approaches, its wheel rolling to a stop directly over the discarded card. Martin starts the engine and drives away.",Scene Grounding
8,enc05e4f27bd8448ebaf9883c64aa4d599,en,,What event immediately prior to Debi relaying the final verdict explains her decision to end the broadcast with that particular message?,Debi exposes Martin to live audience questioning on air,"In the deejay booth, Debi activates the 'ON-AIR' switch without Martin's knowledge, opening the line for public response to his return after abandoning her on prom night. Callers confront Martin with criticism, mockery, and emotional detachment, culminating in a message from Grosse Pointe, Michigan, which Debi later repeats as the final verdict. The audience's judgment unfolds in real time, shaping the tone and outcome of the broadcast.",Causal-Motivational Reasoning
9,enc05e4f27bd8448ebaf9883c64aa4d599,en,,"In [32、INT. MARTIN'S CAR - MORNING], what action immediately before entering the 7-11 explains Martin's confrontational stance toward the clerk?",Martin drives while listening to the radio,"As Martin drives down the road with the radio playing, he turns a corner expecting something different and sees the 7-11 ahead, causing his expression to fall. He pulls over, surveys the area with visible tension, and walks into the store where he confronts the clerk, Carl, asking, 'What are you doing here?' His demeanor suggests disappointment or disruption, rooted in the moment he first spotted the store while driving.",Causal-Motivational Reasoning
10,enc05e4f27bd8448ebaf9883c64aa4d599,en,,"What action by Mary enables Martin to pursue reconciliation with Debi, leading to her on-air response?",Mary suggests Martin borrow her car instead,"As Martin and Mary prepare to part, she suggests he take her car and return his rental, arranging for Debi to drive him back. This gives Martin the opportunity to see Debi, which culminates in his visit and her subsequent on-air relay of a caller’s message, signaling her guarded emotional response to his return.",Causal-Motivational Reasoning
11,enc05e4f27bd8448ebaf9883c64aa4d599,en,,What action directly triggers Martin's vision of the reunion in the therapy session?,Martin opens the mauve envelope,"In Dr. Oatman's office, Martin holds an open mauve envelope and resists attending his high school reunion. As Oatman presses him to articulate his fears, Martin describes a vivid, violent vision of the event: from an overhead view, he sees alumni in a gymnasium turn on him and each other with guns, descending into mass chaos. The vision emerges during the same session in which he opens the envelope, and it is framed as a manifestation of his deeper anxieties about identity, connection, and purpose.",Causal-Motivational Reasoning
12,enc05e4f27bd8448ebaf9883c64aa4d599,en,,"By the time Debi confronts Martin on live radio, what has already happened between them earlier that day?",Martin reacts to Debi's gaze and drives away from the storefront,"Earlier in the sequence, Martin sees Debi at the storefront and, after a tense moment of eye contact, quickly leaves the scene by driving away in his car. This moment sets the stage for the later confrontation, where Debi addresses Martin publicly during a live radio broadcast, indicating that their unresolved interaction has escalated.",Temporal Reasoning
13,enc05e4f27bd8448ebaf9883c64aa4d599,en,,"By the time Debi confronts Martin on live radio, what has already taken place just before her confrontation begins?",Debi Newberry swivels her chair to face the street and observes Martin's car,"In an earlier moment, Debi notices Martin's car from her window, a quiet but pivotal beat that sets her emotional state ahead of the live radio confrontation. This observation occurs in the same narrative thread leading directly to her public address, grounding her reaction in a specific, witnessed detail before the escalation unfolds.",Temporal Reasoning
14,enc05e4f27bd8448ebaf9883c64aa4d599,en,,How does Martin Blank's treatment of Felix evolve from their first encounter to the final confrontation between them?,Martin Blank consistently treats Felix as a threat,"From their initial sighting at the radio station, where Martin reacts to Felix with clear dislike and mutual avoidance suggests established distrust, through multiple subsequent encounters including a shootout at a 7-11 and repeated hostile standoffs, Martin Blank perceives Felix as a danger. This perception culminates in a final hallway confrontation where Felix attempts to assassinate Martin with a silenced pistol, prompting Martin to kill him in self-defense, confirming the sustained adversarial dynamic.",Role-Relation Continuity
15,enc05e4f27bd8448ebaf9883c64aa4d599,en,,How does Martin Blank's relationship to the Assassin evolve from their first encounter in the kitchen through the final confrontation in the bedroom?,Martin Blank treats the Assassin as a lethal threat and attacks him on sight,"From the kitchen encounter to the final bedroom confrontation, Martin Blank consistently responds to the Assassin with immediate physical aggression. In the kitchen, he shoots at the Assassin upon entry, reflecting a hostile reaction to an active threat. Later, in the bedroom, he again attacks without hesitation, ultimately killing the Assassin by snapping his neck. These actions across multiple scenes indicate a persistent adversarial dynamic defined by Martin's intent to neutralize the Assassin as a danger.",Role-Relation Continuity
16,enc05e4f27bd8448ebaf9883c64aa4d599,en,,How does Martin Blank's treatment of Husky Man evolve or remain consistent from their first confrontation to their final encounter in the hallway?,Martin Blank keeps treating Husky Man as a threat,"From the initial violent exchange in the hallway where both characters fire at each other, through to the final moment where Martin aims his gun while Husky Man pleads for mercy, Martin consistently responds to Husky Man with lethal intent, maintaining a hostile and adversarial stance throughout the sequence.",Role-Relation Continuity
17,enc05e4f27bd8448ebaf9883c64aa4d599,en,,What turning point shifts the narrative toward Debi confronting Martin on live radio and subjecting him to public judgment?,Martin Reveals He's in Therapy During Radio Broadcast,"In the deejay booth, Martin discloses his therapy sessions during a live broadcast, altering the trajectory of his public confrontation with Debi. This revelation reshapes the power dynamics of their interaction and sets the stage for her subsequent challenges to his return and credibility. [scene: 47、INT. DEEJAY BOOTH]",Narrative Progression
18,enc05e4f27bd8448ebaf9883c64aa4d599,en,,"What turning point initiates the sequence leading to Martin's visit to his father's grave, the surveillance by Lardner and McCullers, and his discovery of the 7-11 on the site of his childhood home?",Martin Arrives at the 7-11,"The moment Martin arrives at the 7-11 marks a pivotal shift in the narrative, triggering a chain of events that unfold in subsequent scenes. This development sets into motion Martin's emotional confrontation with his past, drawing the attention of Lardner and McCullers and culminating in his realization that his childhood home has been replaced by a convenience store. [32、INT. MARTIN'S CAR - MORNING]",Narrative Progression
19,enc05e4f27bd8448ebaf9883c64aa4d599,en,,"What turning point initiates the sequence leading directly to Martin's departure, return to the station, and visit to his father's grave?",Martin Gets His Car and Leaves,"The moment Martin retrieves his car marks a decisive shift in the narrative, setting into motion a chain of events that includes his escape as police arrive, his subsequent return to the police station, and a pilgrimage to his father's grave. This action severs prior hesitations and reorients the story toward resolution and personal reckoning [3、EXT. COUNTRY CLUB - DAY].",Narrative Progression
20,enc05e4f27bd8448ebaf9883c64aa4d599,en,,"What turning point initiates the chain of events leading to Martin's escape, his arrival at the apartment, and his flight onto the turnpike?",Martin Flees After Witnessing the Doorman's Attack,"In the immediate aftermath of the doorman carrying out the execution, Martin, having seen the act, reacts by fleeing the scene. This decision sets off a sequence in which he seeks refuge at the apartment and then rapidly departs the city, driving onto the turnpike while adjusting the radio—actions directly triggered by his flight following the violent event. [scene: 9、EXT. STREET - SAME - INTERCUT]",Narrative Progression
21,enc05e4f27bd8448ebaf9883c64aa4d599,en,,In which scene or scenes are Newberry and Sniper both present?,105、INT. GROCER'S VAN - SAME | 109、INT. TOWN CAR - SAME | 227、INT. GROCER'S VAN - SAME | 231、INT. TOWN CAR - SAME,"{""pair"": [""Newberry"", ""Sniper""], ""pair_mentions"": 12, ""scene_grounding_subtype"": ""copresence_localization"", ""scene_count"": 4, ""scene_numbers"": [105, 109, 227, 231], ""scene_titles"": [""105、INT. GROCER'S VAN - SAME"", ""109、INT. TOWN CAR - SAME"", ""227、INT. GROCER'S VAN - SAME"", ""231、INT. TOWN CAR - SAME""]}",Scene Grounding
22,enc05e4f27bd8448ebaf9883c64aa4d599,en,,In which scene or scenes is Debi acting as a member of Wrfn Fm?,31、INT. MARTIN'S CAR | 40、INT. RADIO STATION - DAY | 153、INT. MARTIN'S CAR,"{""character"": ""Debi"", ""role_label"": ""Wrfn Fm"", ""relation_names"": [""belongs to"", ""is on-air host of""], ""descriptions"": [""Debi Newberry is the female DJ hosting a segment on WFRN, indicating her membership or affiliation with the station."", ""Debi flips the 'ON-AIR' switch, speaks into the microphone, and identifies herself as part of the WRFN FM broadcast, indicating her institutional affiliation with the station.""], ""scene_grounding_subtype"": ""role_state_localization"", ""scene_count"": 3, ""scene_numbers"": [31, 40, 153], ""scene_titles"": [""31、INT. MARTIN'S CAR"", ""40、INT. RADIO STATION - DAY"", ""153、INT. MARTIN'S CAR""]}",Scene Grounding
23,enc05e4f27bd8448ebaf9883c64aa4d599,en,,In which scene or scenes are Messenger and Tom both present?,8、INT. HOTEL ROOM - SAME | 9、EXT. STREET - SAME - INTERCUT | 130、INT. HOTEL ROOM - SAME | 131、EXT. STREET - SAME - INTERCUT,"{""pair"": [""Messenger"", ""Tom""], ""pair_mentions"": 7, ""scene_grounding_subtype"": ""copresence_localization"", ""scene_count"": 4, ""scene_numbers"": [8, 9, 130, 131], ""scene_titles"": [""8、INT. HOTEL ROOM - SAME"", ""9、EXT. STREET - SAME - INTERCUT"", ""130、INT. HOTEL ROOM - SAME"", ""131、EXT. STREET - SAME - INTERCUT""]}",Scene Grounding
24,enc05e4f27bd8448ebaf9883c64aa4d599,en,,In which scene or scenes are Mary and Nurse both present?,34、INT. NURSING HOME - DAY | 36、EXT. NURSING HOME - DAY | 156、INT. NURSING HOME - DAY | 158、EXT. NURSING HOME - DAY,"{""pair"": [""Mary"", ""Nurse""], ""pair_mentions"": 27, ""scene_grounding_subtype"": ""copresence_localization"", ""scene_count"": 4, ""scene_numbers"": [34, 36, 156, 158], ""scene_titles"": [""34、INT. NURSING HOME - DAY"", ""36、EXT. NURSING HOME - DAY"", ""156、INT. NURSING HOME - DAY"", ""158、EXT. NURSING HOME - DAY""]}",Scene Grounding
25,enc05e4f27bd8448ebaf9883c64aa4d599,en,,In which scene or scenes is Skateboarder clearly present?,55、INT. 7-11 - NIGHT | 56、EXT. 7-11 - CONTINUOUS | 177、INT. 7-11 - NIGHT | 178、EXT. 7-11 - CONTINUOUS,"{""character"": ""Skateboarder"", ""mention_total"": 23, ""scene_span"": 124, ""scene_grounding_subtype"": ""entity_presence_localization"", ""scene_count"": 4, ""scene_numbers"": [55, 56, 177, 178], ""scene_titles"": [""55、INT. 7-11 - NIGHT"", ""56、EXT. 7-11 - CONTINUOUS"", ""177、INT. 7-11 - NIGHT"", ""178、EXT. 7-11 - CONTINUOUS""]}",Scene Grounding
26,enc05e4f27bd8448ebaf9883c64aa4d599,en,,Who are the 3 most central characters in this story?,"Debi, Grocer, Martin_Blank",,Character Understanding
