id,movie_id,language,related_scenes,question,answer,evidence_or_reason,question_type
1,en44fd740e98fd44c186677b99ad139c57,en,1、INT. CAR,How does Jerry's behavior reflect his dependency on Carl after learning about the potential funding?,"Jerry attempts to contact Carl to coordinate, revealing Carl's role as a necessary accomplice in the plan tied to the proposed funding.","Wade informs Jerry that Stan Grossman may finance his proposal if the numbers are accurate, setting a meeting for 2:30. Jerry needs to locate Carl and Gaear to proceed, but Shep refuses to help, and Jerry expresses frustration over being unable to reach them.",Character Understanding
2,en44fd740e98fd44c186677b99ad139c57,en,41、INT. HUT,What motivates Carl's immediate actions upon securing the briefcase despite his injury?,To escape the scene quickly and evade capture or confrontation,"Carl, his jaw bleeding, picks up the briefcase from the ground. He throws it into his car, gets in, and drives off quickly. The car speeds down the ramp, taking the corner at high speed. It swerves, narrowly missing Jerry's Oldsmobile as it approaches the top.",Character Understanding
3,en44fd740e98fd44c186677b99ad139c57,en,25、INT. CAR,What does Carl aim to achieve when the state trooper pulls him over and requests his documents?,Avoid a ticket by offering a bribe,"A state trooper activates his emergency lights and pulls Carl over on the shoulder of the road. Carl complies, steering onto the gravel and stopping behind the patrol car. Inside the vehicle, Jean is heard whimpering from the back seat, prompting warnings from both Grimsrud and Carl to keep her quiet. As the trooper approaches with a hand on his holster, Carl rolls down the window and cooperates verbally, citing a forgotten temporary tag when asked about the missing license plate. He then opens his wallet, revealing a folded fifty-dollar bill, and hands it toward the trooper along with his license and registration.",Character Understanding
4,en44fd740e98fd44c186677b99ad139c57,en,29、INT. CIERA,What motivates Grimsrud's immediate actions after the pursued vehicle crashes?,The crash requires intervention,"The red tail lights of the pursued car disappear with a distant crunch as it slams into a telephone pole, crumpling on impact. Grimsrud slows, his headlights revealing the wreck off the road. He brakes hard, bringing the vehicle to a lurching stop. Jean in the back seat slides forward and hits the legwell. Grimsrud reaches for his gun, throws open the driver's door, and steps out into the snow, moving toward the crash site.",Character Understanding
5,en44fd740e98fd44c186677b99ad139c57,en,24、INT. WADE'S OFFICE,What action takes place when Jerry tries to reach Wade from a different room?,Jerry attempts to call Wade from another room,"Jerry moves to a separate room, picks up the telephone, and dials Wade Gustafson, identifying himself urgently and insisting the matter is critical. He speaks with rising agitation, emphasizing that the situation cannot wait, listens briefly, and hangs up in frustration—only to attempt the call again from another location within the building.",Scene Grounding
6,en44fd740e98fd44c186677b99ad139c57,en,12、EXT. CABIN,What occurs when Grimsrud and Carl bring Jean to the lakeside cabin?,Grimsrud and Carl arrive at lakeside cabin with Jean,"A brown Ciera with dealer plates pulls into the driveway of a secluded lakeside cabin. Grimsrud exits the passenger side and Carl the driver's side. Grimsrud opens the rear door and gently takes Jean by the elbow to help her out, her hands tied and head covered by a black hood. Jean suddenly jerks her arm free, stumbles across the front lawn, lurching erratically and muffled under the hood before falling face-first into the snow, sobbing, while Carl laughs and Grimsrud hesitates before retrieving her.",Scene Grounding
7,en44fd740e98fd44c186677b99ad139c57,en,44、EXT. CAR,What action initiates Marge's confrontation with Grimsrud at the cabin?,Marge pulls over her cruiser past the cabin,"Marge arrives at the cabin in her police cruiser, pulling over past the structure before stepping out into the cold. She listens to the sound of a power tool coming from inside, then begins her cautious approach down the snowy slope. Observing Grimsrud through the window as he works on a leg with a power tool, she draws her gun, advances, and calls out for him to surrender, leading to his attempted escape and eventual arrest.",Scene Grounding
8,en44fd740e98fd44c186677b99ad139c57,en,1、INT. CAR; 23、INT. CAR,What event prompts Jerry to seek out Shep at the garage in hopes of locating Carl?,"Wade calls Jerry to confirm a funding meeting, contingent on accurate numbers","Wade contacts Jerry at the Lundegaard household to inform him that Stan Grossman is considering financing his business proposal, but only if the financial details hold up. He schedules a meeting for 2:30 to review the numbers, creating urgency for Jerry to connect with Carl and Gaear, who are essential to finalizing the deal. When Jerry asks Shep for help reaching them, Shep refuses to vouch for Carl or provide further contact information, leaving Jerry in a bind. This pressure directly leads Jerry to revisit Shep at the garage, hoping to find another way to reach Carl as the funding deadline looms.",Causal-Motivational Reasoning
9,en44fd740e98fd44c186677b99ad139c57,en,8、EXT. ROAD; 12、EXT. CABIN,What prompts Marge to return to the office with a lead in hand?,Marge receives urgent phone call during night,"Late at night, Marge is awakened by a ringing phone. She takes the call in hushed tones, reacting with growing concern before agreeing to respond immediately. Her husband Norm offers to make her breakfast, which she initially declines but then accepts. After a quick meal, she dresses in her police uniform, equips her duty belt, and departs in the early morning hours. This call directly precedes her arrival at the station, where she engages with colleagues and begins following up on a new development related to a vehicle seen at a roadside motel.",Causal-Motivational Reasoning
10,en44fd740e98fd44c186677b99ad139c57,en,16、INT. CABIN; 33、INT. PROWLER,What action by Carl directly prompts Jerry and Stan to finalize the ransom drop and depart in the Lincoln?,Carl demands money from Jerry over the phone,"In a tense phone call from a roadside diner, Carl confronts Jerry, demanding the full ransom be delivered within thirty minutes and threatening to kill Jerry’s wife and child if he fails to comply. Jerry, visibly strained, confirms the money is ready but hesitates, attempting to stall. Carl ends the call abruptly, unaware that Wade has been listening on an extension. This ultimatum forces Jerry and Stan to immediately coordinate the handoff in the snowy parking lot, where they finalize the plan before departing in the Lincoln as Wade waits, engine running.",Causal-Motivational Reasoning
11,en44fd740e98fd44c186677b99ad139c57,en,10、INT. GUNDERSON HOUSE; 32、INT. GUNDERSON HOUSE,What action by Lou enables Marge to begin her investigation at the crash site and prompts her to ask about the state trooper's location?,Lou offers Marge a cup of coffee at the crime scene,"When Marge arrives at the roadside where the wrecked car is located, Lou greets her from his squad car and hands her a steaming cup of coffee. This moment marks her entry into the scene, allowing her to immediately begin assessing the situation. As they walk toward the vehicle, Lou confirms it is a triple homicide and points out the two victims already found. Marge inspects the car and observes injuries on the second body, then scans the surroundings, noting the cold and the footprints in the snow. It is in this context—immediately after receiving the coffee and beginning her assessment—that she asks Lou where the state trooper is, setting off her focused examination of the scene and the sequence of deductions that follow.",Causal-Motivational Reasoning
12,en44fd740e98fd44c186677b99ad139c57,en,38、INT. CABIN; 24、INT. WADE'S OFFICE,What decision by Jerry leads Wade to threaten handling the deal without him?,Jerry refuses to let anyone else handle the ransom call,"During a meeting at the Lundegaard cabin, Jerry insists that only he can manage the ransom exchange, citing the kidnappers' explicit instructions and the danger involved. Wade argues that the money is his and demands a role in the delivery, warning that exclusion will prompt him to bring in outside help. Stan supports Wade’s position, creating pressure on Jerry to compromise. Jerry’s firm rejection of their involvement establishes the tension that later erupts when Wade declares his willingness to proceed without Jerry in the negotiation.",Causal-Motivational Reasoning
13,en44fd740e98fd44c186677b99ad139c57,en,3、INT. CAR; 21、EXT. JERRY'S HOUSE,"By the time Carl drives away injured and discovers the money in the briefcase, what has already happened to him on the road?",Carl freezes in the car's headlights,"Before Carl can flee the scene and find the money, he is momentarily paralyzed with fear as headlights approach him on the dark road, leaving him exposed and vulnerable in the moments leading up to his escape. This moment of hesitation is a critical precursor to his subsequent injury and discovery.",Temporal Reasoning
14,en44fd740e98fd44c186677b99ad139c57,en,3、INT. CAR; 21、EXT. JERRY'S HOUSE,"By the time Carl drives away injured and discovers the money in the briefcase, what has already happened in the immediate aftermath of the shooting?",Carl expresses shock at the trooper's death,"In the moments following the shooting, Carl reacts with visible distress and disbelief upon realizing the state trooper is dead. This emotional response occurs inside the car shortly after the violence unfolds, establishing his psychological state before he flees the scene. The discovery of the money happens much later, after Carl has left the area and arrived near Jerry's house, marking a shift from crisis response to unintended consequence.",Temporal Reasoning
15,en44fd740e98fd44c186677b99ad139c57,en,1、INT. CAR; 38、INT. CABIN,How does Shep Proudpfut's treatment of Carl Showalter evolve from their first interaction to the cabin confrontation?,Shep Proudpfut continues to pursue Carl Showalter as an enemy,"From their initial encounter in the car, where Shep refuses to vouch for Carl and expresses clear distrust, through multiple subsequent scenes including unprovoked physical attacks and mutual threats, Shep consistently maintains a hostile stance toward Carl. This adversarial dynamic culminates in the cabin scene with Shep violently confronting Carl, confirming an unbroken trajectory of enmity initiated early in the narrative.",Role-Relation Continuity
16,en44fd740e98fd44c186677b99ad139c57,en,1、INT. CAR; 34、EXT. CABIN,How does Carl Showalter's relationship to Jean Lundegaard remain consistent from the initial confrontation through the cabin scenes?,Carl continues to treat Jean as a captive and target of hostility,"From the moment Carl arrives while Jean is under attack, she perceives him as a threat and flees, establishing immediate hostility. Throughout subsequent scenes, including during her captivity in the car and at the cabin, Carl reinforces this dynamic by threatening her, restraining her, and mocking her distress, demonstrating a sustained adversarial and captor-victim relationship without any shift in alignment or intent.",Role-Relation Continuity
17,en44fd740e98fd44c186677b99ad139c57,en,24、INT. WADE'S OFFICE; 42、INT. JERRY'S CAR; 20、INT. JERRY'S CAR,What pivotal event sets in motion Jerry's actions to conceal Wade's death and assert control over the ransom process?,Jerry's Desperate Calls to Wade,"In the aftermath of Wade's death, Jerry's increasingly frantic attempts to reach Wade by phone mark a critical shift in the narrative. These calls represent his realization that the situation has spiraled beyond his control, prompting him to move the body and take decisive steps to manage the fallout independently, including excluding his family from the ransom delivery. [24、INT. WADE'S OFFICE]",Narrative Progression
18,en44fd740e98fd44c186677b99ad139c57,en,12、EXT. CABIN; 12、EXT. CABIN; 38、INT. CABIN,What event sets in motion the sequence in which Jean is held captive and Carl reacts with laughter as she struggles to escape?,Grimsrud and Carl bring Jean to the lakeside cabin,"After Jean is transported against her will, the dynamics at the remote cabin shift decisively. Her attempts to flee are met with restraint, and Carl's demeanor turns mocking as tension mounts between him and Grimsrud. The isolation of the location intensifies the power imbalance, establishing the conditions for Jean's prolonged captivity and the psychological confrontation that unfolds. [12、EXT. CABIN]",Narrative Progression
19,en44fd740e98fd44c186677b99ad139c57,en,1、INT. CAR; 23、INT. CAR; 41、INT. HUT,"What pivotal event sets in motion Jerry's efforts to secure support from Shep, Wade's confrontation with Carl, and Jerry's encounter with Carl and Gaear at the tavern?",Jerry awaits funding decision and tries to reach Carl,"As Jerry waits in his car for a crucial funding decision, he repeatedly attempts to contact Carl, whose silence heightens the tension and forces Jerry to seek alternative alliances. This moment marks the shift where Jerry begins taking decisive action, prompting his visit to Shep at the garage, escalating Wade's suspicions leading to the rooftop confrontation, and ultimately driving Jerry to meet Carl and Gaear at the Jolly Troll Tavern. [scene: INT. CAR]",Narrative Progression
20,en44fd740e98fd44c186677b99ad139c57,en,8、EXT. ROAD; 34、EXT. CABIN; 44、EXT. CAR,"What event sets in motion Marge's series of actions involving the station, her return home with information, and her investigation of the wreck?","Marge Awakened by Call, Prepares for Work, and Departs","The sequence begins when Marge is roused by an urgent call, prompting her to prepare and leave for work. This moment initiates her involvement with the unfolding events along the road, leading directly to her delivery of earthworms to Norm at the station, her subsequent return home with critical news, and her later examination of the accident site where she questions the trooper's absence. [scene: 8、EXT. ROAD]",Narrative Progression
