id,movie_id,language,related_scenes,question,answer,evidence_or_reason,question_type
1,en5a2464c851a44d5e814a92455b48783b,en,15、INT. LIVING ROOM - NIGHT,What does Watson aim to achieve by entering Holmes's flat so abruptly?,Confront Holmes immediately,"Watson arrives at 221B Baker Street, unlocks the front door, and moves quickly through the vestibule and up the stairs. He opens the flat door without hesitation and calls out Holmes's name while standing in the doorway, signaling a direct and urgent intent.",Character Understanding
2,en5a2464c851a44d5e814a92455b48783b,en,16、INT. LIVING ROOM - NIGHT,What does Watson's outburst reveal about his view of his relationship with Holmes in this moment?,"He sees himself as betrayed and publicly endangered by Holmes, shifting from trusted ally to aggrieved party demanding accountability.","Watson storms in furious, accusing Holmes of deception that has damaged his reputation and caused real consequences like lost pension and whispers among former comrades. His demands for action—marriage, separation, legal threats—reflect his belief that their relationship is under public scrutiny and must be actively managed. When he notices Holmes's evasiveness about personal defenses, his anger gives way to concern, signaling a deeper emotional dependence beneath the confrontation.",Character Understanding
3,en5a2464c851a44d5e814a92455b48783b,en,16、INT. LIVING ROOM - NIGHT,What is Watson trying to achieve when Watson bursts into the room?,Force a confrontation,"Watson enters the room expecting to confront Holmes, only to find a smoking machine simulating Holmes's presence. Upon realizing he has been tricked, Watson becomes enraged, not just at the ruse itself, but at the implications—Holmes used his name to entangle him in a personal scandal involving a woman, risking Watson's standing in St. Petersburg and with his former regiment. His reaction stems from a deep concern for his honor and the potential consequences of being falsely associated with Holmes's actions.",Character Understanding
4,en5a2464c851a44d5e814a92455b48783b,en,29、INT. LIVING ROOM - 221B BAKER STREET - DAY,What shift in Watson's perception of danger occurs when he enters Holmes' room?,He realizes the threat has escalated beyond Gabrielle's disappearance to Holmes being in immediate peril.,"Watson rushes to Holmes' room after learning Gabrielle is missing, only to freeze upon seeing something that signals direct danger to Holmes, shifting his focus from a search to a crisis response.",Character Understanding
5,en5a2464c851a44d5e814a92455b48783b,en,33、INT. EMPTY SHOP - DAY,What does Gabrielle do upon noticing the letter on the cage?,Hands the letter to Holmes,"After the old woman in the wheelchair leaves, Gabrielle notices a letter addressed to Sherlock Holmes resting on top of the cage. She picks it up and hands it to him, prompting Holmes to open it with his cane and read aloud a summons from Mycroft to attend the Diogenes Club by 11 a.m. Watson checks his watch, noting it is 10:43, but Holmes corrects him, stating the watch is slow and needs resetting. Amidst this, Holmes deduces they are in Inverness, Scotland, based on a scrap of newspaper found in the cage, while Gabrielle questions whether Emile will come personally to retrieve the letter.",Scene Grounding
6,en5a2464c851a44d5e814a92455b48783b,en,12、INT. DRESSING ROOM - NIGHT,What action marks the turning point in Watson's experience during the dressing room scene?,Watson dances ecstatically with ballerinas,"After Holmes leaves the party, Watson continues dancing with growing joy, spinning and leaping among the ballerinas, fully immersed in the celebration. Rogozhin watches silently, then whispers a revelation about Watson to the dancers, causing them to gradually withdraw and replace him with male partners. As Watson notices the shift and feels increasingly isolated, he confronts Rogozhin, who implies that Holmes has been informed about Watson’s relationship. In response, Watson seizes Rogozhin’s glass of vodka and drinks it in a moment of distress.",Scene Grounding
7,en5a2464c851a44d5e814a92455b48783b,en,23、INT. LIVING ROOM - 221B BAKER STREET - NIGHT,What action initiates the examination of Gabrielle upon her arrival at Baker Street?,Watson leads Gabrielle to a chair by the fireplace,"Upon arriving at 221B Baker Street, Watson guides Gabrielle to a chair by the fireplace and helps her sit, marking the start of his assessment. He notices a bruise on her temple with coagulated blood, indicating the injury preceded her time in the water, and concludes she was deliberately attacked. He requests his medical bag, which Holmes retrieves from another room, while continuing his evaluation.",Scene Grounding
8,en5a2464c851a44d5e814a92455b48783b,en,15、INT. LIVING ROOM - NIGHT; 16、INT. LIVING ROOM - NIGHT,What action by Holmes directly prompts Watson's outburst upon entering the flat?,Holmes adjusts chair and dims lamp,"Before Watson returns, Holmes rearranges the wing chair to face away from the door and lowers the lamp's wick, creating the illusion that someone is seated in the chair smoking. When Watson enters, he sees the pipe smoke rising from the empty chair and immediately reacts with anger, feeling deceived. His confrontation escalates when he discovers the chair holds only a smoking machine and Holmes emerges from the shadows, having orchestrated the setup to avoid a difficult personal matter.",Causal-Motivational Reasoning
9,en5a2464c851a44d5e814a92455b48783b,en,31、INT. LIVING ROOM - DAY; 39、INT. LIVING ROOM - 221B BAKER STREET - DAY,What event immediately precedes and enables Gabrielle's search for her glove in the flat?,Holmes and Watson arrive at the landing outside their flat,"Holmes and Watson return to the landing outside their flat, where Gabrielle is already waiting in the open doorway. Her presence at the threshold, initiated by their arrival, directly precedes her subsequent entry and search for the missing glove within the room.",Causal-Motivational Reasoning
10,en5a2464c851a44d5e814a92455b48783b,en,31、INT. LIVING ROOM - DAY; 39、INT. LIVING ROOM - 221B BAKER STREET - DAY,What moment earlier in the scene explains why Gabrielle later searches for her missing glove?,Holmes humorously identifies Watson as the handsome one,"When Gabrielle first arrives at Baker Street, disoriented and unsteady, Holmes greets her and, when she cannot immediately distinguish between him and Watson, quips that Watson is the handsome one. Watson reacts with visible pleasure, twirling his mustache, while Gabrielle continues to appear confused and overwhelmed. This exchange subtly shifts her attention toward Watson as more approachable, which later manifests when she silently turns to him during her search for the missing glove, signaling her quiet reliance on him after that moment of recognition.",Causal-Motivational Reasoning
11,en5a2464c851a44d5e814a92455b48783b,en,15、INT. LIVING ROOM - NIGHT; 16、INT. LIVING ROOM - NIGHT,What event immediately prior to Holmes commenting on the flower explains Watson's abrupt destruction of it?,Watson returns to 221B Baker Street,"Watson arrives at 221B Baker Street, unlocks the front door, and strides into the vestibule. He climbs the stairs quickly, crosses the landing, and flings the flat door open. Standing in the doorway, he calls out, 'Holmes!' This reentry into their shared space marks his reengagement after a period of separation, setting the stage for the charged interaction that follows.",Causal-Motivational Reasoning
12,en5a2464c851a44d5e814a92455b48783b,en,31、INT. LIVING ROOM - DAY; 48、EXT. GLENNAHURICH CEMETARY - NIGHT,What event immediately before the coffin is opened explains Gabrielle's collapse upon seeing Valladon's body?,Gabrielle appears from Holmes' bedroom wearing his dressing gown,"Gabrielle emerges unsteady from Holmes' bedroom wrapped in his dressing gown, disoriented and only beginning to grasp her situation. Holmes addresses her as Madame Valladon and shows her a photograph of her husband, Emile, which she confirms. She is still confused about her surroundings and the identities of the men present when Watson intervenes, suggesting she needs coffee. Shortly afterward, the coffin is opened, revealing Valladon's body, at which moment she screams and faints.",Causal-Motivational Reasoning
13,en5a2464c851a44d5e814a92455b48783b,en,23、INT. LIVING ROOM - 221B BAKER STREET - NIGHT; 33、INT. EMPTY SHOP - DAY,What prompts Holmes to receive Mycroft's summons in the canary shop?,Gabrielle asks the identity of Watson and Holmes,"After Gabrielle questions who Watson and Holmes are, revealing her disorientation and lack of recognition, the scene transitions to the canary shop where she later notices a letter addressed to Holmes. This moment of uncertainty and the need to establish identity set the conditions for Mycroft's summons to arrive at a time when Holmes's presence is still unconfirmed and his role unclear, making the summons both timely and consequential.",Causal-Motivational Reasoning
14,en5a2464c851a44d5e814a92455b48783b,en,12、INT. DRESSING ROOM - NIGHT; 12、INT. DRESSING ROOM - NIGHT,What introduction creates the conditions for Holmes's moment of hesitation during the toast?,Rogozhin introduces Sherlock Holmes to Madame Petrova,"Rogozhin brings Sherlock Holmes into a softly lit room where Madame Petrova, still in costume, receives him with measured curiosity. She greets him in Russian, noting his stature, but expresses interest in his intellect, a sentiment Rogozhin affirms. The exchange establishes a tense civility between Holmes and Petrova, framed by cultural and linguistic distance, with Rogozhin serving as intermediary. This initial meeting sets the foundation for the charged dynamic later observed when they share a toast, and Holmes reacts warily to the drink.",Causal-Motivational Reasoning
15,en5a2464c851a44d5e814a92455b48783b,en,4、INT. LIVING ROOM - 221B BAKER STREET - DAY; 31、INT. LIVING ROOM - DAY,"By the time Gabrielle awakens and is identified, what key event has already taken place?",Mrs. Hudson expresses disappointment about lack of warning,"Before Gabrielle's awakening and identification, Mrs. Hudson voices her frustration over not being given prior notice, establishing a moment of tension that precedes the unfolding revelation of Gabrielle's identity.",Temporal Reasoning
16,en5a2464c851a44d5e814a92455b48783b,en,21、INT. LIVING ROOM - 221B BAKER STREET - NIGHT; 39、INT. LIVING ROOM - 221B BAKER STREET - DAY,"By the time Gabrielle begins preparing for the journey, what key event has already taken place?",Holmes questions cabbie about reason for bringing Gabrielle to 221B Baker Street,"Before Gabrielle takes steps to depart on her journey, Holmes has already interrogated the cabbie who delivered her to 221B Baker Street, extracting crucial details about her arrival and initial circumstances. This exchange provides foundational information that shapes the investigation's direction and precedes any action Gabrielle undertakes in planning her next moves.",Temporal Reasoning
17,en5a2464c851a44d5e814a92455b48783b,en,15、INT. LIVING ROOM - NIGHT; 15、INT. LIVING ROOM - NIGHT; 10、INT. LIVING ROOM - DAY,"What pivotal event sets in motion the sequence leading to Watson's confrontation with Holmes, the plea to attend the ballet, and their return to a guarded Mrs. Hudson?",Holmes arranges the room before Watson returns,"After a period of separation, Holmes prepares the shared living space in anticipation of Watson's return. This deliberate act shifts the narrative trajectory by establishing a new emotional and physical context for their reunion, directly enabling the subsequent interactions in which Watson confronts Holmes, urges him to attend the ballet, and later returns with him to find Mrs. Hudson standing watch.",Narrative Progression
18,en5a2464c851a44d5e814a92455b48783b,en,33、INT. EMPTY SHOP - DAY; 34、EXT. DIOGENES CLUB - DAY; 36、INT. STUDY - DIOGENES CLUB - DAY,What event sets in motion Holmes and Watson's involvement with the Diogenes Club and the unfolding revelations about the engineer case?,Holmes Receives Mycroft's Summons in the Canary Shop,"The narrative shifts when Holmes is contacted by Mycroft under unusual circumstances, prompting the journey to the Diogenes Club and initiating a chain of disclosures about the case, including Watson's growing curiosity, Holmes's strategic revelations, and Mycroft's explicit warning to abandon the investigation.",Narrative Progression
19,en5a2464c851a44d5e814a92455b48783b,en,23、INT. LIVING ROOM - 221B BAKER STREET - NIGHT; 23、INT. LIVING ROOM - 221B BAKER STREET - NIGHT; 38、INT. DOWNSTAIRS - 221B BAKER STEET - DAY,"What pivotal development sets in motion the investigation into Gabrielle's condition, the return to the flat, and the cabbie's testimony?",Holmes and Watson Examine Gabrielle's Condition and Clues,"Following Gabrielle's rescue, the critical assessment of her physical state and the evidence she carries becomes the foundation for subsequent inquiries. This examination reveals key details that prompt Holmes and Watson to revisit their lodgings, pursue the account of the cab driver, and analyze the water-damaged card, anchoring the next phase of their investigation.",Narrative Progression
20,en5a2464c851a44d5e814a92455b48783b,en,15、INT. LIVING ROOM - NIGHT; 23、INT. LIVING ROOM - 221B BAKER STREET - NIGHT; 16、INT. LIVING ROOM - NIGHT,"What turning point initiates the sequence in which Watson protects Gabrielle from Holmes's questioning, destroys the flower Holmes identifies, and Holmes later returns with a suitcase?",Watson Returns and Confronts Holmes,"Watson's return and direct confrontation with Holmes marks a shift in agency, triggering a chain of actions where Watson actively shields Gabrielle, rejects Holmes's observations by destroying the flower, and sets the conditions for Holmes's subsequent reappearance with a suitcase, reconfiguring their dynamic and the story's direction.",Narrative Progression
