id,movie_id,language,related_scenes,question,answer,evidence_or_reason,question_type
1,en6277019821914a26ba881ef5d254969f,en,,What motivates Alice during her confrontation with Charlene in the apartment scene?,To defend Dicky's importance to Micky's training and hold Charlene accountable for harming the family,"Alice arrives at Charlene's apartment with several of Micky's sisters. She confronts Charlene, demanding to know what she is doing to the family and insisting that Dicky is essential to Micky's training. Charlene tells her that Dicky is in prison. Enraged, Alice lunges at Charlene. Micky steps in, restraining his mother and stopping the attack. The confrontation escalates emotionally. [scene: Alice Confronts Charlene Over Dicky's Role]",Character Understanding
2,en6277019821914a26ba881ef5d254969f,en,,What does Micky intend by meeting Dicky alone in the locker room?,End their professional relationship,"Micky and Dicky meet alone in the locker room. Micky tells Dicky he can no longer work with him, citing past betrayals. He speaks quietly, his voice heavy with sorrow and regret. Dicky stares at him, stunned, asking questions, trying to understand what went wrong during his absence. Micky does not respond further. He turns and walks away, leaving Dicky standing in silence, visibly shaken.",Character Understanding
3,en6277019821914a26ba881ef5d254969f,en,,What does Alice aim to achieve by coming to Charlene's apartment with Micky's sisters?,Confront Micky directly about allegedly hiding from the family,"Alice arrives at Charlene's apartment with several of Micky's sisters. She stands on the porch and accuses Micky of hiding from the family. Charlene opens the door and tells Alice that Micky is not hiding. Alice ignores her and addresses Micky directly, demanding to know what he is doing. Micky steps forward and says he is not hiding from anyone. [Alice Confronts Micky at Charlene's Apartment]",Character Understanding
4,en6277019821914a26ba881ef5d254969f,en,,What does Dicky aim to accomplish by confronting Charlene at her apartment?,Reconcile Charlene with Micky,"Dicky walks down the street, limping at first, then breaks into a run toward Charlene's apartment building. He repeatedly presses the buzzer despite her telling him to leave. When she appears, he argues with her, asserting that Micky deserves a second chance and that she should support him. He appeals to her sense of loyalty, pointing out her own flaws and insisting that both she and he need to be in Micky's corner. After a tense exchange, she agrees to reconcile for Micky's sake, nodding to Micky when he arrives moments later.",Character Understanding
5,en6277019821914a26ba881ef5d254969f,en,,What action does Micky take immediately after reconciling with Dicky and seeing Charlene's support?,instructs Dicky to bring O'Keefe back,"After Dicky convinces Charlene to support Micky and walks away, Micky arrives and calls out in surprise. Dicky assures him they’ve resolved their issues and tells him to ask Charlene, who confirms it from her doorway. With tensions eased, Micky directs Dicky to reunite the team by bringing O'Keefe back into the fold, then walks toward Charlene.",Scene Grounding
6,en6277019821914a26ba881ef5d254969f,en,,What action takes place when Dicky returns to Ramalho's West End Gym with Alice and Little Dicky?,Dicky returns to Ramalho's West End Gym with Alice and Little Dicky,"Dicky arrives at Ramalho's West End Gym accompanied by Alice and Little Dicky, prompting Micky to stop sparring. Gym members greet Dicky as he enters, and there is tense eye contact between Micky, Alice, and Charlene. George introduces Dicky to Sal LoNano, and Dicky shares an emotional high five with Ray Ramalho. Mickey O'Keefe becomes angry at Micky for interrupting his workout. Dicky addresses the room, offering a public apology and declaring his commitment to supporting Micky's career, speaking with emotion about being back at the gym. Later, Dicky follows Micky into the locker room and expresses hope they can work together again, but Micky reveals he has promised not to let Dicky manage him anymore.",Scene Grounding
7,en6277019821914a26ba881ef5d254969f,en,,What action takes place in the scene where Micky prepares in his apartment above the garage before joining his family for the fight?,Micky prepares for the day before the big fight,"Micky stands in front of the mirror in his small apartment, adjusting his button-down shirt and pulling on a sports coat that doesn’t fit right. His suitcase lies open on the bed. He grabs it and heads out. Outside, he parks his 1989 silver Ford Tempo in front of his parents’ house on Hawthorne Street, where a limousine is already waiting. The family, including Alice, George, Pork, Sherry, and Red Rog, gathers by the vehicle, dressed for the occasion. Alice comforts Little Dicky, instructing him to be good for Aunt Cathy while his father helps Uncle Micky. Micky joins the group, and after a quiet exchange with Mickey O’Keefe about leaving without Dicky, affirms that he needs Dicky’s presence, believing he can’t win without him.",Scene Grounding
8,en6277019821914a26ba881ef5d254969f,en,,What event directly motivates Alice's confrontation with Micky at Charlene's apartment?,Alice confronts Charlene during an awkward living room meeting,"In the living room at Alice and George Ward's house, the family gathers as Alice announces Micky's new fight. When Micky expresses disinterest and a sense of unease about continuing his boxing career in Lowell, Alice is stunned and presses him for answers. Dicky challenges Micky to clarify his complaints, creating tension. Amid the strained exchange, Alice turns her focus to Charlene, who is present but silent, and confronts her directly, marking a shift in Alice's emotional trajectory that culminates in her later confrontation with Micky.",Causal-Motivational Reasoning
9,en6277019821914a26ba881ef5d254969f,en,,What moment immediately prior to the weigh-in enables Micky to reunite his team?,Dicky whispers encouragement to Micky before weigh-in,"Before the official weigh-in, Dicky stands with Micky, whispering encouragement. Micky acknowledges his mother during a press interaction and remains composed when questioned about fighting in Shea Neary's hometown. The media builds tension around the upcoming title fight, and Alice confronts Neary during the face-off, requiring Dicky to intervene. Later, Dicky and Micky share a quiet moment where Micky affirms Dicky’s legacy regarding his fight with Sugar Ray Leonard. This exchange marks a turning point in their relationship, after which Dicky begins reconciling with others in Micky’s life, ultimately leading to the team’s reunion.",Causal-Motivational Reasoning
10,en6277019821914a26ba881ef5d254969f,en,,What event directly prompts Micky to reunite his team?,Alice confronts Charlene about Dicky's role in Micky's training,"Alice arrives at Charlene's apartment with several of Micky's sisters and confronts her, insisting that Dicky is essential to Micky's success. The confrontation turns physical until Micky intervenes. Later, after tensions flare again at a bar, Micky questions his mother about her loyalty to Dicky, leading to an emotional moment that shifts his perspective. This sequence sets the stage for Dicky and Charlene to reconcile their roles in Micky's life, culminating in Micky's decision to bring his team back together.",Causal-Motivational Reasoning
11,en6277019821914a26ba881ef5d254969f,en,,What event directly precipitates Dicky's emotional breakdown in the holding cell after his arrest?,Micky and Dicky are arraigned separately in Lowell District Court,"At Lowell District Court, Micky and Dicky are processed in separate custody, both injured and shackled. During the arraignment, Dicky faces charges while Micky is present but increasingly distant. Alice, overwhelmed, breaks down in tears and drops Micky's lobby card without noticing. After the hearing, the brothers are led to different cells. In the courthouse atrium, Dicky pleads with Micky, claiming self-defense, but Micky rebukes him, blaming him for his injured hand. Dicky flinches at the verbal blow, and Micky walks away, deepening Dicky's isolation just before he is detained and later breaks down in the holding cell, fearing the end of his comeback and abandonment by those around him.",Causal-Motivational Reasoning
12,en6277019821914a26ba881ef5d254969f,en,,"By the time Alice confronts Charlene about Dicky's involvement, what has already taken place involving Alice and Micky near the house?",Alice approaches the front porch of the crack house while Micky walks down the driveway,"Before Alice confronts Charlene regarding Dicky's role, a key moment unfolds at the house where Alice moves toward the front porch of the crack house while Micky is seen walking down the driveway. This sequence establishes the immediate physical and narrative setup preceding the confrontation, grounding the tension in their parallel movements and positioning.",Temporal Reasoning
13,en6277019821914a26ba881ef5d254969f,en,,"By the time Alice and Dicky watch the fight from afar, what has already taken place between Dicky and Micky?",Dicky convinces Micky to keep fighting,"Before Alice and Dicky observe the fight from a distance, Dicky has already intervened to persuade Micky to continue the match, reinforcing his role as both mentor and brother. This pivotal moment occurs during a private conversation in a parked limousine outside Alice and George Ward's house, setting the emotional and narrative stage for the events that follow.",Temporal Reasoning
14,en6277019821914a26ba881ef5d254969f,en,,"What turning point sets in motion the sequence leading to the confrontations between Alice, Micky, and Charlene surrounding the fight and the lobby card?",Alice Announces a New Fight Amid Family Tension,"In the aftermath of escalating personal and professional tensions, Alice reveals a new fight opportunity during a charged family gathering outside a Lexington art-house theater, triggering a chain of confrontations that directly lead to Micky's preparation for the weigh-in and the subsequent conflicts over Charlene's future and Alice's ambitions.",Narrative Progression
15,en6277019821914a26ba881ef5d254969f,en,,"What pivotal event sets in motion the chain of developments leading to Dicky's escape, George's intervention, and the family's reaction to his arrest?",The Family Gathers Before the Fight,"In the scene 'EXT. MICKY'S APARTMENT ABOVE GARAGE - MORNING - LATER IN THIB,' tensions within the family reach a critical mass as they confront the escalating consequences of Dicky's actions. This moment catalyzes the subsequent events, including Micky waiting for Dicky at the crack house, Dicky's narrow escape interrupted by George, and the family's emotional reckoning at the diner following Dicky's arrest.",Narrative Progression
16,en6277019821914a26ba881ef5d254969f,en,,"What pivotal event sets off the chain of consequences leading to Micky's intervention, Dicky's court appearance, and the family's reaction at the diner?",Dicky's Fight with Bouncer and Police at Cosmopolitan Cafe,"The confrontation between Dicky and the bouncer at the Cosmopolitan Cafe escalates into a physical altercation with police, resulting in his arrest. This incident directly triggers the subsequent legal and familial developments, serving as the catalyst for Micky's involvement, the arraignment proceedings, and the family's emotional response during their meeting at the diner [scene: INT. OLYMPIA RESTAURANT - DOWNTOWN, LOWELL - NIGHT].",Narrative Progression
17,en6277019821914a26ba881ef5d254969f,en,,"What turning point initiates the chain of events leading directly to Micky losing the keys, Alice announcing a new fight, and Micky’s walk to the ring?",Micky Wakes Up in Pain and Hesitates to Call Charlene,"The sequence begins when Micky experiences physical pain upon waking and delays reaching out to Charlene, creating emotional and logistical friction that sets off a cascade of decisions affecting the family and fight preparations. This moment disrupts the usual dynamics and forces subsequent actions, including the misplacement of the keys, Alice's announcement under tension, and Micky’s isolated approach to the ring. [scene: 3、EXT. ALICE & GEORGE WARD'S HOUSE - LIMOUSINE (PARKED) -]",Narrative Progression
18,en6277019821914a26ba881ef5d254969f,en,,What event directly triggers Micky's attempt to stop the police during Dicky's arrest?,Dicky confronts bouncer outside Cosmopolitan Cafe,"Dicky confronts a bouncer outside the Cosmopolitan Cafe, escalating the situation by punching him and then attacking arriving police officers, which leads to a violent struggle as they attempt to subdue him. This confrontation draws Micky to the scene, where he intervenes by trying to pull an officer off Dicky, prompting the police to turn on him and beat him as Charlene and others react in horror.",Causal-Motivational Reasoning
19,en6277019821914a26ba881ef5d254969f,en,,What advice does Mickey O'Keefe give Micky that sets up Alice's later confrontation with Charlene about Dicky's importance to Micky's career?,Mickey O'Keefe advises Micky to move on without Dicky,"In the scene following Micky's visit to the crack house, Mickey O'Keefe urges Micky to let go of Dicky and move forward without him, arguing that Dicky brings only trouble and that Micky is already capable on his own. Micky resists, insisting that Dicky taught him everything and has always been there for him. This exchange establishes the growing tension around Dicky's role in Micky's life, which later erupts when Alice confronts Charlene, defending Dicky's essential place in Micky's training and family dynamic.",Causal-Motivational Reasoning
20,en6277019821914a26ba881ef5d254969f,en,,What event prior to the family gathering explains Micky's subdued reaction when Alice announces his new fight?,Micky wakes up and takes pain medication,"In the early morning, Micky awakens on his couch, still in yesterday’s clothes, with bandages on his head. He moves to the kitchen, drinks a beer, and takes pain medication. He picks up a cocktail napkin with Charlene’s number and a heart drawn on it, starts to call, then hesitates and hangs up. He returns to the couch and falls back asleep as the TV plays silently. Later that day, at the family gathering, Alice announces Micky’s new fight, but he responds with detachment, expressing dissatisfaction with his stagnant routine in Lowell—behavior that reflects his physical discomfort and emotional withdrawal evident earlier.",Causal-Motivational Reasoning
21,en6277019821914a26ba881ef5d254969f,en,,Which scene or scenes best match the following description: Jimmy opens the door as Micky stands outside. Kasie runs up and hugs her father. She tells him about his upcoming fight against Saoul Mamby.,1、EXT. BEAUTIFUL HOUSE - FRONT DOOR - DAY | 2、EXT. MICKY'S APARTMENT ABOVE GARAGE - MORNING - LATER IN THIB,Jimmy opens the door as Micky stands outside. Kasie runs up and hugs her father. She tells him about his upcoming fight against Saoul Mamby.,Scene Grounding
22,en6277019821914a26ba881ef5d254969f,en,,In which scene or scenes are Red Dog and Tar both present?,"3、EXT. ALICE & GEORGE WARD'S HOUSE - LIMOUSINE (PARKED) - | 5、EXT. LEXINGTON ART-HOUSE MOVIE THEATER - NIGHT | 12、INT. OLYMPIA RESTAURANT - DOWNTOWN, LOWELL - NIGHT | 16、EXT. LOWELL STREET NEARY MICKY'S - DAY","{""pair"": [""Red Dog"", ""Tar""], ""pair_mentions"": 24, ""scene_grounding_subtype"": ""copresence_localization"", ""scene_count"": 4, ""scene_numbers"": [3, 5, 12, 16], ""scene_titles"": [""3、EXT. ALICE & GEORGE WARD'S HOUSE - LIMOUSINE (PARKED) -"", ""5、EXT. LEXINGTON ART-HOUSE MOVIE THEATER - NIGHT"", ""12、INT. OLYMPIA RESTAURANT - DOWNTOWN, LOWELL - NIGHT"", ""16、EXT. LOWELL STREET NEARY MICKY'S - DAY""]}",Scene Grounding
23,en6277019821914a26ba881ef5d254969f,en,,In which scene or scenes is Little Alice clearly present?,"5、EXT. LEXINGTON ART-HOUSE MOVIE THEATER - NIGHT | 12、INT. OLYMPIA RESTAURANT - DOWNTOWN, LOWELL - NIGHT | 16、EXT. LOWELL STREET NEARY MICKY'S - DAY | 17、INT. GYM - CONTINUOUS","{""character"": ""Little Alice"", ""mention_total"": 14, ""scene_span"": 13, ""scene_grounding_subtype"": ""entity_presence_localization"", ""scene_count"": 4, ""scene_numbers"": [5, 12, 16, 17], ""scene_titles"": [""5、EXT. LEXINGTON ART-HOUSE MOVIE THEATER - NIGHT"", ""12、INT. OLYMPIA RESTAURANT - DOWNTOWN, LOWELL - NIGHT"", ""16、EXT. LOWELL STREET NEARY MICKY'S - DAY"", ""17、INT. GYM - CONTINUOUS""]}",Scene Grounding
24,en6277019821914a26ba881ef5d254969f,en,,In which scene or scenes does Dicky repeatedly press the buzzer at Charlene's apartment building and persist until she responds from the intercom and eventually comes to the door?,17、INT. GYM - CONTINUOUS | 18、EXT. CRACK STREET - CONTINUOUS,"Dicky approaches Charlene's apartment building and repeatedly presses the buzzer until she responds via intercom, telling him to leave and calling him a piece of shit. He continues pressing the buzzer until she comes to the door, where their confrontation continues face to face. This sequence begins outside the apartment building and overlaps with the immediate aftermath as Micky arrives on scene.",Scene Grounding
25,en6277019821914a26ba881ef5d254969f,en,,"In which scene or scenes does Dicky arrive at the gym with Alice and Little Dicky, causing Micky to stop sparring as gym members greet Dicky upon his entrance?",16、EXT. LOWELL STREET NEARY MICKY'S - DAY | 17、INT. GYM - CONTINUOUS,"Dicky arrives at Ramalho's West End Gym accompanied by Alice and Little Dicky. Micky stops sparring when he sees them, and gym members greet Dicky as he walks in. The arrival triggers immediate reactions from those present, including awkward glances between Micky, Alice, and Charlene, and sets off a chain of interactions involving George, Sal LoNano, and Ray Ramalho.",Scene Grounding
26,en6277019821914a26ba881ef5d254969f,en,,Who are the 3 most central characters in this story?,"Charlene, Dicky, Micky_Ward",,Character Understanding
