id,movie_id,language,related_scenes,question,answer,evidence_or_reason,question_type
1,en46a42bd9735146aab01614153446ad01,en,,What is Zus trying to achieve when Zus zus greets Tuvia with anger?,Force a confrontation,"Zus greets Tuvia with anger, criticizing him for returning with more people instead of food. He demands to know if they at least brought back a gun. Tuvia shows him the weapon, revealing there are only four bullets. Zus stares at the gun, then declares they will have to make the bullets count. He walks away toward the group gathered around the food. [Zus Confronts Tuvia Over New Arrivals and Ammunition]",Character Understanding
2,en46a42bd9735146aab01614153446ad01,en,,What is Zus's immediate goal in the scene where he attacks the farmer after being told there is no gun?,To force the farmer to reveal the location of his rifle,"Zus demands to know where the farmer keeps his gun. The farmer says he has none. In response, Zus grabs a dinner plate and smashes it into the farmer's face. Bloodied, the farmer cowers. Zus kicks him, demanding the weapon again. The farmer pleads, begging for mercy. Zus kicks him once more. The farmer begins to weep. Zus dumps the remains of the farmer's meal over him. Zus threatens to hit him again, warning of worse consequences. The farmer, trembling, points to a rifle above the stove. Zus kicks him aside, climbs up, and takes the rifle. He aims it at the farmer and warns him they were never there. [Zus Forces the Farmer to Surrender His Rifle]",Character Understanding
3,en46a42bd9735146aab01614153446ad01,en,,What is Tuvia trying to achieve when Tuvia tuvia stands in the doorway?,Force a confrontation,"Tuvia enters the room in 'Tuvia Confronts the Police Captain' with a pistol, presses it to the Captain's forehead, and demands he kneel. He shouts the names of his parents, David and Beila Bielski, and references his slain brothers and others, indicating his intent is not merely to threaten but to make the Captain face moral accountability.",Character Understanding
4,en46a42bd9735146aab01614153446ad01,en,,What is Tuvia's objective when he arrives at the Police Captain's home?,Confront and execute the Captain and his sons,"Tuvia stands at the doorway of the Police Captain's home, drenched from the rain, a pistol at his side. The Captain, his wife, and their two sons look up from dinner. Tuvia asks if the Captain knows who he is and whether he remembers why he is there. The Captain claims he was only doing his job and insists he treated Tuvia’s family fairly. Tuvia accuses him of hunting Jews, then declares the names of his murdered family members. After the Captain pleads and one son attempts to intervene, Tuvia shoots the son, then kills the Captain and the second son, carrying out a lethal act of retribution.",Character Understanding
5,en46a42bd9735146aab01614153446ad01,en,,What action takes place when Zus confronts Tuvia about the new arrivals and ammunition?,Zus criticizes Tuvia for bringing more people,"Zus greets Tuvia with anger, criticizing him for returning with more people instead of food. He demands to know if they at least brought back a gun. Tuvia shows him the weapon, revealing there are only four bullets. Zus stares at the gun, then declares they will have to make the bullets count. He walks away toward the group gathered around the food.",Scene Grounding
6,en46a42bd9735146aab01614153446ad01,en,,What action occurs when Tuvia returns to his brothers in the forest at dawn?,Asael embraces Tuvia emotionally,"When Tuvia returns to the forest camp at dawn, Asael immediately reacts by leaping to his feet and throwing his arms around him, crying about the death of their parents and clinging to Tuvia as if he were salvation. Tuvia silently embraces both Asael and Aron, marking a moment of reunion and emotional release before Zus appears and confronts Tuvia with cautious recognition.",Scene Grounding
7,en46a42bd9735146aab01614153446ad01,en,,What action takes place in the scene where Zus expresses concern about the group's ability to feed the new survivors?,Zus voices concern about feeding the new survivors,"In this scene, Zus observes the survivors eating and raises an immediate concern about the group's limited resources, stating they cannot sustain the additional people. This prompts Tuvia to decide on a course of action—to seek food and a pistol from Koscik. As Tuvia departs, Zus calls after him with a sarcastic remark, underscoring the tension around the decision.",Scene Grounding
8,en46a42bd9735146aab01614153446ad01,en,,What event directly prompts Zus's confrontation with Tuvia over the influx of new arrivals and limited ammunition?,Aron leads survivors from the trees,"Aron emerges from the forest with a group of survivors, including a traumatized girl and her family, who are in dire condition. Tuvia provides them with food, but the group arrives with no supplies or weapons. This arrival sets the stage for Zus's later criticism of Tuvia, as the camp now faces increased strain on resources and insufficient arms, leading to his outburst when he learns only four bullets were recovered.",Causal-Motivational Reasoning
9,en46a42bd9735146aab01614153446ad01,en,,What proposal creates the conditions for Asael to assert the brothers' forest expertise and Tuvia to yield to their plan?,Zus suggests raiding Stankowicz's farm,"While shivering and hungry in the Nalibocki Forest, the group struggles to find food. Asael uncovers only worm-infested potatoes, and their matches are too wet to use. Amid the desperation, Zus proposes raiding Stankowicz’s farm, then shifts the idea to Wilencki’s farm when Asael raises concerns about dogs. Tuvia questions the risk, fearing the farmer will involve the police, but Zus remains defiant, insisting they will take the food regardless. Asael reinforces the plan by emphasizing their knowledge of the forest, which becomes the decisive factor in Tuvia’s silent acceptance of his brothers’ leadership in the raid.",Causal-Motivational Reasoning
10,en46a42bd9735146aab01614153446ad01,en,,What exchange creates the tension that fuels the brothers' argument about acquiring weapons for the resistance?,Zus questions Tuvia about his return and intentions,"In a quiet forest clearing, Zus confronts Tuvia upon his return, chewing aggressively as he demands to know why Tuvia has come back and whether he has a plan. Tuvia remains evasive, offering no clear answer, while the younger brothers watch silently. This unresolved confrontation establishes a rift between the brothers, particularly Zus’s skepticism toward Tuvia’s leadership, which directly surfaces again when they debate the need for more weapons in the resistance effort.",Causal-Motivational Reasoning
11,en46a42bd9735146aab01614153446ad01,en,,What action by Koscik creates the immediate necessity for Tuvia to hide moments later?,Koscik hands bullets to Tuvia,"In a warmly lit kitchen, Koscik gives Tuvia four bullets, recalling Tuvia's father with respect, sharing a toast to the dead, and offering vodka despite his wife's silent hostility. Moments later, approaching headlights signal danger, and Koscik urgently tells Tuvia to hide in the barn—his earlier act of supplying ammunition making Tuvia’s presence incriminating and exposure lethal. [19 A CLEARING (CAMP #1) - LATER 19]",Causal-Motivational Reasoning
12,en46a42bd9735146aab01614153446ad01,en,,"By the time Tuvia seeks supplies and a weapon, what has already occurred in the forest camp?",Tuvia asks if there is any food left,"In an earlier scene set in the Nalibocki Forest, Tuvia discovers the group's food stores are nearly depleted—finding the sausage gone and worms in the potatoes—prompting him to ask if any food remains. This moment precedes his subsequent effort to secure additional supplies and a weapon elsewhere in the forest.",Temporal Reasoning
13,en46a42bd9735146aab01614153446ad01,en,,"By the time Aron brings the survivors from the forest, what has already occurred in the grove?",Aron discovers a pile of corpses,"Before Aron leads the survivors out of the forest, he enters a wooded grove while chasing a small girl and stumbles upon a mass grave, a discovery that sets into motion his decision to extract the others. This event takes place in the scene immediately preceding his return with the group.",Temporal Reasoning
14,en46a42bd9735146aab01614153446ad01,en,,How does the working relationship between Asael and Malbin remain consistent from the truck journey through the evacuation under fire?,They continue coordinating as trusted comrades under pressure,"From the strategic discussion during the truck journey to the urgent coordination during the evacuation under fire, Asael and Malbin maintain a cooperative dynamic, contributing jointly to group efforts, following and issuing instructions without conflict, and demonstrating mutual reliance in high-stakes situations.",Role-Relation Continuity
15,en46a42bd9735146aab01614153446ad01,en,,"What pivotal event sets in motion the sequence leading to the acquisition of bullets, Tuvia going into hiding, and the raid on the farmer's home?",Tuvia Seeks Supplies and a Weapon,"In the scene '18 ANOTHER PART OF THE FOREST 18', Tuvia's decision to seek supplies and a weapon marks a critical shift in the narrative, initiating a chain of actions that directly leads to Koscik providing him with ammunition, instructing him to hide, and ultimately joining Zus in raiding the farmer's home.",Narrative Progression
16,en46a42bd9735146aab01614153446ad01,en,,"What turning point initiates the chain of events leading to Tuvia revealing Rifka's whereabouts, fleeing the house in the rain, and returning to his brothers?",Tuvia Dresses and Departs as Rifka Stays Behind,"In the scene '7 A BOURGEOIS APARTMENT -- DAY 7', Tuvia prepares and leaves the apartment while Rifka remains behind, marking a decisive shift in his personal trajectory. This departure sets into motion his subsequent emotional confrontation, flight during the storm, and eventual reunion with his brothers.",Narrative Progression
17,en46a42bd9735146aab01614153446ad01,en,,What turning point initiates the sequence in which the brothers challenge Tuvia’s leadership and assert their roles in the forest camp?,Tuvia Returns to His Brothers,"Tuvia's return to the forest camp marks a pivotal shift in group dynamics, reigniting tensions among the brothers and setting in motion a series of confrontations over leadership, resources, and survival strategy. This event directly precedes escalating disagreements, including Zus’s challenge regarding new arrivals and ammunition, and Asael’s assertion of his knowledge about the forest, culminating in Tuvia’s eventual concession. [11 THE NALIBOKI FOREST AT DAWN - VIEWED FROM ABOVE 11]",Narrative Progression
18,en46a42bd9735146aab01614153446ad01,en,,"What turning point shifts the narrative trajectory toward the developments involving Tuvia's inquiry about Sonia and the baby, Zus's proposal to raid Wilencki's farm, and the brothers' conflict over resistance weapons?",Zus Questions Tuvia's Return,"The scene titled '12 ASAEL AND ARON SLEEP HUDDLED ON THE GROUND 12' marks the moment when tensions between the brothers escalate, catalyzing a shift in group dynamics and strategic direction. This moment sets in motion subsequent decisions and conflicts regarding personal loyalties, military action, and leadership challenges within the partisan camp.",Narrative Progression
19,en46a42bd9735146aab01614153446ad01,en,,What prompts Koscik to give Tuvia bullets later in the story?,Asael reveals Koscik possesses a pistol,"Asael informs his brothers that Koscik has a pistol, a detail observed previously. This disclosure sets in motion the later moment when Koscik, approached by Tuvia, provides bullets—limited though they are—marking a tangible step in the brothers' efforts to arm themselves. The exchange occurs in Koscik's kitchen, where past loyalties and personal risks surface amid quiet tension with his disapproving wife.",Causal-Motivational Reasoning
20,en46a42bd9735146aab01614153446ad01,en,,What action by Shimon creates the personal connection that leads Tuvia to invite him to join the group?,Shimon offers condolences for Tuvia's parents,"Shimon approaches Tuvia and expresses that he has heard about the death of Tuvia’s parents, offering his condolences. Tuvia responds silently with a shake of his head. The exchange continues as Shimon inquires about Tuvia’s brothers, recalling Zus by name and asking if they are hiding in the forest, to which Tuvia nods. This moment of personal recognition and empathy establishes a bond that precedes Tuvia’s decision to include Shimon in his group.",Causal-Motivational Reasoning
21,en46a42bd9735146aab01614153446ad01,en,,In which scene or scenes are Viktor and Zus both present?,"104D BACK TO THE WEDDING 104D | 122A IN HIS ZEMYLANKA - LATER 122A | 131A IN THE DEEP FOREST -- ARON IS OUT HUNTING 131A | 138 TUVIA STANDS ALONE IN THE FOREST, HIS FACE IN SHADOW 138","{""pair"": [""Viktor"", ""Zus""], ""pair_mentions"": 34, ""scene_grounding_subtype"": ""copresence_localization"", ""scene_count"": 4, ""scene_numbers"": [114, 141, 151, 158], ""scene_titles"": [""104D BACK TO THE WEDDING 104D"", ""122A IN HIS ZEMYLANKA - LATER 122A"", ""131A IN THE DEEP FOREST -- ARON IS OUT HUNTING 131A"", ""138 TUVIA STANDS ALONE IN THE FOREST, HIS FACE IN SHADOW 138""]}",Scene Grounding
22,en46a42bd9735146aab01614153446ad01,en,,In which scene or scenes is Sergeant clearly present?,49 A GERMAN STAFF CAR 49 | 50 DIRECTLY OVER THE DITCH 50 | 52 UP THE ROAD 52 | 56 UP THE ROAD 56,"{""character"": ""Sergeant"", ""mention_total"": 17, ""scene_span"": 8, ""scene_grounding_subtype"": ""entity_presence_localization"", ""scene_count"": 4, ""scene_numbers"": [50, 51, 53, 57], ""scene_titles"": [""49 A GERMAN STAFF CAR 49"", ""50 DIRECTLY OVER THE DITCH 50"", ""52 UP THE ROAD 52"", ""56 UP THE ROAD 56""]}",Scene Grounding
23,en46a42bd9735146aab01614153446ad01,en,,In which scene or scenes are Riva and Tamara both present?,103 A FLAT STRETCH OF TRAIN TRACK 103 | 130A THE OTRIAD 130A | 133A EXT. CAMP PERIMETER - DAYS LATER 133A | 142 THE SPOTTER PLANE -- FLIES OVER THE BIELSKI CAMP 142,"{""pair"": [""Riva"", ""Tamara""], ""pair_mentions"": 24, ""scene_grounding_subtype"": ""copresence_localization"", ""scene_count"": 4, ""scene_numbers"": [109, 149, 153, 162], ""scene_titles"": [""103 A FLAT STRETCH OF TRAIN TRACK 103"", ""130A THE OTRIAD 130A"", ""133A EXT. CAMP PERIMETER - DAYS LATER 133A"", ""142 THE SPOTTER PLANE -- FLIES OVER THE BIELSKI CAMP 142""]}",Scene Grounding
24,en46a42bd9735146aab01614153446ad01,en,,In which scene or scenes are Rachel and Tuvia both present?,18 ANOTHER PART OF THE FOREST 18 | 61 IN THE WOODS 61 | 103 A FLAT STRETCH OF TRAIN TRACK 103 | 119 IN THE TRUCK (TRAVELING) 119,"{""pair"": [""Rachel"", ""Tuvia""], ""pair_mentions"": 19, ""scene_grounding_subtype"": ""copresence_localization"", ""scene_count"": 4, ""scene_numbers"": [19, 62, 109, 137], ""scene_titles"": [""18 ANOTHER PART OF THE FOREST 18"", ""61 IN THE WOODS 61"", ""103 A FLAT STRETCH OF TRAIN TRACK 103"", ""119 IN THE TRUCK (TRAVELING) 119""]}",Scene Grounding
25,en46a42bd9735146aab01614153446ad01,en,,In which scene or scenes are Miriam and Tuvia both present?,"62 THE FOREST CAMP - DAWN 62 | 133A EXT. CAMP PERIMETER - DAYS LATER 133A | 138 TUVIA STANDS ALONE IN THE FOREST, HIS FACE IN SHADOW 138 | 149 TUVIA'S WORLD IS IN SLOW-MOTION 149","{""pair"": [""Miriam"", ""Tuvia""], ""pair_mentions"": 16, ""scene_grounding_subtype"": ""copresence_localization"", ""scene_count"": 4, ""scene_numbers"": [63, 153, 158, 169], ""scene_titles"": [""62 THE FOREST CAMP - DAWN 62"", ""133A EXT. CAMP PERIMETER - DAYS LATER 133A"", ""138 TUVIA STANDS ALONE IN THE FOREST, HIS FACE IN SHADOW 138"", ""149 TUVIA'S WORLD IS IN SLOW-MOTION 149""]}",Scene Grounding
26,en46a42bd9735146aab01614153446ad01,en,,Who are the 3 most central characters in this story?,"Asael, Tuvia, Zus",,Character Understanding
