id,movie_id,language,related_scenes,question,answer,evidence_or_reason,question_type
1,enf854f6d986194b25a467dae9b922f46e,en,27、INT. VAULT - DAY,What does Thor seek to accomplish upon discovering the Vault breach?,Launch a preemptive strike on Jotunheim,"Thor enters the Vault to find devastation—shattered ice, smoldering Frost Giant corpses, and the Destroyer returning the Casket of Ancient Winters. When Odin arrives, Thor demands retribution, framing the intrusion as an act of war. He argues that the breach justifies a full retaliation to crush the Frost Giants before they can threaten Asgard again. Odin refuses, citing the existing truce with Laufey and the absence of a broader threat, emphasizing defense over aggression. Thor insists he would act decisively as king, but is reminded he is not yet one. Recognizing his father’s unyielding stance, Thor abandons the argument and departs in defiance.",Character Understanding
2,enf854f6d986194b25a467dae9b922f46e,en,37、EXT. CENTRAL PLAZA - DAY,What does Thor aim to accomplish when Laufey mocks him as a boy seeking glory?,Confront Laufey and assert authority,"Laufey mocks Thor, accusing him of craving battle and being nothing more than a boy trying to prove himself. Thor steps forward, but Frost Giants move to block his path. Loki urges him to stop, warning they are outnumbered. Laufey steps out of the shadows and warns Thor of the consequences of his actions, telling him to leave while he still can. After a tense pause, Thor turns away. Loki speaks for the group, accepting the offer to depart. The Asgardians begin to leave the plaza.",Character Understanding
3,enf854f6d986194b25a467dae9b922f46e,en,39、INT. HEIMDALL'S OBSERVATORY - DAY,What does Thor aim to do by challenging Odin in the Observatory?,Assert his authority as king,"Heimdall stands at the controls of the Observatory as Odin removes his sword from the panel and throws it back to him. Heimdall steps away. Thor demands to know why Odin brought them back to Asgard, insisting he was protecting his home. Odin criticizes Thor’s actions and questions his leadership, accusing him of pride and vanity. Thor argues that inaction will make Asgard appear weak and declares that the Nine Realms must recognize the new King of Asgard will not be disrespected. He claims the old ways are failing and that Asgard will fall under Odin’s hesitation. Odin condemns Thor as unready, and Loki nearly intervenes before being silenced by Odin’s gaze.",Character Understanding
4,enf854f6d986194b25a467dae9b922f46e,en,39、INT. HEIMDALL'S OBSERVATORY - DAY,What does Odin's act of removing Heimdall's sword and returning it signify about his authority in the moment he confronts Thor?,"It reinforces his role as the sovereign enforcer of order, asserting control before rebuking Thor.","Odin removes Heimdall's sword from the control panel and throws it to him. Heimdall steps back. Thor demands to know why Odin brought them back. Odin responds by questioning Thor's actions and what they have set in motion. Thor insists he was protecting his home, but Odin counters that Thor cannot even protect his friends, so how can he protect a kingdom. Thor argues that the kingdom will fall if they do not act, declaring that the Nine Realms must know the new King of Asgard will not be disrespected. Odin rebukes him, calling his words prideful and vain, not the mark of a true leader. He reminds Thor of the lessons he has failed to learn about patience and cunning. Thor accuses Odin of being outdated and passive, while Odin calls Thor a vain, greedy, and cruel boy. Thor retorts that Odin is an old man and a fool. The room falls silent. Odin, speaking calmly but with quiet intensity, says he was a fool to believe Thor was ready. Loki steps forward and begins to speak, but Odin silences him with a look.",Character Understanding
5,enf854f6d986194b25a467dae9b922f46e,en,39、INT. HEIMDALL'S OBSERVATORY - DAY,What action does Odin take in the observatory that alters Thor's claim to the throne?,denounces Thor as unworthy of kingship,"In Heimdall's observatory, Odin responds to Thor's defiance by quietly but decisively declaring that he was mistaken to believe Thor was ready to rule. His words mark a pivotal shift, stripping Thor of his standing as heir apparent and setting in motion his journey toward redemption.",Scene Grounding
6,enf854f6d986194b25a467dae9b922f46e,en,2、EXT. SUV - NIGHT,What action takes place as Jane Foster and Erik Selvig await the celestial anomaly?,scan the night sky in anticipation of celestial anomaly,"Jane Foster and Erik Selvig stand atop the SUV, scanning the night sky as they wait for a celestial anomaly to appear. The moments stretch on with no sign of it. Jane grows concerned, noting it has never taken this long before. From inside the vehicle, Darcy Lewis asks if she can turn on the radio, but Jane dismisses the idea, citing poor reception, and eventually climbs back into the SUV, leaving Selvig alone on the roof.",Scene Grounding
7,enf854f6d986194b25a467dae9b922f46e,en,27、INT. VAULT - DAY,What does Thor do upon discovering the Frost Giants' breach in the Vault?,Demands military action against Jotunheim,"In the aftermath of the Frost Giants' intrusion, Thor stands in the damaged Vault, confronting the evidence of their sabotage. He calls for immediate retaliation, urging a full invasion of Jotunheim to punish the Frost Giants and deter future threats. Odin intervenes, rejecting Thor's aggressive stance and asserting a more restrained response. He orders Thor's companions to leave and challenges Thor's judgment directly, emphasizing that he rules with wisdom, not rage. After being overruled, Thor departs in silence, physically forcing the doors open as a final act of defiance.",Scene Grounding
8,enf854f6d986194b25a467dae9b922f46e,en,28、INT. BANQUET HALL - DAY; 39、INT. HEIMDALL'S OBSERVATORY - DAY,What action by Thor directly leads Odin to conclude he is unfit to inherit the throne?,Thor demands retribution from the Jotuns,"After discovering the Frost Giants' breach of the Vault, Thor confronts Odin and insists on launching a retaliatory war against Jotunheim, arguing that the intrusion constitutes an act of war and that decisive action is required. Odin rejects this, emphasizing the existing truce with Laufey and the need to secure Asgard’s defenses rather than escalate. Thor defiantly asserts that he would act differently as king, directly challenging Odin’s judgment. Odin, observing Thor’s impulsiveness and disregard for diplomacy, later declares him unworthy of the throne, marking a turning point in their relationship. [scene: INT. VAULT - DAY]",Causal-Motivational Reasoning
9,enf854f6d986194b25a467dae9b922f46e,en,28、INT. BANQUET HALL - DAY; 39、INT. HEIMDALL'S OBSERVATORY - DAY,What action by Loki directly precedes and motivates Odin's decision to disown Thor's claim to the throne?,Loki attempts to dissuade Thor from going to Jotunheim,"In the banquet hall, Thor expresses frustration over the interrupted coronation and insists on confronting the Frost Giants in Jotunheim to secure Asgard's safety. Loki warns him that the plan is madness, fearing the consequences of Thor's impulsive resolve. When the Warriors Three and Sif arrive, Loki downplays the tension by claiming Thor was jesting, but Thor reaffirms his intent seriously, setting in motion the chain of events that leads Odin to question Thor's judgment and ultimately reject his fitness to rule.",Causal-Motivational Reasoning
10,enf854f6d986194b25a467dae9b922f46e,en,21、INT. PALACE ANTEROOM - DAY; 26、INT. THRONE ROOM - DAY,What moment of personal reassurance enables Thor to face the ceremonial weight of his oaths with renewed resolve?,Frigga reassures Thor about his anxiety,"Before the ceremony, Thor stands in the palace anteroom gripping his hammer, visibly tense. Frigga approaches and gently acknowledges his nervousness, which he initially denies. She tells him he can't hide from her, reminding him that he possesses something even Odin lacked—her as his mother. Her words visibly settle him, and she departs, leaving him to face the ritual. Shortly after, Thor stands before Odin and the court, delivering his oaths with firm conviction, only for the ceremony to be interrupted by an unnatural frost spreading through the throne room.",Causal-Motivational Reasoning
11,enf854f6d986194b25a467dae9b922f46e,en,28、INT. BANQUET HALL - DAY; 38、EXT. BIFROST LANDING SITE (JOTUNHEIM) - DAY,What event directly prompts Loki to reveal the Frost Giants during the confrontation at the Bifrost landing site?,Thor confronts Loki about the cancelled celebration,"In the banquet hall, Thor confronts Loki amid the wreckage of the cancelled celebration meant to honor his ascension. Tensions rise as Thor expresses his frustration over the lost triumph, and Loki admits he shares Thor’s concern about the Frost Giants and Laufey potentially threatening Asgard. When Thor declares his intent to go to Jotunheim to confront the threat, Loki does not stop him, setting in motion the chain of events that leads to their arrival at the Bifrost landing site. There, at Thor’s insistence, Loki dispels the mists to reveal the full force of the Frost Giants waiting in formation—an exposure that escalates the situation into immediate danger.",Causal-Motivational Reasoning
12,enf854f6d986194b25a467dae9b922f46e,en,3、INT. SUV - NIGHT; 47、EXT./INT. SMITH MOTORS - LAB - MORNING,"By the time Darcy identifies a figure in the Bifrost image, what has she already witnessed in the desert sky?",Glowing clouds forming,"Before analyzing the Bifrost image, Darcy observes unusual atmospheric phenomena in the desert sky, specifically glowing clouds beginning to form. This visual anomaly sets the stage for the later discovery of a structured figure within the Bifrost data, establishing a causal and chronological link between the natural disturbance and the technological revelation. [3、INT. SUV - NIGHT]",Temporal Reasoning
13,enf854f6d986194b25a467dae9b922f46e,en,3、INT. SUV - NIGHT; 47、EXT./INT. SMITH MOTORS - LAB - MORNING,"By the time Darcy identifies a figure in the Bifrost image, what key action has Jane already completed?",Jane consults handwritten notebook with geomagnetic calculations,"Before Darcy's discovery in the Bifrost image, Jane is seen reviewing her handwritten notes containing geomagnetic calculations during a nighttime drive, establishing her prior investigation into atmospheric anomalies. This moment lays the groundwork for the team's evolving understanding of the phenomenon Darcy later visualizes.",Temporal Reasoning
14,enf854f6d986194b25a467dae9b922f46e,en,2、EXT. SUV - NIGHT; 159、EXT. SMITH MOTORS - DAY,How does the working relationship between Erik Selvig and Jane Foster remain consistent from their initial collaboration through later events?,they continue as trusted scientific collaborators under pressure,"From the early scenes of their joint research in the SUV to the later confrontation at Smith Motors, Erik Selvig and Jane Foster maintain a consistent dynamic of mutual reliance and professional trust. They collaborate closely on scientific observations, respond jointly to anomalies, and demonstrate concern for each other’s safety, with Selvig protecting Jane in the desert and Jane refusing to abandon him when injured. Their interactions across multiple settings show a sustained pattern of cooperative problem-solving and loyalty, rooted in their shared mission and established partnership.",Role-Relation Continuity
15,enf854f6d986194b25a467dae9b922f46e,en,28、INT. BANQUET HALL - DAY; 160、EXT. DOWN THE STREET,"What consistent role does Hogun hold in relation to Thor across their shared actions, from the banquet hall to the confrontation on Jotunheim?",trusted comrade,"Thor references past battles led with Hogun in the banquet hall [28、INT. BANQUET HALL - DAY], and Hogun immediately supports Thor’s mission to Jotunheim. They fight side by side during the plaza battle [37、EXT. CENTRAL PLAZA - DAY], and Thor relies on Hogun’s coordination in high-stakes moments later in the street confrontation [160、EXT. DOWN THE STREET], confirming an enduring role as a trusted comrade throughout.",Role-Relation Continuity
16,enf854f6d986194b25a467dae9b922f46e,en,45、INT. HOSPITAL ER - NIGHT; 112、INT. HAMMER CONTAINMENT CUBE,How does the relationship between Thor and the Frost Giant evolve from their initial confrontation through later encounters?,Thor consistently treats the Frost Giant as an enemy,"From the hospital ER scene onward, Thor is in active conflict with the Frost Giant, who is aligned with the security forces attempting to restrain him. This adversarial dynamic continues through subsequent scenes, including moments in the tunnel and the containment cube, where Thor resists capture and engages in physical confrontations, maintaining a persistent hostile stance toward the Frost Giant without any shift toward cooperation or neutrality.",Role-Relation Continuity
17,enf854f6d986194b25a467dae9b922f46e,en,2、EXT. SUV - NIGHT; 11、INT. SUV; 7、INT. SUV,What pivotal event sets in motion the characters' reactions to the approaching storm and their subsequent attempts to gather data and regroup?,Jane and Selvig Wait for the Anomaly,"As the storm approaches, Jane and Selvig remain at the observation site, anticipating the anomaly they believe will provide critical scientific data. Their decision to wait creates a cascade of consequences: the group's vehicle is damaged during the resulting chaos, prompting a retreat; Jane later insists on taking magnetic readings amid worsening conditions; and tensions flare between Selvig and Darcy, ultimately leading to a temporary rift before Jane rejoins the team. This moment of deliberate inaction becomes the catalyst for the unfolding crisis. [2、EXT. SUV - NIGHT]",Narrative Progression
18,enf854f6d986194b25a467dae9b922f46e,en,21、INT. PALACE ANTEROOM - DAY; 26、INT. THRONE ROOM - DAY; 26、INT. THRONE ROOM - DAY,What pivotal moment sets in motion Thor's actions leading to his confrontation with the Frost Giants and subsequent conflict with Odin?,Frigga Reassures Thor Before the Ceremony,"In the quiet moments before the coronation, Frigga offers Thor counsel and emotional grounding, reinforcing his sense of duty while subtly challenging his impulsiveness. This interaction calibrates his mindset, directly influencing his later decisions when faced with the desecration of the vault and the breach by the Frost Giants. The scene establishes a psychological threshold that shapes Thor's trajectory through the ensuing conflicts. [21、INT. PALACE ANTEROOM - DAY]",Narrative Progression
19,enf854f6d986194b25a467dae9b922f46e,en,22、INT. THRONE ROOM - DAY; 22、INT. THRONE ROOM - DAY; 39、INT. HEIMDALL'S OBSERVATORY - DAY,"What event sets in motion Odin's actions of noticing Thor's absence, ordering Fandral's evacuation, and proclaiming Thor's inheritance?",Odin and Frigga Take the Throne,"Following the consolidation of power in Asgard, Odin and Frigga assume their positions on the throne, establishing the authority and situational awareness that enable Odin's subsequent decisions, including recognizing Thor's absence, directing Fandral to the Healing Room, and formally declaring Thor's future inheritance. This moment marks a shift from ceremonial transition to active governance. [22、INT. THRONE ROOM - DAY]",Narrative Progression
20,enf854f6d986194b25a467dae9b922f46e,en,27、INT. VAULT - DAY; 27、INT. VAULT - DAY; 39、INT. HEIMDALL'S OBSERVATORY - DAY,What pivotal event shifts the narrative toward the confrontation between Thor and Odin following the breach of the vault?,"Thor Demands War, Odin Refuses","In the aftermath of the vault breach, Thor's insistence on launching a war is met with Odin's firm refusal, marking a critical rupture in their relationship and setting in motion the subsequent confrontations in which Odin rebukes Thor for his recklessness and ultimately disavows his claim to the throne. This moment crystallizes the central conflict between paternal authority and filial ambition. [27、INT. VAULT - DAY]",Narrative Progression
