id,movie_id,language,related_scenes,question,answer,evidence_or_reason,question_type
1,en891ad2b0053b41d48ce33f75cc636305,en,"18、EXT. RUINS, IN THE UNDERBRUSH - NIGHT",What does Broom recognize in the moment the Nazi scientist approaches the box with the gold cylinders?,The portal is open,"As the Nazi scientist steps toward the box containing the gold cylinders and pauses beside it, Broom turns urgently to Whitman, speaking in a fierce whisper. He warns that the portal is open and stresses the need to stop them, signaling immediate danger.",Character Understanding
2,en891ad2b0053b41d48ce33f75cc636305,en,6、EXT. DITCH,What is Matlin's objective in moving with the troops across the terrain?,Reach the slope to observe below,"Matlin moves with the troops, carrying his tripod and camera gear. As they approach a slope, he prepares to set up his equipment, ultimately stopping at the vantage point to observe the area below, indicating his intent was to reach that position for observation.",Character Understanding
3,en891ad2b0053b41d48ce33f75cc636305,en,6、EXT. DITCH,What does Matlin realize when he turns after setting up his camera on the slope?,that Nazis are actively excavating the ruin,"After setting up his camera on the slope, Matlin turns and sees bright lights in the distance. He gasps, stunned. Below, Broom and Whitman stand together, looking down at a Romanesque ruin illuminated by worklights, with dozens of Nazi soldiers moving through the site, actively swarming the structure.",Character Understanding
4,en891ad2b0053b41d48ce33f75cc636305,en,21、EXT. INSIDE THE CHURCH - NIGHT,What occurs when the allied forces arrive at the church ruins?,Enter the ruins,"Allied soldiers move into the church ruins at night. Matlin helps Broom to his feet, and Broom collects a sample of thick, white goo from the damaged machine. He orders the area cordoned off and gestures toward a 13th-century fresco depicting heaven and hell as Whitman demands to know where the entity came from.",Scene Grounding
5,en891ad2b0053b41d48ce33f75cc636305,en,23、EXT. INSIDE CHAPEL RUINS - NIGHT,What action does Matlin take upon hearing a rustling in the chapel ruins?,readies his handgun,"In the ruined chapel at night, rain falls through the broken roof as a rustling sound disturbs the silence. Matlin reacts immediately by drawing and aiming his handgun into the darkness. Broom follows up by sweeping the area with a flashlight, revealing movement as a red creature leaps into view. The team opens fire, but the creature evades the shots, springing between arches. As reinforcements arrive, the group tries to identify the creature, eventually realizing it is not a threat—Broom calms it with a candy bar, revealing it to be a young, stone-skinned being.",Scene Grounding
6,en891ad2b0053b41d48ce33f75cc636305,en,23、EXT. INSIDE CHAPEL RUINS - NIGHT,What occurs when the group first becomes aware of the creature in the chapel ruins?,The group hears labored breathing of an unseen creature,"In the chapel ruins at night, the group becomes aware of a presence through the sound of labored breathing. Matlin spots a figure crouched between a gargoyle and a stone saint, initially mistaking the creature's hand for a large stone. Broom corrects him, revealing the true nature of the figure. As Whitman raises his gun to shoot the red, shadowy form above them, Broom intervenes, stopping him from firing. The creature remains motionless, its golden eyes streaked with burnt sienna, observing the group from the darkness.",Scene Grounding
7,en891ad2b0053b41d48ce33f75cc636305,en,"18、EXT. RUINS, IN THE UNDERBRUSH - NIGHT; 21、EXT. INSIDE THE CHURCH - NIGHT",What action by Broom immediately prior to securing the anomaly site motivates his insistence on cordoning off the area?,Broom issues a fierce warning to Whitman about the open portal,"In the moments before securing the anomaly site, Broom confronts Whitman with urgent intensity upon witnessing the Nazi scientist approach the gold cylinders. As the portal activates, Broom delivers a forceful warning—'The portal is open!!! We have to stop them!!!'—establishing his awareness of imminent danger. This moment directly informs his later directive to isolate the site after discovering the residual goo, reflecting a clear causal link between his prior alarm and subsequent actions at the church ruins.",Causal-Motivational Reasoning
8,en891ad2b0053b41d48ce33f75cc636305,en,11、EXT. ABBEY RUINS - ALTAR AREA - CEREMONY - NIGHT; 13、EXT. ABBEY RUINS - ALTAR AREA - NIGHT,What action immediately enables Grigory to activate the machine through incantation and gesture?,Grigory approaches the machine and has the mecha-glove attached,"Grigory walks toward the machine under heavy rain, guided by floodlights, as Ilsa shelters him with an umbrella and Von Krupt pressures him with reminders of their mission and the Führer’s expectations. Upon reaching the altar, Kroenen retrieves a gold and copper mecha-glove from an oak case and secures it to Grigory’s hand, connecting it to a network of cables and hoses—preparing him for activation. Moments later, standing at the altar’s peak, Grigory whispers an incantation and uses the glove to initiate the machine, triggering a surge of energy that repels the rain and sets the mechanism in motion.",Causal-Motivational Reasoning
9,en891ad2b0053b41d48ce33f75cc636305,en,23、EXT. INSIDE CHAPEL RUINS - NIGHT; 24、EXT. CHAPEL RUINS - NIGHT,What action by Broom directly enables his later embrace of the creature?,Broom offers a Baby Ruth candy bar to the red creature,"In the chapel ruins at night, Broom offers a Baby Ruth candy bar to the red creature, eating a piece first to demonstrate it is safe. The creature, initially hesitant, emerges from the shadows and accepts the candy. Broom then wraps it in a blanket and cradles it, establishing a moment of trust that precedes his later embrace.",Causal-Motivational Reasoning
10,en891ad2b0053b41d48ce33f75cc636305,en,8、EXT. NEARBY - BROOM - NIGHT; 8、EXT. NEARBY - BROOM - NIGHT,What action immediately prior to receiving the response time explains Broom's rejection of the delay?,Broom lowers binoculars and passes them to Whitman,"In the same location and scene, after Broom lowers the binoculars and hands them to Whitman, Whitman initiates the call for backup. This sequence directly precedes the radio operator receiving the response that Londonderry is forty minutes away, at which point Broom objects, stating they don't have that long—making his prior action the pivotal setup for his rejection.",Causal-Motivational Reasoning
11,en891ad2b0053b41d48ce33f75cc636305,en,88、EXT. BELLAMIE MENTAL HOSPITAL - GARDEN AREA - NIGHT; 227、INT. ADJACENT TUNNEL,How does the relationship between Hellboy and Liz Sherman persist across their interactions from the garden at Bellamie Mental Hospital through the adjacent tunnel?,They remain emotionally bonded and mutually supportive partners,"From their encounter in the hospital garden, where Hellboy visits Liz with clear concern and she responds with affectionate familiarity, through subsequent moments of shared intimacy and trust—including a rooftop conversation and a final embrace in the tunnel—their bond consistently reflects deep emotional reliance. Liz is shown regarding Hellboy as someone she loves, and their actions repeatedly demonstrate reciprocal care and attachment, confirming a sustained and intimate partnership throughout these scenes.",Role-Relation Continuity
12,en891ad2b0053b41d48ce33f75cc636305,en,"45、INT. B.P.R.D. - FREAK CORRIDOR ""A"" - NIGHT; 161、EXT. BUILDING ROOFTOP - NIGHT",How does the working relationship between Clay and John Myers evolve from their initial interaction through the rooftop mission sequence?,"They maintain a cooperative, collegial alliance under operational pressure","From Clay inviting Myers to 'come on in and meet the rest of the family' in the B.P.R.D. corridor, to their coordinated presence during the rooftop extraction, the two agents consistently engage in professional collaboration. Myers acknowledges Clay's standing within the team, and Clay repeatedly includes him in mission-critical contexts, indicating a sustained dynamic of mutual operational reliance and institutional camaraderie.",Role-Relation Continuity
13,en891ad2b0053b41d48ce33f75cc636305,en,46、INT. HELLBOY'S DEN - NIGHT; 135、INT. CENTER OF THE TUNNEL LABYRINTH (SET) - DAY,How does the working relationship between Clay and Hellboy remain consistent from their interactions in Hellboy's den to the tunnel labyrinth mission?,trusted team members,"From Clay managing Hellboy's daily routine in his den to coordinating tactical communications during the tunnel labyrinth operation, their relationship consistently reflects mutual reliance and trust. Clay uses familiar terms like 'Red' and 'champ,' assists Hellboy physically when needed, and employs formal team protocols such as Code 30 over radio, demonstrating a stable, cooperative dynamic throughout the sequence.",Role-Relation Continuity
14,en891ad2b0053b41d48ce33f75cc636305,en,50、INT./EXT. GARBAGE TRUCK LAB - LIBRARY CROWD - NIGHT; 134、INT. ABANDONED SHOWER ROOM (SET) - DAY,How does the working relationship between Abe Sapien and Hellboy remain consistent from their initial coordination in the library operation through Abe's injury in the abandoned shower room?,trusted teammates under shared operational command,"From the garbage truck lab through the library mission and into later scenes, Abe Sapien and Hellboy function as coordinated team members under Clay's command, engaging in synchronized actions and demonstrating mutual reliance. Their interactions in the library corridor show them dividing tactical roles—Abe performing ritual actions while Hellboy handles firepower—and communicating urgent threats, confirming a structured, trust-based partnership. This dynamic persists when Hellboy, upon finding Abe injured in the abandoned shower room, immediately calls for medical help, reinforcing their ongoing role as committed, cooperative agents within the same unit.",Role-Relation Continuity
15,en891ad2b0053b41d48ce33f75cc636305,en,11、EXT. ABBEY RUINS - ALTAR AREA - CEREMONY - NIGHT; 19、EXT. ABBEY RUINS - ALTAR AREA - NIGHT; 11、EXT. ABBEY RUINS - ALTAR AREA - CEREMONY - NIGHT,"What pivotal event initiates the sequence in which Grigory is transformed through energy surges, receives the Mecha-Glove, and ultimately rises as a new being?",Grigory Approaches the Machine with Ilsa and Von Krupt,"The transformation of Grigory begins when he arrives at the altar alongside Ilsa and Von Krupt, positioning him directly at the center of the ritual machinery. This moment sets into motion the chain of events where energy surges through him, Kroenen attaches the Mecha-Glove, and he eventually rises as a photographed, altered figure. [11、EXT. ABBEY RUINS - ALTAR AREA - CEREMONY - NIGHT]",Narrative Progression
16,en891ad2b0053b41d48ce33f75cc636305,en,"3、INT. SUBMARINE STATEROOM - NIGHT; 18、EXT. RUINS, IN THE UNDERBRUSH - NIGHT; 8、EXT. NEARBY - BROOM - NIGHT",What pivotal event sets in motion Broom's confrontation with the Nazi scientist and the subsequent threat assessment with Whitman?,Broom Gathers Artifacts Under Urgent Call,"In the submarine stateroom at night, Broom responds to an urgent directive by collecting critical artifacts, initiating a chain of events that leads to the discovery of the Nazi scientist's advance on the gold cylinders. This action directly precipitates Broom's warning to Whitman, their joint evaluation of the emerging danger, and the move to secure the anomaly site.",Narrative Progression
17,en891ad2b0053b41d48ce33f75cc636305,en,"8、EXT. NEARBY - BROOM - NIGHT; 8、EXT. NEARBY - BROOM - NIGHT; 18、EXT. RUINS, IN THE UNDERBRUSH - NIGHT","What pivotal event sets in motion the sequence where Broom responds to the threat, warns Whitman as the Nazi scientist accesses the gold cylinders, and the red creature emerges?",Broom and Whitman Assess Threat and Call for Backup,"Following the discovery of the Nazi scientist's proximity to the gold cylinders, Broom and Whitman evaluate the imminent danger and initiate emergency protocols, triggering a chain of urgent responses that lead directly to confrontation and the creature's emergence. [8、EXT. NEARBY - BROOM - NIGHT]",Narrative Progression
18,en891ad2b0053b41d48ce33f75cc636305,en,40、INT. B.P.R.D. LOBBY - DAY; 40、INT. B.P.R.D. LOBBY - DAY; 40、INT. B.P.R.D. LOBBY - DAY,What pivotal event initiates the sequence leading directly to Myers descending into the facility and undergoing biometric screening at the gate?,Myers Arrives at B.P.R.D. Lobby for Security Screening,"The arrival of Myers at the B.P.R.D. lobby marks the beginning of a tightly connected sequence in which she proceeds to descend into the facility, step back onto the symbolic logo, and undergo a biometric scan at the gate. This moment serves as the narrative threshold where external tension gives way to institutional immersion, triggering the next phase of her integration into the organization’s secure environment [40、INT. B.P.R.D. LOBBY - DAY].",Narrative Progression
19,en891ad2b0053b41d48ce33f75cc636305,en,whole film,Who are the 3 most central characters in this story?,"Hellboy, John Myers, Liz Sherman","According to the retained focal_character_timelines in task_1_character_timelines.json, the current core characters for this film are Hellboy, John Myers, Liz Sherman. These are the same retained characters centered by the current task setup, so they are the most central characters in the story.",Character Understanding
20,en891ad2b0053b41d48ce33f75cc636305,en,,"Which scenes best match the following description: The group hears the labored breathing of a living creature. Matlin spots a figure crouched between a gargoyle and a stone saint, holding what looks like a large stone in its hand. Broom corrects him—the stone is not an object, it is the creature’s hand.",23、EXT. INSIDE CHAPEL RUINS - NIGHT | 24、EXT. CHAPEL RUINS - NIGHT,"The group hears the labored breathing of a living creature. Matlin spots a figure crouched between a gargoyle and a stone saint, holding what looks like a large stone in its hand. Broom corrects him—the stone is not an object, it is the creature’s hand.",Scene Grounding
21,en891ad2b0053b41d48ce33f75cc636305,en,,Which scenes show Ilsa and John Myers together?,"210、INT. TUNNEL ""B"" - UNDERGROUND TUNNEL CAVERN AREA - DAY | 211、INT. THE CATACOMBS - NIGHT | 220、INT. CATACOMBS - NIGHT | 221、INT. CATACOMBS - NIGHT",These 4 scenes were selected because Ilsa and John Myers are explicitly present together in the extracted scene graph. They co-occur 19 times across the script. The listed scenes are the clearest grounded matches.,Scene Grounding
22,en891ad2b0053b41d48ce33f75cc636305,en,,Which scenes show Hellboy as part of B.P.R.D.?,"52、INT. MACHEN LIBRARY, MAIN LOBBY - NIGHT | 109、INT. BEAM TUNNEL AREA - BENJAMIN INSTITUTE - DAY | 140、INT. B.P.R.D. - MAIN HALL AREA - DAY | 172、INT. CARGO PLANE - NIGHT","These 4 scenes were selected because Hellboy is explicitly linked to B.P.R.D. in the extracted graph. Supporting relations include belongs to. One direct cue is: Hellboy is present with the BPRD team during the operation, marching through the lobby with other agents, which confirms his affiliation with the BPRD.",Scene Grounding
23,en891ad2b0053b41d48ce33f75cc636305,en,,Which scenes clearly show Liz's mother?,96、EXT. TENEMENT BUILDING COURTYARD - DAY | 97、EXT. TENEMENT COURTYARD - DAY | 98、EXT. TENEMENT COURTYARD - STEPS - DAY,"Liz's mother is present across three consecutive exterior courtyard scenes, beginning at the tenement building courtyard and moving to the steps, with her presence consistently indicated through dialogue and action throughout these locations.",Scene Grounding
24,en891ad2b0053b41d48ce33f75cc636305,en,,"Which scenes best match the following description: A sudden surge of energy courses through the area. Grigory jerks violently, limbs flailing as he dangles in the air like a marionette. Nearby, Von Krupt, once skeptical, stands motionless, his eyes glazed, entranced by the force now gripping him.",19、EXT. ABBEY RUINS - ALTAR AREA - NIGHT | 20、EXT. ABBEY RUINS - ALTAR AREA - NIGHT,"A sudden surge of energy courses through the area. Grigory jerks violently, limbs flailing as he dangles in the air like a marionette. Nearby, Von Krupt, once skeptical, stands motionless, his eyes glazed, entranced by the force now gripping him.",Scene Grounding
25,en891ad2b0053b41d48ce33f75cc636305,en,21、EXT. INSIDE THE CHURCH - NIGHT; 23、EXT. INSIDE CHAPEL RUINS - NIGHT,What occurs just before Broom attempts to calm the creature with candy?,Allied soldiers enter the ruins,"Shortly after the Allied soldiers move into the chapel ruins under cover of darkness, Broom tries to pacify the creature using candy as a lure. The arrival of the soldiers sets the immediate stage for this tense encounter, marking a shift from exploration to active engagement at the anomaly site.",Temporal Reasoning
26,en891ad2b0053b41d48ce33f75cc636305,en,23、EXT. INSIDE CHAPEL RUINS - NIGHT; 24、EXT. CHAPEL RUINS - NIGHT,What occurs just before the group photo is taken at the chapel ruins?,Matlin hears a rustling sound and readies his handgun,"Shortly after the team gathers outside the chapel ruins, a quiet moment is broken when Matlin reacts to a sudden noise. He turns toward the bushes, draws his weapon, and prepares for potential danger, setting up the tension that precedes the group photo. This moment unfolds in the immediate aftermath of their positioning for the picture but before the camera shutter is released. [23、EXT. INSIDE CHAPEL RUINS - NIGHT]",Temporal Reasoning
27,en891ad2b0053b41d48ce33f75cc636305,en,19、EXT. ABBEY RUINS - ALTAR AREA - NIGHT; 20、EXT. ABBEY RUINS - ALTAR AREA - NIGHT,What occurs with Grigory shortly before the portal collapses and he vanishes with Ilsa?,Grigory is controlled by a surge of energy,"In the moments leading up to the portal's collapse, Grigory experiences a sudden surge of energy at the altar area of the abbey ruins, which takes hold of him and sets the stage for the subsequent disintegration of the portal and his disappearance alongside Ilsa. [19、EXT. ABBEY RUINS - ALTAR AREA - NIGHT]",Temporal Reasoning
28,en891ad2b0053b41d48ce33f75cc636305,en,11、EXT. ABBEY RUINS - ALTAR AREA - CEREMONY - NIGHT; 13、EXT. ABBEY RUINS - ALTAR AREA - NIGHT,What occurs immediately before Grigory begins the activation ritual at the altar?,Grigory approaches the machine under floodlights,"Shortly after arriving at the ruins with Ilsa and Von Krupt, Grigory moves toward the machine under the glare of floodlights, positioning himself at the altar just before he commences the activation sequence with incantation and gesture. [11、EXT. ABBEY RUINS - ALTAR AREA - CEREMONY - NIGHT]",Temporal Reasoning
29,en891ad2b0053b41d48ce33f75cc636305,en,"17、EXT. RUINS - IN THE UNDERBRUSH - NIGHT; 18、EXT. RUINS, IN THE UNDERBRUSH - NIGHT",What occurs just before Broom confronts Whitman about the Nazi scientist’s approach to the gold cylinders?,Matlin takes photographs aggressively,"Shortly before Broom warns Whitman of the advancing Nazi scientist, Matlin is seen aggressively taking photographs in the underbrush near the ruins, capturing images that heighten the tension and set the stage for the imminent confrontation. This moment directly precedes the shift in focus to Broom’s urgent warning as the threat draws closer. [17、EXT. RUINS - IN THE UNDERBRUSH - NIGHT]",Temporal Reasoning
30,en891ad2b0053b41d48ce33f75cc636305,en,43、INT. B.P.R.D. - CONCRETE CHAMBER 51 - DUSK; 44、INT. BROOMS OFFICE (FULL AQUARIUM)- DUSK,What occurs immediately before the discovery of the Latin inscription and the unfolding mission?,Elevator stops in narrow dark space,"Shortly after Myers enters the chamber behind the oak door, the elevator comes to a halt in a confined, dimly lit area, setting the stage for the subsequent revelation of the Latin inscription and the assignment of the mission. This moment marks a transition from physical descent to the initiation of a critical plot thread.",Temporal Reasoning
31,en891ad2b0053b41d48ce33f75cc636305,en,46、INT. HELLBOY'S DEN - NIGHT,What caused Hellboy to agree to go on the mission when the alarm went off in his den?,the alarm blaring and red lights flashing,"The alarm blares, red lights flashing. Hellboy grins. 'They're playing our song,' he says. 'C'mon, Champ! Happy Halloween! You're taking me for a walk!'",Causal-Motivational Reasoning
32,en891ad2b0053b41d48ce33f75cc636305,en,44、INT. BROOMS OFFICE (FULL AQUARIUM)- DUSK,Why did Broom correct Myers when he referred to Abe as 'it'?,to affirm Abe's personhood and identity,"BROOM
-- He. Not ""it.""",Character Understanding
33,en891ad2b0053b41d48ce33f75cc636305,en,46、INT. HELLBOY'S DEN - NIGHT,Why did Hellboy drop the dumbbell when he was introduced to Myers?,he didn't want a new liaison,"HELLBOY
I don't want him. BANG!!! Hellboy lets the dumbbell drop.",Character Understanding
34,en891ad2b0053b41d48ce33f75cc636305,en,44、INT. BROOMS OFFICE (FULL AQUARIUM)- DUSK,What did John Myers learn about Abe that changed how he saw him?,that Abe has a unique frontal lobe enabling psychic communication,"Myers demands to know how Abe could possibly know such things. Professor Broom explains that Abe possesses a unique frontal lobe, which allows him to communicate psychically.",Character Understanding
