id,movie_id,language,related_scenes,question,answer,evidence_or_reason,question_type
1,enf30d36a744764b89b68ac58103b401f0,en,34、INT. DILAPIDATED HOTEL ROOM - DAY,What does Cobb aim to achieve by revealing how he discovered Saito's hidden apartment?,Extract the missing information from Saito,"Cobb confronts Saito in a concealed apartment, holding a gun and pressing him about how the location was uncovered. He implies that Saito's affair led to the leak, undermining Saito's confidence in his secrecy. Cobb emphasizes that they haven't obtained the key information they came for, indicating his intent to use the psychological advantage to force disclosure. The tension escalates as Arthur warns of the approaching crowd, underscoring the urgency of the moment.",Character Understanding
2,enf30d36a744764b89b68ac58103b401f0,en,34、INT. DILAPIDATED HOTEL ROOM - DAY,What does Cobb seek to achieve by confronting Saito with a gun?,Force Saito to reveal his true intentions,"Cobb presses the barrel of his gun under Saito's chin, demanding to know why Saito allowed them into his facility if he was aware of their mission. Saito remains defiant, dismissing their efforts as a failed audition and asserting that their deception was transparent. Amid rising chaos from below, Cobb insists he successfully extracted Saito's information, but Saito shows no concern, undermining Cobb's assumptions and control.",Character Understanding
3,enf30d36a744764b89b68ac58103b401f0,en,38、INT. DILAPIDATED HOTEL ROOM-DAY,What realization does Saito come to about his surroundings after speaking with Cobb?,He is still in a dream.,"Saito turns from the carpet to look at Cobb and deduces that he is not lying on his carpet in his apartment, concluding that he must still be dreaming.",Character Understanding
4,enf30d36a744764b89b68ac58103b401f0,en,32、INT. DILAPIDATED HOTEL ROOM - MOMENTS LATER,What does Arthur recognize in his interaction with Cobb during the escalating unrest?,the threat is approaching,"Arthur observes the growing violence outside while Cobb sits holding Saito's gun, seemingly detached. With Nash restraining Saito and the sounds of rioting intensifying, Arthur turns from the window and alerts Cobb that the danger is drawing nearer, signaling his awareness of the immediate physical threat to their situation.",Character Understanding
5,enf30d36a744764b89b68ac58103b401f0,en,"47、INT. APARTMENT, TOKYO - CONTINUOUS",What does Arthur do immediately after observing Cobb prepare to leave the apartment?,asks if Cobb is okay after Mal's appearance in the dream,"In the Tokyo apartment, Arthur sees Cobb move to pick up his bag and immediately checks on his well-being, referencing Mal's unexpected presence in the dream. Cobb responds by apologizing for Arthur's injury, but Arthur shifts focus to the worsening situation. When Cobb presses for information about Nash, Arthur confirms Nash hasn't arrived and questions whether they should wait, but Cobb insists they must leave now because their delayed delivery has exposed their failure to Cobol Engineering.",Scene Grounding
6,enf30d36a744764b89b68ac58103b401f0,en,40、INT. DILAPIDATED HOTEL ROOM - DAY,What occurs when Saito rises in the hotel room as rioters attack?,Saito stands up and expresses admiration for Cobb,"Saito gets to his feet and looks at Cobb with admiration. Cobb lowers his gun, his expression resigned, and glances at his watch. Around them, music echoes heavily through the room as rioters pound on the door.",Scene Grounding
7,enf30d36a744764b89b68ac58103b401f0,en,"47、INT. APARTMENT, TOKYO - CONTINUOUS",What does Cobb do immediately after hearing a knock at the door?,Grabs his spinning top and handgun,"Cobb hears a knock at the door and quickly retrieves his spinning top and handgun from the table before approaching the door. He opens it slightly to find Arthur waiting, who informs him their ride is on the roof. Cobb then nods and picks up his bag to leave.",Scene Grounding
8,enf30d36a744764b89b68ac58103b401f0,en,43、INT. BULLET TRAIN COMPARTMENT - DAY,What action initiates the team's departure from the bullet train compartment?,Todashi opens the door to the compartment,"Todashi pulls open the compartment door, prompting Cobb to instruct the team to look out for themselves. Arthur and Nash immediately rush out in opposite directions down the corridor. Cobb hands a thick roll of cash to Todashi, checks on Saito as he stirs slightly, then exits the compartment himself, marking the start of the team's dispersal.",Scene Grounding
9,enf30d36a744764b89b68ac58103b401f0,en,"13、INT. DINING ROOM, JAPANESE CASTLE - CONTINUOUS; 13、INT. DINING ROOM, JAPANESE CASTLE - CONTINUOUS",What event immediately triggers Cobb's decision to shoot Arthur and flee the room?,Lights turn on and Cobb freezes,"The lights suddenly snap on, freezing Cobb in place. Saito orders him to turn around, and Cobb sees Saito at the far end of the room with Mal, who holds a gun to Arthur's head as guards drag him forward. Mal smiles and maintains her aim, creating a standoff that shifts abruptly when she shoots Arthur in the leg and threatens his life, prompting Cobb's sudden, violent response.",Causal-Motivational Reasoning
10,enf30d36a744764b89b68ac58103b401f0,en,31、INT. FILTHY BATHROOM - DAY; 31、INT. FILTHY BATHROOM - DAY,What moment immediately before the confrontation enables Cobb to react quickly when Saito bursts in and attacks?,Cobb awakens suddenly and gasps for air,"As Cobb jolts awake, gasping for air and disoriented, Saito crashes into the room, slams into Nash, and triggers chaos. Cobb’s abrupt return to consciousness just before the intrusion allows him to mobilize instantly, launching from the tub and subduing Saito before he can gain control of the situation.",Causal-Motivational Reasoning
11,enf30d36a744764b89b68ac58103b401f0,en,32、INT. DILAPIDATED HOTEL ROOM - MOMENTS LATER; 34、INT. DILAPIDATED HOTEL ROOM - DAY,What action immediately enables Cobb to confront Saito at gunpoint?,Cobb sits with Saito's gun in hand while Nash restrains Saito,"Cobb is present in a hidden apartment where Nash physically restrains Saito, holding his arms behind his back, while Cobb examines Saito's own gun. The tension escalates as Cobb asserts control over the situation, noting that Saito’s secrets are not as well protected as he believes, particularly due to his relationship with a married woman. With the sounds of approaching chaos outside, Cobb observes that the critical information they sought is still missing, positioning him to escalate the confrontation.",Causal-Motivational Reasoning
12,enf30d36a744764b89b68ac58103b401f0,en,43、INT. BULLET TRAIN COMPARTMENT - DAY; 43、INT. BULLET TRAIN COMPARTMENT - DAY,What action enables the team to exit the compartment by ensuring the sedation remains active longer?,Arthur adjusts the dial on the briefcase to extend sedation time,"Before leaving the compartment, Arthur modifies the briefcase's settings to prolong the sedation, which stabilizes the dream state long enough for the team to disengage safely. This adjustment is critical to maintaining synchronization across dream layers as they prepare to exit.",Causal-Motivational Reasoning
13,enf30d36a744764b89b68ac58103b401f0,en,"34、INT. DILAPIDATED HOTEL ROOM - DAY; 47、INT. APARTMENT, TOKYO - CONTINUOUS",What action directly triggers Cobb and Arthur's decision to flee following the mission's collapse?,Cobb forces Saito to look up at gunpoint,"After confronting Saito at gunpoint and demanding answers about their failed mission, Cobb holds him under threat, only for Saito to reveal the operation was an audition they failed. As sounds of advancing chaos echo from below, this confrontation confirms their cover is blown and the mission compromised, leading directly to Cobb and Arthur's urgent departure.",Causal-Motivational Reasoning
14,enf30d36a744764b89b68ac58103b401f0,en,20、INT. DILAPIDATED HOTEL ROOM - DAY; 39、INT. BULLET TRAIN COMPARTMENT - DAY,"By the time Arthur awakens and checks the countdowns, what has already taken place involving the silver case?",Arthur opens silver case containing complex mechanism,"Arthur activates a key mechanism by opening a silver case with intricate internal components, setting a sequence in motion that precedes his later awareness and verification of the countdowns.",Temporal Reasoning
15,enf30d36a744764b89b68ac58103b401f0,en,14、INT. FILTHY BATHROOM - DAY; 43、INT. BULLET TRAIN COMPARTMENT - DAY,"By the time Arthur ends the sedation and closes the briefcase, what has already taken place?",Arthur wakes up in the armchair and removes wrist tubes,"Arthur regains consciousness in the armchair, detaches the medical tubing from his wrists, and becomes aware of his surroundings before proceeding to terminate the sedation and secure the briefcase, establishing a clear sequence in which his reawakening and physical disengagement precede the final action.",Temporal Reasoning
16,enf30d36a744764b89b68ac58103b401f0,en,88、INT. WORKSHOP - CONTINUOUS; 262、EXT. PENTHOUSE (LIMBO) - DAY,How does Ariadne's treatment of Mal evolve from their first interaction to the confrontation in limbo?,Ariadne consistently treats Mal as a threat,"From the workshop onward, Ariadne exhibits wariness toward Mal, beginning with expressing concern about her presence in the dream. This apprehension solidifies into direct antagonism when Ariadne takes aim at Mal in limbo, reflecting a sustained perception of Mal as a danger, despite the lack of direct interaction between them in intervening scenes.",Role-Relation Continuity
17,enf30d36a744764b89b68ac58103b401f0,en,"13、INT. DINING ROOM, JAPANESE CASTLE - CONTINUOUS; 13、INT. DINING ROOM, JAPANESE CASTLE - CONTINUOUS; 40、INT. DILAPIDATED HOTEL ROOM - DAY","What turning point initiates the sequence in which Saito demands the envelope, Mal shoots Arthur, Saito rises, Cobb surrenders, and Cobb ultimately confronts Saito at gunpoint?",Cobb Confronted by Saito and Mal,"The confrontation between Cobb, Saito, and Mal disrupts the existing power dynamics, triggering a chain of escalating actions that propel the narrative toward the climax. This moment forces Cobb into a reactive stance, sets Saito on a path of assertion, and activates Mal's disruptive influence, aligning multiple character arcs toward convergence.",Narrative Progression
18,enf30d36a744764b89b68ac58103b401f0,en,"47、INT. APARTMENT, TOKYO - CONTINUOUS; 47、INT. APARTMENT, TOKYO - CONTINUOUS; 48、INT. CORRIDOR - CONTINUOUS",What pivotal event sets in motion the sequence where Cobb and Arthur plan their departure and escape by helicopter?,"Arthur Arrives, Cobb Prepares to Leave","Following the collapse of the mission, Arthur's arrival prompts Cobb to initiate immediate exit protocols. This moment shifts the narrative from disintegration to coordinated withdrawal, triggering the decisions and movements that lead directly to their shared escape plans and boarding of the helicopter.",Narrative Progression
19,enf30d36a744764b89b68ac58103b401f0,en,32、INT. DILAPIDATED HOTEL ROOM - MOMENTS LATER; 50、INT. HELICOPTER ON PAD - CONTINUOUS; 34、INT. DILAPIDATED HOTEL ROOM - DAY,"What pivotal event shifts the narrative toward Cobb questioning Nash's fate and Saito proposing inception, followed by the confrontation at gunpoint and Cobb's surrender?",Cobb Confronts Saito in the Hidden Apartment,"The sequence unfolds as Cobb's actions in the hidden apartment directly trigger Saito's proposal of inception and set in motion a chain of confrontations, including the escalation at gunpoint and Cobb's eventual surrender, marking a critical shift in the story's trajectory.",Narrative Progression
20,enf30d36a744764b89b68ac58103b401f0,en,"32、INT. DILAPIDATED HOTEL ROOM - MOMENTS LATER; 43、INT. BULLET TRAIN COMPARTMENT - DAY; 47、INT. APARTMENT, TOKYO - CONTINUOUS","What pivotal event sets in motion the sequence leading to the sedation's end, the briefcase being secured, the team's escape, and Cobb's confrontation with Saito?",Arthur watches the riot and warns Cobb,"Arthur observes escalating unrest outside the hotel and alerts Cobb to the growing threat, prompting immediate operational changes that trigger the collapse of the mission's stability and force a shift from extraction to survival.",Narrative Progression
