id,movie_id,language,related_scenes,question,answer,evidence_or_reason,question_type
1,ene7ea5a09bac248ef93cb96fea57e1d53,en,10、INT. CAFETERIA SCULLERY - DAY,What does Ralph aim to do upon observing the dirty dishes in the kitchen?,Summon Joe Buck to address the mess,"Ralph stands in the kitchen, taking in the sight of dirty dishes piled high in the sink and across the counter. He shakes his head, turns away, and calls out firmly, 'Where's that Joe Buck?'—his tone conveying urgency and expectation of action.",Character Understanding
2,ene7ea5a09bac248ef93cb96fea57e1d53,en,40、INT. REMEMBERED WHOREHOUSE - ANOTEER TIME,What motivates the prostitute's confrontation with the soldier when she addresses him directly on camera?,Recover potential earnings lost due to the soldier's actions,"The prostitute, visibly reacting to the soldier, shakes her head and scolds him, emphasizing that his behavior will cost her money, indicating her primary concern is the financial impact on her livelihood.",Character Understanding
3,ene7ea5a09bac248ef93cb96fea57e1d53,en,42、INT. REMEMBERED BEAUTY SALON - ANOTHER TIME,What does Sally Buck aim to assert by wiping the lipstick from Joe's lips?,Assert dominance and set boundaries,"Sally Buck gently wipes lipstick from Joe's lips and then warns him to keep his hands off her operators, signaling a clear power move framed as both a physical correction and a verbal boundary.",Character Understanding
4,ene7ea5a09bac248ef93cb96fea57e1d53,en,22、EXT. SALLY BUCK'S BEAUTY SALON - DAY,What does Joe realize when he stands before the empty shop that guides his decision to leave?,The parlor was once vibrant and alive,"Joe stands in front of the abandoned shop, momentarily transported by vivid sensory memories—the sound of laughter, singing, and humming driers, the sight of crowded chairs and bustling activity—recalling the beauty parlor in its prime. This contrast between its former liveliness and current desolation informs his understanding of what has been lost, prompting him to turn away and head toward the bus depot with his radio in hand.",Character Understanding
5,ene7ea5a09bac248ef93cb96fea57e1d53,en,17、INT. HOTEL ROOM - DAY,What action marks Joe's departure from the hotel room?,Joe locks his suitcase and leaves,"In the hotel room, Joe locks his suitcase, speaks defiantly about handling the dishes himself, adjusts his appearance by combing his hair and lighting a cigarette, takes a final look in the mirror, and departs with a portable transistor radio.",Scene Grounding
6,ene7ea5a09bac248ef93cb96fea57e1d53,en,20、INT. SUNSHINE CAFETERIA - DAY,What action initiates Joe's departure from the cafeteria?,Joe emerges from the employees-only area and walks through the dining room,"Joe steps out through a swinging door marked EMPLOYEES ONLY into a stark, cluttered dining room filled with remnants of meals and disengaged patrons. As he crosses the space, two teenage girls watch him with faint mockery, and an off-screen chorus begins a wistful farewell ballad, marking the emotional weight of his exit.",Scene Grounding
7,ene7ea5a09bac248ef93cb96fea57e1d53,en,35、INT. BUS - MORNING,What action marks Joe's reorientation at the start of the scene on the bus?,Joe awakens with a stiff neck and becomes alert,"Joe wakes up stiff and disoriented, rubbing his neck as he straightens in his seat. He notices the Old Cowhand removing a sweat-stained saddle from the overhead rack and moving toward the front of the bus. Joe calls out a farewell, then takes gum from his pocket, chews it, and waves out the window as the bus departs.",Scene Grounding
8,ene7ea5a09bac248ef93cb96fea57e1d53,en,21、EXT. TOWN MAIN STREET - DAY; 21、EXT. TOWN MAIN STREET - DAY,What action immediately precedes Joe's walk through town while listening to grain prices on the radio?,Joe finishes eating and leaves the cafeteria,"After finishing his meal in the cafeteria, Joe steps outside into the quiet streets of a small Western town. He begins walking toward the bus depot, the sound of his boots echoing on the pavement. A radio at his ear broadcasts live grain prices from the Commodity Exchange, a constant auditory backdrop as he moves through the stillness of the afternoon. The environment is sparse—weathered buildings, empty lots, and signs of gradual change—underscoring the solitude of his journey.",Causal-Motivational Reasoning
9,ene7ea5a09bac248ef93cb96fea57e1d53,en,25、INT. BUS - DAY; 25、INT. BUS - DAY,What action immediately precedes and motivates Joe's withdrawal into himself on the bus?,Joe moves to his empty double seat at the back of the bus,"After offering gum to a pale blonde woman and making a dry joke about carsickness, Joe relocates to an unoccupied double seat at the back of the bus. He observes the other passengers briefly, then stretches out across the seat, turns on the radio, and engages in a series of small, self-contained actions—combing his hair, lighting a cigarette, watching the landscape pass—while becoming increasingly absorbed in his own thoughts and surroundings, signaling a retreat into isolation.",Causal-Motivational Reasoning
10,ene7ea5a09bac248ef93cb96fea57e1d53,en,25、INT. BUS - DAY; 25、INT. BUS - DAY,What action by Joe earlier in the scene makes his later interaction with the woman on the bus a continuation of his established behavior?,Joe comments on the bus's engine power,"Joe begins the scene seated at the front of the bus, where he audibly remarks on the vehicle's engine performance, cracking his gum as he speaks. This moment establishes his tendency to vocalize observations in a casual, slightly performative manner despite minimal response from others. Later, when he moves to the back and engages with a woman who asks for gum, his joke about carsickness echoes the same pattern of initiating contact through wry, low-stakes commentary, suggesting a consistent behavioral impulse rooted in the earlier moment.",Causal-Motivational Reasoning
11,ene7ea5a09bac248ef93cb96fea57e1d53,en,30、INT. BUS - NIGHT; 30、INT. BUS - NIGHT,What moment of silent observation prompts Joe to initiate banter and inquire about Woodsy Niles?,Old cowhand observes Joe's clothing with curiosity,"When Joe notices the old cowhand studying his clothes with a quiet, inquisitive gaze, he responds by offering a light for the man's cigarette. After the man coughs and wipes his eyes, Joe breaks the silence with a joke and then asks about a mutual acquaintance, Woodsy Niles, framing the inquiry as a connection through his grandmother, Sally Buck.",Causal-Motivational Reasoning
12,ene7ea5a09bac248ef93cb96fea57e1d53,en,11、INT. HOTEL ROOM - DAY; 20、INT. SUNSHINE CAFETERIA - DAY,"By the time Joe walks out amid whistles and a farewell song, what has already taken place during his preparation?",Joe sings while preparing in front of mirror,"In the sequence leading to Joe's departure, he spends a moment alone dressing and singing to himself with lighthearted energy, reflecting a sense of personal ritual before the communal send-off begins.",Temporal Reasoning
13,ene7ea5a09bac248ef93cb96fea57e1d53,en,11、INT. HOTEL ROOM - DAY; 20、INT. SUNSHINE CAFETERIA - DAY,"By the time Joe walks out amid whistles and a farewell song, what has already taken place just before his exit?",Joe buttons his new cowboy shirt while singing,"Joe prepares to leave the room after dressing and singing to himself, fastening his new cowboy shirt as a gesture of readiness; this moment of quiet preparation directly precedes the public moment of departure marked by whistles and a group farewell.",Temporal Reasoning
14,ene7ea5a09bac248ef93cb96fea57e1d53,en,80、INT. EVERETT'S BAR - DAY; 318、EXT. SIDEWALK CAFE - COCKTAIL HOUR,How does Ratso Rizzo's relationship with O'Daniel evolve from their initial interaction through later references across the sequence?,Ratso consistently positions O'Daniel as a trusted intermediary for placements,"From the early bar scene, Ratso identifies O'Daniel as a reliable contact, calling him 'my friend' and recommending him for managerial roles. Subsequent mentions maintain this framing: Ratso notes having placed someone with O'Daniel and speaks of him as a functional recipient of referrals. While the interactions are sparse and context-specific, the pattern shows Ratso repeatedly using O'Daniel as an endpoint in placement arrangements, indicating a sustained functional trust rather than a personal alliance.",Role-Relation Continuity
15,ene7ea5a09bac248ef93cb96fea57e1d53,en,135、INT. REMEMBERED CAR - NIGHT; 371、INT. REMEMBERED CAR - NIGHT,How does the relationship between Anastasia and Ratpack evolve from their first confrontation to the later remembered scene in the car?,Ratpack continues to treat Anastasia as a target of coordinated assault,"From the initial intrusion to the later recollection, Ratpack surrounds Anastasia in the car, chases her while she is naked, and uses flashlights as instruments of violation, including forcing one into her mouth during a traumatic sequence. These repeated actions establish a sustained pattern in which Ratpack acts as a collective aggressor and Anastasia is positioned as the victim of a ritualized, violent pursuit.",Role-Relation Continuity
16,ene7ea5a09bac248ef93cb96fea57e1d53,en,135、INT. REMEMBERED CAR - NIGHT; 371、INT. REMEMBERED CAR - NIGHT,How does the relationship between Joe Buck and Ratpack evolve from their first confrontation to the later encounter in the remembered car?,Ratpack continues to target Joe Buck as an assailant,"From the initial scene in the remembered car, Ratpack establishes a hostile dynamic by surrounding Joe Buck, restraining him while naked, and using flashlights and physical force during an assault. This adversarial pattern persists through the later scene where Ratpack again surrounds Joe's car, pulls him out naked, holds him down, and threatens him with a broken bottle, confirming an ongoing role of Ratpack as an aggressor toward Joe Buck.",Role-Relation Continuity
17,ene7ea5a09bac248ef93cb96fea57e1d53,en,17、INT. HOTEL ROOM - DAY; 19、INT. CAFETERIA SCULLERY - DAY; 25、INT. BUS - DAY,What pivotal moment sets in motion Joe's departure and the subsequent reactions from those around him?,Joe Locks His Suitcase and Leaves with a Defiant Smile,"Joe's decision to leave is crystallized when he secures his belongings and exits with a resolute expression, marking the point after which others begin to respond to his departure, shifting the narrative toward its concluding moments.",Narrative Progression
18,ene7ea5a09bac248ef93cb96fea57e1d53,en,21、EXT. TOWN MAIN STREET - DAY; 35、INT. BUS - MORNING; 20、INT. SUNSHINE CAFETERIA - DAY,"What pivotal event sets in motion Joe's departure from the town, leading to his final farewells and solitary walk?",Joe Leaves the Cafeteria and Walks to the Bus Depot,"After lingering in familiar spaces, Joe makes a decisive move toward leaving when he exits the cafeteria and heads to the bus depot. This action initiates a sequence of parting moments, including a farewell song, a walk through town accompanied by distant radio reports, and final goodbyes, marking the end of his chapter in the community.",Narrative Progression
19,ene7ea5a09bac248ef93cb96fea57e1d53,en,30、INT. BUS - NIGHT; 30、INT. BUS - NIGHT; 32、INT. BUS - NIGHT,What pivotal moment sets in motion Joe's shift in demeanor and the subsequent interactions with the old cowhand?,Joe Offers a Light to the Old Cowhand,"The scene in which Joe offers a light to the old cowhand marks a critical shift in the narrative, preceding a series of exchanges that reveal Joe's growing introspection and the quiet dissolution of his connection to the past. This gesture initiates a chain of actions including shared humor, a declined cigarette, and a final farewell, all signaling a transition in Joe's emotional trajectory.",Narrative Progression
20,ene7ea5a09bac248ef93cb96fea57e1d53,en,39、INT. BUS - DAY; 39、INT. BUS - DAY; 43、INT. BUS - DAY,What event marks the turning point that initiates Joe's reconnection with the veterans and sets the emotional trajectory for the subsequent scenes of shared testimony and camaraderie?,Singing and Stories on the Bus,"During the bus ride, Joe begins to open up through song, sparking a moment of mutual recognition among the veterans. This moment shifts the tone from isolation to connection, enabling the exchanges that follow—questioning, singing, and passing the bottle—as acts of shared remembrance and acceptance.",Narrative Progression
