id,movie_id,language,related_scenes,question,answer,evidence_or_reason,question_type
1,en3b8f79aa09a045818b4e725fdf6b57e7,en,,What is WILLARD trying to achieve when WILLARD willard demands to be taken to Colonel Kurtz and confronts Colby?,Force a confrontation,"Willard demands to be taken to Colonel Kurtz and confronts Colby, who denies any role in the shrunken head operations, saying all decisions come from Kurtz. Kurtz emerges from his headquarters, frail and ill, wearing a blend of military fatigues and tribal adornments. He returns Willard's salute and gestures for him to sit. Around him, his men lower themselves onto the ground in a practiced, ritual manner. Willard formally reports his arrival. Kurtz speaks with precise knowledge of Willard's history and questions his true reasons for coming. In response, Willard places his sidearm on the dirt. Kurtz picks up the gun, aims without hesitation, and shoots a man standing nearby. He then throws the weapon back to the ground. Willard stands frozen, stunned by the sudden violence. Chef mutters in disbelief. Moonby, silent, passes a marijuana joint to Kurtz, who takes a slow draw before turning and walking back into the headquarters. Moonby follows at a respectful distance, leaving Willard and the crew standing in the dust under the heavy silence of the fortress. [scene title]",Character Understanding
2,en3b8f79aa09a045818b4e725fdf6b57e7,en,,What is Willard's goal when the river surges and he confronts the Chief?,To force the Chief to steer the P.B.R. into the tributary to escape the dangerous current,"During the river surge, Willard sees turning into a tributary as the only way to save the boat from destructive debris and insists on it despite the Chief's resistance due to fear of V.C. presence; Willard escalates to a direct threat to compel compliance [Willard Forces Chief to Enter Tributary].",Character Understanding
3,en3b8f79aa09a045818b4e725fdf6b57e7,en,,What does Chef conclude about their situation at the temple wall that motivates his plea to Willard?,The place is evil and they will die,"By the campfire at the temple wall, Chef crouches beside Willard and warns that enemy forces have been probing their position, signaling an imminent major attack. As Willard acknowledges the threat, Chef presses him on their purpose there. Willard reveals his mission to kill Kurtz, prompting Chef to reflect on Kurtz’s emotional detachment during killing and question whether Willard feels anything in return. Observing the surreal and grotesque camp—wild fighters, skulls on huts, children playing with bayonets, a downed helicopter, and American mercenaries—Chef calls the place evil and expresses fear that they will all die. He urgently implores Willard to carry out the mission so they can escape, emphasizing his desire to survive. Willard listens, recognizing Kurtz’s brilliance as a commander, but remains resolute in his knowledge of what must be done.",Character Understanding
4,en3b8f79aa09a045818b4e725fdf6b57e7,en,,What is P.B.R.'s objective during the river traversal under fire?,To escape down the river while evading enemy fire and reach a concealed position under overhanging trees before nightfall,"The P.B.R. surges forward, accelerating rapidly as it exits the shallow part of the river. The crew scrambles into position, taking up posts at the twin fifty-caliber machine guns and scanning the dense jungle along the banks. The boat weaves sharply through the water, changing course frequently as if evading fire. Lance points toward a stretch of overhanging trees and suggests pulling in there to wait under cover until nightfall [P.B.R. Escapes Down River Under Threat].",Character Understanding
5,en3b8f79aa09a045818b4e725fdf6b57e7,en,,What occurs when Willard receives his mission briefing aboard the helicopter at dusk?,Civilian instructs Willard to investigate and terminate Colonel Kurtz's command,"Aboard a helicopter at dusk, a civilian official delivers Willard's orders, instructing him to travel up the Nung River via Navy P.B.R., make contact with Colonel Kurtz, determine the situation, and end his command. This directive sets the central mission in motion and defines the purpose of Willard's journey into the delta.",Scene Grounding
6,en3b8f79aa09a045818b4e725fdf6b57e7,en,,What occurs when Willard first confronts Colby at the river outpost?,Colby denies involvement in controversial operations,"At the river outpost, Willard demands to be taken to Colonel Kurtz and confronts Colby, who denies any role in the shrunken head operations, asserting that all decisions come from Kurtz. This moment sets the stage for Willard's introduction to Kurtz's isolated command, where authority and ritual converge under the shadow of unchecked power.",Scene Grounding
7,en3b8f79aa09a045818b4e725fdf6b57e7,en,,What occurs immediately after the command Huey lands on the beach?,Kilgore and Lance disembark from command helicopter under escort,"The command Huey touches down on the beach, and Kilgore and Lance exit under the protection of armed guards. Shortly afterward, a second helicopter lands, bringing more personnel, including Kilgore’s surfers and members of the P.B.R. crew. Willard follows closely behind, joining the group as they move into the debris-strewn landing zone.",Scene Grounding
8,en3b8f79aa09a045818b4e725fdf6b57e7,en,,What action directly enables Willard and Lance to retrieve ammunition and escape via the P.B.R. boat at Do Lung Bridge?,Willard points out P.B.R. boat to Lance through smoke,"In the command copter, Willard spots a P.B.R. boat emerging through the smoke on the river and alerts Lance to its presence. He signals silently for them to move toward it, initiating their effort to reach the vessel amid the battlefield chaos. This sighting and decision to act set in motion their subsequent retrieval of ammunition and escape downstream.",Causal-Motivational Reasoning
9,en3b8f79aa09a045818b4e725fdf6b57e7,en,,"What event immediately heightens the tension before Willard fires the grenade, prompting the crew's movement into the jungle?",Helicopter approaches with loudspeaker message from Kilgore,"A helicopter circles overhead, broadcasting Kilgore’s demand for the return of his surfboard, creating palpable tension among the crew. After the aircraft departs, Willard suggests moving ashore under cover of darkness, which the Chief approves. Willard and Chef then step onto the beach and advance into the jungle, setting the stage for the subsequent ambush where Willard ultimately fires the grenade after Clean falls.",Causal-Motivational Reasoning
10,en3b8f79aa09a045818b4e725fdf6b57e7,en,,What action by Willard earlier establishes the tension that leads to him taking decisive control during the ambush in the tributary?,Willard threatens Chief with violence to force entry into tributary,"In the midst of a violent river current, Willard demands the Chief steer the P.B.R. into a tributary to escape danger, but the Chief refuses, citing the risk of V.C. presence. After a near-miss with debris and growing frustration, Willard hurls a pole at the Chief and explicitly threatens to kill him if he doesn't comply. The Chief, recognizing the seriousness of the threat, acquiesces and turns into the tributary. This moment of insubordination and coercion shifts the balance of authority on the boat, setting the stage for Willard’s later assumption of tactical control during the ambush, where he independently takes up the M-79 and fires on enemy positions without orders.",Causal-Motivational Reasoning
11,en3b8f79aa09a045818b4e725fdf6b57e7,en,,What action by Kilgore directly initiates the helicopter assault on the beachside village?,Kilgore points to location on map and inquires about village name,"During a planning scene aboard the helicopter, Kilgore identifies a surf break near a riverside village by pointing to a location on a map and asking its name. Upon learning it is Vin Drip Drop—a rare left-breaking wave—he immediately orders a dawn airmobile assault to secure the point, overriding logistical concerns and preparing his unit for deployment. This decision sets in motion the large-scale attack shown later, where fifty helicopters descend on the village, launching a coordinated bombardment to take control of the area.",Causal-Motivational Reasoning
12,en3b8f79aa09a045818b4e725fdf6b57e7,en,,"Before the team can approach the fortress-temple and encounter Colby, what earlier development has already taken place?",Willard and Kilgore have already discussed the mission to Nu Mung Ba aboard the helicopter.,"The approach to the fortress-temple comes later in the mission sequence. Earlier, aboard the helicopter, Willard and Kilgore talk through the Nu Mung Ba mission, establishing the operational context that precedes the team's later movement toward the temple and the encounter with Colby.",Temporal Reasoning
13,en3b8f79aa09a045818b4e725fdf6b57e7,en,,"By the time the crew navigates the river under fog, what has already taken place?",Crew hides boat under trees at night,"Prior to the crew's movement through the fog-covered river, they conceal their boat beneath trees during the night to avoid detection, establishing a necessary precondition for their subsequent navigation.",Temporal Reasoning
14,en3b8f79aa09a045818b4e725fdf6b57e7,en,,What specific role-based relationship persists between Colby and Willard from the temple battle through their actions along the river?,battle comrades,"From the temple battle in scene 52, where Willard calls out 'Napalm' and Colby immediately activates the plungers in response, to their coordinated gunfire against helicopters in scene 115, Colby and Willard repeatedly act in direct combat alignment—initiating and sustaining joint offensive actions. This pattern, including their reengagement in scene 112 and mutual defiance in scene 55, confirms a persistent role relationship as battle comrades.",Role-Relation Continuity
15,en3b8f79aa09a045818b4e725fdf6b57e7,en,,How does Captain B.L. Willard's treatment of the Civilian evolve from their first encounter to their later sighting on the same street?,Captain B.L. Willard keeps treating the Civilian as a suspected threat,"From the initial scene on the street in Saigon, Captain B.L. Willard perceives the American civilian as someone who might be following him, expressing suspicion and an unfavorable stance. This attitude persists through later moments in the narrative, including a subsequent encounter at the same location, where Willard again looks back, uncertain and wary, indicating that his view of the civilian as a potential threat remains unchanged.",Role-Relation Continuity
16,en3b8f79aa09a045818b4e725fdf6b57e7,en,,What turning point initiates the sequence in which Kilgore plans and executes the airmobile assault to secure the Vin Drip Drop surf point?,Kilgore and Lance Arrive on the Beach,"The arrival of Kilgore and Lance on the beach marks a pivotal shift in the narrative, triggering a series of military and symbolic actions centered on the surf point. This moment sets into motion Kilgore’s airmobile assault planning, the surf test under fire, and the coordinated use of napalm and artillery, all of which unfold as direct consequences of their presence and command decisions established in this episode [21、INT. COMMAND COPTER - KILGORE, WILLARD, LANCE, ETC.].",Narrative Progression
17,en3b8f79aa09a045818b4e725fdf6b57e7,en,,What turning point initiates the sequence in which Kilgore directs surfing under combat conditions and Willard retrieves a surfboard during active fire?,Kilgore Plans Airmobile Assault to Secure Vin Drip Drop Surf Point,"The decision by Kilgore to launch an airmobile assault to capture the Vin Drip Drop surf point sets in motion a series of events where military operations are subordinated to the pursuit of ideal surfing conditions. This strategic yet reckless move directly leads to combat scenarios in which surfing proceeds amid artillery fire, a napalm strike is ordered to clear the area for surf testing, and Willard is compelled to recover Kilgore’s surfboard under hostile fire. [scene: 8、EXT. THE HELICOPTER - MED. SHOT]",Narrative Progression
18,en3b8f79aa09a045818b4e725fdf6b57e7,en,,"What turning point initiates Kilgore's shift into an active combat role, leading directly to his assumption of the gunner's position, sniper engagement, and response to the distress call?",Kilgore Spares the Third Soldier and Takes Position,"In the command copter, Kilgore makes a decisive choice after encountering enemy soldiers, sparing one and asserting control over the mission's tactical direction. This moment marks his transition from command oversight to direct combat involvement, immediately preceding his take-over of the gunner's role, a sniper shot from the helicopter, and his directive to engage enemy huts following a distress call. [19、INT. COMMAND COPTER - MED. SHOT - KILGORE, WILLARD]",Narrative Progression
19,en3b8f79aa09a045818b4e725fdf6b57e7,en,,"What turning point initiates the sequence leading directly to the aftermath of Clean's death, the river debris encounter, and departure with The Chief?",Willard and Lance Spot the P.B.R. Boat Downriver,"The sighting of the P.B.R. boat downriver marks a pivotal shift in the narrative, triggering a chain of events that includes dealing with Clean's death, navigating the dangerous river currents, and ultimately boarding The Chief at the dock. This moment redirects the mission's trajectory and sets the crew on a new course of action. [21、INT. COMMAND COPTER - KILGORE, WILLARD, LANCE, ETC.]",Narrative Progression
20,en3b8f79aa09a045818b4e725fdf6b57e7,en,,What event immediately prior to Willard administering morphine explains Kurtz's physical state and his refusal of a second dose?,Kurtz suffers severe pain from stomach wound and collapses,"After discussing the clarity of his mind and the madness of his soul, Kurtz is overcome by intense abdominal pain from his untreated stomach wound. He groans, clutches his abdomen, and collapses from his chair onto the dirt floor. Willard immediately moves to examine the injury, assessing its severity and setting the stage for his subsequent decision to administer morphine. This sudden physical deterioration directly precedes and motivates both the administration of the drug and Kurtz’s later refusal of a second dose.",Causal-Motivational Reasoning
21,en3b8f79aa09a045818b4e725fdf6b57e7,en,,In which scene or scenes are Sergeant and The Chief both present?,5、EXT. HAU FAT - AN ADVANCE STAGING AREA | 7、EXT. FULL VIEW - DAY | 65、EXT. HAU FAT - AN ADVANCE STAGING AREA | 67、EXT. FULL VIEW - DAY,"{""pair"": [""Sergeant"", ""The Chief""], ""pair_mentions"": 29, ""scene_grounding_subtype"": ""copresence_localization"", ""scene_count"": 4, ""scene_numbers"": [5, 7, 65, 67], ""scene_titles"": [""5、EXT. HAU FAT - AN ADVANCE STAGING AREA"", ""7、EXT. FULL VIEW - DAY"", ""65、EXT. HAU FAT - AN ADVANCE STAGING AREA"", ""67、EXT. FULL VIEW - DAY""]}",Scene Grounding
22,en3b8f79aa09a045818b4e725fdf6b57e7,en,,In which scene or scenes is WILLARD acting as a member of U.S. Army?,"27、EXT. THE P.B.R. APPROACHING DO LUNG BRIDGE - FULL SHOT - | 45、EXT. THE RIVER - P.B.R. DAY | 83、INT. TENT - MED. SHOT - WILLARD, AGENT | 105、EXT. THE RIVER - P.B.R. DAY","{""character"": ""WILLARD"", ""role_label"": ""U.S. Army"", ""relation_names"": [""serves in"", ""belongs to""], ""descriptions"": [""Willard is recognized by the Gunner as an officer ('sir'), moves freely among the soldiers, and participates in frontline operations, establishing his role as a member of the U.S. Army Soldiers."", ""Willard is addressed as 'Captain B.L. Willard' and salutes Kurtz, a fellow officer, indicating his rank and institutional membership in the U.S. Army.""], ""scene_grounding_subtype"": ""role_state_localization"", ""scene_count"": 4, ""scene_numbers"": [27, 45, 83, 105], ""scene_titles"": [""27、EXT. THE P.B.R. APPROACHING DO LUNG BRIDGE - FULL SHOT -"", ""45、EXT. THE RIVER - P.B.R. DAY"", ""83、INT. TENT - MED. SHOT - WILLARD, AGENT"", ""105、EXT. THE RIVER - P.B.R. DAY""]}",Scene Grounding
23,en3b8f79aa09a045818b4e725fdf6b57e7,en,,In which scene or scenes do native men clearly appear?,90、EXT. THE TRIBUTARY - P.B.R. - RAIN | 112、EXT. OF THE TEMPLE AT NU MUNG BA - NIGHT,"Native men are depicted in two distinct scenes within the screenplay: first during the river sequence under rainy conditions, and later in a nighttime setting outside a temple, where their presence is explicitly indicated through action and dialogue.",Scene Grounding
24,en3b8f79aa09a045818b4e725fdf6b57e7,en,,In which scene or scenes are Philippe and The Chief both present?,"30、EXT. THE TRIBUTARY - P.B.R. - RAIN | 41、EXT. DOCK - FULL SHOT - WILLARD, OTHERS | 90、EXT. THE TRIBUTARY - P.B.R. - RAIN | 101、EXT. DOCK - FULL SHOT - WILLARD, OTHERS","{""pair"": [""Philippe"", ""The Chief""], ""pair_mentions"": 34, ""scene_grounding_subtype"": ""copresence_localization"", ""scene_count"": 4, ""scene_numbers"": [30, 41, 90, 101], ""scene_titles"": [""30、EXT. THE TRIBUTARY - P.B.R. - RAIN"", ""41、EXT. DOCK - FULL SHOT - WILLARD, OTHERS"", ""90、EXT. THE TRIBUTARY - P.B.R. - RAIN"", ""101、EXT. DOCK - FULL SHOT - WILLARD, OTHERS""]}",Scene Grounding
25,en3b8f79aa09a045818b4e725fdf6b57e7,en,,In which scene or scenes is Lance Johnson acting as a member of P.B.R. Crew?,4、EXT. HELICOPTER - DUSK | 64、EXT. HELICOPTER - DUSK | 94、INT. DINING ROOM GROUP - TRACKING SHOT | 112、EXT. OF THE TEMPLE AT NU MUNG BA - NIGHT,"{""character"": ""Lance Johnson"", ""role_label"": ""P.B.R. Crew"", ""relation_names"": [""crew member of"", ""is member of"", ""is a member of""], ""descriptions"": [""Lance Johnson is introduced as part of the P.B.R. crew and is seen manning the forward machine guns, confirming his membership on the boat."", ""Lance Johnson is part of the Navy P.B.R. crew, evident from his active participation and positioning on the boat.""], ""scene_grounding_subtype"": ""role_state_localization"", ""scene_count"": 4, ""scene_numbers"": [4, 64, 94, 112], ""scene_titles"": [""4、EXT. HELICOPTER - DUSK"", ""64、EXT. HELICOPTER - DUSK"", ""94、INT. DINING ROOM GROUP - TRACKING SHOT"", ""112、EXT. OF THE TEMPLE AT NU MUNG BA - NIGHT""]}",Scene Grounding
26,en3b8f79aa09a045818b4e725fdf6b57e7,en,,Who are the 2 most central characters in this story?,"Kurtz, WILLARD",,Character Understanding
