id,movie_id,language,related_scenes,question,answer,evidence_or_reason,question_type
1,chf4bc38ad92a58a87e8b51efe2214e53d0e6b2e96,zh,43、医院楼梯间，日，内,廖队长在与棠真对话时持续追问，体现出他对棠真怎样的角色定位？,信息提供者/线索来源,廖队长基于监控和事件时间线不断质询棠真，试图从她口中获取关于Marco和翩翩的关键信息，表明他视棠真为破案所需情报的直接来源。,Character Understanding
2,chf4bc38ad92a58a87e8b51efe2214e53d0e6b2e96,zh,21、棠家客厅，日，内,在准备待客用品时，棠余月影招呼棠真一起做事，她最希望实现什么？,重建默契合作,冲突过后，棠余月影主动邀请棠真共同准备待客用品，通过递接物品的互动恢复两人之间的配合与信任，表现出她意在修复关系、重建协作的意图。,Character Understanding
3,chf4bc38ad92a58a87e8b51efe2214e53d0e6b2e96,zh,33、棠家后庭院房子，日，内,棠余月影阻止棠真上学，反映了她在此时对棠真的角色定位是什么？,带路者/跟进者,棠余月影决定带棠真去探望翩翩，主动引导行动方向，棠真则顺从跟随。,Character Understanding
4,chf4bc38ad92a58a87e8b51efe2214e53d0e6b2e96,zh,6、棠家客厅，日，内,棠真接完电话后，她在迎接王院长夫人的准备行动中扮演了什么角色？,信息传递者/协调者，负责通报关键动态以启动迎接流程,棠真获知夫人抵达信息后立即告知众人，推动迎接行动展开，体现出她在流程中的信息枢纽作用,Character Understanding
5,chf4bc38ad92a58a87e8b51efe2214e53d0e6b2e96,zh,33、棠家后庭院房子，日，内,在棠家后庭院房子的这场戏中，哪个动作直接引发了棠余月影的激烈反应并改变了后续的家庭互动？,棠真打开木盒展示吸毒工具,棠真通过展示藏在木盒中的吸毒工具，揭发棠宁涉毒，这一举动直接触发了棠余月影的情绪爆发和对空间使用的禁令，推动了人物关系的紧张与情节的转向。,Scene Grounding
6,chf4bc38ad92a58a87e8b51efe2214e53d0e6b2e96,zh,23、棠家房子，日，内,在[棠家房子，日，内]这场戏中，棠宁通过什么关键动作确立了她与辜献忠交涉的主导地位？,打趣辜献忠要生孩子,棠宁以调侃辜献忠‘要生孩子了’开场，借古董夜壶制造笑点，迅速掌握对话节奏。这一玩笑不仅打破拘谨氛围，更引出她对屋内物品皆可定价的论述，为后续谈判铺路，体现出她在交涉中的主动与掌控。,Scene Grounding
7,chf4bc38ad92a58a87e8b51efe2214e53d0e6b2e96,zh,43、医院楼梯间，日，内,在医院楼梯间这场戏中，廖队长采取了哪个关键动作来推进对Marco和翩翩事件的调查？,询问棠真关于Marco和翩翩的关系,廖队长在楼梯间与棠真对话，通过提问引导她回忆事发经过，特别是她与Marco、翩翩之间的关联，借此获取调查线索。这一问话行为构成了该场景的核心推动力。,Scene Grounding
8,chf4bc38ad92a58a87e8b51efe2214e53d0e6b2e96,zh,47、医院院子，日，外廖队长和棠真走着。; 7、车，日，内,棠余月影为何会在车上主动安慰棠真并让她露出笑容？,棠宁骑摩托车接走棠真并与廖队长短暂对峙,棠真在医院院子与廖队长交谈时情绪压抑，因被追问家庭冲突而陷入沉默。棠宁此时骑车出现，打断对话并将棠真接走。这一举动改变了棠真的处境，使她从被盘问的压力中脱离，进入与棠宁、棠余月影共处的私密空间，从而为后续棠余月影在行驶途中察觉其情绪并进行安抚创造了条件。,Causal-Motivational Reasoning
9,chf4bc38ad92a58a87e8b51efe2214e53d0e6b2e96,zh,33、棠家后庭院房子，日，内; 34、棠家后院，日，外,棠余月影为何在后院散步时对棠真流露出格外温柔的叮嘱？,她决定不去上学，转而带棠真去探望翩翩,这一温柔态度源于她改变原定安排，选择带棠真探望翩翩的决定，体现出她在冲突后对棠真的情感安抚意图。,Causal-Motivational Reasoning
10,chf4bc38ad92a58a87e8b51efe2214e53d0e6b2e96,zh,6、棠家客厅，日，内; 13、庄园走廊/亭子，日，外,是什么事件促使棠余月影开始陪同王夫人参观宅邸并安排亭中表演？,棠真接听电话并通报王院长夫人即将抵达,棠真接到王院长夫人抵达的通知后，立即告知在场众人，触发了迎接客人的准备流程。棠余月影随即调整安排，引导宾客参观宅邸并启动预先准备的表演环节，从而自然过渡到亭中演出场景。,Causal-Motivational Reasoning
11,chf4bc38ad92a58a87e8b51efe2214e53d0e6b2e96,zh,13、庄园走廊/亭子，日，外; 14、庄园亭子，日，外,棠余月影为何会在画展期间向林议员表达谢意并称赞合作？这一态度背后的直接促成事件是什么？,棠余月影搀扶王夫人参观宅邸并安排亭中表演,棠余月影在陪同王夫人参观过程中展现出周到的礼数与对家庭形象的维护意识，同时通过安排棠真与林翩翩的表演营造出和谐氛围，这一举动间接巩固了与林议员的合作关系，为后续公开致谢提供了情感与社交基础。,Causal-Motivational Reasoning
12,chf4bc38ad92a58a87e8b51efe2214e53d0e6b2e96,zh,28、警局门口，日，外; 43、医院楼梯间，日，内,到了廖队长在医院楼梯间追问棠真关于Marco和翩翩的事时，此前在警局门口已经发生了什么关键发展？,记者们在警局门口围堵并拍摄发言人,在医院楼梯间的对峙发生之前，剧情已通过警局门口的公开紧张场面建立了媒体压力的背景，该场景中记者聚集拍摄发言人，为后续人物关系的紧张推进提供了叙事铺垫。,Temporal Reasoning
13,chf4bc38ad92a58a87e8b51efe2214e53d0e6b2e96,zh,6、棠家客厅，日，内; 44、林翩翩家卧室，夜，内,到了林翩翩交出日记本并催促棠真行动时，此前在棠家客厅已发生的关键发展是什么？,林翩翩声称看到棠宁与两名男子聊天,在林翩翩采取进一步行动之前，她已在棠家客厅透露棠宁与两名男子交谈的情形，为后续交出日记本和推动棠真行动提供了动机与信息铺垫。,Temporal Reasoning
14,chf4bc38ad92a58a87e8b51efe2214e53d0e6b2e96,zh,4、棠家花园，日，外; 104、【回忆】医院病房，日，内,从[4、棠家花园，日，外]到[104、【回忆】医院病房，日，内]，林翩翩和棠真之间的关系如何演变？,从亲密好友变为单向深切关怀：前期彼此信任互动，后期棠真在林翩翩危难时表现出强烈情感投入。,初期两人以昵称相称、共同行动，显示对等友谊；中期出现短暂敌意，但后期棠真在林翩翩病危时流露悲痛并积极求助，表明其始终保有关怀，关系由双向友情转向单向深切牵挂。,Role-Relation Continuity
15,chf4bc38ad92a58a87e8b51efe2214e53d0e6b2e96,zh,7、车，日，内; 104、【回忆】医院病房，日，内,从[7、车，日，内]到[104、【回忆】医院病房，日，内]，棠余月影与棠真之间的互动关系经历了怎样的转变？,从相互信任、情感支持转变为对视中的紧张与公开对立,早期场景中，棠余月影多次主动安慰、赞赏棠真，两人以亲密家人姿态共同行动，关系稳定且积极；而在回忆病房场景中，棠真面对棠余月影选择沉默对视后逃离，表现出明显的敌对张力，标志关系已破裂。,Role-Relation Continuity
16,chf4bc38ad92a58a87e8b51efe2214e53d0e6b2e96,zh,14、庄园亭子，日，外; 86、车，日，内,从[14、庄园亭子，日，外]到[86、车，日，内]，棠宁与棠真之间的互动模式如何演变？,从棠宁单方面主导的家庭亲密关系，转变为双方在外部压力下相互信任与依赖的姐妹关系,初期棠宁以家族名义主导互动，表现出对棠真的关爱与指派；中期出现管教与排斥，关系出现波动；后期在共同面对外部压力时，棠真主动保护棠宁，体现出关系已发展为双向信任与情感依赖。,Role-Relation Continuity
17,chf4bc38ad92a58a87e8b51efe2214e53d0e6b2e96,zh,33、棠家后庭院房子，日，内; 34、棠家后院，日，外; 33、棠家后庭院房子，日，内,哪一个事件成为后续Marco对棠宁产生戒备、棠余月影带棠真探望翩翩并予以情感安抚等一系列行动的叙事转折点？,棠真揭发棠宁藏毒引发冲突,该事件首次暴露家庭内部的信任危机，迫使其他角色重新评估棠宁的行为，并触发保护棠真与寻求情感支持的连锁行动，从而推动剧情从日常隐忍转向紧张对峙与情感疏导并行的阶段。,Narrative Progression
18,chf4bc38ad92a58a87e8b51efe2214e53d0e6b2e96,zh,23、棠家房子，日，内; 23、棠家房子，日，内; 23、棠家房子，日，内,在[棠家房子，日，内]场景中，哪一个举动首次将日常互动转化为实质性的交易谈判，从而推动后续以水写字与佛像交易的发展？,棠宁以玩笑引出交易,该场景中，棠宁通过看似随意的玩笑话切入敏感话题，巧妙地将气氛从日常对峙转向隐秘协商，为后续用水迹写字达成协议及佛像交易铺平道路，构成情节推进的关键起点。,Narrative Progression
19,chf4bc38ad92a58a87e8b51efe2214e53d0e6b2e96,zh,42、医院病房，日，内; 17、庄园走廊，夜，外; 18、庄园墙壁边，夜，外,哪一个事件标志着棠真从被动照料转向主动介入林翩翩的逃离计划，从而推动后续追问Marco下落、协助出逃及接收日记本等行动？,棠真为林翩翩放音乐并陷入回忆,该场景中，棠真通过播放音乐触发对过往的回忆，情感上重新连接林翩翩的处境，表现出态度转变的起点，为后续一系列主动行为提供了内在动机。这一举动虽表面平静，实则打破了此前疏离的状态，成为推动情节向前的关键心理转折。,Narrative Progression
20,chf4bc38ad92a58a87e8b51efe2214e53d0e6b2e96,zh,23、棠家房子，日，内; 23、棠家房子，日，内; 23、棠家房子，日，内,在[23、棠家房子，日，内]场景中，哪个事件标志着棠宁与辜献忠之间从日常互动转向实质性佛像交易谈判的叙事转折？,棠宁邀辜献忠入座,该邀请行为开启了两人密谈的空间与氛围，使后续以玩笑方式引出交易、正式商议佛像买卖及以水写字达成默契成为可能，是推动情节由日常转向交易核心的结构性起点。,Narrative Progression
