id,movie_id,language,related_scenes,question,answer,evidence_or_reason,question_type
1,enb43327ef98f144afae56e30053028568,en,17、INT. MATT'S CAR - DAY,What does Matt aim to accomplish during the car ride with Scottie?,Secure Scottie's apology and limit Reina's influence,"Matt drives Scottie to their destination and uses the opportunity to address Scottie's behavior. He confronts him about sending hurtful messages, emphasizing the emotional impact on others and insisting on a sincere apology. Matt links Scottie's actions to his association with Reina, expressing disapproval of her influence. He sets a condition: Scottie must apologize and speak with his mother before any visit from Reina can be considered. The conversation reveals Matt's intent to hold Scottie accountable and reshape his social boundaries.",Character Understanding
2,enb43327ef98f144afae56e30053028568,en,16、INT. KING HOUSE - DAY,What does Matt intend to do after learning about Scottie's messages to Lani?,Confront Scottie about harassment,"Matt receives a call from Barb Higgins, who informs him that her daughter Lani has been targeted by offensive messages from Scottie, including a demeaning comment posted on Facebook and a mocking nickname implying Lani's size. Barb reads the message aloud and insists Scottie apologize in person, warning she will escalate to the headmaster if no action is taken. Despite Matt noting Scottie's personal struggles due to her mother's illness, Barb rejects any justification, emphasizing the emotional harm to her daughter. During the call, Matt sees Scottie outside, distracted and physically agitated, pounding the ground with a rock.",Character Understanding
3,enb43327ef98f144afae56e30053028568,en,47、INT. LIVING ROOM - DAY,What does Alexandra aim to accomplish by revealing what she saw at Black Point?,Expose her mother's infidelity,"Matt sits with Alexandra on the sofa and urges her to help inform family and friends about their mother's illness, emphasizing the importance of allowing loved ones to say goodbye. Alexandra resists, expressing reluctance to discuss her mother's condition. Matt pushes her to move past their strained relationship and act maturely. In response, Alexandra discloses that she witnessed her mother in a compromising situation with another man at Black Point, describing the man's appearance and physical contact. Matt questions the details, visibly disturbed, before abruptly leaving the room.",Character Understanding
4,enb43327ef98f144afae56e30053028568,en,20、INT. LANI'S HOUSE - CONTINUOUS,What does Scottie recognize about her past action toward Lani that shifts the moral balance in the confrontation?,She brought Lani cake first,"Inside the TV room, tensions surface as Barb Higgins criticizes Scottie for unkind words, insisting they reflect deep wrongdoing. Matt challenges this perspective by highlighting that children's actions aren't always defining, citing a past incident where Lani locked Scottie out during her birthday party. As Lani acknowledges this moment, Scottie recalls a prior gesture of kindness—bringing cake to Lani—which Matt seizes upon to argue that goodwill preceded the conflict. This recollection reframes the narrative, suggesting mutual fault and shared history rather than one-sided blame.",Character Understanding
5,enb43327ef98f144afae56e30053028568,en,46、EXT. KING SWIMMING POOL - DAY,What does Alexandra do immediately after Scottie runs back inside?,Enters the pool and floats at the edge,"After Scottie runs back inside following an outburst, Alexandra slides into the pool and swims to the other side, positioning herself at the edge with her lower body still in the water. Matt joins her shortly after, and they discuss Scottie while sitting in the pool. Alexandra suggests Matt take Scottie camping on Kaua'i, recalling that it was something her own mother did when she acted out.",Scene Grounding
6,enb43327ef98f144afae56e30053028568,en,5、INT. HOSPITAL ROOM - DAY,What does Matt do upon reflecting on his wife's condition and her living will?,Insists she will pull through,"Matt stands by his wife’s bedside, observing her unconscious state after twenty-three days in a coma. He contemplates the doctors’ upcoming decision about her care and recalls her living will, which limits his authority. Despite this, he internally asserts that she will recover. Shortly after, his phone rings with an urgent message about his daughter.",Scene Grounding
7,enb43327ef98f144afae56e30053028568,en,46、EXT. KING SWIMMING POOL - DAY,What occurs when Matt delivers the news about Alexandra's mother at the swimming pool?,Matt informs Alexandra of her mother's impending death,"At the swimming pool, Matt tells Alexandra that her mother will not wake up and that medical care will be withdrawn according to her will. Alexandra initially remains silent, submerges herself underwater in distress, then surfaces, climbs out, and begins to cry. When Matt moves to comfort her, she questions his motives and ultimately rejects his embrace, walking back into the house alone.",Scene Grounding
8,enb43327ef98f144afae56e30053028568,en,46、EXT. KING SWIMMING POOL - DAY; 46、EXT. KING SWIMMING POOL - DAY,What action by Matt creates the conditions for his conversation with Alexandra by the pool?,Matt demands Scottie apologize sincerely,"During a car ride, Matt confronts Scottie about his hurtful messages, insisting he apologize sincerely and stop the behavior, which has caused someone to cry. He links Scottie’s actions to Reina’s influence and refuses to allow her to visit unless Scottie apologizes and speaks with his mother. This confrontation sets the stage for the later scene by the pool, where Matt and Alexandra reflect on Scottie’s behavior and Matt’s role in addressing it.",Causal-Motivational Reasoning
9,enb43327ef98f144afae56e30053028568,en,45、INT. KING KITCHEN - DAY; 47、INT. LIVING ROOM - DAY,What prompts Alexandra to reveal her mother's affair during her confrontation with Matt?,Matt comments on her condition and hesitates to speak further in front of Scottie,"In the kitchen, Matt observes Alexandra's disheveled appearance and remarks that she seems hungover, then begins to say he doesn’t know where to start before pausing, glancing at Scottie, and deciding not to continue the conversation in front of the child. This moment of withheld communication and judgment fuels Alexandra’s emotional tension, which later erupts when Matt pressures her to help inform family about her mother’s illness, leading her to disclose the affair as a way to assert the depth of the rift she feels.",Causal-Motivational Reasoning
10,enb43327ef98f144afae56e30053028568,en,3、INT. HOSPITAL ROOM - DAY; 11、INT. HOSPITAL STAIRWAY - DAY,What event motivates Matt's private moment of envisioning a renewed life with Elizabeth as he climbs the hospital stairs?,Elizabeth King suffers head injury and near-drowning in powerboat accident,"In the hospital room, Matt sits beside his comatose wife, Elizabeth, who remains unresponsive 23 days after being thrown from a powerboat during a race. She sustained a severe head injury and nearly drowned, leaving her in a deep coma with minimal neurological response. Surrounded by medical equipment and the quiet hum of life support, Matt confronts the fragility of her condition. Later, as he ascends the hospital stairs, he speaks aloud of her recovery and their shared future, imagining a reconciliation that hinges on the possibility of her awakening from this trauma-induced state.",Causal-Motivational Reasoning
11,enb43327ef98f144afae56e30053028568,en,46、EXT. KING SWIMMING POOL - DAY; 46、EXT. KING SWIMMING POOL - DAY,What event immediately precedes and motivates the conversation between Alexandra and Matt in the pool?,Scottie runs onto the patio in her bra and panties and refuses to change,"After Scottie bursts onto the patio in her undergarments and defiantly flips off Matt before running inside, Alexandra criticizes Matt’s parenting. This confrontation sets the stage for their subsequent discussion in the pool, where Alexandra suggests Matt take Scottie camping to rebuild their relationship, directly responding to the earlier outburst and Matt’s expressed helplessness.",Causal-Motivational Reasoning
12,enb43327ef98f144afae56e30053028568,en,16、INT. KING HOUSE - DAY; 20、INT. LANI'S HOUSE - CONTINUOUS,What prompts Scottie to apologize to Lani?,Matt receives a phone call from Barb Higgins about Scottie's behavior,"Barb Higgins calls Matt to report that Scottie has been sending offensive messages to her daughter Lani, including a derogatory comment posted on Facebook and a mocking nickname implying Lani is overweight. Barb demands that Scottie come to her house to apologize in person and threatens to report the behavior to the headmaster if it continues. Matt confronts Scottie shortly after receiving the call, leading directly to the apology.",Causal-Motivational Reasoning
13,enb43327ef98f144afae56e30053028568,en,47、INT. LIVING ROOM - DAY; 47、INT. LIVING ROOM - DAY,What action by Matt prior to learning the truth about his wife's infidelity creates the emotional pressure that makes his withdrawal inevitable?,Matt urges Alexandra to reconcile with her mother,"In the living room, Matt presses Alexandra to help him inform family and friends about her mother’s illness, insisting she let go of past grievances and urging her to remember their love. He tells her to grow up and reconcile, not knowing she harbors the secret of her mother’s affair. When she reveals what she saw—her mother with another man—his earlier insistence collapses under the weight of betrayal, prompting him to abruptly walk away after telling her to watch Scottie.",Causal-Motivational Reasoning
14,enb43327ef98f144afae56e30053028568,en,47、INT. LIVING ROOM - DAY; 48、EXT. KING HOUSE - DAY,What decision immediately motivates Matt's sudden departure from the house?,Matt decides to leave Alexandra with Scottie,"After learning that Alexandra witnessed her mother with another man and hearing about the ensuing confrontation, Matt becomes visibly agitated. He abruptly tells Alexandra to watch Scottie and walks out without further explanation. Moments later, he bursts out of the house and sprints down the street, marking a decisive physical escalation of his emotional state. [scene: 47、INT. LIVING ROOM - DAY]",Causal-Motivational Reasoning
15,enb43327ef98f144afae56e30053028568,en,13、INT. HOSPITAL ROOM - CONTINUOUS; 46、EXT. KING SWIMMING POOL - DAY,"By the time Alexandra and Matt are alone together in the swimming pool, what has Matt already done with Scottie?",Led Scottie to the car,"Before the quiet moment between Alexandra and Matt unfolds at the swimming pool, Matt has already taken Scottie from the elementary school after a tense confrontation about the hospital photos. This occurs in an earlier scene where Matt intervenes to remove Scottie from a distressing situation, setting the stage for the emotional aftermath reflected in the poolside exchange.",Temporal Reasoning
16,enb43327ef98f144afae56e30053028568,en,13、INT. HOSPITAL ROOM - CONTINUOUS; 46、EXT. KING SWIMMING POOL - DAY,"By the time Alexandra and Matt are alone together in the pool following Scottie's emotional reaction, what has Scottie already done that sets the situation in motion?",Scottie giggles and texts on her phone while sitting on a sofa,"Before the tension between Alexandra and Matt unfolds in the swimming pool, Scottie is seen in a hospital room, casually giggling and focused on her phone, which contributes to the growing strain in the group dynamic. This moment initiates a chain of interpersonal reactions that lead to the confrontation and its quiet aftermath by the pool.",Temporal Reasoning
17,enb43327ef98f144afae56e30053028568,en,5、INT. HOSPITAL ROOM - DAY; 48、EXT. KING HOUSE - DAY; 39、INT. DORM SUPERVISOR'S ROOM HALLWAY - NIGHT,What event shifts the narrative trajectory toward Matt’s urgent actions involving his daughter and Lani?,Matt Receives an Urgent Call About His Daughter,"In the hospital room, Matt receives a critical phone call concerning his daughter Alexandra, prompting a chain of urgent decisions and interventions. This moment marks the pivot from prior character tensions to active crisis response, directly initiating his late-night retrieval of Alexandra and escalating his confrontation with Scottie over Lani’s safety. [5、INT. HOSPITAL ROOM - DAY]",Narrative Progression
18,enb43327ef98f144afae56e30053028568,en,3、INT. HOSPITAL ROOM - DAY; 11、INT. HOSPITAL STAIRWAY - DAY; 5、INT. HOSPITAL ROOM - DAY,What pivotal event sets in motion Matt's emotional journey and the subsequent developments involving his daughter's condition and his reconciliation efforts?,Matt Observes Elizabeth in Coma After Boating Accident,"The narrative shifts decisively when Matt confronts the aftermath of the boating accident, standing at his daughter Elizabeth's bedside as she lies unconscious in the hospital. This moment anchors the emotional core of the story, triggering Matt's urgent involvement in her care, his communication with Dr. Johnston regarding her prognosis, and his growing introspection that leads to tentative steps toward reconciliation. [3、INT. HOSPITAL ROOM - DAY]",Narrative Progression
19,enb43327ef98f144afae56e30053028568,en,45、INT. KING KITCHEN - DAY; 45、INT. KING KITCHEN - DAY; 47、INT. LIVING ROOM - DAY,What pivotal moment shifts the narrative toward the revelations about Alexandra's mother and the family's emotional reckoning?,Matt Comments on Alexandra's Condition and Hesitates to Speak Further,"In the kitchen during the day, Matt observes Alexandra's deteriorating state and begins to voice his concerns, but pauses, holding back crucial information. This moment of hesitation underscores the growing tension between truth and protection, setting in motion the subsequent confrontations about her mother's affair and illness, and prompting the difficult conversations about disclosure within the family.",Narrative Progression
20,enb43327ef98f144afae56e30053028568,en,46、EXT. KING SWIMMING POOL - DAY; 46、EXT. KING SWIMMING POOL - DAY; 47、INT. LIVING ROOM - DAY,"What pivotal event shifts the narrative trajectory toward the escalating tensions involving Alexandra, Matt, and Scottie in the subsequent scenes?",Alexandra and Matt in the Pool After Scottie's Outburst,"Following Scottie's emotional outburst, the encounter between Alexandra and Matt at the swimming pool marks a critical shift in their dynamic, setting in motion a chain of confrontations and revelations. This moment recalibrates the power balance and emotional stakes, directly precipitating Alexandra's later comments about the pool, Matt's withdrawal upon learning of the affair, and the eventual late-night confrontation between Matt, Scottie, and Alexandra on the golf course. [46、EXT. KING SWIMMING POOL - DAY]",Narrative Progression
21,enb43327ef98f144afae56e30053028568,en,,Who are the 3 most central characters in this story?,"Alexandra, Matt King, Scottie",,Character Understanding
