id,movie_id,language,related_scenes,question,answer,evidence_or_reason,question_type
1,chc8ef1e21bbf697c997957ec09a27524aaf059edf,zh,六、科班胡同冬日阴,小豆子娘为何在关师傅面前下跪并执意带走孩子？,托付儿子求生路,她意识到无法独自抚养儿子，下跪是为恳求关师傅收留小豆子，带走他是为切断亲情羁绊，确保孩子能有学艺立命的机会。,Character Understanding
2,chc8ef1e21bbf697c997957ec09a27524aaf059edf,zh,三十七、故宫外春 黎明,小豆子提出找师哥和想撒尿，真实意图是什么？,借故逃离屏风前,小豆子目睹张太监与侍女的异常互动后感到不安，随即以找师哥和撒尿为由试图离开，反映出他想摆脱当前危险情境的判断。,Character Understanding
3,chc8ef1e21bbf697c997957ec09a27524aaf059edf,zh,十一、科班练功棚冬日,小豆子在受伤时仍注视小石头，反映出他怎样的判断？,关切小石头的处境,小豆子虽被压制受伤，但视线始终投向小石头受罚的方向，身体僵直、呼吸急促却不动，显示他将注意力集中在小石头的命运上，而非自身痛苦，体现出对同伴处境的深切关注。,Character Understanding
4,chc8ef1e21bbf697c997957ec09a27524aaf059edf,zh,二十一、科班门口——胡同,小癞子在练功棚前宣称冰糖葫芦最好吃并召唤小豆子，这一行为反映出他在两人关系中扮演了什么角色？,带路者,小癞子主动发起逃跑并回头召唤小豆子，表明他是行动的引导者，小豆子则是跟随者。,Character Understanding
5,chc8ef1e21bbf697c997957ec09a27524aaf059edf,zh,八、科班胡同,在科班胡同的这场戏中，小豆子面对母亲带他入门时的第一个本能反应是什么？,惊恐地钻到桌下,小豆子被母亲带入科班，环境陌生且充满压迫感。当他意识到即将被留下，第一反应是恐惧逃躲，钻到桌下成为他试图逃避命运的具象化动作，也触发了后续的追逐与压制，标志着他被迫入行的开端。,Scene Grounding
6,chc8ef1e21bbf697c997957ec09a27524aaf059edf,zh,六、科班胡同冬日阴,在这场戏中，母亲如何为小豆子争取进入科班的机会？,跪求关师傅收留小豆子,母亲通过下跪恳求的方式向关师傅请求收留小豆子，强调男孩长大难以管教，只能托付于他，这一动作构成了进入科班的关键转折点。,Scene Grounding
7,chc8ef1e21bbf697c997957ec09a27524aaf059edf,zh,十一、科班练功棚冬日,在这场戏中，老师爷如何开始对小豆子施加训练的压迫？,拽着小豆子走向练功棚,这场戏的核心是通过身体控制与痛苦训练建立权力关系。老师爷从拖拽进入练功棚开始，逐步施加物理压迫，标志着严酷训练的启动，后续加砖、按压、捏伤等行为均由此动作引发，构成整场戏的行动起点。,Scene Grounding
8,chc8ef1e21bbf697c997957ec09a27524aaf059edf,zh,三十七、故宫外春 黎明; 二十一、科班门口——胡同,小豆子在离开前为何会特意提醒小石头枕席下的铜钱？这一举动背后的直接动因是什么？,小豆子曾向张太监提出要找师哥并借故想撒尿，从而获得短暂脱身的机会。,小豆子在被张太监控制前，以找师哥和如厕为由试图离开，这一请求虽未成功释放他，但成为他后续行动的转折点。正是在这段经历之后，他在临走时回头提醒小石头藏钱的事，显示出他在危机中仍试图传递重要信息，其行为动机根植于此前争取自由的尝试与紧迫感。,Causal-Motivational Reasoning
9,chc8ef1e21bbf697c997957ec09a27524aaf059edf,zh,四十五、花满楼春夜; 四十五、花满楼春夜,观众为何在蝶衣与晓楼同台演出时热烈喝彩？这一反应直接源于此前哪一关键表演时刻？,蝶衣演唱《霸王别姬》选段,观众的喝彩出现在蝶衣与晓楼合演《霸王别姬》的过程中，其情绪高涨的直接触发点是蝶衣开唱经典唱段时展现出的唱腔与情感投入，这一表演瞬间点燃了现场反应，成为后续持续掌声的基础。,Causal-Motivational Reasoning
10,chc8ef1e21bbf697c997957ec09a27524aaf059edf,zh,四十六、后台春 黄昏; 五十一、袁宅 春夜,四爷为何会在包厢中为程蝶衣鼓掌？这一举动背后最初的触发事件是什么？,四爷赠送水钻头面作为见面礼,四爷初次见到程蝶衣时赠送贵重头面并盛赞其演技，将其比作虞姬转世，显示出他对程蝶衣艺术造诣的高度认可。这一举动奠定了四爷作为知音的身份，也解释了他后来在台下郑重鼓掌的行为——并非偶然赞赏，而是早先艺术认同的自然延续。,Causal-Motivational Reasoning
11,chc8ef1e21bbf697c997957ec09a27524aaf059edf,zh,十一、科班练功棚冬日; 二十一、科班门口——胡同,小癞子为何会突然决定带着小豆子逃跑？这一行动背后更早触发的心理动因是什么？,小豆子在受伤时仍持续注视小石头受罚，流露出深切的担忧与情感牵连。,小豆子自身受罚未止，却将注意力投向小石头所受的惩罚，表现出超越自身痛苦的情感投入。这种对同伴命运的强烈关注，暴露了他在严苛环境中脆弱的心理状态，成为小癞子感知到逃离紧迫性的关键信号，进而促成了带人出逃的行动。,Causal-Motivational Reasoning
12,chc8ef1e21bbf697c997957ec09a27524aaf059edf,zh,二、地坛市场; 二十三、戏园内,到了小癞子和小豆子逃场看戏却被老师爷追打时，此前最关键的转折是什么？,小癞子在表演中突然逃跑,在逃场事件爆发前，小癞子曾在正式表演中途离场，这一行为打破了演出秩序，成为后续两人结伴逃离、遭追责的导火索。该事件标志着反抗情绪的首次公开爆发，为后续集体逃逸埋下直接伏笔。,Temporal Reasoning
13,chc8ef1e21bbf697c997957ec09a27524aaf059edf,zh,七、关家堂屋; 二十、学徒宿舍春夜,到了小石头为小豆子包扎伤口并叮嘱上香仪式时，此前最关键的举动是什么？,小豆子娘将小豆子拉到磨刀挑子前,在包扎与叮嘱发生前，小豆子娘已强行控制小豆子并带至磨刀处，构成后续情节的直接导因。,Temporal Reasoning
14,chc8ef1e21bbf697c997957ec09a27524aaf059edf,zh,一、体育馆春黄昏内; 一百、体育馆,段晓楼与程蝶衣从最初相互扶持的舞台搭档，到最终发生激烈冲突，这一过程中两人角色关系经历了怎样的实质转变？,从相互依赖的搭档关系转变为对立冲突的撕打关系，体现出保护者/被保护者到对抗者的角色反转,早期互动中程蝶衣为段晓楼勾脸、卸妆并表达关切，显示情感依附与配合分工，后期在体育馆中二人撕打，标志合作关系破裂与角色对立,Role-Relation Continuity
15,chc8ef1e21bbf697c997957ec09a27524aaf059edf,zh,二、地坛市场; 三十八、科班宿舍,从小石头在地坛市场被小豆子注视，到科班宿舍为他披衣呼唤，两人之间的互动方式如何演变？,从被仰慕的对象变为相互照应的同伴,最初小豆子因小石头的表演而产生敬佩，关系单向且带有距离；随着共同经历严苛训练与压迫，小石头开始主动保护与关怀小豆子，尤其在寒冷环境中让被、披衣等举动体现平等而紧密的同伴关系，情感联结趋于双向与深厚。,Role-Relation Continuity
16,chc8ef1e21bbf697c997957ec09a27524aaf059edf,zh,四十三、戏园春黄昏; 七十六、法庭 春 黄昏,从戏园初遇至法庭对峙，袁四爷对程蝶衣的态度和角色定位经历了怎样的演变？,从台下捧场者转为公开辩护的支持者,袁四爷最初以观众身份频繁捧场，体现对程蝶衣艺术的认可；随着关系发展，在法庭上主动为其辩护，澄清演唱内容为国粹精华，表现出从私下支持到公开维护的实质性转变。,Role-Relation Continuity
17,chc8ef1e21bbf697c997957ec09a27524aaf059edf,zh,六、科班胡同冬日阴; 十六、关家科班春日晴; 八、科班胡同,剧情如何从小豆子被送入戏班的初始情境，转向后续严苛训练与身份规训的一系列关键事件？,小豆子娘跪求关师傅收留并强行带走小豆子,这一事件标志着小豆子正式脱离原有生活，进入戏班权力结构的起点。母亲的交付行为既促成师徒关系的建立，也为后续背戏、立关书、体罚等规训机制提供了合法性基础，是制度性压迫开始的触发点。,Narrative Progression
18,chc8ef1e21bbf697c997957ec09a27524aaf059edf,zh,八、科班胡同; 八、科班胡同; 八、科班胡同,在小豆子被正式立契送入戏班的过程中，哪一个事件实际触发了后续离别、立约与分离的一系列不可逆行动？,小豆子钻桌逃跑被按倒祖师像前,该事件标志着小豆子反抗的失败，使其从被动接受转为无法逃脱的命运节点，由此引出母亲诀别、立关书和被带走等程序性步骤，成为制度性收容的起点。,Narrative Progression
19,chc8ef1e21bbf697c997957ec09a27524aaf059edf,zh,三十七、故宫外春 黎明; 三十七、故宫外春 黎明; 三十七、故宫外春 黎明,剧情如何从小豆子试图脱身的日常举动，滑向被卷入张太监的私密场景并遭受羞辱与控制的关键转折？,小豆子借故找师哥并想撒尿,这一举动看似寻常，却是小豆子主动进入禁地的开端，使其意外撞见私会，进而被张太监胁迫，成为后续权力压迫与身体羞辱的导火索。,Narrative Progression
20,chc8ef1e21bbf697c997957ec09a27524aaf059edf,zh,十一、科班练功棚冬日; 二十一、科班门口——胡同; 二十一、科班门口——胡同,剧情如何从小石头受罚的压抑情境转向后续一系列情感回应——包括逃跑、临别警示与深夜照料？哪一个事件成为情感积累的支点？,小豆子带伤注视小石头受罚,该事件集中呈现了压迫下的沉默见证，使小豆子内心情感发生质变，由此催生后续逃离冲动与对小石头复杂的保护行为，构成情感动力的源头。,Narrative Progression
