id,movie_id,language,related_scenes,question,answer,evidence_or_reason,question_type
1,en69e9830df5f14930bfd6ec2e9744f84e,en,,"In [47、INT. BEN'S CAR - DAY], what realization shapes Ben's next move when Ben johan asks Ben about Jonathan?",Confirms Jonathan's Death and Demands Secrecy,"Ben concludes that Jonathan is dead and that no action can be taken. In response, he instructs Johan not to reveal the conversation or his visit to their mother. [Ben Confirms Jonathan's Death and Demands Secrecy]",Character Understanding
2,en69e9830df5f14930bfd6ec2e9744f84e,en,,What motivates Gordon during his conversation with Ben in this scene?,He believes Jonathan was wrongfully punished and fears the lasting impact of injustice more than physical harm.,"Gordon stands with Ben, his voice strained as he insists his son Jonathan did nothing wrong. He says the punishment was unjust, that no one listened to the boy, and that he believes Jonathan completely. Ben responds with sympathy but offers little reassurance, suggesting there is nothing they can do now. Gordon presses that he fears the consequences of a police record, not the physical wounds, which he says will heal. He strikes his chest, saying the real injury is the injustice that lingers. [scene: Gordon Confronts Ben About Jonathan's Punishment]",Character Understanding
3,en69e9830df5f14930bfd6ec2e9744f84e,en,,"In [14、INT. BARAGWANATH MORTUARY - DAY], what realization shapes Gordon's next move when Gordon gordon peers into the last metal drawer?",Jonathan is not among the dead,"Gordon peers into the last metal drawer. The small face inside is not Jonathan's. He steps back, silent. Stanley and Julius move toward the exit, followed by Gordon and Emily. They walk past rows of parents still hunched before open drawers, past a group of women seated on the floor, heads bowed, hands clasped. The air is heavy with breath and silence. No one speaks as they make their way out of the room. [Gordon Confirms Jonathan Is Not Among the Dead]",Character Understanding
4,en69e9830df5f14930bfd6ec2e9744f84e,en,,What does Viljoen aim to assess by questioning Ben about Gordon Ngubene's reaction to his son's death?,Gordon's emotional response and loyalty,"Colonel Viljoen leans forward and asks Ben whether Gordon Ngubene became angry or rebellious after his son Jonathan's death. Ben hesitates, then responds by asking the Colonel how he would feel if it were his own son. The room falls silent. Captain Stolz, standing by the window, interrupts to state that the information was already provided. Ben turns slightly, showing surprise at Stolz’s remark. Viljoen looks at Ben for a moment, then quietly says that he also has a son.",Character Understanding
5,en69e9830df5f14930bfd6ec2e9744f84e,en,,What happens when Ben approaches Gordon in the garden?,Gordon turns off the machine and remains silent,"Ben crosses the yard toward Gordon, who is working quietly. As Ben draws near, asking if he is okay, Gordon shuts off the machine, stands still, and delivers the news that the police took Jonathan and that he has disappeared. His silence in the moment before speaking marks a pivotal shift in the scene, setting off Ben’s resolve to act.",Scene Grounding
6,en69e9830df5f14930bfd6ec2e9744f84e,en,,What action takes place between Gordon and Ben on the playing fields that conveys Gordon's emotional and moral resolve?,Gordon expresses grief and moral urgency to Ben,"Gordon stands with Ben on the edge of the playing fields as the sounds of a school rugby match fade in the background. He speaks with growing intensity, insisting that knowing how his son Jonathan died is not something he can let go. He rejects the official story, saying it brings him no peace. Ben places a hand on Gordon’s shoulder, offering sympathy and reminding him he still has other children to live for. Gordon interrupts, pressing for the truth—how Jonathan died and where his body lies. He declares that his son belongs to him and Emily, and that he will not stop until he knows what happened. Without waiting for a reply, Gordon climbs onto his lawnmower, starts the engine, and drives across the field, leaving Ben behind. From an office window in the school, the headmaster watches the scene unfold, concerned.",Scene Grounding
7,en69e9830df5f14930bfd6ec2e9744f84e,en,,What occurs when Gordon seeks information about Jonathan at Dube's shop?,Gordon inquires about Jonathan's fate,"Gordon approaches Wellington and Stanley at Dube's shop, asking about Jonathan's whereabouts and condition. Wellington states he hasn't seen Jonathan in weeks, while Stanley ultimately reveals that Jonathan is dead. Gordon presses for details about how he died, marking this moment as the first confirmation of Jonathan's death and the catalyst for Gordon's subsequent actions.",Scene Grounding
8,en69e9830df5f14930bfd6ec2e9744f84e,en,,What prompts Ben to investigate Jonathan's disappearance before confirming his death and demanding secrecy?,Johan asks about Jonathan's scheduled help,"In Ben's garden, Johan questions why Jonathan, who was supposed to assist Gordon, is absent. Ben inquires about Jonathan’s recovery, but Gordon remains silent and avoids answering. After persistent questioning, Gordon reveals that the police took Jonathan and that he has since disappeared. Ben, disturbed by the news and Gordon’s secrecy, resolves to find out what happened, setting in motion his later confrontation with Johan in the car.",Causal-Motivational Reasoning
9,en69e9830df5f14930bfd6ec2e9744f84e,en,,What event directly prompts Ben's emotional moment with Johan that Susan later observes?,Johan inquires about Jonathan's status,"In Ben's car during the day, Johan asks Ben about Jonathan's condition. Ben informs him that Jonathan is dead and instructs Johan not to tell their mother about the conversation. This exchange precedes the scene in Ben's study at night, where Susan enters to find Ben comforting Johan, who appears distressed, and she responds by bringing coffee and offering quiet support before gently guiding Johan to bed.",Causal-Motivational Reasoning
10,en69e9830df5f14930bfd6ec2e9744f84e,en,,What action by Ben creates the conditions that lead him to confirm Jonathan's death and impose secrecy afterward?,Ben requests permission for Gordon's wife to deliver food and clothes,"In the colonel's office, Ben secures permission for Gordon's wife to bring food and a change of clothes, a request granted after Viljoen reassures him about his family's safety. Ben expresses gratitude and agrees to pass along Viljoen's regards to his father-in-law before leaving. Unbeknownst to Ben, this interaction positions him as a conduit for controlled information, as Viljoen begins orchestrating further intelligence efforts through Stolz, setting the stage for Ben’s later role in managing the narrative around Jonathan’s fate.",Causal-Motivational Reasoning
11,en69e9830df5f14930bfd6ec2e9744f84e,en,,What moment initiates Ben's decision to confirm Jonathan's death and enforce silence about the visit?,Gordon and Jonathan arrive and stand hesitantly in the garden,"Gordon and Jonathan appear at Ben's garden gathering, standing apart with a tense demeanor. Their arrival draws the attention of the entire family, and Ben approaches them, visibly unsettled. This unannounced presence introduces immediate tension, setting in motion Ben's subsequent actions to control the narrative once Jonathan’s fate is addressed [5、EXT. BEN'S HOUSE - BARBECUE - DAY].",Causal-Motivational Reasoning
12,en69e9830df5f14930bfd6ec2e9744f84e,en,,"By the time Ben confirms Jonathan's death and demands secrecy, what has already taken place?",Ben examines Gordon's son's injuries,"Before confronting the aftermath of Jonathan's death and imposing silence, Ben has already assessed the boy's condition in his kitchen, where he carefully examined the injuries. This moment of medical evaluation precedes the later, more somber scene in Ben's car where the death is formally acknowledged and secrecy is enforced.",Temporal Reasoning
13,en69e9830df5f14930bfd6ec2e9744f84e,en,,"By the time Ben learns of Jonathan's disappearance and vows to help, what key event has already taken place at the school?",Mrs. Cloete observes the altercation without intervening,"At Dan Pienaar Secondary School for Boys, an altercation occurs involving Jonathan, during which Mrs. Cloete witnesses the incident but chooses not to step in. This moment precedes Ben's later realization of Jonathan's absence and his subsequent commitment to assist, establishing a critical sequence in the unfolding of events.",Temporal Reasoning
14,en69e9830df5f14930bfd6ec2e9744f84e,en,,How does Capt. Stolz's treatment of Ben Du Toit evolve from their first confrontation to their final encounter?,Capt. Stolz consistently treats Ben Du Toit as a threat,"From their initial meeting in Viljoen's office, where Stolz asserts official authority over Ben's personal grief, through subsequent interactions marked by surveillance, intimidation, and punitive action, Stolz maintains a hostile stance, challenging Ben's actions and undermining his efforts at every turn, culminating in a final confrontation at Jan Smuts Airport where Stolz delivers a coercive ultimatum, confirming the unbroken adversarial dynamic.",Role-Relation Continuity
15,en69e9830df5f14930bfd6ec2e9744f84e,en,,How does Capt. Stolz's treatment of Gordon evolve from the interrogation at Gordon's house to the courtroom inquest?,Capt. Stolz continues treating Gordon as a threat through sustained hostility,"From the initial raid at Gordon's house through multiple interrogation scenes at John Vorster Square, Capt. Stolz consistently subjects Gordon to physical abuse, psychological pressure, and verbal aggression, positioning him as an interrogator confronting a dangerous adversary. This pattern persists into the courtroom setting, where Stolz maintains a stance of suspicion and antagonism, indicating an unbroken trajectory of perceiving and treating Gordon as a hostile figure.",Role-Relation Continuity
16,en69e9830df5f14930bfd6ec2e9744f84e,en,,What pivotal event sets in motion the chain of revelations involving Jonathan Ngubene's fate and the confrontation between Gordon and Ben?,Ben Learns of Jonathan's Disappearance and Vows to Help,"In the garden scene, Ben receives critical information about Jonathan Ngubene's disappearance, prompting him to commit to uncovering the truth. This moment shifts the narrative trajectory, triggering subsequent events including Gordon's demand for answers, Ben's discovery of the letter, and Viljoen's interrogation, all of which hinge on Ben's decision to act. [19、EXT. BEN'S GARDEN]",Narrative Progression
17,en69e9830df5f14930bfd6ec2e9744f84e,en,,What pivotal event shifts the narrative toward Ben's confrontation with the truth about Jonathan and sets in motion his demand for secrecy and Gordon's subsequent reckoning?,Ben and Johan Question Gordon About Jonathan's Absence,"In the garden, Ben and Johan confront Gordon about Jonathan's unexplained absence, pressing him for answers. This direct challenge disrupts the existing silence surrounding Jonathan's fate, forcing Gordon into a defensive position and initiating a chain of disclosures that lead Ben to uncover the truth, insist on concealment, and ultimately confront the moral consequences of complicity. [19、EXT. BEN'S GARDEN]",Narrative Progression
18,en69e9830df5f14930bfd6ec2e9744f84e,en,,What pivotal event sets in motion Ben's commitment to help and Gordon's escalating concerns about Jonathan's future?,Gordon and Jonathan Arrive at the Garden Gathering,"The arrival of Gordon and Jonathan at the garden gathering introduces the central conflict by exposing the consequences of Jonathan's actions and triggering Ben's involvement. This moment shifts the narrative trajectory, prompting Ben to become actively engaged in the situation while initiating Gordon's anxiety about institutional repercussions and long-term consequences.",Narrative Progression
19,en69e9830df5f14930bfd6ec2e9744f84e,en,,"What pivotal event sets in motion the sequence leading directly to Ben's defense of Gordon Ngubene, the start of the interrogation, and Ben's eventual departure with the revelation of Viljoen's hidden agenda?",Greeting in the Colonel's Office,"The scene in Viljoen's office marks a critical shift in the narrative, where initial formalities give way to underlying tensions that propel the subsequent chain of events. This moment establishes the power dynamics and unspoken motives that directly enable Ben's involvement in Gordon Ngubene's case, the unfolding interrogation, and the exposure of deeper political maneuvering behind Ben's assignment. [43、INT. VILJOEN'S OFFICE - DAY]",Narrative Progression
20,en69e9830df5f14930bfd6ec2e9744f84e,en,,What action by Colonel Viljoen creates the conditions for Ben to later defend Gordon Ngubene in their conversation?,Colonel Viljoen greets Ben with a handshake,"In the office, Colonel Viljoen rises to greet Ben with a handshake and a warm personal remark about having seen him play rugby, establishing a tone of mutual respect and informal camaraderie. This gesture sets a collaborative atmosphere, which persists when Ben later speaks in defense of Gordon Ngubene, appealing to shared humanity and fallibility—appeals that Viljoen receives with agreement and laughter, suggesting the earlier rapport enabled Ben's intervention.",Causal-Motivational Reasoning
21,en69e9830df5f14930bfd6ec2e9744f84e,en,,"Which scene or scenes best match the following description: The phone rings. Captain Stolz releases Gordon, straightens up, and walks to the phone. He picks up the receiver and speaks calmly.",42、INT. INTERROGATION ROOM (JOHN VORSTER SQUARE) - DAY | 43、INT. VILJOEN'S OFFICE - DAY,"The phone rings. Captain Stolz releases Gordon, straightens up, and walks to the phone. He picks up the receiver and speaks calmly.",Scene Grounding
22,en69e9830df5f14930bfd6ec2e9744f84e,en,,In which scene or scenes are Susan and Vivier both present?,51、INT. DINING ROOM - NIGHT | 53、INT. DINING ROOM - NIGHT | 54、INT. KITCHEN - NIGHT | 59、INT. DU TOIT LOUNGE - NIGHT,"{""pair"": [""Susan"", ""Vivier""], ""pair_mentions"": 12, ""scene_grounding_subtype"": ""copresence_localization"", ""scene_count"": 4, ""scene_numbers"": [51, 53, 54, 59], ""scene_titles"": [""51、INT. DINING ROOM - NIGHT"", ""53、INT. DINING ROOM - NIGHT"", ""54、INT. KITCHEN - NIGHT"", ""59、INT. DU TOIT LOUNGE - NIGHT""]}",Scene Grounding
23,en69e9830df5f14930bfd6ec2e9744f84e,en,,In which scene or scenes is Advocate De Villiers clearly present?,75、INT. EMILY'S HOUSE - AFTERNOON | 79、INT. COURT ROOM - FIRST DAY OF INQUEST - DAY | 81、INT. CAFE NEAR COURT - DAY | 82、INT. COURTROOM - AFTERNOON,"{""character"": ""Advocate De Villiers"", ""mention_total"": 38, ""scene_span"": 8, ""scene_grounding_subtype"": ""entity_presence_localization"", ""scene_count"": 4, ""scene_numbers"": [75, 79, 81, 82], ""scene_titles"": [""75、INT. EMILY'S HOUSE - AFTERNOON"", ""79、INT. COURT ROOM - FIRST DAY OF INQUEST - DAY"", ""81、INT. CAFE NEAR COURT - DAY"", ""82、INT. COURTROOM - AFTERNOON""]}",Scene Grounding
24,en69e9830df5f14930bfd6ec2e9744f84e,en,,In which scene or scenes is Ben Du Toit acting as a member of Inquest?,75、INT. EMILY'S HOUSE - AFTERNOON | 78、INT. BEN'S BEDROOM - NIGHT | 96、INT. LEWINSON'S OFFICE - DAY | 138、INT. BEN'S STUDY - DAY,"{""character"": ""Ben Du Toit"", ""role_label"": ""Inquest"", ""relation_names"": [""is involved in"", ""participated in"", ""is leading""], ""descriptions"": [""Ben mentions having a good advocate for the inquest and expresses confidence in the process, indicating his active affiliation and participation in the inquest effort."", ""Susan refers to Ben's 'anxiety about the inquest' and reassures him it will be cleared up legally, indicating Ben is formally involved in or subject to the inquest.""], ""scene_grounding_subtype"": ""role_state_localization"", ""scene_count"": 4, ""scene_numbers"": [75, 78, 96, 138], ""scene_titles"": [""75、INT. EMILY'S HOUSE - AFTERNOON"", ""78、INT. BEN'S BEDROOM - NIGHT"", ""96、INT. LEWINSON'S OFFICE - DAY"", ""138、INT. BEN'S STUDY - DAY""]}",Scene Grounding
25,en69e9830df5f14930bfd6ec2e9744f84e,en,,"Which scene or scenes best match the following description: The boy tells Stanley that Wellington is at Dube's shop with some other boys. Stanley thanks him, calls out to Gordon, turns the car around, and drives off quickly. Stanley pulls up in his car and calls out a greeting to Wellington and the others standing",32、INT. STANLEY'S CAR - DAY | 33、EXT. DUBE'S SHOP - DAY,"The boy tells Stanley that Wellington is at Dube's shop with some other boys. Stanley thanks him, calls out to Gordon, turns the car around, and drives off quickly. Stanley pulls up in his car and calls out a greeting to Wellington and the others standing",Scene Grounding
26,en69e9830df5f14930bfd6ec2e9744f84e,en,,Who are the 3 most central characters in this story?,"Ben_Du_Toit, Gordon, Stanley",,Character Understanding
