id,movie_id,language,related_scenes,question,answer,evidence_or_reason,question_type
1,en05bc3690e0134347aa5df63f6920ae65,en,59、EXT. AUDITORIUM - LATER THAT EVENING,What does Jamie aim to expose in her exchange with Landon about his need for popularity?,His dependence on audience validation,"Jamie challenges Landon’s self-image by pointing out that his behavior is performative and sustained only by social attention. She asserts that he values school not for its purpose but for the status it gives him, and that without an audience, his act has no power. Her words target the fragility of his identity, leading him to react defensively as she walks away.",Character Understanding
2,en05bc3690e0134347aa5df63f6920ae65,en,59、EXT. AUDITORIUM - LATER THAT EVENING,What does Jamie reveal about Landon's motivations when she confronts him after rehearsal?,"That he maintains his cynical, detached persona to protect himself from losing his social status.","Jamie confronts Landon in the rain after rehearsal, challenging his dismissive attitude toward the play and his belief that caring about theater makes someone a 'dork.' She observes that he doesn’t care about school or graduating but values being popular, which he knows is temporary. She argues his aloof act only works when people are watching, implying it’s a performance meant to preserve his image. Landon reacts with mockery and deflection, but remains alone as his ride fails to appear, watching Jamie drive away.",Character Understanding
3,en05bc3690e0134347aa5df63f6920ae65,en,38、INT. PRINCIPAL'S OFFICE - 8:05 AM,What does Kelly aim to accomplish by gesturing for Landon to sit and presenting evidence from his car?,Enforce school rules and expel Landon,"Kelly gestures for Landon to sit, initiating a disciplinary conversation. He references Landon's poor attendance and barely passing grade, acknowledging his intelligence while criticizing his behavior. Kelly places empty bottles found in Landon's car on the desk and produces a police report detailing his blood alcohol level. Though under the legal limit, Kelly asserts his authority over school conduct, ultimately confirming Landon's expulsion. Landon responds with defiance, signaling the end of their institutional relationship.",Character Understanding
4,en05bc3690e0134347aa5df63f6920ae65,en,58、INT. SCHOOL AUDITORIUM - TUESDAY EVENING,What objective does Landon's shift in performance style reveal when rehearsing with Jamie?,To take the lead role seriously,"Landon and Jamie sit on the stage with folding chairs, reading lines from The Rainmaker. Landon initially delivers his lines flatly, prompting Ms. Garber to question whether he is trying to perform poorly. In response, he shifts to an exaggerated emotional delivery, fully engaging with the character of Starbuck. During the scene, he asks Jamie's character if she sees herself as pretty, then declares she is beautiful with theatrical intensity, causing laughter and discomfort. Ms. Garber awards him the lead role, which he protests but is compelled to accept when Mr. Kelly insists he perform it with sincerity and dignity.",Character Understanding
5,en05bc3690e0134347aa5df63f6920ae65,en,59、EXT. AUDITORIUM - LATER THAT EVENING,What action does Jamie take in the auditorium scene that shifts the power dynamic with Landon?,Asserts her right to judge Landon in return,"In the evening outside the auditorium, Jamie responds to Landon's judgment by asserting her own right to evaluate him. She challenges his motives, accusing him of valuing popularity over purpose and performing only when an audience is present. As Landon reacts with a defiant stare, Jamie turns and walks toward her father's old Pontiac, the last car in the parking lot, marking a turning point in their confrontation.",Scene Grounding
6,en05bc3690e0134347aa5df63f6920ae65,en,59、EXT. AUDITORIUM - LATER THAT EVENING,What action initiates the confrontation between Jamie and Landon outside the auditorium?,Jamie approaches Landon with a serious concern about the play,"After rehearsal, as Landon waits under an overhang in the rain for a ride, smoking and visibly annoyed, Jamie approaches him. The school lights shut off behind them as the building closes. She confronts him about his dismissive attitude toward the play, challenging his belief that caring about theater makes someone a 'dork,' and suggests he only acts rebellious to maintain his popularity. Landon responds with mockery and disengagement, but remains physically present as she walks away.",Scene Grounding
7,en05bc3690e0134347aa5df63f6920ae65,en,57、INT. SCHOOL BUS - NOON,What does Jamie do to clarify her reason for tutoring during the bus ride?,Explains she tutored reading because books were her world growing up,"On the school bus, Jamie tells Landon that she tutors reading because, as a child, books were her world. When Landon mocks her use of the past tense, she pushes back, defending her choices and challenging his dismissive attitude. The exchange reveals her motivation and deepens the tension between them before the bus arrives at Beaufort High.",Scene Grounding
8,en05bc3690e0134347aa5df63f6920ae65,en,63、EXT. ACROSS STREET FROM FIRE - LITTLE LATER; 65、INT. SULLIVAN LIVING ROOM - MOMENTS LATER,What does Landon say that prompts Reverend Sullivan to warn him to stay away?,Fathers always like him,"Jamie agrees to help Landon rehearse on two conditions: he must not fall in love with her and must meet her father. Landon dismisses the first condition easily and confidently claims that fathers always like him. At that moment, the parsonage door opens and Reverend Sullivan appears, overhearing or witnessing this remark, which precedes his later confrontation with Landon in which he demands he stay away from his daughter and their home.",Causal-Motivational Reasoning
9,en05bc3690e0134347aa5df63f6920ae65,en,59、EXT. AUDITORIUM - LATER THAT EVENING; 62、INT. OLD PONTIAC - TRAVELING - MOMENTS LATER,What event immediately before the car chase motivates Landon's urgency in following the fire trucks?,Fire trucks speeding past the school while Landon is left alone,"As rain falls, Landon stands under the school's overhang, watching fire trucks rush down the nearby street. Realizing no one has come to pick him up, he sees Jamie’s father’s old Pontiac—the last car in the lot—begin to reverse. This moment of isolation and the passing emergency vehicles set in motion his insistence moments later that Jamie follow the fire trucks, framing the fire as something alive and uncontrollable.",Causal-Motivational Reasoning
10,en05bc3690e0134347aa5df63f6920ae65,en,52、INT. PRINCIPAL KELLY'S OFFICE - MOMENTS LATER; 58、INT. SCHOOL AUDITORIUM - TUESDAY EVENING,What earlier decision creates the situation where Landon is cast as Starbuck despite his objections?,Mr. Kelly assigns Landon to join the drama club,"Mr. Kelly informs Landon that he must participate in the drama club, dismissing his requests for alternative responsibilities or personal time. This mandatory involvement establishes Landon's presence in the production, enabling Ms. Garber to cast him as Starbuck and Mr. Kelly to enforce the role when Landon resists, making his assignment both the procedural and authoritative basis for his casting.",Causal-Motivational Reasoning
11,en05bc3690e0134347aa5df63f6920ae65,en,52、INT. PRINCIPAL KELLY'S OFFICE - MOMENTS LATER; 52、INT. PRINCIPAL KELLY'S OFFICE - MOMENTS LATER,What action by Mr. Kelly creates the context for his later mention of Landon's father?,Mr. Kelly proposes conditions for Landon's return,"When Landon expresses a desire to return to school, Mr. Kelly agrees only if he commits to a set of demanding responsibilities, including attending all classes, performing unpaid work for the janitorial staff, tutoring disadvantaged students, and joining the drama club. As Landon accepts these terms and prepares to leave, Mr. Kelly softens his tone and references the faculty’s memory of Landon’s father, prompting Landon’s terse reply that he remembers less than they do.",Causal-Motivational Reasoning
12,en05bc3690e0134347aa5df63f6920ae65,en,57、INT. SCHOOL BUS - NOON; 57、INT. SCHOOL BUS - NOON,What prompts Landon to exit the bus and greet Belinda upon arrival at Beaufort High?,Jamie tells Landon that Harold was released from the hospital and is staying at a rest home on Oak Street,"On the bus, Jamie informs Landon that Harold, who recently left the hospital, is now at a rest home on Oak Street and attends her father’s church. She suggests that people can find their way back to teaching through unexpected paths, implying a need for reconciliation or renewal. Landon initially dismisses her, but when the bus arrives at Beaufort High, he exits and immediately greets Belinda, who is waiting by her car wearing a neck brace, suggesting a shift in his intentions tied to the news about Harold.",Causal-Motivational Reasoning
13,en05bc3690e0134347aa5df63f6920ae65,en,45、EXT. MINI-MALL - AUTO PARTS SHOP - LITTLE LATER; 57、INT. SCHOOL BUS - NOON,"By the time Landon boards the bus and sits next to Jamie, what has already taken place?",Landon knocks on Cynthia's bedroom door,"Before leaving for school, Landon attempts to get a ride from Cynthia by knocking on her bedroom door, initiating a chain of events that leads to him eventually boarding the bus and sitting next to Jamie.",Temporal Reasoning
14,en05bc3690e0134347aa5df63f6920ae65,en,45、EXT. MINI-MALL - AUTO PARTS SHOP - LITTLE LATER; 57、INT. SCHOOL BUS - NOON,"Before 'Landon Boards the Bus and Sits Next to Jamie' begins, what earlier development is already in place?",Landon exits building with arms full,"Landon leaves the building carrying a heavy load, immediately noticing the bus approaching. This moment sets up his hurried entry and eventual seating next to Jamie, establishing the physical and narrative conditions for their encounter.",Temporal Reasoning
15,en05bc3690e0134347aa5df63f6920ae65,en,47、EXT. CARTER DRIVEWAY; 208、INT. LANDON'S BEDROOM - LATE NIGHT,How does Cynthia's relationship to Landon Carter evolve from their interaction in the driveway to the late-night scene in his bedroom?,Cynthia maintains a supportive caretaker role toward Landon throughout,"From the driveway conversation to the intimate moment in Landon's bedroom, Cynthia consistently engages him with concern and guidance, urging him toward employment, offering emotional support during family tensions, and culminating in a physical embrace after a vulnerable exchange. Her actions reflect an enduring dynamic of care and involvement, shifting in expression but not in underlying intent.",Role-Relation Continuity
16,en05bc3690e0134347aa5df63f6920ae65,en,19、INT. CAMARO; 88、INT. AUDITORIUM,How does Belinda's treatment of Jamie Sullivan evolve from their initial encounter to the auditorium scene?,Belinda consistently treats Jamie Sullivan with hostility and mockery,"From the Camaro scene onward, Belinda positions Jamie Sullivan as a target of derision, mocking her nickname 'Brain' in front of peers. This pattern continues in later interactions, including a dismissive comment about Jamie's social awareness outside the school, and culminates in the auditorium scene where Belinda's cold, hard expression upon seeing Jamie with Landon underscores an ongoing adversarial stance. Throughout, Belinda maintains a posture of social exclusion and contempt toward Jamie.",Role-Relation Continuity
17,en05bc3690e0134347aa5df63f6920ae65,en,57、INT. SCHOOL BUS - NOON; 57、INT. SCHOOL BUS - NOON; 59、EXT. AUDITORIUM - LATER THAT EVENING,"What pivotal moment shifts the narrative trajectory leading into the sequence where Jamie speaks about Harold, Landon dismisses her, and she confronts him both about his behavior and after rehearsal?",Jamie Shares Her Reasons and Stands Up to Landon,"The story builds toward a series of confrontations between Jamie and Landon, triggered by unresolved tensions surrounding Harold. Jamie's decision to articulate her motivations and assert her stance marks a critical shift in agency, altering the dynamics of their relationship and setting in motion direct challenges that follow in subsequent scenes.",Narrative Progression
18,en05bc3690e0134347aa5df63f6920ae65,en,59、EXT. AUDITORIUM - LATER THAT EVENING; 59、EXT. AUDITORIUM - LATER THAT EVENING; 59、EXT. AUDITORIUM - LATER THAT EVENING,What pivotal moment sets in motion the sequence where Jamie confronts Landon and Landon seeks a ride?,Landon Notices Jamie Leaving as Fire Trucks Pass,"The narrative shifts when Landon observes Jamie departing just as fire trucks pass by, triggering a chain of actions that lead directly to Jamie confronting Landon following rehearsal, challenging him about his behavior, and Landon subsequently banging on a car to request a ride.",Narrative Progression
19,en05bc3690e0134347aa5df63f6920ae65,en,21、INT. CAMARO; 21、INT. CAMARO; 21、INT. CAMARO,"What event shifts the narrative momentum toward the sequence involving Landon observing Jamie, the use of headlights, the group's reaction, Jamie's mirror stunt, and Belinda's call?",Landon turns on the dome lights,"The moment Landon activates the dome lights alters the scene's dynamics, drawing attention and prompting a chain of actions that unfold as tensions rise and behaviors shift within the group, setting in motion the subsequent events.",Narrative Progression
20,en05bc3690e0134347aa5df63f6920ae65,en,52、INT. PRINCIPAL KELLY'S OFFICE - MOMENTS LATER; 52、INT. PRINCIPAL KELLY'S OFFICE - MOMENTS LATER; 58、INT. SCHOOL AUDITORIUM - TUESDAY EVENING,What pivotal event sets in motion Landon's involvement with the drama club and his confrontation with Mr. Kelly's expectations?,Mr. Kelly Assigns Landon to the Drama Club,"Landon's forced enrollment in the drama club by Mr. Kelly initiates a chain of escalating demands and personal disclosures, directly leading to the conditions for his return, his reluctant casting as Starbuck, and the revelation of his father's history.",Narrative Progression
