id,movie_id,language,related_scenes,question,answer,evidence_or_reason,question_type
1,en6e3adb1c4f5546c4a6178969b0cb2f43,en,,What is Tudor trying to achieve when Tudor tudor steps into the apartment and immediately smells smoke and burned flesh?,Secure a useful lead,"Tudor enters the apartment and immediately smells smoke and burned flesh. He sees Hobbes's foot extending from the dining room corner and approaches cautiously. Annabelle's body is on the dining table, still smoking, with a surgical clip on her lips and bruises on her neck. Hobbes lies beneath the table, a scalpel embedded in his neck, blood pooled beneath him. Tudor reacts with physical distress before retrieving his attaché case and leaving.",Character Understanding
2,en6e3adb1c4f5546c4a6178969b0cb2f43,en,,What does Rollo come to understand about Hobbes while examining the documents in the lab?,Hobbes had been systematically falsifying research and deceiving institutions and colleagues.,"In the lab, Rollo reviews materials sent by Hobbes’s mother, including handwritten notes and documents from cardboard shoeboxes. As he sorts through the papers while eating knishes, he uncovers a pattern of fraud—Hobbes had been deceiving the university, research foundations, private labs, and even his own colleagues, hiding erratic and dishonest behavior throughout his career. [Rollo Discovers Hobbes's Deception]",Character Understanding
3,en6e3adb1c4f5546c4a6178969b0cb2f43,en,,What does Mrs. Wheatley aim to do upon discovering Tudor collapsed in his office?,Stabilize Tudor and get him seated,"Mrs. Wheatley knocks on Tudor's office door after he fails to answer the phone. Finding no response, she enters and sees him on the floor behind his desk, weakly rolling with his chair tipped over. She rushes to him, helps him up, notices a trickle of blood at his mouth, rights the chair, and supports him as he collapses into it, dazed and breathing heavily.",Character Understanding
4,en6e3adb1c4f5546c4a6178969b0cb2f43,en,,What does Rollo realize upon discovering the page marked 'ANNABELLE' in Hobbes's notes?,Hobbes transformed and killed Annabelle,"Rollo searches through Hobbes's notes and finds a page marked 'ANNABELLE' in red ink. He reads Hobbes's words: 'She is becoming a new creature before my eyes. It is like living at the Dawn of Creation. I am euphoric, I am in ecstasy.' As Rollo reads, he brushes crumbs from the page, smearing grease over the text. He pauses, then speaks aloud, piecing together that Hobbes had implanted Annabelle with a parasitic organism, that she changed, and that Hobbes ultimately killed her—burning not her body, but the parasites that had taken hold.",Character Understanding
5,en6e3adb1c4f5546c4a6178969b0cb2f43,en,,What action initiates the pivotal moment in the bathroom scene?,Tudor stumbles into bathroom with hands over mouth,"Tudor enters the bathroom in distress, both hands clamped over his mouth, signaling the onset of a violent physical episode. He drops to his knees beside the bathtub, gags, and vomits a trail of blood-streaked slime before collapsing onto the floor, unconscious and breathing heavily. This sequence marks the turning point in his physical deterioration.",Scene Grounding
6,en6e3adb1c4f5546c4a6178969b0cb2f43,en,,What occurs when Tudor suddenly collapses in his apartment?,Tudor suffers sudden physical spasm and collapses,"Tudor sits on the sofa and turns on the TV. After a short moment of stillness, he suddenly contracts into the fetal position, spilling his drink onto the floor. He rolls onto the floor, eyes wide, mouth opening and closing rapidly, tendons in his neck straining. After a time, he struggles back to his feet, hands clamped over his mouth, and stumbles toward the bathroom.",Scene Grounding
7,en6e3adb1c4f5546c4a6178969b0cb2f43,en,,What occurs in the lab when Rollo uncovers Hobbes's experiment on Annabelle?,Rollo reveals Hobbes implanted Annabelle with the parasite,"In the lab at night, Rollo examines Hobbes's notes, clearing crumbs from the pages as he reads. He discovers a section titled ANNABELLE, written in red, detailing how Hobbes implanted her with a human parasite modeled after the satyr's tongue. The notes describe her transformation into a new creature and Hobbes's euphoria at witnessing what he saw as the dawn of creation. Rollo confirms that after the implantation, Annabelle became uncontrollable, forcing Hobbes to kill her and burn her body to prevent the parasites from spreading.",Scene Grounding
8,en6e3adb1c4f5546c4a6178969b0cb2f43,en,,What action directly explains why Mrs. Wheatley is attentive to Tudor’s physical state when she finds him collapsed in his office?,Mrs. Wheatley shows Tudor the blood on her Kleenex,"Earlier in the same office scene, Mrs. Wheatley observes blood on a Kleenex and shows it to Tudor, marking the first visible sign of his deteriorating condition. When he dismisses her concern and sends her away, she leaves reluctantly, setting the stage for her returning with heightened awareness of his vulnerability. This prior observation prompts her to check on him again and immediately recognize the severity of his collapse.",Causal-Motivational Reasoning
9,en6e3adb1c4f5546c4a6178969b0cb2f43,en,,What event directly triggers Tudor's physical collapse on the balcony?,Tudor discovers Annabelle's and Hobbes's bodies in the apartment,"In the apartment, Tudor encounters the gruesome scene of Annabelle's body on the dining table, her face altered and skin still smoking, with Hobbes's corpse curled beneath, a scalpel in his neck. The sight and smell overwhelm him—he retches, composes himself, and leaves without calling the police. Later, standing on his balcony at night, the trauma surfaces violently as he gags and vomits over the railing, his body reacting to the repressed horror of what he witnessed earlier.",Causal-Motivational Reasoning
10,en6e3adb1c4f5546c4a6178969b0cb2f43,en,,What event immediately before Tudor's collapse explains Mrs. Wheatley's intervention in his office?,Tudor staggers away from the crime scene with his attaché case,"After discovering the bodies in Annabelle's apartment, Tudor suppresses his shock and exits the scene carrying his attaché case, visibly strained but composed enough to close the door behind him. Later, in his office, he collapses behind his desk, where Mrs. Wheatley finds him disoriented and bleeding slightly from the mouth, prompting her to assist him and urge medical attention. The physical and psychological toll from leaving the crime scene manifests in his collapse, linking his departure to her response.",Causal-Motivational Reasoning
11,en6e3adb1c4f5546c4a6178969b0cb2f43,en,,"In [33、INT. TUDOR'S APARTMENT -- NIGHT], what action immediately before Janine's departure explains Tudor's private moment of affirmation toward the abdominal lumps?",Tudor hides the abdominal lumps under the covers upon seeing Janine,"When Janine enters the bedroom and attempts to uncover Tudor's abdomen, he pulls the sheets tightly over himself and refuses her help, causing her to leave in distress. Immediately after the door slams, Tudor reveals the lumps again, smiles, and speaks to them approvingly, indicating that his concealment from Janine directly precedes and motivates his subsequent private reinforcement of the condition.",Causal-Motivational Reasoning
12,en6e3adb1c4f5546c4a6178969b0cb2f43,en,,"By the time Dr. St. Luc visits and assesses Nick, what has he already done after reviewing the clinic’s patient sign-in list?",Dr. St. Luc reviews patient sign-in list,"Before visiting Nick, Dr. St. Luc examines the patient sign-in list at the clinic, a step that occurs in the reception area of Starliner Towers during the afternoon. This review informs his subsequent decision to visit Nick at Betts' apartment later that night, establishing a clear narrative progression between administrative assessment and personal evaluation.",Temporal Reasoning
13,en6e3adb1c4f5546c4a6178969b0cb2f43,en,,What event precedes Janine's return to her apartment?,Janine leaves the clinic after the consultation,20、INT. ST. LUC'S OFFICE -- AFTERNOON,Temporal Reasoning
14,en6e3adb1c4f5546c4a6178969b0cb2f43,en,,How does Emil Hobbes's treatment of Annabelle evolve from their first encounter to the final interaction in Rollo's lab?,Emil Hobbes consistently treats Annabelle as a victim of abuse and experimentation,"From the initial scene in Annabelle's apartment, where Hobbes desecrates her corpse, to later revelations of his predatory conduct when she was alive, and culminating in his use of her as a test subject for the parasite in Rollo's lab, Hobbes's actions toward Annabelle remain defined by exploitation and harm. Throughout these scenes, he occupies a position of power and perpetration, while she is repeatedly positioned as the target of his abuse—whether through invasive examination, physical violation, or fatal experimentation—establishing a sustained dynamic of perpetrator and victim.",Role-Relation Continuity
15,en6e3adb1c4f5546c4a6178969b0cb2f43,en,,"What pivotal event sets in motion the revelations about Hobbes's work on Annabelle, leading to the examination of her corpse and the discovery of the parasite?",Rollo Reveals Hobbes's Experiment on Annabelle,"In the lab late at night, Rollo discloses the truth about Hobbes's unauthorized experiment on Annabelle, exposing the ethical breach and scientific implications that trigger a chain of investigations. This disclosure directly prompts St. Luc's involvement, the review of Hobbes's research notes, and the subsequent incision on Annabelle's body to uncover the parasitic presence. [scene: 40、INT. ROLLO'S LAB -- NIGHT]",Narrative Progression
16,en6e3adb1c4f5546c4a6178969b0cb2f43,en,,"What pivotal event sets in motion the sequence leading to Tudor's collapse, the parasite's fall near the basement window, and the discovery of the bloodied umbrella?",Tudor Vomits and Collapses in Bathroom,"The scene in which Tudor violently vomits and collapses in his apartment bathroom marks a critical shift in the narrative, triggering a chain of events that directly lead to Mrs. Wheatley discovering his unconscious body, the parasite's descent near the basement window, and the later sighting of the bloodied umbrella during an evening walk. This moment disrupts the prior stability of Tudor's condition and exposes the advancing threat, serving as the catalyst for the subsequent developments. [21、INT. TUDOR'S APARTMENT -- LATE AFTERNOON]",Narrative Progression
17,en6e3adb1c4f5546c4a6178969b0cb2f43,en,,"What turning point sets in motion the sequence leading to Tudor's collapse, arrival at the Towers, and violent episode on the balcony?",Tudor Refuses Help and Sends Mrs. Wheatley Away,"In the aftermath of growing distress, Tudor rejects assistance from Mrs. Wheatley during a critical moment in his office, sending her away instead of accepting support. This decision marks a decisive break from intervention and initiates a chain of events that culminate in his physical collapse, transport to the Towers by cab, and subsequent breakdown on the balcony. [16、INT. TUDOR'S OFFICE -- AFTERNOON]",Narrative Progression
18,en6e3adb1c4f5546c4a6178969b0cb2f43,en,,"What pivotal event sets in motion the sequence leading to Tudor's arrival at the Towers, his collapse, and subsequent bathroom incident?",Tudor Leaves the Apartment,"The departure of Tudor from Annabelle's apartment marks the initiating action that propels the following chain of events, beginning his physical and psychological decline. This moment occurs in the morning as he exits the apartment, setting him on the path toward his arrival at the Towers by cab, his collapse, and the moment he vomits and collapses in the bathroom. [11、INT. ANNABELLE'S APARTMENT -- MORNING]",Narrative Progression
19,en6e3adb1c4f5546c4a6178969b0cb2f43,en,,"In [16、INT. TUDOR'S OFFICE -- AFTERNOON], what event immediately before Tudor is left alone in his office makes his physical deterioration in that moment more consequential?",Mrs. Wheatley assists Tudor to his feet,"After finding Tudor collapsed behind his desk with his chair overturned, Mrs. Wheatley helps him up, steadies him in his chair, and notices blood at the corner of his mouth, which she wipes away with a tissue and shows to him as a warning sign. She urges him to go to the hospital before leaving and closing the door, after which he sits alone and experiences a sudden, severe abdominal pain accompanied by renewed bleeding.",Causal-Motivational Reasoning
20,en6e3adb1c4f5546c4a6178969b0cb2f43,en,,What action by Janine creates the opportunity for Betts to extend an invitation for supper?,Janine enters Betts' apartment and delivers a message about Dr. St. Luc's visit,"Janine enters Betts' apartment and stands in the doorway, delivering news that Dr. St. Luc will visit Nick at ten. During this encounter, Betts is arranging photographs on the floor and mentions having ordered French food for dinner. This moment directly precedes her invitation for Janine to return later for company and a late supper, which Janine silently accepts.",Causal-Motivational Reasoning
21,en6e3adb1c4f5546c4a6178969b0cb2f43,en,,"Which scene or scenes best match the following description: Janine walks down the hallway, stops at a door, and knocks gently. She opens the door and walks in, moving with the ease of someone who has been in the room many times before. Janine enters Betts' apartment and stands halfway in the doorway.",30、INT. HALLWAY -- NIGHT | 31、INT. BETTS' APARTMENT -- NIGHT,"Janine walks down the hallway, stops at a door, and knocks gently. She opens the door and walks in, moving with the ease of someone who has been in the room many times before. Janine enters Betts' apartment and stands halfway in the doorway.",Scene Grounding
22,en6e3adb1c4f5546c4a6178969b0cb2f43,en,,In which scene or scenes are Janine and St Luc both present?,15、INT. WOMEN'S SAUNA -- AFTERNOON | 20、INT. ST. LUC'S OFFICE -- AFTERNOON | 31、INT. BETTS' APARTMENT -- NIGHT | 83、INT. SWIMMING POOL -- NIGHT,"{""pair"": [""Janine"", ""St Luc""], ""pair_mentions"": 19, ""scene_grounding_subtype"": ""copresence_localization"", ""scene_count"": 4, ""scene_numbers"": [15, 20, 31, 83], ""scene_titles"": [""15、INT. WOMEN'S SAUNA -- AFTERNOON"", ""20、INT. ST. LUC'S OFFICE -- AFTERNOON"", ""31、INT. BETTS' APARTMENT -- NIGHT"", ""83、INT. SWIMMING POOL -- NIGHT""]}",Scene Grounding
23,en6e3adb1c4f5546c4a6178969b0cb2f43,en,,In which scene or scenes is Svibens clearly present?,2、INT. LOBBY -- MORNING | 4、INT. LOBBY -- MORNING | 6、INT. RENTAL OFFICE -- MORNING | 9、INT. ELEVATOR -- MORNING,"{""character"": ""Svibens"", ""mention_total"": 28, ""scene_span"": 8, ""scene_grounding_subtype"": ""entity_presence_localization"", ""scene_count"": 4, ""scene_numbers"": [2, 4, 6, 9], ""scene_titles"": [""2、INT. LOBBY -- MORNING"", ""4、INT. LOBBY -- MORNING"", ""6、INT. RENTAL OFFICE -- MORNING"", ""9、INT. ELEVATOR -- MORNING""]}",Scene Grounding
24,en6e3adb1c4f5546c4a6178969b0cb2f43,en,,"Which scene or scenes best match the following description: Kurt, the delivery boy from Restaurant Côte d'Azur, approached the building's main entrance pushing a serving cart laden with silver vessels and utensils. The doorman, recognizing him, smiled and opened the doors. Kurt carefully lifted the cart to clear the",45、INT. MAIN DOORS -- NIGHT | 46、INT. HALLWAY -- NIGHT,"Kurt, the delivery boy from Restaurant Côte d'Azur, approached the building's main entrance pushing a serving cart laden with silver vessels and utensils. The doorman, recognizing him, smiled and opened the doors. Kurt carefully lifted the cart to clear the",Scene Grounding
25,en6e3adb1c4f5546c4a6178969b0cb2f43,en,,"In which scene or scenes does Tudor stand on the balcony gripping the railing, gasping for air, and showing signs of physical distress before vomiting?",25、EXT. TUDOR'S BALCONY -- NIGHT | 26、EXT. GROUNDS BELOW TUDOR'S BALCONY -- NIGHT,"Tudor experiences sudden physical distress on his balcony, where he grips the railing, gasps for air, and stares at the tower lights across. His neck stiffens, his mouth opens violently, and his hands press against his face as the episode escalates toward vomiting. The aftermath of this event is simultaneously visible from the grounds below, where the expelled substance strikes Vi's umbrella during her walk with Olive, linking the two locations through the immediate cause and effect of Tudor's physical collapse.",Scene Grounding
26,en6e3adb1c4f5546c4a6178969b0cb2f43,en,,Who are the 3 most central characters in this story?,"Janine, St_Luc, Tudor",,Character Understanding
