id,movie_id,language,related_scenes,question,answer,evidence_or_reason,question_type
1,en8dc9b5e23f324c86a3593ba801f672ac,en,,What does Miles aim to determine when he confronts Marylin after she arrives unannounced?,Uncover her true motive for returning,"Miles opens the door to find Marylin standing there shortly after her release on bail. He responds with sarcasm and suspicion, questioning her intentions when she asks to retrieve her belongings. As she enters and asserts her legal rights as his spouse, her true purpose unfolds—not to reclaim personal items, but to threaten him with an IRS investigation into unreported gifts from clients. Through veiled warnings and strategic disclosures, she positions herself as both a marital and legal adversary. Miles, initially dismissive, grows increasingly unsettled as he realizes the depth of her leverage, culminating in his silent reckoning with the potential consequences she has set in motion.",Character Understanding
2,en8dc9b5e23f324c86a3593ba801f672ac,en,,What does Miles reveal about his intentions through his proposal to convert the humidor into a nursery?,He wants to start a family with Marylin.,"Miles suggests converting the walk-in humidor into a nursery, describing how he would modify the space. Before he can finish, Marylin kisses him. After the kiss, Miles asks her directly if she wants to have children, indicating his proposal is tied to a desire to build a future together centered on parenthood.",Character Understanding
3,en8dc9b5e23f324c86a3593ba801f672ac,en,,What is Miles's immediate intention when he intercepts Marylin and Howard at the elevators?,To confront Marylin about her engagement and attempt to kiss her,"As Marylin and Howard approach the elevators to leave, Miles steps in and pulls Marylin aside. He asks her about her engagement to Doyle, his voice tense. Marylin stands straight, saying she’s made her decision. Miles backs her against the wall near a flowering ficus, his hands on either side of her. He leans in to kiss her, but she turns her face away. [scene: Miles Confronts Marylin at the Elevator]",Character Understanding
4,en8dc9b5e23f324c86a3593ba801f672ac,en,,What does Miles convey through his bitter response when Marylin offers to return the apartment items after he declares his love and desire to have her baby?,"That material things can be returned, but emotional damage—like lost trust, hopes, and dreams—cannot be undone","After Miles tells Marylin he loves her and wants to have her baby, she notices his cold reaction to the newly decorated apartment and offers to return all the items, pulling receipts from her purse. Miles asks if she can return the trust, the hopes, and the dreams the way she returns furniture, his voice turning bitter. Marylin tells him he is scaring her. Miles composes himself, then says he loves the new decor, calling it chic, timeless, elegant, eclectic, and saying it is truly her. [Miles Confronts Marylin About the Irreversible Damage]",Character Understanding
5,en8dc9b5e23f324c86a3593ba801f672ac,en,,What action occurs as Joe struggles to retrieve the inhaler in the mansion?,Joe nearly drops gun and inhaler while reaching,"In the mansion, Joe stumbles while trying to retrieve his inhaler, momentarily losing control of both the weapon and the medication. Miles reenters the room, shouting to distract Joe and urging Marylin to flee, but she refuses, standing firm and asserting her self-defense training. Joe regains his balance, raises the inhaler, and sprays the medication at Miles, who reacts with shock. An off-screen gunshot follows, resulting in Joe's collapse, prompting Marylin to rush to Miles as they both react to the fallen body.",Scene Grounding
6,en8dc9b5e23f324c86a3593ba801f672ac,en,,What happens when Miles is at Kenneth's house that sets off his urgent response?,Miles receives a threatening phone call from Joe,"After speaking with Marvin, Miles goes to Kenneth's house and immediately calls Joe, urging him to abort any action against Marylin. He hangs up abruptly, visibly distressed, muttering in regret and fear over what may already be in motion. This moment directly triggers his decision to rush out and intervene, setting the stage for his frantic efforts to protect Marylin.",Scene Grounding
7,en8dc9b5e23f324c86a3593ba801f672ac,en,,What occurs when Marylin first arrives at Miles's home and begins to settle in?,Marylin arrives and composes herself,"Marylin arrives at Miles's home visibly upset and teary, but gradually calms down after drinking coffee. She speaks about being misjudged by others and expresses hurt over Miles's earlier disdain. Reflecting on how people perceive her, she shifts between vulnerability and observation, noting the warmth of the house and the art on the walls. As she composes herself, the conversation deepens, leading to a personal exchange about their mothers and childhood experiences of emotional distance.",Scene Grounding
8,en8dc9b5e23f324c86a3593ba801f672ac,en,,What moment earlier in the story creates the emotional bond that explains Marylin's decision to stand with Miles in the final confrontation?,Marylin kisses Miles on the cheek before leaving,"In the scene at the Massey house, Marylin shares a tender farewell with Miles, kissing him lightly on the cheek and calling him her favorite husband. This gesture carries emotional weight, revealing a lingering affection and personal connection. Later, during the tense showdown at the mansion, this bond manifests when Marylin refuses to flee despite danger, choosing instead to face Joe alongside Miles—her actions suggesting that the earlier moment solidified her loyalty and commitment in the crisis.",Causal-Motivational Reasoning
9,en8dc9b5e23f324c86a3593ba801f672ac,en,,What event directly prompts Miles and Marylin to join forces in confronting Joe during the final showdown?,Miles opens the door to find Marylin standing there,"In the scene at the Massey house, Miles confronts Marylin after her release on bail. Though initially hostile and sarcastic, their interaction shifts as Marylin reveals she has evidence of his unreported gifts from clients, which she plans to report to the IRS. She leverages this knowledge not for personal revenge but as a strategic move, exposing systemic vulnerabilities in his professional conduct. This exchange establishes a turning point in their relationship—shifting from adversarial to aligned interests—laying the groundwork for their unexpected alliance. Though they do not explicitly agree to cooperate, the power dynamic is recalibrated, and Marylin’s demonstrated willingness to act decisively foreshadows her presence and agency in the final confrontation with Joe.",Causal-Motivational Reasoning
10,en8dc9b5e23f324c86a3593ba801f672ac,en,,What moment of unresolved conflict directly precipitates Miles and Marylin's decision to flee the house together?,Miles and Marylin exchange emotional greetings,"In the conference room, Miles and Marylin share a charged exchange, acknowledging the emotional toll of their mutual betrayals. They recount how each believed the other had ordered a hit on their life, sparking a cascade of accusations over past crimes—Rex Rexroth, Howard Doyle, forgery, fraud, tax evasion, and ultimately shouting 'Murder!' in unison. This eruption of long-suppressed rage and grief reignites their connection not through reconciliation but through shared peril, setting the stage for their sudden flight when violence erupts moments later in the mansion.",Causal-Motivational Reasoning
11,en8dc9b5e23f324c86a3593ba801f672ac,en,,What proposal by Miles immediately precedes and motivates his question about food in the den?,Miles proposes converting humidor to nursery adjacent to master suite,"In the den at the Massey house, Miles suggests repurposing the walk-in humidor next to the master suite into a nursery, describing how he would modify the space. Before he can elaborate, Marylin kisses him, halting his explanation. Following this moment, Miles looks around and asks Marylin if certain items nearby are food, shifting the conversation in tone and focus.",Causal-Motivational Reasoning
12,en8dc9b5e23f324c86a3593ba801f672ac,en,,"Before Herb Meyerson confronts Miles in his office, what earlier development has already occurred?",Miles has already received a message saying Herb Meyerson wants to meet with him.,Herb's confrontation is prepared in advance by a smaller but important beat: Miles first receives word that Herb Meyerson is asking for a meeting. That earlier message creates the expectation of a direct encounter and sets up the later office confrontation.,Temporal Reasoning
13,en8dc9b5e23f324c86a3593ba801f672ac,en,,"By the time Marilyn confronts the intruder, what has already taken place in Miles's bedroom?",Phone rings in Miles's bedroom,"Before Marilyn can confront the intruder at the Massey Mansion, a phone call originates in Miles's bedroom during a late-night scene, setting off a chain of events. This moment occurs well before the confrontation, establishing a causal and temporal link between the two developments.",Temporal Reasoning
14,en8dc9b5e23f324c86a3593ba801f672ac,en,,"What pivotal event shifts the narrative trajectory toward Miles and Marylin's intimate encounter, his subsequent proposal, and his decision to abandon the cigars?",Miles Races to Undo His Mistake,"In the scene at Kenneth's house, Miles takes urgent action to correct a critical error, setting off a chain of emotionally charged decisions that lead directly to his reconciliation with Marylin, their physical and emotional intimacy, and his symbolic relinquishment of the cigars.",Narrative Progression
15,en8dc9b5e23f324c86a3593ba801f672ac,en,,What pivotal event sets in motion the confrontation and emotional resolution between Miles and Marylin at the settlement meeting?,Ruth and Marylin Enter the Settlement Meeting,"Ruth and Marylin's arrival at the settlement meeting disrupts the expected proceedings and catalyzes a chain of revelations and emotional confrontations between Miles and Marylin. Their entrance shifts the narrative trajectory, directly leading to the accusations, intimate exchange, and mutual recriminations that unfold in the aftermath. [45、INT. MASSEY MYERSON CONFERENCE ROOM - DAY]",Narrative Progression
16,en8dc9b5e23f324c86a3593ba801f672ac,en,,"What pivotal event sets in motion the confrontation between Miles, Marilyn, and Joe, leading to the final escalation and its aftermath?",Marilyn Receives Urgent Call from Miles,"The urgency of Miles's call to Marilyn disrupts her position and prompts her immediate involvement, directly triggering the sequence in which the two confront Joe at the mansion. This moment shifts the narrative from buildup to direct conflict, aligning with the rapid progression toward the showdown, the physical struggle, and Marilyn's subsequent final visit. The call serves as the critical catalyst that mobilizes the protagonists into the story's climax [42、INT. MASSEY MANSION - NIGHT].",Narrative Progression
17,en8dc9b5e23f324c86a3593ba801f672ac,en,,"What turning point initiates the sequence leading to Miles inviting his guests to sit, Marilyn opening up to him, and her complimenting his home and inquiring about the lithograph?",Miles Greets Marylin and Her Companion,"The arrival of Marilyn and her companion marks the beginning of a pivotal social interaction at Miles's home. This moment sets in motion a series of personal exchanges, including Marilyn's emotional openness and her appreciation of Miles's living space, culminating in deeper engagement between the characters. [10、INT. PRIVATE BATHROOM]",Narrative Progression
18,en8dc9b5e23f324c86a3593ba801f672ac,en,,What occurs when Marylin confronts Miles at the Massey house?,Marylin warns Miles about filing legal action and seeking an injunction,"In the Massey house, Marylin tells Miles she will file legal action against him and, after a waiting period, plans to have Ruth seek an injunction to keep him away from the property. Miles asserts that the house belongs to him, but Marylin counters that it will likely be part of the settlement. She then offers to drop the forgery charge if he ceases pursuing her, implying she will not expose the gifts he has accepted from clients in exchange for cooperation. After kissing him on the cheek and calling him her favorite husband, she leaves.",Scene Grounding
19,en8dc9b5e23f324c86a3593ba801f672ac,en,,What occurs when Marilyn interacts with Rex during the meeting at Massey Myerson?,Marilyn whispers to Rex and offers him Tagamet,"During a meeting at Massey Myerson, Marilyn leans toward Rex, whispers, and hands him a bottle of Tagamet, their fingers briefly touching. She asks if he has been taking his digestive enzymes, and he swallows two tablets. Rex later reflects on the gesture, noting that Ruth used to bring him his medication during their marriage, but Miles interprets Ruth's past actions cynically and reveals she had private investigators working for her. Rex ultimately rejects reconciliation and decides to proceed aggressively against her, with Miles approving the shift in strategy.",Scene Grounding
20,en8dc9b5e23f324c86a3593ba801f672ac,en,,"In [42、INT. MASSEY MANSION - NIGHT], what event immediately before the confrontation with Joe enables Marilyn to recognize the danger she is in?",Phone rings in the bedroom and Marilyn answers it,"The phone rings in the bedroom, and Marilyn answers to hear Miles urgently telling her to leave the house immediately. He confirms his love but insists she go now, prompting her to hang up and begin moving through the room, where she discovers Joe standing silently against the wall. Her conversation with Miles heightens her emotional state and sharpens her awareness, leading directly to her attempt to negotiate with Joe upon realizing he is not who she assumed.",Causal-Motivational Reasoning
21,en8dc9b5e23f324c86a3593ba801f672ac,en,,"Which scene or scenes best match the following description: Miles opens the door to find Marylin standing beside a large, roughly handsome man in a business suit. She steps forward smoothly and says, ""Miles, how nice of you to see us — may I introduce Howard D. Doyle of Doyle Oil."" Doyle nods and adds, ""I told you we",10、INT. PRIVATE BATHROOM | 11、INT. HOWARD'S HOUSE - NIGHT,"Miles opens the door to find Marylin standing beside a large, roughly handsome man in a business suit. She steps forward smoothly and says, ""Miles, how nice of you to see us — may I introduce Howard D. Doyle of Doyle Oil."" Doyle nods and adds, ""I told you we",Scene Grounding
22,en8dc9b5e23f324c86a3593ba801f672ac,en,,In which scene or scenes are Ruth Rabino and Wrigley both present?,3、EXT. RUNNING PATH - SAN VICENTE BLVD. - MORNING | 4、INT. GYM - CLOSE ON | 15、INT. MILES OFFICE | 45、INT. MASSEY MYERSON CONFERENCE ROOM - DAY,"{""pair"": [""Ruth Rabino"", ""Wrigley""], ""pair_mentions"": 25, ""scene_grounding_subtype"": ""copresence_localization"", ""scene_count"": 4, ""scene_numbers"": [3, 4, 15, 45], ""scene_titles"": [""3、EXT. RUNNING PATH - SAN VICENTE BLVD. - MORNING"", ""4、INT. GYM - CLOSE ON"", ""15、INT. MILES OFFICE"", ""45、INT. MASSEY MYERSON CONFERENCE ROOM - DAY""]}",Scene Grounding
23,en8dc9b5e23f324c86a3593ba801f672ac,en,,In which scene or scenes is Judge clearly present?,3、EXT. RUNNING PATH - SAN VICENTE BLVD. - MORNING | 4、INT. GYM - CLOSE ON | 21、INT. CHAPEL | 22、INT. CHAPEL,"{""character"": ""Judge"", ""mention_total"": 27, ""scene_span"": 20, ""scene_grounding_subtype"": ""entity_presence_localization"", ""scene_count"": 4, ""scene_numbers"": [3, 4, 21, 22], ""scene_titles"": [""3、EXT. RUNNING PATH - SAN VICENTE BLVD. - MORNING"", ""4、INT. GYM - CLOSE ON"", ""21、INT. CHAPEL"", ""22、INT. CHAPEL""]}",Scene Grounding
24,en8dc9b5e23f324c86a3593ba801f672ac,en,,"In which scene or scenes does Miles enter the kitchen through the swinging doors from the dining room and immediately encounter Joe, expressing initial relief before correcting himself?",44、INT. MANSION | 45、INT. MASSEY MYERSON CONFERENCE ROOM - DAY,"Miles backs through the swinging doors from the dining room into the kitchen and comes face to face with Joe, exhaling in relief and whispering, 'Joe! Thank God you're in time,' before correcting himself: 'You're not in time. I'm in time.' He declares the contract off and urges Joe to leave, but Joe remains silent, unscrewing the silencer from his gun while fixing his gaze ahead, signaling the confrontation is far from over.",Scene Grounding
25,en8dc9b5e23f324c86a3593ba801f672ac,en,,In which scene or scenes does Miles Massey appear in his role as a member of the Matrimonial Lawyers?,10、INT. PRIVATE BATHROOM | 24、EXT. MASSEY MYERSON - CONFERENCE ROOM - DAY,"Miles Massey is explicitly associated with the Matrimonial Lawyers through dialogue affirming his expertise in matrimonial law and his institutional affiliation, with references to his professional identity and use of inclusive language about the legal practice, occurring across two distinct scenes.",Scene Grounding
26,en8dc9b5e23f324c86a3593ba801f672ac,en,,Who are the 3 most central characters in this story?,"Marilyn, Miles_Massey, Rex_Rexroth",,Character Understanding
