id,movie_id,language,related_scenes,question,answer,evidence_or_reason,question_type
1,en97608cba906d4e549dfa0a6a4964fb63,en,,What objective motivates The Hammer's actions when confronting Santa in the mall?,To confront Santa and assert his identity,"The Hammer and Esther move through the mall in disguise, blending in with the holiday crowd. The Hammer wears a baseball hat and a Jesus Fish T-shirt over his traditional attire. At a samples booth, he declines a bacon cheeseburger, citing dietary laws. They approach Santa’s line, where Santa initially refuses to see them together. Bambi and Tawni intervene, escorting them forward. When Santa sees The Hammer, he appears shocked. The Hammer reveals his identity by removing his hat and shirt, then draws a gun and points it at Santa. Santa appeals to their past friendship and signals Bambi and Tawni to seduce The Hammer, but he remains unmoved. As the standoff escalates, Esther draws her weapon on Tony when he pulls back the curtain. Children witness the scene, and MC Hammer pleads with The Hammer not to harm Santa. Santa then tells the crowd that The Hebrew Hammer intends to cancel Christmas, prompting fearful reactions.",Character Understanding
2,en97608cba906d4e549dfa0a6a4964fb63,en,,What realization motivates The Hammer's return to the Chief's office after initially leaving?,He cannot bear the symbolic burden,"After leaving the Chief's office, The Hammer returns once he is told that Hanukkah itself seems to rest on his shoulders. He makes clear that the pressure feels unbearable, emphasizing his own fallibility and pleading not to be treated as if he cannot fail. The return is driven less by defiance than by the need to push back against a burden he cannot emotionally carry.",Character Understanding
3,en97608cba906d4e549dfa0a6a4964fb63,en,,What is Santa's objective when he addresses the group in the dimly lit conference room?,Confront Damian about eliminating Hanukkah,"Santa stands before a group of elves and reindeer in a dimly lit conference room, his voice heavy as he addresses his son Damian. He reveals that Damian’s name has appeared on the naughty list due to a disturbing plan to eliminate Hanukkah. Damian, slouched in his chair, cigarette dangling from his lips, stares back without speaking. Santa demands an explanation, his expression a mix of anger and sorrow. In response, Damian slowly lifts his hand, gives a mocking 'Ho. Ho. Ho,' his tone dripping with contempt. The reindeer Blitzen and Rudolph shift uneasily. Santa looks at his son, then down at the remote in his hand, the weight of the moment settling over the room.",Character Understanding
4,en97608cba906d4e549dfa0a6a4964fb63,en,,What objective drives Mrs. Carver's actions during the meal in the dining room?,Ensure the Hammer finishes his food before others are allowed to eat,"Mrs. Carver places food in the dining room and insists everyone keep eating, even after the Hammer and Esther say they are full. When Mun Chi reaches for a chicken wing, she strikes his hand with a wooden spoon and states he cannot eat until the Hammer finishes his plate. She then focuses on the Hammer, waiting for him to comply [Mrs. Carver Enforces Mealtime Rules at Hanukkah Dinner].",Character Understanding
5,en97608cba906d4e549dfa0a6a4964fb63,en,,What action does Hammer take after deciding to stop Santa in the Jewish Defense League chamber?,decides to go to the Jewish Atomic Clock,"After watching Santa's transmission, Hammer declares he must stop him and heads for the exit. Esther pleads to join, but Hammer refuses, insisting the mission is too dangerous and that his days of working with her are over. He leaves the room alone, leaving Esther visibly upset. The Chief, watching the exchange, quietly instructs Esther to follow him, assuring she will be needed.",Scene Grounding
6,en97608cba906d4e549dfa0a6a4964fb63,en,,What action defines the moment when The Hammer responds to Shlomo after the boys run off?,checks on Shlomo's well-being after the incident,"After the boys ran off, The Hammer looks down at Shlomo, who stands with his head slightly lowered. He asks if Shlomo is alright, then encourages him to take pride in his identity, calling him a 'bad, bold, big-nosed, biblical brother.' Shlomo straightens up, mirrors The Hammer's fist-to-chest gesture, and thanks him. As The Hammer leaves, he tells Shlomo to stay Jewish, reinforcing the moment of solidarity and affirmation.",Scene Grounding
7,en97608cba906d4e549dfa0a6a4964fb63,en,,What action takes place as The Hammer and Esther enter the Santa encounter area in disguise?,The Hammer and Esther survey the area while in disguise,"The Hammer and Esther move through the mall concealed within the holiday crowd. The Hammer wears a baseball hat over his shtreml and a Jesus Fish T-shirt over his black suit, blending in while remaining vigilant. As they approach the Santa display, they assess their surroundings before joining the line, maintaining their cover as ordinary visitors amid the festive atmosphere. This moment sets the stage for the confrontation, with their disguised presence marking the beginning of their attempt to reach Santa under false pretenses.",Scene Grounding
8,en97608cba906d4e549dfa0a6a4964fb63,en,,"In [15、INT. MRS. CARVER'S DINING ROOM - 4 HOURS LATER], what event immediately before dessert is served explains Mrs. Carver's assertive control of the conversation and atmosphere when she presents the dessert?",Hammer returns to the table after using the bathroom,"When the Hammer reenters the dining room and retakes his seat, he interrupts a charged moment between his mother and Esther. He asks what they discussed in his absence, prompting Mrs. Carver to quickly interject and redirect the conversation, asserting narrative control by smoothly explaining what she had been telling Esther. Esther remains silent and tense as Mrs. Carver dominates the exchange, setting the tone for her subsequent performance when she serves dessert with forced cheer and deliberate authority, maintaining dominance over the table's emotional dynamics.",Causal-Motivational Reasoning
9,en97608cba906d4e549dfa0a6a4964fb63,en,,What action by Esther directly enables the intimate moment between her and The Hammer later that night?,Esther refuses to leave Hammer's side,"In his office, Esther insists on staying with Mordechai Hammer until he agrees to speak with her father. As they prepare to leave, she pauses to question the meaning of the sign on his door—'certified circumcised dick'—and demands to see his credentials, prompting an amused and proud reaction from Hammer. This persistence and closeness set the stage for their physical intimacy later that night at his apartment.",Causal-Motivational Reasoning
10,en97608cba906d4e549dfa0a6a4964fb63,en,,What earlier refusal by Mordechai Hammer directly motivates his decision to end the meeting as the Sabbath begins?,Mordechai Hammer denies affiliation with the Jewish Defense League and rejects Esther's case,"In his office, Mordechai Hammer tells Esther he no longer works with the Jewish Defense League due to its brutal politics and claims he is too busy to take on her case. She notices his in and out boxes are empty and covered in dust, casting doubt on his excuse, and presses him further. His refusal to engage with her request creates tension that culminates in him abruptly ending the meeting as the Sabbath begins, using the onset of religious observance as a reason to disengage.",Causal-Motivational Reasoning
11,en97608cba906d4e549dfa0a6a4964fb63,en,,"What event immediately prior to The Hammer comforting Shlomo demonstrates his defiance and establishes his authority, making his subsequent encouragement credible?",Hammer exits bar after violent confrontation,"After violently confronting skinheads inside Duke's Bar, The Hammer emerges unharmed, pours Manischewitz on the ground, and ignites it into the shape of a Star of David before walking away. This act of bold, symbolic resistance directly precedes his encounter with Shlomo in the ghetto alley, where he uplifts the younger boy with a message of Jewish pride and solidarity.",Causal-Motivational Reasoning
12,en97608cba906d4e549dfa0a6a4964fb63,en,,"By the time Esther and The Hammer share an intimate dance and conversation, what has already happened involving The Hammer at Mrs. Carver's dining room?",Hammer leaves the table to use the bathroom,"In the earlier scene at Mrs. Carver's dining room, four hours prior to the intimate exchange between Esther and The Hammer at his apartment, Hammer excuses himself from the table to use the bathroom—an event that precedes the shift in tone and setting leading to their private moment.",Temporal Reasoning
13,en97608cba906d4e549dfa0a6a4964fb63,en,,"By the time Hammer departs to stop Santa, what key revelation about Esther has already taken place?",Hammer reveals Esther works for the JDL,"In the dining room of Mrs. Carver, four hours after a prior confrontation, Hammer discloses that Esther is affiliated with the Jewish Defense League, establishing critical context before his subsequent mission to intercept Santa unfolds at the JDL headquarters.",Temporal Reasoning
14,en97608cba906d4e549dfa0a6a4964fb63,en,,How does Rudolph's relationship with Santa evolve from their first confrontation to their later interactions?,Rudolph continues to treat Santa as a target of hostility,"From the initial scene where Rudolph is shown in silhouette participating in Santa's goring, through subsequent encounters including physical intimidation at the Jewish Atomic Clock and a final confrontational moment in Santa's conference room, the relationship remains defined by active hostility. Rudolph's role as an aggressor is established early when he gores Santa with his antlers, and this adversarial stance persists even as Santa assumes a more dominant position later, retaliating with mockery and smoke. The dynamic is consistently antagonistic, with no indication of reconciliation or shift in allegiance.",Role-Relation Continuity
15,en97608cba906d4e549dfa0a6a4964fb63,en,,"What turning point sets in motion the chain of events leading to Mrs. Carver's arrangement, Esther's appeal to the Hebrew Hammer, and her decision to remain and question the sign?",Hammer Denies Esther's Request in His Office,"The denial of Esther's request in the Hebrew Hammer's private office marks a critical shift in the narrative, triggering a sequence in which Mrs. Carver makes a deal, Esther formally appeals to the Hebrew Hammer, and ultimately decides to stay and confront the meaning of the sign. This moment disrupts the status quo and redirects the trajectory of Esther's involvement, establishing new stakes and setting key plotlines into motion. [13、INT. HEBREW HAMMER INVESTIGATIONS - PRIVATE OFFICE - DAY]",Narrative Progression
16,en97608cba906d4e549dfa0a6a4964fb63,en,,"What turning point shifts the narrative toward Esther and The Hammer leaving the event, their intimate moment, and his subsequent departure to stop Santa?",Esther Stays and Questions the Sign,"In the private office at Hebrew Hammer Investigations, Esther remains behind after the event, fixating on the significance of the sign and pressing The Hammer for deeper meaning, which prompts a chain of emotional and narrative developments that lead directly to their departure, a moment of closeness, and ultimately his mission to confront Santa. [13、INT. HEBREW HAMMER INVESTIGATIONS - PRIVATE OFFICE - DAY]",Narrative Progression
17,en97608cba906d4e549dfa0a6a4964fb63,en,,What turning point initiates the sequence leading to the confrontation on the highway and the pursuit of the Hammer?,Hammer Rides Through the Desert,"The movement toward escalating tension begins when the Hammer enters the open highway, setting in motion a chain of events that draws Esther into direct pursuit. This moment marks the first active progression toward the confrontation, establishing spatial and narrative momentum that directly feeds into the subsequent scenes of pursuit and engagement. [47、EXT. ISRAELI OPEN HIGHWAY - DAY]",Narrative Progression
18,en97608cba906d4e549dfa0a6a4964fb63,en,,What pivotal event sets in motion the sequence leading directly to the confrontation at the bar and the ignition of the Star of David with Manischewitz?,The Hammer Pays with Shekels,"The act of paying with shekels in the bar marks a deliberate provocation, disrupting the established atmosphere and triggering a chain of escalating tensions that culminate in the violent showdown and symbolic act of defiance. This moment shifts the narrative trajectory from tension to action, serving as the catalyst for the subsequent scenes. [INT. DUKE'S BAR - AFTERNOON]",Narrative Progression
19,en97608cba906d4e549dfa0a6a4964fb63,en,,What event directly prompts The Hammer to begin his mission to stop Santa?,The Chief orders The Hammer to find Santa Claus and bring him back,"In the Chief's office, after reprimanding The Hammer for excessive force in the West Bank, the Chief assigns him a new mission: to locate Santa Claus and return him, emphasizing the importance of the task and warning against reckless actions. The Hammer initially responds with sarcasm but becomes serious when the Chief declares the fate of Hanukkah rests on his shoulders, visibly reacting to the weight of the responsibility before leaving to begin the mission.",Causal-Motivational Reasoning
20,en97608cba906d4e549dfa0a6a4964fb63,en,,What conversation directly prompts the Hammer's decision to pursue Santa?,Mohammed and Hammer discuss purpose of visit,"In the Kwanzaa Liberation Front headquarters, the Hammer and Mohammed meet as old allies. The Hammer reveals he is working for the JDL again and is tracking a rogue Santa who has taken over the North Pole. Mohammed cryptically warns that Santa is coming for Hanukkah and suggests the Hammer seek out someone who has answers, reinforcing the urgency of the mission. This exchange solidifies the Hammer’s resolve to act, leading directly to his departure to stop Santa.",Causal-Motivational Reasoning
21,en97608cba906d4e549dfa0a6a4964fb63,en,,"In which scene or scenes does Mordechai stand at the base of a large crucifix, confronted by antisemitic graffiti, before walking toward the school?",1、EXT. PUBLIC ELEMENTARY SCHOOL - DAY | 2、EXT. SCHOOLYARD - MOMENTS LATER,"Mordechai, a Hasidic boy, is seen at the base of a crucifix outside St. Peter, Paul, and Mary Public Elementary School, where the wall bears the graffiti 'HANUKKAH IS HOMOS.' He clutches his Sandy Koufax lunchbox, takes a deep breath, and begins walking toward the school. The sequence continues as he moves across the yard, passing children who later mock him, marking a transition from solitary confrontation to public scrutiny.",Scene Grounding
22,en97608cba906d4e549dfa0a6a4964fb63,en,,In which scene or scenes are Mordechai Jefferson Carver and Santa both present?,4、EXT. GHETTO STREET - NIGHT | 13、INT. HEBREW HAMMER INVESTIGATIONS - PRIVATE OFFICE - DAY | 36、INT. MALL OF AMERICA - DAY | 62、INT. MRS. CARVER'S HOUSE - SHABAT,"{""pair"": [""Mordechai Jefferson Carver"", ""Santa""], ""pair_mentions"": 22, ""scene_grounding_subtype"": ""copresence_localization"", ""scene_count"": 4, ""scene_numbers"": [4, 13, 36, 62], ""scene_titles"": [""4、EXT. GHETTO STREET - NIGHT"", ""13、INT. HEBREW HAMMER INVESTIGATIONS - PRIVATE OFFICE - DAY"", ""36、INT. MALL OF AMERICA - DAY"", ""62、INT. MRS. CARVER'S HOUSE - SHABAT""]}",Scene Grounding
23,en97608cba906d4e549dfa0a6a4964fb63,en,,In which scene or scenes is Esther Bloomenbergensteinthal acting as a member of Jdl?,12、INT. THE JEWISH DEFENSE LEAGUE - DAY | 15、INT. MRS. CARVER'S DINING ROOM - 4 HOURS LATER | 43、INT. HAMMER'S BEDROOM - MORNING,"{""character"": ""Esther Bloomenbergensteinthal"", ""role_label"": ""Jdl"", ""relation_names"": [""belongs to"", ""works for"", ""is affiliated with""], ""descriptions"": [""Esther is present in the hall with the various members of the JDL and participates in the discussion, indicating her affiliation with the group."", ""The text explicitly states 'Esther works for the JDL' and that they sent her to recruit Hammer, indicating her institutional affiliation.""], ""scene_grounding_subtype"": ""role_state_localization"", ""scene_count"": 3, ""scene_numbers"": [12, 15, 43], ""scene_titles"": [""12、INT. THE JEWISH DEFENSE LEAGUE - DAY"", ""15、INT. MRS. CARVER'S DINING ROOM - 4 HOURS LATER"", ""43、INT. HAMMER'S BEDROOM - MORNING""]}",Scene Grounding
24,en97608cba906d4e549dfa0a6a4964fb63,en,,"Which scene or scenes best match the following description: Harriet Tubbelman leads Esther and the Hammer into one of the waiting ride vehicles, each designed to resemble a baby Moses basket. She hands them tickets and lowers the lap restraints, checking to ensure they are secure. 'You should be safe from here on",37、INT. CAVERNOUS ROOM - MOMENTS LATER | 38、EXT. ALLEY - DAY,"Harriet Tubbelman leads Esther and the Hammer into one of the waiting ride vehicles, each designed to resemble a baby Moses basket. She hands them tickets and lowers the lap restraints, checking to ensure they are secure. 'You should be safe from here on",Scene Grounding
25,en97608cba906d4e549dfa0a6a4964fb63,en,,In which scene or scenes does Skinheads appear?,27、INT. DUKE'S BAR - AFTERNOON | 28、EXT. DUKE'S BAR - CONTINUOUS,"Skinheads are present across two consecutive scenes, beginning inside Duke's Bar during the afternoon and continuing immediately outside as the action moves to the exterior.",Scene Grounding
26,en97608cba906d4e549dfa0a6a4964fb63,en,,Who are the 3 most central characters in this story?,"Esther_Bloomenbergensteinthal, Hebrew_Hammer, Santa",,Character Understanding
