id,movie_id,language,related_scenes,question,answer,evidence_or_reason,question_type
1,en7ca13db75ab44faa9d147be6e5540ab7,en,42、INT. LIMOUSINE - CONTINUOUS ACTION,What does Merv aim to accomplish by entering the limo after Sheldon?,Impose Smoochy's charity obligations,"Sheldon slides into the back seat of a limo where Henry, a large thug, is already seated. Merv follows, closing the door and trapping Sheldon between them as the car pulls away. Merv introduces himself and claims to represent the Parade of Hope Foundation, which funds children's hospitals and has historically sponsored Kidnet's ice shows. He confronts Sheldon about withdrawing from the event, insists tradition must be upheld, and unilaterally declares that Smoochy the Rhino will perform for their causes starting the next day. He commands Sheldon to prepare for the role, then has him ejected from the vehicle.",Character Understanding
2,en7ca13db75ab44faa9d147be6e5540ab7,en,42、INT. LIMOUSINE - CONTINUOUS ACTION,What does Merv aim to accomplish by refusing Sheldon's objection to the ice show?,Force Sheldon into performing as Smoochy,"Sheldon shakes his head and insists he will not do an ice show, telling the driver to let him out. Merv leans forward and declares that starting the next day, Sheldon will appear as Smoochy the Rhino for Parade of Hope at benefits, banquets, and fundraisers. He then tells the driver to pull over. The limo stops, the door opens, and Sheldon is thrown out onto the street.",Character Understanding
3,en7ca13db75ab44faa9d147be6e5540ab7,en,42、INT. LIMOUSINE - CONTINUOUS ACTION,What does Sheldon do when he realizes Merv Green intends to replace him with Smoochy the Rhino?,Asserts his refusal to participate and demands to be released from the limo,"Sheldon finds himself trapped in a limo with Merv Green, who pressures him about withdrawing from the Kidnet ice show. When Merv reveals his plan to replace Sheldon’s role with Smoochy the Rhino for Parade of Hope events, Sheldon insists he never agreed to the show and demands to be let out, showing resistance to coercion and protecting his professional autonomy [scene: Sheldon Confronts Merv in the Limo].",Character Understanding
4,en7ca13db75ab44faa9d147be6e5540ab7,en,41、EXT. BROADWAY (TIMES SQUARE) - NIGHT,What does Merv's action of revealing a gun and calling Sheldon 'rhino' reveal about his character when Sheldon refuses to enter the limo?,"He asserts dominance through intimidation, using a weapon and a demeaning nickname to enforce compliance.","Sheldon declines to get into the limo, saying he is going uptown. Merv responds by pulling back his jacket to reveal a revolver tucked in his waistband. He tells Sheldon to get in and calls him 'rhino,' instructing him to humor him.",Character Understanding
5,en7ca13db75ab44faa9d147be6e5540ab7,en,16、EXT. KIDNET BUILDING - NIGHT,What does Sheldon do immediately after leaving the Kidnet building?,Chases after Nora,"After the meeting at the Kidnet building, Nora walks away down Broadway without responding to Sheldon. He exits the building and follows her through the crowd, trying to engage her in conversation about the meeting and the Smoochy songbook. When he catches up, he mentions the breadth of the songbook's content, but Nora rebuffs him, asserting that he only has his job because Rainbow Randolph was fired and that she delivered him like groceries. She dismisses his emotional appeals and walks away.",Scene Grounding
6,en7ca13db75ab44faa9d147be6e5540ab7,en,11、INT. RECEPTION AREA - SHORT WHILE LATER,What action follows Sheldon reading Nora's business card and recognizing her affiliation with Kidnet?,Sheldon shakes Nora's hand enthusiastically,"After reading Nora's business card and reacting with surprise to her connection with Kidnet, Sheldon immediately greets her by firmly shaking her hand with enthusiasm. He then releases her hand and invites her to join him for food.",Scene Grounding
7,en7ca13db75ab44faa9d147be6e5540ab7,en,43、INT. CORPORATE PENTHOUSE - NIGHT,What action initiates the pivotal moment between Sheldon and Nora on the balcony?,Sheldon leads Nora onto the balcony for fresh air,"After Nora arrives at the penthouse unsteady from drinking, Sheldon takes her outside for air. There, she apologizes for her past harshness and expresses admiration for his decision to abandon the ice show. He reveals he kept it secret to preserve the joy she found in their arguments. As they open up about emotional guardedness in their industry, Sheldon recites a poem from their shared childhood, sparking a connection. They bond over their mutual inspiration from the character Rickets the Hippo, reminisce about the Klunky-Wunky dance, and ultimately share a passionate kiss.",Scene Grounding
8,en7ca13db75ab44faa9d147be6e5540ab7,en,41、EXT. BROADWAY (TIMES SQUARE) - NIGHT; 42、INT. LIMOUSINE - CONTINUOUS ACTION,What action by Sheldon directly enables Merv Green to intercept him and initiate the confrontation in the limousine?,Sheldon exits the Kidnet building and attempts to hail a cab,"After leaving the Kidnet building at night, Sheldon steps to the curb and raises his hand to flag a taxi. As he waits, Merv Green approaches and engages him just as a limousine pulls up. Merv opens the door and guides Sheldon into the vehicle, where he is confronted about the ice show and the Parade of Hope Foundation. The encounter escalates inside the moving limo before Sheldon is forcibly removed onto the street.",Causal-Motivational Reasoning
9,en7ca13db75ab44faa9d147be6e5540ab7,en,11、INT. RECEPTION AREA - SHORT WHILE LATER; 32、INT. NORA'S OFFICE - CONTINUOUS ACTION,What action by Sheldon immediately prior to Nora's rejection explains his subsequent departure from her office?,Sheldon carries Smoochy's body and head through reception,"Sheldon enters the reception area wearing street clothes, carrying Smoochy's body draped over his shoulder on a hanger and holding a large shopping bag containing the head. Nora observes him silently, then hands him her business card when he mistakes her for a patient. After reading the card, Sheldon recognizes her and invites her to lunch, which sets up his later attempt to engage her professionally in her office—ending in his quiet exit after she declines his offer to collaborate.",Causal-Motivational Reasoning
10,en7ca13db75ab44faa9d147be6e5540ab7,en,11、INT. RECEPTION AREA - SHORT WHILE LATER; 43、INT. CORPORATE PENTHOUSE - NIGHT,What prompts Sheldon and Nora's intimate moment on the balcony?,Nora compliments Sheldon's performance,"After Sheldon finishes his performance as Smoochy, Nora approaches him in the reception area, praises his act as 'spirited,' and reveals she works for Kidnet. Their conversation shifts from professional to personal as Sheldon asks if she is hungry, laying the groundwork for their later encounter. This exchange establishes a connection that culminates in their kiss on the corporate penthouse balcony.",Causal-Motivational Reasoning
11,en7ca13db75ab44faa9d147be6e5540ab7,en,16、EXT. KIDNET BUILDING - NIGHT; 16、EXT. KIDNET BUILDING - NIGHT,What does Nora's blunt dismissal of Sheldon reveal about the professional dynamic that motivates his persistent pursuit of her approval?,Nora stops and confronts Sheldon with harsh truth about his career,"As they walk along Broadway after a meeting, Nora halts and turns to Sheldon, delivering a scathing assessment of his role on the show. She makes it clear he was hired only because Rainbow Randolph was fired, not due to any talent or potential she recognized in him. Comparing his delivery to a bag of groceries, she dismisses his creative contributions and emotional appeals, stating she cares more about her nail polish than his opinions. She commands him to stop sharing ideas and to limit himself to smiling and nodding—an instruction that underscores her view of him as a disposable figurehead. This moment crystallizes the power imbalance between them and sets the stage for Sheldon’s subsequent attempts to assert his value.",Causal-Motivational Reasoning
12,en7ca13db75ab44faa9d147be6e5540ab7,en,42、INT. LIMOUSINE - CONTINUOUS ACTION; 42、INT. LIMOUSINE - CONTINUOUS ACTION,What prompts Merv to force Sheldon out of the limousine?,Merv confronts Sheldon about rumors of withdrawing from the ice show,"In the limousine, Merv confronts Sheldon about reports that he is pulling out of the ice show, asserting that the Parade of Hope Foundation expects his participation. Sheldon denies any commitment, refuses to comply, and demands to be let out. In response, Merv declares that Sheldon will begin performing as Smoochy the Rhino for the foundation’s events and orders the driver to stop the car, leading to Sheldon being thrown out.",Causal-Motivational Reasoning
13,en7ca13db75ab44faa9d147be6e5540ab7,en,23、INT. STUDIO B - LATER; 23、INT. STUDIO B - LATER,What moment directly motivates Randolph's interruption during the show?,Randolph watches the Magic Cookie Bag descent with delight,"From his hiding place backstage, Randolph observes the Magic Cookie Bag descending on a wire as Smoochy sings and lifts it aloft. His eyes widen with amusement, and he suppresses laughter while muttering sarcastic encouragement. When Smoochy pulls out a red, misshapen cookie and claims it is a rocket ship, Randolph’s expression shifts from glee to disgust, culminating in him stepping forward to snatch the cookie—immediately preceding his full interruption of the performance.",Causal-Motivational Reasoning
14,en7ca13db75ab44faa9d147be6e5540ab7,en,25、INT. FRANK STOKES' OFFICE - TIGHT ON NEW YORK POST FRONT; 25、INT. FRANK STOKES' OFFICE - TIGHT ON NEW YORK POST FRONT,What event directly enables Burke to confront Stokes about Smoochy's future with authority?,Sheldon introduces Burke Bennett as his new agent,"Sheldon introduces Burke Bennett as his new agent during a meeting in Frank Stokes' office, where Burke immediately asserts control over Smoochy the Rhino by declaring ownership of the character and all associated rights. He pours himself a drink from Stokes' private bar, stands over Stokes with intense proximity, and declares that Sheldon deserves everything—'heaven, hell, and everything in between'—establishing his dominance in the room. This moment marks the first public assertion of Burke's representation and sets the foundation for his later confrontation with Stokes over creative control and compensation.",Causal-Motivational Reasoning
15,en7ca13db75ab44faa9d147be6e5540ab7,en,12、EXT. CONEY ISLAND BOARDWALK - NATHAN'S HOT DOGS - SHORT; 39、INT. TELEVISION STUDIO - DAY,What task does the seamstress complete before the television studio performance begins?,Redesigned Smoochy costume,"The seamstress finishes altering the Smoochy costume prior to the taping, as confirmed by the costume's updated appearance when Sheldon presents it during the studio performance [scene: INT. TELEVISION STUDIO - DAY].",Temporal Reasoning
16,en7ca13db75ab44faa9d147be6e5540ab7,en,12、EXT. CONEY ISLAND BOARDWALK - NATHAN'S HOT DOGS - SHORT; 39、INT. TELEVISION STUDIO - DAY,"By the time the chaos of the live broadcast unfolds, what has the choreographer already completed offstage?",Mapped out the dance number for Smoochy and the Rhinettes,"Prior to the televised performance where disruptions threaten the show's flow, the choreographer has already finalized the routine, having planned the sequence during an earlier rehearsal on the boardwalk. This groundwork occurs well in advance of the studio taping, establishing the structure that will be tested once the broadcast begins [Smoochy Leads the Rhinettes in the 'Fantabulous Day' Performance].",Temporal Reasoning
17,en7ca13db75ab44faa9d147be6e5540ab7,en,16、EXT. KIDNET BUILDING - NIGHT; 21、INT. KIDNET STUDIO - STAGE B - DAY; 21、INT. KIDNET STUDIO - STAGE B - DAY,"What pivotal event shifts the narrative trajectory toward the escalating confrontations between Sheldon and Nora, culminating in their intimate moment on the balcony?",Sheldon Chases Nora After the Meeting,"In the aftermath of a tense meeting outside the KidNet building at night, Sheldon pursues Nora, initiating a chain of direct engagements that redefine their relationship. This pursuit marks a decisive shift from prior indirect interactions, setting in motion a series of confrontations about creative control and personal boundaries, which ultimately lead to a charged encounter on the balcony where emotional and professional tensions converge.",Narrative Progression
18,en7ca13db75ab44faa9d147be6e5540ab7,en,11、INT. RECEPTION AREA - SHORT WHILE LATER; 16、EXT. KIDNET BUILDING - NIGHT; 32、INT. NORA'S OFFICE - CONTINUOUS ACTION,"What pivotal event initiates Sheldon's romantic pursuit of Nora and sets in motion their subsequent interactions, including their balcony kiss?",Sheldon Meets Nora from Kidnet,"The encounter between Sheldon and Nora in the reception area marks the first meaningful connection between them, establishing the foundation for Sheldon's growing interest. This meeting directly precedes and motivates his later actions, including chasing her, inviting her to lunch, and their eventual intimate moment on the balcony. [11、INT. RECEPTION AREA - SHORT WHILE LATER]",Narrative Progression
19,en7ca13db75ab44faa9d147be6e5540ab7,en,41、EXT. BROADWAY (TIMES SQUARE) - NIGHT; 42、INT. LIMOUSINE - CONTINUOUS ACTION; 16、EXT. KIDNET BUILDING - NIGHT,What pivotal event sets in motion the chain of confrontations involving Merv and Sheldon in the limo and Nora's departure?,Sheldon Exits Kidnet and Meets Merv Green,"After leaving his job at Kidnet, Sheldon encounters Merv Green in Times Square at night, initiating a series of escalating interactions that lead directly to Merv forcing Sheldon out of the limo, Sheldon chasing Nora following a tense meeting, and Merv confronting Sheldon inside the vehicle. This encounter marks the critical shift from Sheldon's corporate routine to a volatile personal and professional unraveling. [41、EXT. BROADWAY (TIMES SQUARE) - NIGHT]",Narrative Progression
20,en7ca13db75ab44faa9d147be6e5540ab7,en,11、INT. RECEPTION AREA - SHORT WHILE LATER; 15、INT. NORA BISHOP'S OFFICE - CLOSE ON LITTLE MECHANICAL; 16、EXT. KIDNET BUILDING - NIGHT,What pivotal event shifts the narrative trajectory toward Nora’s final confrontation with Sheldon and the resolution involving Smoochy’s legacy?,Sheldon Carries Smoochy's Remains Through Reception,"The moment Sheldon carries Smoochy’s remains through the reception area marks a critical escalation, forcing Nora to reevaluate her position and setting into motion her decision to exclude Sheldon, confront him on Broadway, and ultimately leading to Randolph escorting Sheldon and Smoochy to the charity soiree. [11、INT. RECEPTION AREA - SHORT WHILE LATER]",Narrative Progression
21,en7ca13db75ab44faa9d147be6e5540ab7,en,,Who are the 3 most central characters in this story?,"Nora, Randolph, Sheldon Mopes",,Character Understanding
