id,related_scenes,question,answer,related_context,question_type,question_source
1,（八十二）万家外附近。日。,"在[（八十二）万家外附近。日。]中, 阿好在简底离开后的表情？",松了一口气,阿好松一口气的表情,Character Understanding,broad_coverage_scene
2,（十八）万发家睡眠处。晚上，有月亮的晚上。,万发如何回应阿好对简的描述？,他列举了简的多个特征并质疑其关系。,万发：简简简，干你娘啦！鬼打到了，那么大声做什么？,Character Understanding,broad_coverage_scene
3,（六）村庄“小赌场”。白天。,"在[（六）村庄“小赌场”。白天。]中, 阿好的行为状态如何描述？",原始、粗鲁，没有文明的矫饰,她的一举一动，都仿佛和性有着很强烈的关连。她是那么原始，那么粗鲁，那么没有点文明的矫饰！,Character Understanding,broad_coverage_scene
4,（七十七）万发家屋外。昏。,"在[（七十七）万发家屋外。昏。]中, 万发此时的情绪状态如何？",惊讶，若有所思，若有所望,万发惊讶的眼神。万发脸上表情是若有所思，又似若有所望。,Character Understanding,broad_coverage_scene
5,（七十五）医院屋内。日。,"在[（七十五）医院屋内。日。]中, 阿好在等待时的情绪如何？",怯生、紧张,阿好（怯生，嗫嚅地）,Character Understanding,broad_coverage_scene
6,（八十七）村庄市场。日。,"在[（八十七）村庄市场。日。]中, 卖酱菜的角色有什么样的情绪状态？",尖酸刻薄且夸张,卖酱菜的（表情极尽尖酸刻薄也极尽夸张）,Character Understanding,broad_coverage_scene
7,（三十三）村庄赌场。日。,阿好打错牌时简底有何反应？,气得连说‘不对啦！’并打她的胸,只要阿好打错牌，他就会气得连说‘不对啦！’同时，还无意识地打一下她的胸,Scene Grounding,broad_coverage_scene
8,（七十九）村庄小路。日。,"在[（七十九）村庄小路。日。]中, 阿狗在对话中表现出何种性格特征？",率直天真、机灵,阿狗（率直，天真）；阿狗（机灵地改口说）,Character Understanding,broad_coverage_scene
9,（七十八）万发家厅内。昏。,"在[（七十八）万发家厅内。昏。]中, 阿好看到万发吃饭时有什么反应？",觉得好笑又怜悯。,阿好见到万发在猛吃饭，吃得那么饥荒，觉得好笑，转念之间，又有点怜悯起来。,Character Understanding,broad_coverage_scene
10,（八十五）树下小吃店。日（夏）。,"在[（八十五）树下小吃店。日（夏）。]中, 老者的行为状态是什么？",弹唱并故意停顿吊人胃口,老者（弹唱起来）...老者故意停一停，吊人胃口,Character Understanding,broad_coverage_scene
11,（十九）万发家屋外。月又圆又亮的晚上。,"在[（十九）万发家屋外。月又圆又亮的晚上。]中, 万发的情绪状态如何？",冷漠且不耐烦,万发仿佛没有听到，一点表情也无。万发：要去，你自己去！,Character Understanding,broad_coverage_scene
12,（三）村庄花生油厂外。,乙妇如何评价阿好的赌博习惯？,阿好爱博（赌），以前博得好厉害，连三个女儿都输了了。,乙妇：阿好好爱博（赌），你们甘知（知道吗）？现在有较差（比较好些），以前博得好厉害，连三个女儿都输了了。,Character Understanding,broad_coverage_scene
13,（十）村子的食堂及附近的地方。,"在[（十）村子的食堂及附近的地方。]中, 老板对万发的态度如何？",漠然且冷漠,老板：来坐呀！来坐呀！见到万发经过，老板只漠然地看他一眼，并不向他打招呼。,Character Understanding,broad_coverage_scene
14,（十七）万发家屋外。晨。,"在[（十七）万发家屋外。晨。]中, 简底接过牙粉时的状态如何？",不知如何感谢，手不知放哪儿,简底一副不知怎么感谢的神色，手都觉得不知道放哪儿好,Character Understanding,broad_coverage_scene
15,（二十）简家屋内。晚。,"在[（二十）简家屋内。晚。]中, 阿好在提到自己成为简底母亲时的情绪如何？",戏谑,阿好（语带戏谑）：昨天还是你的大嫂,Character Understanding,broad_coverage_scene
16,（八十五）树下小吃店。日（夏）。,"在[（八十五）树下小吃店。日（夏）。]中, 唱歌老者的神情如何？",有秘密要宣扬的愉快神情,接前场唱歌老者的一副有秘密要宣扬的那种愉快神情,Character Understanding,broad_coverage_scene
17,（三十四）村庄道路上。白天。,礼箱队的礼箱有什么特征？,浅浅的无盖的四方箱子，上面铺大红布，摆钱钞或金饰，或砖块,每一礼箱是浅浅的无盖的四方箱子，台湾俗称为“舍”，上面铺大红布，布上摆钱钞或金饰，或砖块,Scene Grounding,broad_coverage_scene
18,（二十一）简家内。早上。,"在[（二十一）简家内。早上。]中, 阿好对内衣有何反应？",嗅嗅后撇嘴，认为臭,她把简底塞在墙角没洗的内衣内裤找出来，提在手中，鼻子还去嗅嗅，撇撇嘴，臭得很呢！,Character Understanding,broad_coverage_scene
19,（二十五）万发家内。晚。,阿好威胁要如何惩罚万发？,割你嘴舌,令爸就割你嘴舌，有听到莫？,Scene Grounding,broad_coverage_scene
20,（四十）简家卧室。雨。,简为什么握阿好的手？,因为阿好用带着欲望的眼神看着他,△阿好把衣服递到简底面前，用带着欲望的眼神，看着半裸的简底。简底：阿好姊呀，你连衣服都帮我收进来啦，（看看阿好手上的衣服）还帮我拆得这么整齐！,Causal-Motivational Reasoning,broad_coverage_scene
21,（十五）万发家屋外。早晨。,"在[（十五）万发家屋外。早晨。]中, 阿好在简底叫她'大嫂'后有何反应？",变得十分女性，讲话动作娇模娇样,阿好忽然间变得十分女性，讲话动作也娇模娇样起来。,Character Understanding,broad_coverage_scene
22,（七十三）树下（小吃店）。日。,"在[（七十三）树下（小吃店）。日。]中, 车夫牵牛时表现出怎样的情绪？",万分疼爱,那爱唱歌的车夫万分疼爱地牵着牛,Character Understanding,broad_coverage_scene
23,（七十六）医院诊察室。日。,"在[（七十六）医院诊察室。日。]中, 阿好在医生质疑时有何反应？",脸色红到脖子，尴尬发窘。,阿好脸色红到脖子，脸是尴尬发窘，又不得不微笑。,Character Understanding,broad_coverage_scene
24,（十二）万发家厨房。黄昏时。,"在[（十二）万发家厨房。黄昏时。]中, 阿狗为什么惊叫？",误以为对面的鬼来了,阿狗：我还以为对面那个鬼又来啦！,Character Understanding,broad_coverage_scene
25,（十三）万发家前厅。黄昏近晚时。,阿好对阿狗说对面有人搬来住的看法是什么？,对面的房子几百年都没有人住了，有人搬进来，哪有可能？,阿好：对面的房子几百年都没有人住了，有人搬进来，哪有可能？,Character Understanding,broad_coverage_scene
26,（四十八）村庄野地。雨。,"在[（四十八）村庄野地。雨。]中, 阿好与简底在何处翻滚？",大雨中的泥地上,△阿好与简底在大雨中的泥地上翻滚。,Scene Grounding,broad_coverage_scene
27,（八十三）万发家厅内。晚。,"在[（八十三）万发家厅内。晚。]中, 万发在对话中表现出什么态度？",装冷漠,脸上尽量装冷漠。,Character Understanding,broad_coverage_scene
28,（四十）简家卧室。雨。 | （四十七）村庄猪舍旁。晚上。,简在接过阿好递来的干衣服时，表现出怎样的情感状态？,简表现出突然而强烈的情感冲动，从原本的道谢转变为紧紧握住阿好的手，流露出亲密和情感的波动。,简在道谢时没有接过衣服，而是突然紧紧握住阿好的手，显示出情感上的转变和亲密意图。,Character Understanding,broad_coverage_event_chain
29,（二十二）简家屋内。晚。 | （三十九）简家屋内。用。 | （四十）简家卧室。雨。 | （四十七）村庄猪舍旁。晚上。,简底在发现屋子被整理后，对阿好的行为表现出怎样的情感状态？,简底表现出感激的情感状态。,简底闻了闻洗净晾干的内衣裤后，脸上露出感激的神情。,Character Understanding,broad_coverage_event_chain
30,（三）村庄花生油厂外。 | （十三）万发家前厅。黄昏近晚时。,阿好在饭后看到万发沉默不语时表现出怎样的情绪状态？,阿好表现出不满和烦躁的情绪状态。,阿好抱怨万发闷声不响连蚊子都比他大声，并且哼了一声，嘴里念叨屋里冷清。,Character Understanding,broad_coverage_event_chain
31,（十九）万发家屋外。月又圆又亮的晚上。 | （十八）万发家睡眠处。晚上，有月亮的晚上。,万发在阿好提起简底时表现出愤怒的原因是什么？,万发因为阿好反复提起简底而感到烦躁，认为她过于关注这个单身男子，从而引发了他的情绪爆发。,阿好多次提及简底是罗汉脚、讲话腔调怪，万发最终怒斥她不要一直说简底，表现出对这个话题的强烈反感。,Character Understanding,broad_coverage_event_chain
32,（三十八）万发家屋内。阴，雨。 | （三十九）简家屋内。用。 | （四十）简家卧室。雨。 | （四十七）村庄猪舍旁。晚上。,在雨中帮助简底保护家中物品后，阿好的情绪状态如何体现？,阿好表现出关切和主动承担的责任感，她在大雨来临前及时收衣、接漏、关窗，动作连贯而细致，体现出她对家庭事务的操心和应对突发情况的沉稳状态。,阿好在雨前收衣，用各种容器接漏雨，关窗防潲雨，随后穿上蓑衣冒雨外出，显示出她细心、负责且不慌乱的心理状态。,Character Understanding,broad_coverage_event_chain
33,（十五）万发家屋外。早晨。,简底初见阿好时，阿好对他说话方式的反应表现出她怎样的态度？,阿好觉得简底说话口音特别，听不太清楚，因此拍他肩膀让他放慢语速，表现出一种亲切又略带调侃的关心态度。,阿好听出简底的鹿港口音，用手拍他光膀子，让他讲话慢一点，自己才听得清楚。,Character Understanding,broad_coverage_scene
34,（十二）万发家厨房。黄昏时。 | （十三）万发家前厅。黄昏近晚时。,在阿好责骂万发沉默不语后，阿狗模仿她说话时，万发表现出怎样的情绪状态？,万发表现出感到好笑的情绪状态。,阿狗模仿阿好说话后，万发忽然咧嘴笑了出来。,Character Understanding,broad_coverage_event_chain
35,（二十）简家屋内。晚。 | （二十二）简家屋内。晚。 | （三十九）简家屋内。用。 | （四十）简家卧室。雨。,简底在背心裂缝被缝补时表现出怎样的态度变化？,简底最初想自己缝补背心裂缝，表现出独立和坚持的态度，但在阿好坚持代劳并引用俗语回应后，他最终顺从地抬起手臂配合她缝补，表现出从抗拒到接受的转变。,简底起初伸手去拿针线想自己缝，后来在阿好坚持下放弃并抬起手臂配合她完成缝补。,Character Understanding,broad_coverage_event_chain
36,（二十一）简家内。早上。 | （三十一）村庄庙口。日。 | （三十二）村庄市场。日。 | （六）村庄“小赌场”。白天。,阿好在参与四色牌赌局时，通过什么具体动作表现出她的情绪激动状态？,阿好在赌局中蹲在地上，两腿张开，一边喊叫一边拍桌子，时而捶打桌面，时而激动地挥舞手臂，表现出她情绪的高涨和投入。,阿好蹲在地上，两腿张开，一边喊叫一边拍桌子，时而捶打桌面，时而激动地挥舞手臂。,Character Understanding,broad_coverage_event_chain
37,（十九）万发家屋外。月又圆又亮的晚上。 | （三十九）简家屋内。用。 | （四十）简家卧室。雨。 | （四十七）村庄猪舍旁。晚上。,在简底冒雨归来后，阿好采取了哪些具体行动使他感到放心并表达感谢？,阿好关好窗户，把衣服搬到高处，并用脸盆接住屋顶漏下的雨水，防止衣物被淋湿。,阿好关窗、移衣、接漏雨，保护了简底的衣物未被雨水浸湿。,Character Understanding,broad_coverage_event_chain
38,（十九）万发家屋外。月又圆又亮的晚上。 | （十八）万发家睡眠处。晚上，有月亮的晚上。,当阿好再次提到姓简的时，万发表现出怎样的情绪状态及其直接反应？,万发表现出愤怒和不耐烦的情绪状态，他直接推开了阿好的手并大声咒骂。,阿好再次提起姓简的，万发突然推开她的手并咒骂，随后翻过身不再理她。,Character Understanding,broad_coverage_event_chain
39,（十五）万发家屋外。早晨。 | （三十二）村庄市场。日。 | （三十三）村庄赌场。日。,在牌局中，简底对阿好做出什么亲昵举动导致周围人开始哼唱调侃？,简底在阿好出错牌时伸手拍她的胸口，引发周围人哼唱调侃。,每当阿好出错牌，简底就急得喊‘不对啦！’并伸手拍一下她的胸口，引起旁人哼唱起调侃的歌曲。,Character Understanding,broad_coverage_event_chain
40,（二十六）村庄小道。日。 | （三十一）村庄庙口。日。,阿好在被村妇议论后，为什么拒绝了简底一起吃饭的提议？,阿好拒绝简底的饭局是因为她觉得总让对方请客不合适，而且她自己确实有急事要处理。,阿好推辞说总让他请客不合适，而且自己确实有急事要办。,Character Understanding,broad_coverage_event_chain
41,（十八）万发家睡眠处。晚上，有月亮的晚上。 | （十九）万发家屋外。月又圆又亮的晚上。,阿好在发现简姓邻居归来后、打招呼前表现出哪些心理状态？,阿好表现出惊讶和在意自己形象的心理状态，她在看到灯光后轻声惊呼，并立即放下手中的活儿，整理头发，然后提议去打招呼。,阿好看到对面草屋亮灯后停下编畚箕的动作，轻声惊呼简姓邻居回来，并整理头发后提议去打招呼。,Character Understanding,broad_coverage_event_chain
42,（三十一）村庄庙口。日。 | （四十）简家卧室。雨。 | （四十七）村庄猪舍旁。晚上。,在阿好与简底相拥时，简底表现出怎样的情感状态？,简底表现出深情和依恋的情感状态。,简底与阿好在猪圈边紧紧相拥，彼此依偎，动作亲昵而缠绵。,Character Understanding,broad_coverage_event_chain
43,（一一六）监狱会客室。日。|（一二三）村镇街道，大街小巷。白天。,阿好与阿狗的关系到故事后期应如何概括？,从母亲转为同行伙伴,早期阿好与阿狗的关系是母亲；后期变为同行伙伴。,Role-Relation Continuity,supplementary_cross_scene
44,（一一七）监狱牢房。（冬）日。|（一二二）监狱门外。晨。,后期场景中，阿好与万发的关系应如何概括？,从配偶转为亲密同伴,早期阿好与万发的关系是配偶；后期变为亲密同伴。,Role-Relation Continuity,supplementary_cross_scene
45,（十二）万发家厨房。黄昏时。|（十三）万发家前厅。黄昏近晚时。,万发和阿狗原本正用酱油拌粥解决没菜的问题，但阿狗的什么反应直接打断了这一进程，并最终将情节推向万发抽烟出神的状态？,阿狗羡慕地看着万发吃鱼,情节单元1：万发和阿狗准备用酱油拌粥；情节单元2：阿狗羡慕地看着万发吃鱼，随后万发把鱼给阿狗，引发阿好责备。,Narrative Progression,supplementary_cross_scene
46,（十二）万发家厨房。黄昏时。|（十三）万发家前厅。黄昏近晚时。,万发和阿狗正打算用酱油拌粥凑合一顿，但一个什么事件的发生，不仅打断了他们的用餐，还间接推动了阿好催万发洗澡并感叹孤独的情节？,阿狗羡慕地看着万发吃鱼,万发把刚夹起的鱼块放进阿狗的碗里；阿狗羡慕地看，还吞吞口水。,Narrative Progression,supplementary_cross_scene
47,（十二）万发家厨房。黄昏时。|（十三）万发家前厅。黄昏近晚时。,晚餐场景中，万发和阿狗正准备用酱油拌粥应付一顿，但阿好的归来带来了转机。是什么关键事件促使了这一变化，并引发了后续的家庭互动？,阿好向万发解释回来晚的原因,阿好抱着衣衫和一小包东西走进屋，见万发已回来，便解释自己回来晚了是因为帮阿火剥土豆壳，并顺路去市场买了配饭的菜。,Narrative Progression,supplementary_cross_scene
48,（十二）万发家厨房。黄昏时。|（十三）万发家前厅。黄昏近晚时。,在万发父子用酱油拌粥解决没菜问题后，哪个事件直接引发了阿好训斥阿狗抢鱼？,阿好向万发解释回来晚的原因,阿好回家后向万发解释晚归是因为帮阿火剥土豆壳并顺路买菜，随后带回花生米、塔古俺和白带鱼，这些食物引发了后续阿狗与万发争抢鱼块，最终导致阿好训斥阿狗。,Narrative Progression,supplementary_cross_scene
49,（三）村庄花生油厂外。|（四）村子的十字路口。|（十九）万发家屋外。月又圆又亮的晚上。,哪个角色在剧本中是阿狗的母亲，与丈夫万发关系疏离，并与简底保持友好互动？,阿好,阿好与万发是关系疏离且对立，与阿狗是母亲，与简底是友好交流。,Role-Relation Continuity,supplementary_cross_scene
50,（九）牛车主家前面广场。时间已是黄昏时候了。太阳已经下山了，天地是一片瑰丽的桔红。|（十三）万发家前厅。黄昏近晚时。|（十八）万发家睡眠处。晚上，有月亮的晚上。,哪个角色与年轻车夫有信任关系、是阿狗的父亲，并与阿好常有言语冲突？,万发,万发与年轻车夫是信任的伙伴，与阿狗是父亲，与阿好是言语冲突。,Role-Relation Continuity,supplementary_cross_scene
