id,related_scenes,question,answer,related_context,question_type,question_source
1,34、INT. NURSING HOME - DAY,Why is Mary sitting expectantly on the edge of the bed?,"She is waiting for her son, Martin, as the nurse mentions his arrival.",Mary sits expectantly on the edge of the bed clutching her purse.,Causal-Motivational Reasoning,broad_coverage_scene
2,"12、INT. APARTMENT, CHICAGO - NIGHT","In [12、INT. APARTMENT, CHICAGO - NIGHT], What is Martin's emotional state when he enters the apartment?",Weary,He wearily drops his carry-on bag and briefcase,Character Understanding,broad_coverage_scene
3,"5、INT. HIRED CAR, NEW YORK - DAY","In [5、INT. HIRED CAR, NEW YORK - DAY], What is Martin's emotional state regarding his work?",He has lost his passion for work.,MARTIN: 'I've lost my passion for work.',Character Understanding,broad_coverage_scene
4,6、INT. CAR - MANHATTAN STREETS - LATER,What belief does the Driver express about control?,A small group controls the world,It's not so surprising that a small group of people control the whole world.,Character Understanding,broad_coverage_scene
5,21、INT. CHURCH -,What does Martin do with the chalice?,"He removes it, squirts a clear liquid into the cup, swishes it out, and returns it to the cabinet.","MARTIN'S HANDS open the gilded doors to reveal the chalice. He removes it, squirts a clear liquid into the cup, and swishes it out. He returns the chalice to the cabinet.",Scene Grounding,broad_coverage_scene
6,20、INT. DR. OATMAN'S OFFICE - DAY,What does Martin visualize during his session with Dr. Oatman?,"A crowded gymnasium where alumni draw guns and open fire, leading to a bloodbath.","CUT TO: MARTIN'S P.O.V. - FROM ABOVE Of a crowded gymnasium. The alumni below stops what they are doing and look up at Martin, DRAWING GUNS OF ALL SHAPES AND SIZES AND OPEN FIRE ON MARTIN. THE UNITED FORCE INSTANTLY DISINTEGRATES, AND ALL 400 PEOPLE TURN THEIR GUNS ON EACH OTHER. A BLOODBATH ENSUES.",Scene Grounding,broad_coverage_scene
7,28、INT. DETROIT AIRPORT TERMINAL - EARLY MORNING,Why does Lardner dispute McCullers' claim about meeting the man in Lisbon?,Lardner states the man hasn't been to Portugal since '90 per the file.,LARDNER: 'He hasn't been in Portugal since '90. I know that from the file.',Causal-Motivational Reasoning,broad_coverage_scene
8,3、EXT. COUNTRY CLUB - DAY,What does Martin do with the laminated card?,"Fishes it out, looks at it, and tosses it onto the ground","He fishes out the laminated 'Personal Pan Power' card, looks at it, and tosses it onto the ground.",Scene Grounding,broad_coverage_scene
9,28、INT. DETROIT AIRPORT TERMINAL - EARLY MORNING,What causes Lardner's sarcastic suggestion to McCullers about killing the man?,McCullers' persistent claims about knowing the man frustrate Lardner.,LARDNER: 'Why don't I just take the weekend off and let you kill him.',Causal-Motivational Reasoning,broad_coverage_scene
10,30、EXT. HIGHWAY-,What is the result of Martin driving down the roadway?,Headlong into his past.,Martin drives down the roadway... headlong into his past.,Causal-Motivational Reasoning,broad_coverage_scene
11,31、INT. MARTIN'S CAR,Why do Debby's words falter?,She sees Martin's silhouette in the car.,"Debi's P.O.V. of Martin's Town Car outside, Martin silhouetted in shadow. Debi... Her words falter almost imperceptibly.",Causal-Motivational Reasoning,broad_coverage_scene
12,44、EXT. STREET -,"In [44、EXT. STREET -], What is Martin's emotional state after stopping?",Determined,"His face softens, then becomes determined",Character Understanding,broad_coverage_scene
13,40、INT. RADIO STATION - DAY,What does Martin reveal about his profession?,He's a professional killer.,MARTIN I'm a professional killer.,Character Understanding,broad_coverage_scene
14,37、EXT. GRAVEYARD ROAD - DAY,What does Martin claim about his own actions?,He murders for cash.,I murder for cash,Character Understanding,broad_coverage_scene
15,53、EXT. ROAD - DAY,What does Martin accuse Paul of doing?,Putting hard-earned dollars into the hands of the class bully.,How could you put your hard-earned dollars into the hands of the class bully?,Character Understanding,broad_coverage_scene
16,35、EXT. SUBURBAN STREET - DAY,Why does Martin decide to change the subject during his conversation with Mary?,Because Mary mentioned speaking to his father.,Mary spoke to your father the other day. Martin decides to change the subject.,Causal-Motivational Reasoning,broad_coverage_scene
17,37、EXT. GRAVEYARD ROAD - DAY,What does Martin say about his mother?,She's a psycho-pharmacological punching bag.,Mom's a psycho-pharmacological punching bag,Character Understanding,broad_coverage_scene
18,50、EXT. FRANK LLOYD WRIGHT HOUSE - DAY,"In [50、EXT. FRANK LLOYD WRIGHT HOUSE - DAY], What is Martin's emotional state during his conversation with the guard?",Heartfelt and longing,Martin's dialogue about wanting a beautiful place and a wife like the couple,Character Understanding,broad_coverage_scene
19,58、EXT. RADIO STATION - NIGHT,What is a Shockabuku?,A swift spiritual kick to the head that alters your reality forever.,DEBI: It's a swift spiritual kick to the head that alters your reality forever.,Scene Grounding,broad_coverage_scene
20,46、INT. COUNTRY SQUIRE -,When did the radio station start broadcasting news of the massacre?,Two minutes before it happened,two minutes before it happened,Temporal Reasoning,broad_coverage_scene
21,21、INT. CHURCH -,What happens to the chalice when the Priest collapses?,It bounces free from the Priest's hand and hits the ground.,C.U. OF ALTAR CARPET The chalice bounces free from the Priest's hand as it hits the ground.,Scene Grounding,broad_coverage_scene
22,10、INT. MARTIN'S AND GROCERS CARS - DAY,What does Martin notice about the other vehicle and its driver?,"Another Town Car appears in the next lane with the Doorman behind the wheel, phone in hand.","Martin notices another Town Car appears in the next lane. We recognize the Doorman behind the wheel, phone in hand. He is GROCER.",Scene Grounding,broad_coverage_scene
23,45、INT. DEEJAY BOOTH -,"In [45、INT. DEEJAY BOOTH -], What is Debi's emotional state when she mentions Martin?",She is spooked.,I'm a little spooked.,Character Understanding,broad_coverage_scene
24,55、INT. 7-11 - NIGHT,What does Martin say when Carl asks if he can help?,What's done is done.,CARL Can I help you? MARTIN What's done is done.,Character Understanding,broad_coverage_scene
25,16、INT. HUSKY MAN'S APARTMENT - SECONDS LATER,"In [16、INT. HUSKY MAN'S APARTMENT - SECONDS LATER], What is Martin's behavioral state as described in the passage?",Martin is moving silently in a crouch.,Martin moves silently down the hall in a crouch.,Character Understanding,broad_coverage_scene
26,"5、INT. HIRED CAR, NEW YORK - DAY","In [5、INT. HIRED CAR, NEW YORK - DAY], What behavioral trait does the driver describe about himself?",He can handle solitude and thinks on his feet.,"DRIVER: 'I can handle it. See, I can think on my feet.'",Character Understanding,broad_coverage_scene
27,10、INT. MARTIN'S AND GROCERS CARS - DAY,What action does Martin take after his conversation with Grocer?,Hangs up the phone and pulls away from the other car.,Martin hangs up and pulls away.,Scene Grounding,broad_coverage_scene
28,54、EXT. RADIO STATION - NIGHT,What does Paul say to Martin as he leaves?,See you at the left-a-boy-came-back-a-man-made-good party.,PAUL See you at the left-a-boy-came-back-a-man-made-good party.,Character Understanding,broad_coverage_scene
29,"37、EXT. GRAVEYARD ROAD - DAY | 29、EXT. EXIT RAMP, DETROIT AIRPORT - MORNING | 47、INT. DEEJAY BOOTH",What does Martin state about the reason for his meeting with Debi?,Martin states that the meeting with Debi was his therapist’s idea.,He reveals the meeting was his therapist’s idea.,Character Understanding,broad_coverage_event_chain
30,33、EXT. 7-11 PAYPHONE - MORNING | 32、INT. MARTIN'S CAR - MORNING,What does Martin state about his house when he calls Dr. Oatman?,Martin states that his house is gone and that there is now a 7-11 in its place.,"Martin says into the phone, 'My house. It's not here. My house is gone and now there's a 7-11 here.'",Character Understanding,broad_coverage_event_chain
31,36、EXT. NURSING HOME - DAY,What does Mary tell Martin about time and change?,"Mary tells Martin that no matter how impossible things may feel, time can bring change and even miracles, and that some people who have no chance at all can suddenly find themselves with a life.","Seated in the wheelchair, Mary looks at Martin and tells him that no matter how impossible things may feel, time can bring change and even miracles. She says some people have no chance at all, yet suddenly find themselves with a life.",Character Understanding,broad_coverage_scene
32,"7、INT. HOTEL ROOM, NEW YORK CITY - DAY | 9、EXT. STREET - SAME - INTERCUT",When does Martin leave the hotel room?,Martin leaves the hotel room after witnessing the Doorman kill the boss and react to the presence of a second shooter.,"After witnessing the Doorman kicking aside bodies and shooting their boss, Martin reacts with surprise at the sight of the second shooter, pulls back from the window, puts the scope away, and quickly leaves the room.",Temporal Reasoning,broad_coverage_event_chain
33,14、INT. LIVING ROOM - LATER,What does Martin state after the sleeping man's eyes snap open?,Martin whispers 'Fuck!',Martin jerks the fiber-optic cable back up through the hole. 'Fuck!' he whispers.,Character Understanding,broad_coverage_scene
34,36、EXT. NURSING HOME - DAY,What does Mary state about Debi when speaking to Martin?,Mary states that Debi is a keeper.,"Mary tells him to take care of Debi, calling her a keeper.",Character Understanding,broad_coverage_scene
35,19、INT. BLANK HOLDING COMPANY | 20、INT. DR. OATMAN'S OFFICE - DAY,What does Martin say about his connection to the people from his high school?,"Martin says he does not know what he has in common with the people from his high school, or with anyone at all.","Martin says it’s in Michigan and wonders what he has in common with those people, or with anyone.",Character Understanding,broad_coverage_event_chain
36,"8、INT. HOTEL ROOM - SAME | 9、EXT. STREET - SAME - INTERCUT | 29、EXT. EXIT RAMP, DETROIT AIRPORT - MORNING | 47、INT. DEEJAY BOOTH",What does Martin state about why he arranged the meeting with Debi?,Martin states that the meeting was his therapist’s idea.,He reveals the meeting was his therapist’s idea.,Character Understanding,broad_coverage_event_chain
37,47、INT. DEEJAY BOOTH,What does Martin state about the reason for reconnecting with Debi?,Martin states that reconnecting with Debi was his therapist's idea as part of working through his past.,"Martin tells Debi that seeing her again was his therapist's idea, part of an effort to reconnect with people and places from his past.",Character Understanding,broad_coverage_scene
38,36、EXT. NURSING HOME - DAY,"What does Mary state about the possibility of change, even in difficult circumstances?","Mary states that time can bring change and even miracles, no matter how impossible things may feel.","Mary looks at Martin and tells him that no matter how impossible things may feel, time can bring change and even miracles.",Character Understanding,broad_coverage_scene
39,40、INT. RADIO STATION - DAY | 47、INT. DEEJAY BOOTH,What does Debi state about the caller's message regarding love and freedom?,"Debi states that the caller from Grosse Pointe, Michigan said if you love something, set it free, and if it comes back, it's broken.","Debi turns to the console and announces a call from Grosse Pointe, Michigan. She repeats the caller's words: 'If you love something, set it free. If it comes back to you, it's, well... broken.'",Character Understanding,broad_coverage_event_chain
40,45、INT. DEEJAY BOOTH - | 47、INT. DEEJAY BOOTH,What does Debi convey to Martin about the caller's message regarding his return?,Debi conveys that the caller's message implies Martin is broken because he came back after being set free.,"Debi repeats the caller's words: 'If you love something, set it free. If it comes back to you, it's, well... broken,' and then looks at Martin with an apologetic shrug.",Character Understanding,broad_coverage_event_chain
41,9、EXT. STREET - SAME - INTERCUT,What does the Doorman state about his actions after the shooting?,The Doorman does not state anything about his actions after the shooting.,The passage describes the Doorman's actions but does not include any statements or dialogue from him regarding what he does after the shooting.,Character Understanding,broad_coverage_scene
42,49、INT. PAUL'S BMW - DAY | 50、EXT. FRANK LLOYD WRIGHT HOUSE - DAY,Why does Paul become uncomfortable during the house tour?,"Paul becomes uncomfortable during the house tour because Martin disrupts the pitch by making unsettling comments to the potential buyers, expressing hope to have a home and wife like theirs, which confuses the couple and undermines Paul's attempt to sell the house.","Martin turns toward the couple and says, voice soft but clear, that he hopes to one day have a home like this—and a wife like the woman standing before him. He adds that they’ll be safe here. The couple looks confused. Paul stops smiling, avoids eye contact, and glances at his shoes, shifting his weight uncomfortably as the moment unravels.",Causal-Motivational Reasoning,broad_coverage_event_chain
43,11、INT. AIRLINER - DAY | 3、EXT. COUNTRY CLUB - DAY | 37、EXT. GRAVEYARD ROAD - DAY,What does Martin say about his mother during his visit to the cemetery?,Martin states that his mother is a psycho-pharmacological punching bag.,"Martin says, 'Mom's a psycho-pharmacological punching bag' while speaking at his father's grave.",Character Understanding,broad_coverage_event_chain
44,40、INT. RADIO STATION - DAY|66、INT. NEWBERRY FOYER - CONTINUOUS|114、INT. NEWBERRY HOUSE,"Which character in Grosse Pointe Blank has a strained past with Martin Blank, is Mr. Newberry's daughter, and partners with him to escape danger?",Debi,"Debi is in a ongoing tension relationship with Martin Blank, is in a daughter relationship with Mr. Newberry, and is in a cooperating partners relationship with Newberry.",Role-Relation Continuity,supplementary_cross_scene
45,103、INT. EASTWEST HOLDING COMPANY - INTERCUT|183、INT. MARTIN'S SUITE - NIGHT - INTERCUT,How would you describe the evolution of Martin Blank's working relationship with Marcella Mayes by the time he relies on her for critical tasks?,from ongoing adversarial relationship to trusted colleagues,"Earlier, the relationship between Martin Blank and Marcella Mayes is marked by ongoing adversarial relationship; later, it shifts to trusted colleagues.",Role-Relation Continuity,supplementary_cross_scene
46,"7、INT. HOTEL ROOM, NEW YORK CITY - DAY|10、INT. MARTIN'S AND GROCERS CARS - DAY|19、INT. BLANK HOLDING COMPANY","Which character navigates a connection with Tom, tension with Mr. Grocer, and a close working relationship with Marcella Mayes?",Martin Blank,"Martin Blank is in a established contact relationship with Tom, is in a ongoing adversarial tension relationship with Mr. Grocer, and is in a trusted professional partners relationship with Marcella Mayes.",Role-Relation Continuity,supplementary_cross_scene
47,19、INT. BLANK HOLDING COMPANY|20、INT. DR. OATMAN'S OFFICE - DAY,What does Marcella give Martin that derails his focus on the Detroit assignment?,Marcella presents Martin with a reunion invitation,"Marcella presents Martin with a reunion invitation while he is preparing for the Detroit assignment, leading to his anxiety and nightmare about the reunion.",Narrative Progression,supplementary_cross_scene
48,"28、INT. DETROIT AIRPORT TERMINAL - EARLY MORNING|29、EXT. EXIT RAMP, DETROIT AIRPORT - MORNING",What does Martin do in the airport terminal that causes Lardner and McCullers to start following him?,Martin walks past LARDNER and MCCULLERS in the airport terminal,"As Martin walks past Lardner and McCullers in the airport terminal, they fall silent, stand abruptly, and begin pursuing him.",Narrative Progression,supplementary_cross_scene
